symbol,name,summary,currency,sector,industry_group,industry,exchange,mic,market,country,state,city,zipcode,website,market_cap,isin,cusip,figi,composite_figi,shareclass_figi,delisted
SAPD.BA,SAP SE,"SAP SE operates as an enterprise application software company worldwide. The company operates through four segments: Applications, Technology & Support; Concur; Qualtrics; and Services. It offers SAP S/4HANA, an enterprise resource planning suite for intelligent technologies; SAP Integrated Business Planning for Supply Chain, a cloud-based solution that delivers real-time supply chain planning capabilities; SAP Intelligent Asset Management, a solution that helps to define, plan, and monitor service and maintenance strategy; SAP SuccessFactors Human Experience Management Suite, a cloud software that helps to develop, manage, and engage people; SAP Ariba, a digital business-to-business marketplace; SAP Concur, a travel and expense management software; and SAP Fieldglass, a cloud application for services procurement and contingent workforce management. The company also provides SAP solutions for enterprise information management that offers capabilities to understand, integrate, cleanse, manage, associate, and archive data; SAP HANA and SAP HANA Cloud, which enables businesses to process and analyze live data; SAP Analytics Cloud, a cloud analytics solution; SAP BusinessObjects Business Intelligence, a suite of flexible and scalable self-service BI tools; SAP Data Warehouse Cloud, a cloud data warehouse solution for business and IT users; and SAP BW/4HANA, an on-premise data warehouse solution. In addition, it offers SAP Integration Suite that help customers with holistic integration, and API-based and event-based integrations; SAP Extension Suite that provides ready-to-use services to accelerate and develop application extensions; SAP Internet of Things, a cloud solution that generates business outcomes; and SAP Intelligent Robotic Process Automation, a software robot to mimic human actions and responses. SAP SE was founded in 1972 and is headquartered in Walldorf, Germany.",USD,Information Technology,Software & Services,Software,BUE,XBUE,Buenos Aires Mercato De Valores,Germany,,Walldorf,69190,http://www.sap.com,Large Cap,DE0007164600,,,,,False
SBS.BA,Companhia de Saneamento Basico do Estado de Sao Paulo - SABESP,"Companhia de Saneamento B√É¬°sico do Estado de S√É¬£o Paulo - SABESP provides water and sewage services to residential, commercial, industrial, and governmental customers. It provides water supply, sanitary sewage, urban rainwater management and drainage, urban cleaning, and solid waste management services, as well as related activities, including the planning, operation, maintenance, and commercialization of energy. As of December 31, 2020, the company provided water services through 10.1 million water connections to approximately 27.5 million people; and sewage services through 8.5 million sewage connections to approximately 24.3 million people, as well as operated 87,568 kilometers of water pipes and water transmission lines, and 59,660 kilometers of sewer lines. It also offers water and/or sewage services to other municipalities through special purpose companies. The company was founded in 1954 and is headquartered in S√É¬£o Paulo, Brazil.",ARS,Utilities,Utilities,Water Utilities,BUE,XBUE,Buenos Aires Mercato De Valores,Brazil,SP,Sao Paulo,05429-900,http://www.sabesp.com.br,Mid Cap,US20441A1025,20441A102,,,BBG001S8LLN4,False
SBSRF.BA,SBS Asset Management SA - SBS Renta Fija I Fondo de Invension,SBS Asset Management SA - SBS Renta Fija I Fondo de Invension is a fixed income investment fund managed by SBS Asset Management SA. It invests in a portfolio of fixed income securities. The fund is based in Argentina.,ARS,Financials,Diversified Financials,,BUE,XBUE,Buenos Aires Mercato De Valores,,,,,,,,,,,,False
SBUX.BA,Starbucks Corporation,"Starbucks Corporation, together with its subsidiaries, operates as a roaster, marketer, and retailer of specialty coffee worldwide. The company operates through three segments: Americas, International, and Channel Development. Its stores offer coffee and tea beverages, roasted whole bean and ground coffees, single-serve and ready-to-drink beverages, and iced tea; and various food products, such as pastries, breakfast sandwiches, and lunch items. The company also licenses its trademarks through licensed stores, and grocery and foodservice accounts. The company offers its products under the Starbucks, Teavana, Seattle's Best Coffee, Evolution Fresh, Ethos, Starbucks Reserve, and Princi brand names. As of October 29, 2020, it operated approximately 32,000 stores. Starbucks Corporation was founded in 1971 and is based in Seattle, Washington.",ARS,Consumer Discretionary,Consumer Services,"Hotels, Restaurants & Leisure",BUE,XBUE,Buenos Aires Mercato De Valores,United States,WA,Seattle,98134,http://www.starbucks.com,Large Cap,US8552441094,855244109,,,BBG001S72KH6,False
SBUXD.BA,Starbucks Corporation,"Starbucks Corporation is a global roaster, marketer, and retailer of specialty coffee. The company operates through company-operated stores, licensed stores, and other channels. Starbucks is headquartered in Seattle, Washington.",USD,Consumer Discretionary,Consumer Services,,BUE,XBUE,Buenos Aires Mercato De Valores,United States,,,,,,US8552441094,855244109,,,BBG001S72KH6,False
SCCO.BA,Southern Copper Corporation,"Southern Copper Corporation engages in mining, exploring, smelting, and refining copper and other minerals in Peru, Mexico, Argentina, Ecuador, and Chile. The company is involved in the mining, milling, and flotation of copper ore to produce copper and molybdenum concentrates; smelting of copper concentrates to produce blister and anode copper; refining of anode copper to produce copper cathodes; production of molybdenum concentrate and sulfuric acid; production of refined silver, gold, and other materials; and mining and processing of zinc and lead. It operates the Toquepala and Cuajone open-pit mines, and a smelter and refinery in Peru; and La Caridad, an open-pit copper mine, as well as a copper ore concentrator, a SX-EW plant, a smelter, refinery, and a rod plant in Mexico. The company also operates Buenavista, an open-pit copper mine, as well as two copper concentrators and two operating SX-EW plants in Mexico. In addition, it operates five underground mines that produce zinc, lead, copper, silver, and gold; a coal mine that produces coal and coke; and a zinc refinery. The company has interests in 59,252 hectares of exploration concessions in Peru; 503,104 hectares of exploration concessions in Mexico; 229,312 hectares of exploration concessions in Argentina; 27,353 hectares of exploration concessions in Chile; and 7,299 hectares of exploration concessions in Ecuador. Southern Copper Corporation was incorporated in 1952 and is based in Phoenix, Arizona. Southern Copper Corporation is a subsidiary of Americas Mining Corporation.",ARS,Materials,Materials,Metals & Mining,BUE,XBUE,Buenos Aires Mercato De Valores,United States,AZ,Phoenix,85014,http://www.southerncoppercorp.com,Large Cap,US84265V1052,84265V105,,,BBG001S6ZM88,False
SEMI.BA,Molinos Juan Semino S.A.,"Molinos Juan Semino S.A. produces and exports grains and byproducts in Argentina. The company offers flours, gluten, native and modified starches, dextrins, proteins, and pre mixes, as well as byproducts, such as algocol A, acetilated cotton, algocol C, starch A plus, starch A, starch AB, acetilated starch, low humidity starch, starch hydrociclone, starch injection, rusted starch, pregelatinized starch, sanitized starch, dextrines, gluten alvol and protogel, flour 0000 fresh pasta, flour 0000, flour 000 baker, flour mas pan sandwich, flour plus bread, and pandulcera meal. Its products are used in the food, refrigeration, textile, paper, oil, and other industries. The company exports its products to various countries, including Brazil, Chile, Bolivia, Uruguay, Paraguay, Ecuador, Peru, the United States, Japan, China, Malaysia, Taiwan, Thailand, Hong Kong, Saudi Arabia, Turkey, Russia, and others. Molinos Juan Semino S.A. was founded in 1865 and is based in Carcara√É¬±√É¬°, Argentina.",ARS,Consumer Staples,Household & Personal Products,Household Products,BUE,XBUE,Buenos Aires Mercato De Valores,Argentina,,Carcarana,2138,http://www.semino.com.ar,Nano Cap,IE000I8KRLL9,,,BBG011XMHBF2,BBG011XMHBK6,False
SFA3X.BA,,,ARS,,,,BUE,XBUE,Buenos Aires Mercato De Valores,,,,,,,,,,,,False
SHEL.BA,Shell plc ,"Shell plc operates as an energy and petrochemical company Europe, Asia, Oceania, Africa, the United States, and Rest of the Americas. The company operates through Integrated Gas, Upstream, Marketing, Chemicals and Products, and Renewables and Energy Solutions segments. It explores for and extracts crude oil, natural gas, and natural gas liquids; markets and transports oil and gas; produces gas-to-liquids fuels and other products; and operates upstream and midstream infrastructure necessary to deliver gas to market. The company also markets and trades natural gas, liquefied natural gas (LNG), crude oil, electricity, carbon-emission rights; and markets and sells LNG as a fuel for heavy-duty vehicles and marine vessels. In addition, it trades in and refines crude oil and other feed stocks, such ase low-carbon fuels, lubricants, bitumen, sulphur, gasoline, diesel, heating oil, aviation fuel, and marine fuel; produces and sells petrochemicals for industrial use; and manages oil sands activities. Further, the company produces base chemicals comprising ethylene, propylene, and aromatics, as well as intermediate chemicals, such as styrene monomer, propylene oxide, solvents, detergent alcohols, ethylene oxide, and ethylene glycol. Additionally, it generates electricity through wind and solar resources; produces and sells hydrogen; and provides electric vehicle charging services, as well as electricity storage. The company was formerly known as Royal Dutch Shell plc and changed its name to Shell plc in January 2022. Shell plc was founded in 1907 and is headquartered in London, the United Kingdom.
",ARS,Energy,Energy,"Oil, Gas & Consumable Fuels",BUE,XBUE,Buenos Aires Mercato De Valores,United Kingdom,,London,SE1 7NA,http://www.shell.com,Large Cap,GB00BP6MXD84,,,,,False
SHOP.BA,Shopify Inc.,"Shopify Inc., a commerce company, provides a commerce platform and services in Canada, the United States, the United Kingdom, Australia, Latin America, and internationally. The company's platform provides merchants to run their business in various sales channels, including web and mobile storefronts, physical retail locations, pop-up shops, social media storefronts, native mobile apps, buy buttons, and marketplaces; and enables to manage products and inventory, process orders and payments, fulfill and ship orders, new buyers and build customer relationships, source products, leverage analytics and reporting, and access financing. It also sells custom themes and apps, and registration of domain names. The company was formerly known as Jaded Pixel Technologies Inc. and changed its name to Shopify Inc. in November 2011. Shopify Inc. was incorporated in 2004 and is headquartered in Ottawa, Canada.",ARS,Information Technology,Software & Services,Software,BUE,XBUE,Buenos Aires Mercato De Valores,Canada,ON,Ottawa,K2P 2L8,http://www.shopify.com,Large Cap,CA82509L1076,82509L107,,,BBG004DW5NC7,False
SHOPC.BA,SHOPIFY INC,"Shopify Inc. is a Canadian multinational e-commerce company headquartered in Ottawa, Ontario. The company provides a platform for online stores and retail point-of-sale systems. Shopify offers a range of services to merchants, including payment processing, marketing, shipping, and customer engagement tools.",USD,Information Technology,Software & Services,,BUE,XBUE,Buenos Aires Mercato De Valores,Canada,,,,,,,,,,,False
SHOPD.BA,SHOPIFY INC,"Shopify Inc. is a Canadian multinational e-commerce company headquartered in Ottawa, Ontario. The company provides a platform for online stores and retail point-of-sale systems. Shopify offers a range of services to merchants, including payment processing, marketing, shipping, and customer engagement tools.",USD,Information Technology,Software & Services,,BUE,XBUE,Buenos Aires Mercato De Valores,Canada,,,,,,,,,,,False
SID.BA,Companhia Siderurgica Nacional,"Companhia Sider√É¬∫rgica Nacional operates as an integrated steel producer in Brazil and Latin America. The company operates in five segments: Steel, Mining, Logistics, Energy, and Cement. It offers flat steel products, such as high, medium, low carbon, micro-alloyed, and interstitial free slabs; hot-rolled products, including heavy and light-gauge hot-rolled coils and sheets; cold-rolled products comprising cold-rolled coils and sheets; galvanized products; tin mill products that consist of flat-rolled low-carbon steel coils or sheets; and profiles, channels, UPE sections, and steel sleepers for the distribution, packaging, automotive, home appliance, and construction industries. The company primarily explores for iron ore reserves at Casa de Pedra and Engenho mines located in the city of Congonhas; and limestone and dolomite at the Bocaina mine located in the city of Arcos in the state of Minas Gerais, Brazil, as well as produces tin. In addition, it operates railway and port facilities; produces and sells cement to construction material stores, home centers, concrete producers, construction companies, mortar industries, and cement artifact producers; and generates electric power from its thermoelectric co-generation and hydroelectric power plants. The company also exports its products. Companhia Sider√É¬∫rgica Nacional was incorporated in 1941 and is headquartered in S√É¬£o Paulo, Brazil.",ARS,Materials,Materials,Metals & Mining,BUE,XBUE,Buenos Aires Mercato De Valores,Brazil,SP,Sao Paulo,04538-132,http://www.csn.com.br,Large Cap,US8565522039,856552203,,,,False
SLB.BA,Schlumberger Limited,"Schlumberger Limited supplies technology for reservoir characterization, drilling, production, and processing to the oil and gas industry worldwide. It operates in four divisions: Digital & Integration, Reservoir Performance, Well Construction, and Production Systems. The company offers reservoir interpretation and data processing services; open and cased-hole, and slickline services; exploration and production pressure and flow-rate measurement services; tubing-conveyed perforating services; integrated production systems; software, consulting, information management, and IT infrastructure services; reservoir characterization, field development planning, and production enhancement consulting services; and petro technical data services and training solutions. It designs, manufactures, and markets roller cone and fixed cutter drill bits; supplies drilling fluid systems, fluid systems and specialty equipment, production technology solutions, and engineered managed pressure and underbalanced drilling solutions; and offers environmental services and products; provides drilling and measurement, land drilling rigs, and related support services; and supplies well planning and drilling, engineering, supervision, logistics, procurement, and contracting services, as well as drilling rig management services. In addition, the company offers well services; coiled tubing equipment; hydraulic fracturing, multistage completions, perforating, coiled tubing equipment, and services; well completion services and equipment; artificial lift production equipment and optimization services; and production management services. Further, it provides integrated subsea production systems; drilling equipment and services; onshore and offshore platform wellhead systems and processing solutions; and valve and process systems. The company was formerly known as Socie√Ç¬¥te√Ç¬¥ de Prospection E√Ç¬¥lectrique. Schlumberger Limited was founded in 1926 and is based in Houston, Texas.",ARS,Energy,Energy,Energy Equipment & Services,BUE,XBUE,Buenos Aires Mercato De Valores,United States,TX,Houston,77056,http://www.slb.com,Large Cap,,,,,,False
SLBD.BA,SCHLUMBERGER,,USD,,,,BUE,XBUE,Buenos Aires Mercato De Valores,United States,,,,,,,,,,,False
SNA.BA,Snap-on Incorporated,"Snap-on Incorporated manufactures and markets tools, equipment, diagnostics, and repair information and systems solutions for professional users worldwide. It operates through Commercial & Industrial Group, Snap-on Tools Group, Repair Systems & Information Group, and Financial Services segments. The company offers hand tools, including wrenches, sockets, ratchet wrenches, pliers, screwdrivers, punches and chisels, saws and cutting tools, pruning tools, torque measuring instruments, and other products; power tools, such as cordless, pneumatic, hydraulic, and corded tools; and tool storage products comprising tool chests, roll cabinets, and other products. It also provides handheld and PC-based diagnostic products, service and repair information products, diagnostic software solutions, electronic parts catalogs, business management systems and services, point-of-sale systems, integrated systems for vehicle service shops, original equipment manufacturer purchasing facilitation services, and warranty management systems and analytics. In addition, the company offers solutions for the service of vehicles and industrial equipment that include wheel alignment equipment, wheel balancers, tire changers, vehicle lifts, test lane equipment, collision repair equipment, vehicle air conditioning service equipment, brake service equipment, fluid exchange equipment, transmission troubleshooting equipment, safety testing equipment, battery chargers, and hoists. Further, it provides financing programs to facilitate the sales of its products and support its franchise business. The company serves the aviation and aerospace, agriculture, construction, government and military, mining, natural resources, power generation, and technical education industries, as well as vehicle dealerships and repair centers. Snap-on Incorporated was founded in 1920 and is based in Kenosha, Wisconsin.",ARS,Industrials,Capital Goods,Building Products,BUE,XBUE,Buenos Aires Mercato De Valores,United States,WI,Kenosha,53143,http://www.snapon.com,Large Cap,US8330341012,833034101,,,BBG001S5W688,False
SNAP.BA,Snap Inc.,"Snap Inc. operates as a camera company in the United States and internationally. The company offers Snapchat, a camera application with functionalities, such as Camera, Communication, Snap Map, Stories, and Spotlight that enable people to communicate through short videos and images. It also provides Spectacles, an eyewear product that connects with Snapchat and captures video from a human perspective; and advertising products, including AR and Snap ads. The company was formerly known as Snapchat, Inc. and changed its name to Snap Inc. in September 2016. Snap Inc. was founded in 2010 and is headquartered in Santa Monica, California.",ARS,Communication Services,Telecommunication Services,Diversified Telecommunication Services,BUE,XBUE,Buenos Aires Mercato De Valores,United States,CA,Santa Monica,90405,http://www.snap.com,Large Cap,US9113121068,911312106,,,,False
SNOW.BA,"Snowflake, Inc.","Snowflake Inc. provides cloud-based data platform in the United States and internationally. The company's platform offers Data Cloud, an ecosystem that enables customers to consolidate data into a single source of truth to drive meaningful business insights, build data-driven applications, and share data. Its platform is used by various organizations of various sizes in a range of industries. The company was formerly known as Snowflake Computing, Inc. and changed its name to Snowflake Inc. in April 2019. Snowflake Inc. was incorporated in 2012 and is headquartered in San Mateo, California.",ARS,Information Technology,Software & Services,Software,BUE,XBUE,Buenos Aires Mercato De Valores,United States,CA,San Mateo,94402,http://www.snowflake.com,Large Cap,US8334451098,833445109,,,BBG007DHGNK2,False
SNOWD.BA,SNOWFLAKE INC,"Snowflake Inc. provides a cloud-based data platform. The company's platform enables customers to consolidate data into a single source of truth, run diverse analytic workloads, and securely share data. Its headquarters are in the United States.",USD,Information Technology,Technology Hardware & Equipment,,BUE,XBUE,Buenos Aires Mercato De Valores,United States,,,,,,,,,,,False
SNP.BA,China Petroleum & Chemical Corp.,"China Petroleum & Chemical Corporation, an energy and chemical company, engages in oil and gas, and chemical operations in the People's Republic of China. It operates through five segments: Exploration and Production, Refining, Marketing and Distribution, Chemicals, and Corporate and Others. The company explores for and develops oil fields; produces crude oil and natural gas; processes and purifies crude oil; and manufactures and sells petroleum products. It also owns and operates oil depots and service stations; and distributes and sells refined petroleum products, including gasoline and diesel through wholesale and retail sales networks. In addition, the company manufactures and sells petrochemical and derivative petrochemical products; and other chemical products, such as basic organic chemicals, synthetic resins, synthetic fiber monomers and polymers, synthetic fibers, synthetic rubber, and chemical fertilizers. Further, it is involved in the pipeline transportation and sale of petroleum and natural gas; production, sale, storage, and transportation of refinery, petrochemical, and coal chemical products; import and export of petroleum products, natural gas, petrochemical and chemical products, and other commodities and technologies; research, development, and application of technologies and information; production and sale of catalyst products, lubricant base oil, polyester chips and fibers, plastics, and intermediate petrochemical products; research, development, production, and sale of ethylene and downstream byproducts; provision of geophysical and drilling services, as well as well testing and measurement services; manufacturing production equipment; and coal chemical industry investment management activities. The company was founded in 2000 and is headquartered in Beijing, the People's Republic of China. China Petroleum & Chemical Corporation is a subsidiary of China Petrochemical Corporation.",ARS,Energy,Energy,"Oil, Gas & Consumable Fuels",BUE,XBUE,Buenos Aires Mercato De Valores,China,,Beijing,100728,http://www.sinopec.com,Large Cap,CNE1000002Q2,,,,,False
SNS4O.BA,,,,,,,BUE,XBUE,Buenos Aires Mercato De Valores,,,,,,,,,,,,False
SONY.BA,Sony Group Corporation,"Sony Group Corporation designs, develops, produces, and sells electronic equipment, instruments, and devices for the consumer, professional, and industrial markets worldwide. The company distributes software titles and add-on content through digital networks; network services related to game, video, and music content; and home and portable game consoles, packaged software, and peripheral devices. It also develops, produces, markets, and distributes recorded music; publishes music; and produces and distributes animation titles, game applications based on animation titles, and various services for music and visual products. In addition, the company produces, acquires, and distributes live-action and animated motion pictures for theatrical release, as well as scripted and animated series, unscripted reality or light entertainment, daytime serials, game shows, television movies, and miniseries and other television programs; operates a visual effects and animation unit; manages a studio facility; and operates television and digital networks, and post-production facilities. Further, it researches, develops, designs, produces, markets, distributes, sells, and services televisions, and video and sound products; interchangeable lens, compact digital, and consumer and professional video cameras; projectors and medical equipment; mobile phones, tablets, accessories, and applications; and metal oxide semiconductor image sensors, charge-coupled devices, large-scale integration systems, and other semiconductors. Additionally, it offers Internet broadband network services; creates and distributes content for PCs and mobile phones; and provides life and non-life insurance, banking, and other services, as well as batteries, recording media, and storage media products. The company was formerly known as Sony Corporation and changed its name to Sony Group Corporation in April 2021. Sony Group Corporation was incorporated in 1946 and is headquartered in Tokyo, Japan.",ARS,Information Technology,Technology Hardware & Equipment,"Electronic Equipment, Instruments & Components",BUE,XBUE,Buenos Aires Mercato De Valores,Japan,,Tokyo,108-0075,http://www.sony.com,Large Cap,US8356993076,835699307,,,,False
