symbol,name,summary,currency,sector,industry_group,industry,exchange,mic,market,country,state,city,zipcode,website,market_cap,isin,cusip,figi,composite_figi,shareclass_figi,delisted
AAPL.BA,Apple Inc.,"Apple Inc. designs, manufactures, and markets smartphones, personal computers, tablets, wearables, and accessories worldwide. It also sells various related services. The company offers iPhone, a line of smartphones; Mac, a line of personal computers; iPad, a line of multi-purpose tablets; and wearables, home, and accessories comprising AirPods, Apple TV, Apple Watch, Beats products, HomePod, iPod touch, and other Apple-branded and third-party accessories. It also provides AppleCare support services; cloud services store services; and operates various platforms, including the App Store, that allow customers to discover and download applications and digital content, such as books, music, video, games, and podcasts. In addition, the company offers various services, such as Apple Arcade, a game subscription service; Apple Music, which offers users a curated listening experience with on-demand radio stations; Apple News+, a subscription news and magazine service; Apple TV+, which offers exclusive original content; Apple Card, a co-branded credit card; and Apple Pay, a cashless payment service, as well as licenses its intellectual property. The company serves consumers, and small and mid-sized businesses; and the education, enterprise, and government markets. It sells and delivers third-party applications for its products through the App Store. The company also sells its products through its retail and online stores, and direct sales force; and third-party cellular network carriers, wholesalers, retailers, and resellers. Apple Inc. was founded in 1977 and is headquartered in Cupertino, California.",ARS,Information Technology,Technology Hardware & Equipment,"Electronic Equipment, Instruments & Components",BUE,XBUE,Buenos Aires Mercato De Valores,United States,CA,Cupertino,95014,http://www.apple.com,Mega Cap,US0378331005,037833100,,,BBG001S5N8V8,False
AAPLB.BA,Apple Inc.,"Apple Inc. designs, manufactures, and markets smartphones, personal computers, tablets, wearables, and accessories worldwide. It also sells various related services. The company offers iPhone, a line of smartphones; Mac, a line of personal computers; iPad, a line of multi-purpose tablets; and wearables, home, and accessories comprising AirPods, Apple TV, Apple Watch, Beats products, HomePod, iPod touch, and other Apple-branded and third-party accessories. It also provides AppleCare support services; cloud services store services; and operates various platforms, including the App Store, that allow customers to discover and download applications and digital content, such as books, music, video, games, and podcasts. In addition, the company offers various services, such as Apple Arcade, a game subscription service; Apple Music, which offers users a curated listening experience with on-demand radio stations; Apple News+, a subscription news and magazine service; Apple TV+, which offers exclusive original content; Apple Card, a co-branded credit card; and Apple Pay, a cashless payment service, as well as licenses its intellectual property. The company serves consumers, and small and mid-sized businesses; and the education, enterprise, and government markets. It sells and delivers third-party applications for its products through the App Store. The company also sells its products through its retail and online stores, and direct sales force; and third-party cellular network carriers, wholesalers, retailers, and resellers. Apple Inc. was founded in 1977 and is headquartered in Cupertino, California.",ARS,Information Technology,Technology Hardware & Equipment,"Electronic Equipment, Instruments & Components",BUE,XBUE,Buenos Aires Mercato De Valores,United States,CA,Cupertino,95014,http://www.apple.com,Mega Cap,US0378331005,037833100,,,BBG001S5N8V8,False
AAPLC.BA,Apple Inc.,"Apple Inc. designs, manufactures, and markets smartphones, personal computers, tablets, wearables, and accessories worldwide. It also sells various related services. The company offers iPhone, a line of smartphones; Mac, a line of personal computers; iPad, a line of multi-purpose tablets; and wearables, home, and accessories comprising AirPods, Apple TV, Apple Watch, Beats products, HomePod, iPod touch, and other Apple-branded and third-party accessories. It also provides AppleCare support services; cloud services store services; and operates various platforms, including the App Store, that allow customers to discover and download applications and digital content, such as books, music, video, games, and podcasts. In addition, the company offers various services, such as Apple Arcade, a game subscription service; Apple Music, which offers users a curated listening experience with on-demand radio stations; Apple News+, a subscription news and magazine service; Apple TV+, which offers exclusive original content; Apple Card, a co-branded credit card; and Apple Pay, a cashless payment service, as well as licenses its intellectual property. The company serves consumers, and small and mid-sized businesses; and the education, enterprise, and government markets. It sells and delivers third-party applications for its products through the App Store. The company also sells its products through its retail and online stores, and direct sales force; and third-party cellular network carriers, wholesalers, retailers, and resellers. Apple Inc. was founded in 1977 and is headquartered in Cupertino, California.",USD,Information Technology,Technology Hardware & Equipment,"Electronic Equipment, Instruments & Components",BUE,XBUE,Buenos Aires Mercato De Valores,United States,CA,Cupertino,95014,http://www.apple.com,Mega Cap,US0378331005,037833100,,,BBG001S5N8V8,False
AAPLD.BA,Apple Inc.,"Apple Inc. designs, manufactures, and markets smartphones, personal computers, tablets, wearables, and accessories worldwide. It also sells various related services. The company offers iPhone, a line of smartphones; Mac, a line of personal computers; iPad, a line of multi-purpose tablets; and wearables, home, and accessories comprising AirPods, Apple TV, Apple Watch, Beats products, HomePod, iPod touch, and other Apple-branded and third-party accessories. It also provides AppleCare support services; cloud services store services; and operates various platforms, including the App Store, that allow customers to discover and download applications and digital content, such as books, music, video, games, and podcasts. In addition, the company offers various services, such as Apple Arcade, a game subscription service; Apple Music, which offers users a curated listening experience with on-demand radio stations; Apple News+, a subscription news and magazine service; Apple TV+, which offers exclusive original content; Apple Card, a co-branded credit card; and Apple Pay, a cashless payment service, as well as licenses its intellectual property. The company serves consumers, and small and mid-sized businesses; and the education, enterprise, and government markets. It sells and delivers third-party applications for its products through the App Store. The company also sells its products through its retail and online stores, and direct sales force; and third-party cellular network carriers, wholesalers, retailers, and resellers. Apple Inc. was founded in 1977 and is headquartered in Cupertino, California.",USD,Information Technology,Technology Hardware & Equipment,"Electronic Equipment, Instruments & Components",BUE,XBUE,Buenos Aires Mercato De Valores,United States,CA,Cupertino,95014,http://www.apple.com,Mega Cap,US0378331005,037833100,,,BBG001S5N8V8,False
ABBV.BA,AbbVie Inc.,"AbbVie Inc. discovers, develops, manufactures, and sells pharmaceuticals in the worldwide. The company offers HUMIRA, a therapy administered as an injection for autoimmune and intestinal Beh√É¬ßet's diseases; SKYRIZI to treat moderate to severe plaque psoriasis in adults; RINVOQ, a JAK inhibitor for the treatment of moderate to severe active rheumatoid arthritis in adult patients; IMBRUVICA to treat adult patients with chronic lymphocytic leukemia (CLL), small lymphocytic lymphoma (SLL), mantle cell lymphoma, waldenstr√É¬∂m's macroglobulinemia, marginal zone lymphoma, and chronic graft versus host disease; VENCLEXTA, a BCL-2 inhibitor used to treat adults with CLL or SLL; and MAVYRET to treat patients with chronic HCV genotype 1-6 infection. It also provides CREON, a pancreatic enzyme therapy for exocrine pancreatic insufficiency; Synthroid used in the treatment of hypothyroidism; AndroGel for males diagnosed with symptomatic low testosterone; Linzess/Constella to treat irritable bowel syndrome with constipation and chronic idiopathic constipation; Lupron for the palliative treatment of advanced prostate cancer, endometriosis and central precocious puberty, and patients with anemia caused by uterine fibroids; and Botox therapeutic. In addition, the company offers ORILISSA, a nonpeptide small molecule gonadotropin-releasing hormone antagonist for women with moderate to severe endometriosis pain; Duopa and Duodopa, a levodopa-carbidopa intestinal gel to treat Parkinson's disease; Lumigan/Ganfort, a bimatoprost ophthalmic solution for the reduction of elevated intraocular pressure (IOP) in patients with open angle glaucoma (OAG) or ocular hypertension; Ubrelvy to treat migraine with or without aura in adults; Alphagan/ Combigan, an alpha-adrenergic receptor agonist for the reduction of IOP in patients with OAG; and Restasis, a calcineurin inhibitor immunosuppressant to increase tear production. The company was incorporated in 2012 and is based in North Chicago, Illinois.",ARS,Health Care,"Pharmaceuticals, Biotechnology & Life Sciences",Pharmaceuticals,BUE,XBUE,Buenos Aires Mercato De Valores,United States,IL,North Chicago,60064-6400,http://www.abbvie.com,Mega Cap,US00287Y1091,00287Y109,,,BBG0025Y4RZ3,False
ABBVD.BA,ABBVIE INC,,USD,,,,BUE,XBUE,Buenos Aires Mercato De Valores,United States,,,,,,,,,,,False
ABEV.BA,Ambev S.A.,"Ambev S.A., through its subsidiaries, produces, distributes, and sells beer, draft beer, carbonated soft drinks (CSD), other non-alcoholic beverages, malt, and food products in the Americas. It operates through three segments: Brazil; Central America and the Caribbean; Latin America South; and Canada. The company offers beer primarily under the Skol, Brahma, Antarctica, Brahva, Brahva Gold, Extra, Budweiser, Bud Light, Stella Artois, Corona, Modelo Especial, Beck, Leffe, Hoegaarden, Bucanero, Cristal, Mayabe, Cacique, Presidente, Brahma Light, President Light, Bohemia, The One, Banks, Deputy, Quilmes Cl√É¬°sica, Pace√É¬±a, Taqui√É¬±a, Huari, Becker, Cusque√É¬±a, Pilsen, Ouro Fino, Patricia, Michelob Ultra, Busch, Labatt Blue, Alexander Keith's, and Kokanee brands. It also provides bottled water, isotonic beverages, energy drinks, coconut water, powdered and natural juices, and ready-to-drink teas under the Guaran√É¬° Antarctica, Natu, Gatorade, H2OH!, Lipton Iced Tea, Fusion, Do Bem, Pepsi, Canada Dry, Squirt, Red Rock, Pepsi-Cola, Seven Up, Nutrl, and Palm Bay and Mike's brands, as well as For Me wellness shots, a functional beverage. Ambev S.A. offers its products through a network of third-party distributors and a direct distribution system. The company was founded in 1885 and is headquartered in S√É¬£o Paulo, Brazil. Ambev S.A. is a subsidiary of Interbrew International B.V.",ARS,Consumer Staples,"Food, Beverage & Tobacco",Beverages,BUE,XBUE,Buenos Aires Mercato De Valores,Brazil,SP,Sao Paulo,04530-001,http://www.ambev.com.br,Large Cap,US02319V1035,02319V103,,,BBG005KLVT74,False
ABEVD.BA,AMBEV SA,"AMBEV SA is a Brazilian brewing company that produces, distributes, and markets beer, soft drinks, and other beverages. Its portfolio includes popular brands like Skol, Brahma, and Antarctica, and it operates in several countries across the Americas. The company is headquartered in São Paulo, Brazil.",USD,,,,BUE,XBUE,Buenos Aires Mercato De Valores,Brazil,,,,,,,,,,,False
ABT.BA,Abbott Laboratories,"Abbott Laboratories discovers, develops, manufactures, and sells health care products worldwide. It operates in four segments: Established Pharmaceutical Products, Diagnostic Products, Nutritional Products, and Medical Devices. The Established Pharmaceutical Products segment provides generic pharmaceuticals for the treatment of pancreatic exocrine insufficiency, irritable bowel syndrome or biliary spasm, intrahepatic cholestasis or depressive symptoms, gynecological disorder, hormone replacement therapy, dyslipidemia, hypertension, hypothyroidism, M√É¬©ni√É¬®re's disease and vestibular vertigo, pain, fever, inflammation, and migraine, as well as provides anti-infective clarithromycin, influenza vaccine, and products to regulate physiological rhythm of the colon. The Diagnostic Products segment offers laboratory systems in the areas of immunoassay, clinical chemistry, hematology, and transfusion; molecular diagnostics systems that automate the extraction, purification, and preparation of DNA and RNA from patient samples, as well as detect and measure infectious agents; point of care systems; cartridges for testing blood; rapid diagnostics lateral flow testing products; molecular point-of-care testing for HIV, SARS-CoV-2, influenza A and B, RSV, and strep A; cardiometabolic test systems; drug and alcohol test, and remote patient monitoring and consumer self-test systems; and informatics and automation solutions for use in laboratories. The Nutritional Products segment provides pediatric and adult nutritional products. The Medical Devices segment offers rhythm management, electrophysiology, heart failure, vascular, and structural heart devices for the treatment of cardiovascular diseases; and diabetes care products, as well as neuromodulation devices for the management of chronic pain and movement disorders. The company was founded in 1888 and is based in North Chicago, Illinois.",ARS,Health Care,Health Care Equipment & Services,Health Care Technology,BUE,XBUE,Buenos Aires Mercato De Valores,United States,IL,North Chicago,60064-6400,http://www.abbott.com,Mega Cap,US0028241000,002824100,,,BBG001S5N9M6,False
ACH.BA,Aluminum Corporation of China Limited,"Aluminum Corporation of China Limited, together with its subsidiaries, manufactures and sells alumina, primary aluminum, and energy products in the People's Republic of China. The company operates through Alumina, Primary Aluminum, Trading, and Energy segments. The Alumina segment mines for and purchases bauxite and other raw materials; and produces and sells alumina, as well as refined alumina. The Primary Aluminum segment procures alumina and other raw materials, supplemental materials, and electrical power; and produces and sells aluminum and aluminum-related products, such as carbon, aluminum alloy, and other electrolytic aluminum products. The Trading segment trades in alumina, primary aluminum, aluminum fabrication products, other non-ferrous metal products, coal products, raw and supplemental materials; and provides logistics and transport services to external customers. The Energy segment engages in coal mining; and generates and sells electricity using thermal power, wind power, and solar power sources to regional power grid corporations, as well as manufactures power related equipment. The company also acquires, manufactures, and distributes bauxite mines and limestone ore; and provides engineering project management, and research and development services. Aluminum Corporation of China Limited was incorporated in 2001 and is headquartered in Beijing, the People's Republic of China.",ARS,Materials,Materials,Metals & Mining,BUE,XBUE,Buenos Aires Mercato De Valores,China,,Beijing,100082,http://www.chalco.com.cn,Large Cap,,,,,,False
ACHD.BA,ALUMINUM CORP CHN,"ALUMINUM CORP CHN is likely Aluminum Corporation of China Limited (Chalco), a leading Chinese aluminum producer involved in the mining of bauxite, alumina refining, and primary aluminum smelting, headquartered in Beijing, China",USD,Materials,Materials,,BUE,XBUE,Buenos Aires Mercato De Valores,,,,,,,,,,,,False
ADBE.BA,Adobe Inc.,"Adobe Inc. operates as a diversified software company worldwide. Its Digital Media segment provides tools and solutions that enable individuals, teams, and enterprises to create, publish, promote, and monetize their digital content. Its flagship product is Creative Cloud, a subscription service that allows customer to download and access the latest versions of its creative products. This segment serves content creators, experience designers, app developers, enthusiasts, students, social media users, and creative professionals; and marketing departments and agencies, companies, and publishers. The company's Digital Experience segment offers products, services, and solutions for creating, managing, executing, measuring, monetizing, and optimizing customer experiences from analytics to commerce. This segment serves marketers, advertisers, agencies, publishers, merchandisers, merchants, web analysts, data scientists, developers, marketing executives, information management and technology executives, product development executives, and sales and support executives. Its Publishing and Advertising segment offers products and services, such as e-learning solutions, technical document publishing, web conferencing, document and forms platform, web application development, and high-end printing, as well as publishing needs of technical and business, and original equipment manufacturers (OEMs) printing businesses. The company offers its products and services directly to enterprise customers through its sales force and local field offices, as well as to end users through app stores and through its website at adobe.com. It also distributes products and services through a network of distributors, value-added resellers, systems integrators, software vendors and developers, retailers, and OEMs. The company was formerly known as Adobe Systems Incorporated and changed its name to Adobe Inc. in October 2018. The company was founded in 1982 and is headquartered in San Jose, California.",ARS,Information Technology,Software & Services,Software,BUE,XBUE,Buenos Aires Mercato De Valores,United States,CA,San Jose,95110-2704,http://www.adobe.com,Mega Cap,,,,,,False
ADBLF.BA,Supervielle Asset Management S.A. - ADBlick Ganaderia Fondo Comun de Inversion Fund,Supervielle Asset Management S.A. - ADBlick Ganaderia Fondo Comun de Inversion Fund is an Argentinian investment fund. The fund focuses on the cattle industry.,ARS,Financials,Diversified Financials,,BUE,XBUE,Buenos Aires Mercato De Valores,,,,,,,,,,,,False
ADGO.BA,Adecoagro S.A.,"Adecoagro S.A. operates as an agro-industrial company in South America. It engages in farming crops and other agricultural products, dairy operations, and land transformation activities, as well as in sugar, ethanol, and energy production activities. The company is involved in the planting, harvesting, and sale of grains and oilseeds, as well as wheat, corn, soybeans, peanut, cotton, sunflowers, and other; provision of grain warehousing/conditioning, handling, and drying services to third parties; and purchase and sale of crops produced by third parties. It also plants, harvests, processes, and markets rice; and produces and sells raw milk, UHT, cheese, powder milk, and others. In addition, the company engages in the cultivating, processing, and transforming of sugarcane into ethanol and sugar; and sale of electricity co-generated at its sugar and ethanol mills to the grid. Further, it is involved in the identification and acquisition of underdeveloped and undermanaged farmland, and realization of value through the strategic disposition of assets. As of December 31, 2020, the company owned a total of 220,186 hectares, including 18 farms in Argentina, 8 farms in Brazil, and 1 farm in Uruguay, as well as had a total of 241 megawatts of installed cogeneration capacity. Adecoagro S.A. was founded in 2002 and is based in Luxembourg, Luxembourg.",ARS,Consumer Staples,Household & Personal Products,Household Products,BUE,XBUE,Buenos Aires Mercato De Valores,Luxembourg,,Luxembourg City,2453,http://www.adecoagro.com,Small Cap,LU0584671464,,,,BBG001V05PW6,False
ADGOD.BA,ADECOAGRO S A,"ADECOAGRO S.A. is an agro-industrial company in South America. They are involved in farming grains, oilseeds, and other agricultural products, as well as in sugar, ethanol, and electricity production. The company also engages in land transformation activities.",USD,Consumer Staples,"Food, Beverage & Tobacco",,BUE,XBUE,Buenos Aires Mercato De Valores,Luxembourg,,,,,,,,,,,False
ADI.BA,"Analog Devices, Inc.","Analog Devices, Inc. designs, manufactures, tests, and markets integrated circuits (ICs), software, and subsystems that leverage analog, mixed-signal, and digital signal processing technologies. The company offers data converter products, which translate real-world analog signals into digital data, as well as translates digital data into analog signals; high-performance amplifiers to condition analog signals; and radio frequency and microwave ICs to support cellular infrastructure. It also provides power management and reference products for power management and conversion applications in the automotive, communications, industrial, and high-end consumer markets; and microelectromechanical systems technology solutions, including accelerometers used to sense acceleration, gyroscopes to sense rotation, and inertial measurement units to sense multiple degrees of freedom, as well as isolators. In addition, the company offers digital signal processing and system products for high-speed numeric calculations. The company serves clients in the industrial, automotive, consumer, and communications markets through a direct sales force, third-party distributors, and independent sales representatives in the United States, the rest of North and South America, Europe, Japan, China, and rest of Asia, as well as through its Website. Analog Devices, Inc. was founded in 1965 and is headquartered in Wilmington, Massachusetts.",ARS,Information Technology,Semiconductors & Semiconductor Equipment,Semiconductors & Semiconductor Equipment,BUE,XBUE,Buenos Aires Mercato De Valores,United States,MA,Norwood,2062,http://www.analog.com,Large Cap,US0326541051,032654105,,,BBG001S5ND38,False
ADP.BA,"Automatic Data Processing, Inc.","Automatic Data Processing, Inc. provides cloud-based human capital management solutions worldwide. It operates through two segments, Employer Services and Professional Employer Organization (PEO). The Employer Services segment offers strategic, cloud-based platforms, and human resources (HR) outsourcing solutions. Its offerings include payroll, benefits administration, talent management, HR management, workforce management, insurance, retirement, and compliance services. The PEO Services segment provides HR outsourcing solutions to small and mid-sized businesses through a co-employment model. This segment offers benefits package, protection and compliance, talent engagement, comprehensive outsourcing, and recruitment process outsourcing services. The company was founded in 1949 and is headquartered in Roseland, New Jersey.",ARS,Industrials,Commercial & Professional Services,Professional Services,BUE,XBUE,Buenos Aires Mercato De Valores,United States,NJ,Roseland,7068,http://www.adp.com,Large Cap,US0530151036,053015103,,,BBG001S82KF6,False
AEM.BA,Agnico Eagle Mines Limited,"Agnico Eagle Mines Limited engages in the exploration, development, and production of mineral properties in Canada, Sweden, and Finland. The company operates through Northern Business and Southern Business segments. It primarily produces and sells gold deposit, as well as explores for silver, zinc, and copper deposits. The company's flagship property is the LaRonde mine located in the Abitibi region of northwestern Quebec, Canada. As of December 31, 2020, its LaRonde mine had a mineral reserve of approximately 3.8 million ounces of gold. The company is also involved in exploration activities in Europe, Latin America, and the United States. Agnico Eagle Mines Limited was incorporated in 1953 and is headquartered in Toronto, Canada.",ARS,Materials,Materials,Metals & Mining,BUE,XBUE,Buenos Aires Mercato De Valores,Canada,ON,Toronto,M5C 2Y7,http://www.agnicoeagle.com,Large Cap,CA0084741085,008474108,,,BBG001S77MK3,False
AER2O.BA,,,ARS,,,,BUE,XBUE,Buenos Aires Mercato De Valores,,,,,,,,,,,,False
AGRO.BA,Agrometal S.A.I.,"Agrometal S.A.I. manufactures and sells agricultural seeders in Argentina. It provides ADX Air Drill fine and coarse grain seeders; APX precision coarse grain planters with air drill systems; TX MEGA coarse grain seeders with pneumatic and mechanical systems; MXY II and MX MAX coarse and pastures seeders; TX PIVOT II, self-transporting precision coarse grain seeders; and XZ fine grain and pasture seeders, as well as hydro-pneumatic actuators. The company was formerly known as Agrometal S.R.L and changed its name to Agrometal S.A.I. in 1957. The company was founded in 1950 and is based in Monte Ma√É¬≠z, Argentina.",ARS,Industrials,Capital Goods,Machinery,BUE,XBUE,Buenos Aires Mercato De Valores,Argentina,,Monte Maiz,,http://www.agrometal.com,Nano Cap,,,BBG000BZRLB1,BBG000BZRL21,BBG001S7KMZ2,False
