symbol,name,summary,currency,sector,industry_group,industry,exchange,mic,market,country,state,city,zipcode,website,market_cap,isin,cusip,figi,composite_figi,shareclass_figi,delisted
DCSI.CN,"Direct Communication Solutions, Inc.","Direct Communication Solutions, Inc. provides solutions for the Internet of Things (IoT) worldwide. The company develops and delivers a portfolio of cellular based solutions for the IoT. Its range of products includes GPS devices, modems, embedded modules, routers and mobile tracking machine-to-machine (M2M) devices, communications and applications software, and cloud services. Its Software as a Service (SaaS) solutions include MiFleet, which offers fleet and vehicle SaaS telematics; MiSensors that provide M2M device management and service enablement for wireless sensors; and MiFailover, which offers high-speed wireless Internet failover services to small and medium-sized businesses. The company also provides MiServices, an engineering support covering software development, hardware integration, and logistics support, such as SIM card insertion, activation, provisioning, labeling, and device readiness checks to its distribution customers. In addition, it offers Monitoring as a Service (MaaS) solution for the telematics market. The company's clients range from those seeking recommendations on embedded wireless modules; individuals wanting bundled wireless solutions; and companies needing assistance with buying the right wireless products. Direct Communication Solutions, Inc. was incorporated in 2006 and is headquartered in San Diego, California.",CAD,Information Technology,Software & Services,IT Services,CNQ,XCNQ,Canadian Securities Exchange,United States,CA,San Diego,92127,http://www.dcsbusiness.com,Nano Cap,US25460P1049,25460P104,BBG00QKF2LZ9,BBG003QGS9Y2,BBG003QGS9Z1,False
DEEP.CN,Deeprock Minerals Inc.,"Deeprock Minerals Inc. engages in the acquisition, exploration, and development of mineral properties in Canada. It has an option agreement to acquire 50% interests in the Ralleau property located in the Quevillon area of Quebec; to acquire 100% interests in the Romanium property covering an area of 7.641 square kilometre located in the Apuseni mountains of western Romania's Bihor county; and to acquire 100% interests in 13 mineral claims in the Golden Gate project located in the Gloucester Count, Bathurst mining division, New Brunswick. The company was incorporated in 2014 and is headquartered in Vancouver, Canada.",CAD,Materials,Materials,Metals & Mining,CNQ,XCNQ,Canadian Securities Exchange,Canada,BC,Vancouver,V6C 3P6,http://deeprockmineralsinc.com,Nano Cap,,,,,,False
DELC.CN,Delic Holdings Inc.,"Delic Corp provides media brand mainstreaming psychedelic services. The company was founded in 2019 and is based in Marina Del Rey, California.",CAD,Communication Services,Telecommunication Services,Diversified Telecommunication Services,CNQ,XCNQ,Canadian Securities Exchange,United States,CA,Marina Del Rey,90292,http://www.deliccorp.com,,CA24689E1079,24689E107,BBG00Y73YGJ8,BBG00Y73YGB6,BBG00Y73YHC3,False
DFLY.CN,Draganfly Inc.,"Draganfly Inc. manufactures and sells commercial unmanned aerial vehicles worldwide. Its products include quad-copters, fixed wing aircraft, ground based robots, and hand held controllers, as well as software used for tracking, live streaming, and data collection. The company also offers custom engineering and training, simulation consulting, and flight training services, as well as wireless video systems. It serves public safety, agriculture, industrial inspections, and mapping and surveying markets. The company was incorporated in 2018 and is headquartered in Saskatoon, Canada.",CAD,Industrials,Capital Goods,Aerospace & Defense,CNQ,XCNQ,Canadian Securities Exchange,Canada,SK,Saskatoon,S7M 0K7,http://www.draganfly.com,Micro Cap,,,,,,False
DHC.CN,Deer Horn Capital Inc.,"Deer Horn Capital Inc. engages in the acquisition, exploration, and evaluation of mineral properties in Canada. It primarily explores for silver, tellurium, gold, copper, tungsten, copper porphyry, bismuth, lead, zinc, and molybdenum. The company principally holds a 50% interest in the Deer Horn Property covering 5,133 hectares located in north western British Columbia. The company was formerly known as Deer Horn Metals Inc. and changed its name to Deer Horn Capital Inc. in 2014. Deer Horn Capital Inc. was incorporated in 2004 and is headquartered in Delta, Canada.",CAD,Materials,Materials,Metals & Mining,CNQ,XCNQ,Canadian Securities Exchange,Canada,BC,Delta,V4M 3Z2,http://www.deerhorncapital.ca,Nano Cap,,25525P107,,,,False
DIGI.CN,DigiMax Global Inc.,"DigiCrypts Blockchain Solutions Inc. operates in digital security space worldwide. It provides consulting services to operating businesses and helps them to raise capital through the issuance of traditional securities. The company also offers Artificial Intelligence based data analytics services. The company was formerly known as TJR Coatings Inc. and changed its name to DigiCrypts Blockchain Solutions Inc. in May 2018. DigiCrypts Blockchain Solutions Inc. is based in Toronto, Canada.",CAD,Financials,Diversified Financials,Capital Markets,CNQ,XCNQ,Canadian Securities Exchange,Canada,ON,Toronto,M4W 3H1,http://www.digimaxai.com,Nano Cap,,,,,,False
DOCT.CN,Beyond Medical Technologies Inc.,"Beyond Medical Technologies Inc., an industrial/technology company, develops waste digester systems for food and pharmaceuticals industries in Canada. Its Organivore and Pharmavore waste digester systems turns organic waste into clean water. The company also engages in the manufacturing and distribution of personal protective equipment, including medical grade face masks. In addition, it offers health communications platform that facilitates doctors to streamline communications with their patients and remotely monitor them. The company was formerly known as Micron Waste Technologies Inc. The company was incorporated in 2006 and is headquartered in Vancouver, Canada.",CAD,Industrials,Capital Goods,Construction & Engineering,CNQ,XCNQ,Canadian Securities Exchange,Canada,BC,Vancouver,V6C 1G8,http://beyondmd.ca,Nano Cap,CA0886411051,088641105,BBG000RV64K4,BBG000RV6157,BBG001SV9Z74,False
DOSE.CN,Rapid Dose Therapeutics Corp.,"Rapid Dose Therapeutics Corp., a life sciences company, provides drug delivery technologies designed to enhance outcomes and quality of lives in Canada. The company offers QuickStrip, an oral fast-dissolving drug delivery system to rapidly release active ingredients into the blood stream, such as pharmaceuticals, emulsified oils, and over-the-counter medicines; QuickStrip energy to deliver energizing caffeine; QuickStrip B12 to deliver vitamin B12 in the system; and QuickStrip sleep that delivers melatonin in the system. It also offers PharmaStrip delivery system. The company also provides product innovation, production, and consultation services to the nutraceutical, cannabis healthcare, and pharmaceutical manufacturing industries. It has a research partnership program with McMaster University for developing biopolymer compositions that can offer enhanced drug delivery performance when formulated in oral dissolvable thin films. Rapid Dose Therapeutics Corp. is based in Burlington, Canada.",CAD,Health Care,"Pharmaceuticals, Biotechnology & Life Sciences",Biotechnology,CNQ,XCNQ,Canadian Securities Exchange,Canada,ON,Burlington,L7N 2G4,http://www.rapid-dose.com,Nano Cap,,,BBG00MTJ0588,BBG00MTJ0524,BBG00MTJ0631,False
DRUG.CN,Bright Minds Biosciences Inc.,"Bright Minds Biosciences Inc., a biotechnology company, develops 5-HT (serotonin) medicines to improve the lives of patients with severe and life-altering diseases. Its portfolio of selective 5-HT receptor agonists comprise 5-HT2C, 5-HT2A, and 5-HT2C/A for central nervous system -pediatric pharmacoresistant epilepsy, pain- cluster headache, migraine, fibromyalgia, chemotherapy induced neuropathy, neuropsychiatry-major depressive disorder, and impulse control disorder therapeutic areas. The company is headquartered in Vancouver, Canada.",CAD,Health Care,"Pharmaceuticals, Biotechnology & Life Sciences",Biotechnology,CNQ,XCNQ,Canadian Securities Exchange,Canada,BC,Vancouver,V6E 4N7,http://brightmindsbio.com,,,,BBG00Z61F2C9,BBG00Z61F248,BBG00Z61F382,False
DSAI.CN,DeepSpatial Inc.,"DeepSpatial Inc., an early stage artificial intelligence technology company, provides enterprise insights using geospatial data, geographic information systems, and machine learning. The company is headquartered in Toronto, Canada.",CAD,Information Technology,Software & Services,Software,CNQ,XCNQ,Canadian Securities Exchange,Canada,ON,Toronto,M5K 1G8,http://www.deepspatial.ai,,,,BBG0058QZ2K7,BBG0058QZ2B7,BBG0058QZ2C6,False
DST.CN,Dundee Sustainable Technologies Inc.,"Dundee Sustainable Technologies Inc. engages in the development and commercialization of technologies for the treatment of refractory materials in the mining industry in Canada and internationally. It focuses on the commercialization of CLEVR process, which extracts precious metals, as well as removes and stabilizes contaminants, such as arsenic, antimony, and cadmium; and GlassLock process, which stabilizes arsenic, forms scorodite, and produces an insoluble glass residue that meets environmental requirements. The company extracts precious and base metals from ores, concentrates, and tailings. It also provides technical services to customers in the mining industry to evaluate processing alternatives. The company was formerly known as Nichromet Extraction Inc. and changed its name to Dundee Sustainable Technologies Inc. in January 2014. Dundee Sustainable Technologies Inc. was incorporated in 1997 and is headquartered in Montreal, Canada. Dundee Sustainable Technologies Inc. is a subsidiary of Dundee Corporation.",CAD,Industrials,Capital Goods,Construction & Engineering,CNQ,XCNQ,Canadian Securities Exchange,Canada,QC,Montreal,H3A 2W5,http://www.dundeetechnologies.com,Nano Cap,,,BBG0069F7LR0,BBG005L7TX05,BBG005L7TX14,False
DVN-WT.CN,DanavaTechWts,,CAD,,,,CNQ,XCNQ,Canadian Securities Exchange,,,,,,,,,,,,False
DVN.CN,Danavation Technologies Corp.,"Danavation Technologies Corp., an Internet of Things (IoT) technology company, provides micro e-paper displays to organizations across North America. The company's Digital Smart Labels enable companies across various sectors to automate labelling, price, product, and promotions in real-time. Danavation offers its solution to retailers, including big box and boutique grocers while also targeting new markets, including healthcare providers, manufacturing, and logistics companies. The company was incorporated in 2018 and is based in Toronto, Canada.",CAD,Information Technology,Software & Services,Software,CNQ,XCNQ,Canadian Securities Exchange,Canada,ON,Toronto,M9W6Y1,http://danavation.com,Nano Cap,,,BBG00YXT8W06,BBG00YTZ4M58,BBG00YTZ4M67,False
DWR.CN,Dominion Water Reserves Corp.,"Dominion Water Reserves Corp. acquires, manages, and develops spring water assets. The company was founded in 2015 and is headquartered in Montreal, Canada.",CAD,Utilities,Utilities,Water Utilities,CNQ,XCNQ,Canadian Securities Exchange,Canada,QC,Montreal,H3B 0E5,http://www.dominionwr.com,Nano Cap,,,,,,False
EAP.CN,Euro Asia Pay Holdings Inc.,"Euro Asia Pay Holdings Inc. engages in developing payment solutions for the international student market. It offers SideKick, a branded mobile payment solution that enables a parent to transfer, control, and monitor funds to a child attending school abroad. The company was incorporated in 2017 and is headquartered in Vancouver, Canada.",CAD,Information Technology,Software & Services,Software,CNQ,XCNQ,Canadian Securities Exchange,Canada,BC,Vancouver,V6C 1S4,http://www.euroasiapay.com,,,,,,,False
EASY.CN,Speakeasy Cannabis Club Ltd.,"Speakeasy Cannabis Club Ltd. focuses on producing medical cannabis in Canada. It owns approximately 290 acres of land in Rock Creek, British Columbia. The company is headquartered in Rock Creek, Canada.",CAD,Health Care,"Pharmaceuticals, Biotechnology & Life Sciences",Pharmaceuticals,CNQ,XCNQ,Canadian Securities Exchange,Canada,BC,Rock Creek,V0H 1Y0,http://speakeasygrowers.com,Mid Cap,CA84730M1023,84730M102,,BBG00GBGX2N0,BBG002Z0T1H4,False
EAT.CN,Nutritional High International Inc.,"Nutritional High International Inc. manufactures and processes hemp and marijuana-infused cannabis oils, extracts, and edible products for medical and adult recreation use in the United States and Canada. It offers cannabis-based vaping, concentrate, and infused edible products, such as oil vape cartridges, syringes, dab jars, and mints, as well as cannabis infused chocolates under the FLÃ brand name. The company also distributes other branded cannabis products. Nutritional High International Inc. was incorporated in 2004 and is headquartered in Toronto, Canada.",CAD,Health Care,"Pharmaceuticals, Biotechnology & Life Sciences",Pharmaceuticals,CNQ,XCNQ,Canadian Securities Exchange,Canada,ON,Toronto,M5K 1H1,http://www.nutritionalhigh.com,Nano Cap,,,,,,False
EATS.CN,Eat Beyond Global Holdings Inc.,"Eat Beyond Global Holdings Inc. is a private equity and venture capital firm specializing in early stage, growth, expansion, buy-ins or buy-out investments. It focuses on investments in the plant-based protein and meat alternative food industry. It identifies and acquires equity in companies operating in the sectors of plant-based proteins, fermented proteins, cultured proteins/agriculture, food tech, and consumer packaged goods, as well as cell agriculture and other experimental projects. The firm prefers to invest in companies based in North America, Europe, Israel, and Asian and Latin American countries. It typically invests between $1 million and $10million over the initial 48-month deployment period with a minimum ownership goal of 5%+. It prefers to take majority stakes. Eat Beyond Global Holdings Inc. was incorporated in 2019 and is headquartered in Vancouver, Canada.",CAD,Consumer Staples,Food & Staples Retailing,Food & Staples Retailing,CNQ,XCNQ,Canadian Securities Exchange,Canada,BC,Vancouver,V7X 1M5,http://eatbeyondglobal.com,,CA27785T1003,27785T100,BBG00Y6TVKZ8,BBG00Y6TVKR7,BBG00Y6TVLT3,False
EDEN.CN,Eden Empire Inc.,"Eden Empire Inc. invests in and operates in the cannabis sector. It engages in the retail sale of cannabis in Canada and the United States. Eden Empire Inc. is based in Vancouver, Canada.",CAD,Health Care,"Pharmaceuticals, Biotechnology & Life Sciences",Pharmaceuticals,CNQ,XCNQ,Canadian Securities Exchange,Canada,BC,Vancouver,V7V 4G8,http://myeden.ca,Nano Cap,,,,,,False
EDGM.CN,Edgemont Gold Corp.,"Edgemont Gold Corp. engages in the acquisition and exploration of mineral property assets in Canada. It primarily explores the Dungate Creek copper/gold porphyry project, which covers five mineral tenures covering an area of 1,582.2 hectares located to the southeast of the town of Houston in the Omineca Mining Division of northern British Columbia. The company was incorporated in 2018 and is headquartered in Vancouver, Canada.",CAD,Materials,Materials,Metals & Mining,CNQ,XCNQ,Canadian Securities Exchange,Canada,BC,Vancouver,V6E 3X2,http://edgemontgold.com,Nano Cap,,,BBG00V3NBGQ1,BBG00RTBDMD7,BBG00RTBDMF5,False
EGTI.CN,EYEFI Group Technologies Inc.,"EYEFI Group Technologies Inc., an electronics and software engineering company, develops spatial, predictive, approximation, and radial convolution (SPARC) technology. Its products include EYEfi Cloud, a platform that offers remote monitoring, intelligence gathering, and situational awareness solutions; EYEfi Sensors, which is used for monitoring and intelligence gathering applications from industrial-grade camera sensors; EYEfi SPARC, a situational awareness technology for government and industry; and EYEfi SPARC (mobile), a solution that spatially enables smartphones, wearable technology, and UAVs. The company's SPARC solution turns sensors, cameras, or smartphone devices (fixed, mobile, airborne, portable, or handheld) into target co-ordinate acquisition systems. Its solutions also include Industrial Internet of Things (IIoT) hardware sensor product and cloud application (Smart Waste) for waste bins and smart drain for storm water pits. The company, through resellers, serves government and industry customers in the infrastructure and asset management, emergency management, and incident response markets primarily in Australia and New Zealand. EYEFI Group Technologies Inc. was incorporated in 2018 and is headquartered in Collingwood, Australia.",CAD,Information Technology,Software & Services,Software,CNQ,XCNQ,Canadian Securities Exchange,Australia,VIC,Collingwood,3066,http://www.eyefi.com.au,,,,,,,True
EI.CN,EUROGAS INTERNATIONAL INC,"Eurogas International Inc. operates an independent oil and gas exploration company. It holds a 5.625% working interest in the Sfax offshore exploration permit located in the Gulf of Gabes offshore Tunisia. The company is headquartered in Bridgetown, Barbados. Eurogas International Inc. is a subsidiary of Dundee Corporation.",CAD,Energy,Energy,"Oil, Gas & Consumable Fuels",CNQ,XCNQ,Canadian Securities Exchange,Barbados,,Bridgetown,,http://eurogasinternational.com,Nano Cap,,,,,,False
ELMT.CN,Element Nutritional Sciences Inc.,"Element Nutrition Inc. develops nutritional products. The company also engages in retailing of its products through stores and online. Element Nutrition Inc. was incorporated in 2014 and is based in Burlington, Canada.",CAD,Consumer Staples,Food & Staples Retailing,Food & Staples Retailing,CNQ,XCNQ,Canadian Securities Exchange,Canada,ON,Burlington,L7N 2G3,http://www.elementnutrition.com,,CA28619R1047,28619R104,BBG0116ZF0B3,BBG00X3J3L75,BBG00X3J3L84,True
EMER.CN,Emergia Inc.,"Emergia Inc., together with its subsidiaries, engages in the acquisition, development, and management of real estate properties in Canada, the United States, and Greece. Its portfolio includes retail, residential, office, and industrial properties. The company was formerly known as The Delma Group Inc. and changed its name to Emergia Inc. in January 2020. Emergia Inc. is headquartered in Dorval, Canada.",CAD,Real Estate,Real Estate,Real Estate Management & Development,CNQ,XCNQ,Canadian Securities Exchange,Canada,QC,Dorval,H9P 1E9,http://www.emergia.com,Nano Cap,,,BBG0088NHRW0,BBG0088NHRM1,BBG0088NHRN0,False
EMH.CN,"Emerald Health Therapeutics, Inc.","Emerald Health Therapeutics, Inc., together with its subsidiaries, produces and sells medical cannabis for medical purpose in Canada. The company is also involved in developing natural health products. It offers dried cannabis strains, pre-rolls, and cannabis oil products to its medical patients. The company was formerly known as T-Bird Pharma Inc. and changed its name to Emerald Health Therapeutics, Inc. in June 2015. Emerald Health Therapeutics, Inc. is headquartered in Vancouver, Canada.",CAD,Health Care,"Pharmaceuticals, Biotechnology & Life Sciences",Pharmaceuticals,CNQ,XCNQ,Canadian Securities Exchange,Canada,BC,Vancouver,V6C 1J8,http://emeraldhealth.ca,Nano Cap,,,,,,False
EMRG.CN,Emergence Global Enterprises Inc.,"Emergence Global Enterprises Inc develops and distributes natural health foods, supplements, and sports nutrition specialty supplements in North America. The company was formerly known as Velocity Data Inc. and changed its name to Emergence Global Enterprises Inc. in February 2020. Emergence Global Enterprises Inc. was incorporated in 2011 and is based in Vancouver, Canada.",CAD,Information Technology,Technology Hardware & Equipment,"Electronic Equipment, Instruments & Components",CNQ,XCNQ,Canadian Securities Exchange,Canada,BC,Vancouver,V6H 3X8,http://emergenceglobalinc.website,Nano Cap,,,,,,False
ENBI.CN,Entheon Biomedical Corp.,"Entheon Biomedical Corp., a biotechnology research and drug development company, engages in developing and commercializing various N,N-dimethyltryptamine based psychedelic therapeutic products for treating addiction and substance use disorders. The company is based in Vancouver, Canada.",CAD,Health Care,"Pharmaceuticals, Biotechnology & Life Sciences",Biotechnology,CNQ,XCNQ,Canadian Securities Exchange,Canada,BC,Vancouver,V6C 2T5,http://entheonbiomedical.com,Nano Cap,CA29383X1033,29383X103,BBG00KTGG4L9,BBG00KTGG4D8,BBG00KTGG5F3,True
EOM.CN,Eco Oro Minerals Corp.,"Eco Oro Minerals Corp. engages in the acquisition, exploration, and development of mineral assets in Colombia. The company was formerly known as Greystar Resources Ltd. and changed its name to Eco Oro Minerals Corp. in August 2011. Eco Oro Minerals Corp. is based in Vancouver, Canada.",CAD,Materials,Materials,Metals & Mining,CNQ,XCNQ,Canadian Securities Exchange,Canada,BC,Vancouver,V6E 2E9,http://www.eco-oro.com,Nano Cap,,,BBG000CT4007,BBG000CT3WX2,BBG001S727L0,False
EPIC.CN,Leviathan Natural Products Inc.,"Leviathan Natural Products Inc. engages in cultivating, processing, and distributing of cannabis and hemp products in Canada, the United States, and Colombia. The company was formerly known as Leviathan Cannabis Group Inc. and changed its name to Leviathan Natural Products Inc. in July 2020. Leviathan Natural Products Inc. is headquartered in Toronto, Canada.",CAD,Health Care,"Pharmaceuticals, Biotechnology & Life Sciences",Pharmaceuticals,CNQ,XCNQ,Canadian Securities Exchange,Canada,ON,Toronto,M5H 4J6,http://leviathan-naturals.com,Nano Cap,,,,,,False
EPY.CN,ePlay Digital Inc.,"ePlay Digital Inc., through its subsidiary, Mobovivo Inc., provides a social game engine and content marketing platform to engage audiences in Canada. Its solutions integrate TV, video, sports, daily fantasy, and social games into multiplatform destinations and campaigns for brands, sports teams, and venues. The company also operates an augmented reality sports, esports, and entertainment game platform. ePlay Digital Inc. is headquartered in Calgary, Canada.",CAD,Communication Services,Media & Entertainment,Interactive Media & Services,CNQ,XCNQ,Canadian Securities Exchange,Canada,AB,Calgary,T3H 3C8,http://www.eplaydigital.com,Nano Cap,,26885W104,BBG007XHMLT8,BBG007XHMLL6,BBG007XHMLM5,False
ERTH.CN,EarthRenew Inc.,"EarthRenew Inc. produces and sells organic fertilizers from livestock waste in North America and Europe. It also produces electricity from natural gas using an industrial-sized gas turbine to electrical grid and cryptocurrency miners. The company sells it fertilizers under GrowER and GrowER Biochar names. The company is headquartered in Toronto, Canada.",CAD,Utilities,Utilities,Independent Power and Renewable Electricity Producers,CNQ,XCNQ,Canadian Securities Exchange,Canada,ON,Toronto,M5H 2M5,http://www.earthrenew.ca,Nano Cap,CA27034F2089,27034F208,BBG000BQHBF0,BBG000BQH6T6,BBG001S6K7K3,False
ESNR.CN,E79 Resources Corp.,"E79 Resources Corp., a resource exploration company, engages in the acquisition and exploration of mineral properties. The company primarily explores for gold. It holds 100% interest in the Beaufort Project located in the southwest of Victoria, Australia; and holds interest in Myrtleford Project located in the north-east of Victoria, Australia. The company also holds a 100% interest in the Golden Girl Property located in British Columbia, Canada. E79 Resources Corp. was formerly known as Top Exploration Inc. and changed its name to E79 Resources Corp. in October 2020. The company was incorporated in 2018 and is headquartered in Vancouver, Canada.",CAD,Materials,Materials,Metals & Mining,CNQ,XCNQ,Canadian Securities Exchange,Canada,BC,Vancouver,V6E 2Y3,http://e79resources.com,Nano Cap,,26917E106,BBG00S4759H5,BBG00Q6ZDHT5,BBG00Q6ZDJ11,False
ETI.CN,EnviroLeach Technologies Inc.,"EnviroLeach Technologies Inc. develops and commercializes inorganic electrochemical technologies for the hydrometallurgical extraction and recovery of precious metals in the primary and secondary metal sectors. Its targets the gold mining sector and the e-waste sector markets. The company was incorporated in 2016 and is headquartered in Burnaby, Canada.",CAD,Materials,Materials,Metals & Mining,CNQ,XCNQ,Canadian Securities Exchange,Canada,BC,Burnaby,V5A 4W2,http://enviroleach.com,Nano Cap,CA29408D1087,29408D108,BBG00GBV7VD3,BBG00FJGMFX6,BBG00FJGMFY5,False
ETR.CN,Etruscus Resources Corp.,"Etruscus Resources Corp., a junior exploration company, engages in the exploration and development of natural resource properties. The company explores for gold, silver, zinc, lead, and copper deposits. It focuses on developing its 100% owned Rock & Roll and Sugar properties covering 27,136 hectares in northwestern British Columbia, Canada. The company was incorporated in 2017 and is based in Vancouver, Canada.",CAD,Materials,Materials,Metals & Mining,CNQ,XCNQ,Canadian Securities Exchange,Canada,BC,Vancouver,V6Z 2K8,http://www.etruscusresources.com,Nano Cap,,29787F104,BBG00N26TPN1,BBG00N26TPG9,BBG00N26TQH6,False
EVG.CN,Evolving Gold Corp.,"Evolving Gold Corp., an exploration stage company, engages in the acquisition, exploration, and development of natural resource properties in Canada. The company explores for lithium deposit. Its flagship property is the Lithium Lakes property that covers an area of 72.5 square kilometers in Quebec. The company was formerly known as 6109527 Canada Ltd. and changed its name to Evolving Gold Corp. in September 2003. Evolving Gold Corp. was incorporated in 2003 and is headquartered in Vancouver, Canada.",CAD,Materials,Materials,Metals & Mining,CNQ,XCNQ,Canadian Securities Exchange,Canada,BC,Vancouver,V6E 3Z3,http://www.evolvinggold.com,Nano Cap,,,,,,False
