symbol,name,summary,currency,sector,industry_group,industry,exchange,mic,market,country,state,city,zipcode,website,market_cap,isin,cusip,figi,composite_figi,shareclass_figi,delisted
AAWH.CN,Ascend Wellness Holdings LLC,"Ascend Wellness Holdings LLC is a vertically integrated cannabis company. The company cultivates, processes, and retails cannabis products through its network of dispensaries and wholesale operations. Ascend Wellness Holdings is headquartered in New York, NY.",,,,,CNQ,XCNQ,Canadian Securities Exchange,United States,,,,,,,,,,,False
ACDC.CN,Extreme Vehicle Battery Technologies Corp.,"Extreme Vehicle Battery Technologies Corp. provides blockchain solutions. It focuses on providing services for application programming interface in regards to operator look-up, customer look-up, IP information, and customer friendly user experience; and developing and implementing blockchain, distributed ledger, closed loop, and cryptocurrency services for government and commercial partners. The company was formerly known as Global Elsimate Capital Corp. and changed its name to Extreme Vehicle Battery Technologies Corp. in September 2020. Extreme Vehicle Battery Technologies Corp. is based in Vancouver, Canada.",CAD,Information Technology,Software & Services,Software,CNQ,XCNQ,Canadian Securities Exchange,Canada,BC,Vancouver,V7Y 1G5,http://www.evbattery.tech,Micro Cap,CA22906X1069,22906X106,,,,False
ACME.CN,ACME Lithium Inc.,"ACME Lithium Inc., a technology company, specializes in the digital customer acquisition in Canada. The company manages and optimizes its customers digital marketing campaigns by using a proprietary inquiry management platform and database of international prospects. It serves higher education institutions that promote campus and online degree programs to consumers through digital media, such as websites, mobile apps, social media networks, and direct e-mails. The company was incorporated in 2017 and is based in Vancouver, Canada.",CAD,Information Technology,Software & Services,,CNQ,XCNQ,Canadian Securities Exchange,Canada,BC,Vancouver,V6J 3H4,,,,,,,,True
ACRG-AU.CN,AcreageHoldInc,"Acreage Holdings is a cannabis company focused on cultivating, processing, and distributing cannabis products, with operations in the United States and headquartered in New York City, New York",USD,Consumer Staples,"Food, Beverage & Tobacco",,CNQ,XCNQ,Canadian Securities Exchange,,,,,,,,,,,,False
ACRG-BU.CN,AcreageHoldings,"Acreage Holdings is a cannabis company focused on cultivating, processing, and distributing cannabis products, with operations in the United States and headquartered in New York City, New York",USD,Consumer Staples,"Food, Beverage & Tobacco",,CNQ,XCNQ,Canadian Securities Exchange,,,,,,,,,,,,False
ACT.CN,Aduro Clean Technologies Inc.,"Aduro Energy Inc. develops water-based solutions to transform corn distillers oil and other waste lipids into drop-in diesel, petroleum, specialty chemicals, and bio-jet fuel. The company was founded in 2011 and is based in London, Canada.",CAD,Industrials,Capital Goods,Construction & Engineering,CNQ,XCNQ,Canadian Securities Exchange,Canada,ON,London,N6G 0J3,http://www.aduroenergy.com,Nano Cap,CA0074081070,007408107,BBG00N9ZZW58,BBG00N9ZZVZ7,BBG00N9ZZX01,False
AFD.CN,Ansar Financial and Development Corporation,"Ansar Financial and Development Corporation, a real estate corporation, acquires, owns, and sells properties in Canada. The company also purchases, develops, and sells residential lots near the Edmonton Airport in Alberta; and commercial/industrial lots near Calgary, Alberta. Ansar Financial and Development Corporation was incorporated in 2008 and is based in Toronto, Canada.",CAD,Real Estate,Real Estate,Real Estate Management & Development,CNQ,XCNQ,Canadian Securities Exchange,Canada,ON,Toronto,M1B 4Z9,http://www.ansarfinancial.com,Nano Cap,,,,,,False
AFI.CN,Affinor Growers Inc.,"Affinor Growers Inc., a farming technology company, engages in acquiring, patenting, and commercializing various agriculture technologies and vertical farming technology for indoor controlled environment and outdoor greenhouse agriculture industry in North America. Its vertical growing technology helps to grow crops, such as romaine lettuce and strawberries. The company was formerly known as Affinor Resources Inc. and changed its name to Affinor Growers Inc. in May 2014. Affinor Growers Inc. was incorporated in 1996 and is based in Langley, Canada.",CAD,Consumer Staples,Household & Personal Products,Household Products,CNQ,XCNQ,Canadian Securities Exchange,Canada,BC,Langley,V2Y 0G9,http://www.affinorgrowers.com,Nano Cap,,,BBG003GFK9S0,BBG003GFK9L7,BBG003GFKBB3,False
AG-UN.CN,Arctic Glacier Income Fund,"Arctic Glacier Income Fund operates as an unincorporated open-ended mutual fund trust. The company, through its subsidiary Arctic Glacier Inc., engages in manufacturing, marketing, and distributing packaged ice products in the United States and Canada. The company sells its packaged ice products under the Arctic Glacier Premium Ice brand to retail customers, such as mass merchandisers, grocery stores, and convenience stores, as well as to various commercial users comprising special events and festivals, airlines, restaurants, hotels, and bars. It also produces ice in bulk quantities for industrial users, including food processing, construction, chemical manufacturing, and other commercial industries. In addition, the company licenses its trade names and proprietary technology to independently owned companies under franchise and license agreements. Further, it provides ancillary products, such as bottled water, dry ice, packaged wood, and rock salt, as well as sells and leases ice-making and dispensing equipment. The company was founded in 1996 and is headquartered in Winnipeg, Canada. On February 22, 2012, Arctic Glacier Income Fund filed for proceedings under the Companies' Creditors Arrangement Act in the Court of the Queen's Bench.",CAD,Consumer Staples,Food & Staples Retailing,Food & Staples Retailing,CNQ,XCNQ,Canadian Securities Exchange,Canada,MB,Winnipeg,R3A 0V1,http://www.arcticglacier.com,Micro Cap,,,,,,False
AGN.CN,Algernon Pharmaceuticals Inc.,"Algernon Pharmaceuticals Inc., a clinical stage pharmaceutical development company, focuses in the areas of nonÂalcoholic steatohepatitis, chronic kidney disease, inflammatory bowel disease, idiopathic pulmonary fibrosis, chronic cough, and acute lung injury associated with COVID-19 in Canada and Australia. The company's lead candidate is NP-120, an N-methyl-d-aspartate (NMDA) receptor glutamate receptor antagonist, which targets NMDA-type subunit 2B (Glu2NB), as well as exhibits agonist activity for the Sigma-1 receptor, a chaperone protein up-regulated during endoplasmic reticulum stress. It is also developing AP-188 (N,N-Dimethyltryptamine), a psychedelic compound that is part of the tryptamine family for the treatment of ischemic stroke in humans. Algernon Pharmaceuticals Inc. has an agreement with Charles River Laboratories for preclinical studies of AP-188 for the company's stroke clinical research program. Algernon Pharmaceuticals Inc. is headquartered in Vancouver, Canada.",CAD,Health Care,"Pharmaceuticals, Biotechnology & Life Sciences",Biotechnology,CNQ,XCNQ,Canadian Securities Exchange,Canada,BC,Vancouver,V6C 1G8,http://algernonpharmaceuticals.com,Nano Cap,CA01559R4008,01559R400,BBG00C1CQ1Q6,BBG00C1CQ1G7,BBG00C1CQ1J4,False
AGRA.CN,AgraFlora Organics International Inc.,"AgraFlora Organics International Inc. operates in the cannabis industry in Canada and the Republic of Colombia. The company was formerly known as PUF Ventures Inc. and changed its name to AgraFlora Organics International Inc. in November 2018. The company was incorporated in 2004 and is headquartered in Vancouver, Canada.",CAD,Health Care,"Pharmaceuticals, Biotechnology & Life Sciences",Pharmaceuticals,CNQ,XCNQ,Canadian Securities Exchange,Canada,BC,Vancouver,V6C 2T7,http://agraflora.com,Nano Cap,CA0085052086,008505208,BBG000CWD3P7,BBG000CWD1B6,BBG001SC1ZS1,False
AIML.CN,AI/ML Innovations Inc.,"AI/ML Innovations Inc. operates in the digital healthcare business. It focuses on offering a patent-pending personal health monitoring and management system for caregivers, patients, and healthcare professionals to access and utilize data for enhance recovery outcomes and healthy living. The company was formerly known as AIML Resources Inc. and changed its name to AI/ML Innovations Inc. in November 2020. AI/ML Innovations Inc. is based in Toronto, Canada.",CAD,Materials,Materials,Metals & Mining,CNQ,XCNQ,Canadian Securities Exchange,Canada,ON,Toronto,M5C 1P1,http://www.aiml-innovations.com,Nano Cap,,,BBG000CNRJT3,BBG000CNRFH4,BBG001S706N2,False
AION.CN,Aion Therapeutic Inc.,"Aion Therapeutic Inc. researches, grows, harvests, and markets medical cannabis products in Canada. The company was formerly known as Osoyoos Cannabis Inc. and changed its name to Aion Therapeutic Inc. in August 2020. Aion Therapeutic Inc. was founded in 2011 and is based in Toronto, Canada.",CAD,Health Care,"Pharmaceuticals, Biotechnology & Life Sciences",Pharmaceuticals,CNQ,XCNQ,Canadian Securities Exchange,Canada,ON,Toronto,M2N 5W9,http://www.aiontherapeutic.com,Nano Cap,,,BBG00NF0FQY1,BBG00LG81738,BBG00LG81747,False
AJN.CN,AJN Resources Inc.,"AJN Resources Inc., an exploration and development company, acquires, explores for, and develops mineral properties. The company holds an option to acquire a 100% interest in the Salt Wells Lithium Project located in Nevada, the United States. AJN Resources Inc. was founded in 2016 and is headquartered in Surrey, Canada.",CAD,Materials,Materials,Metals & Mining,CNQ,XCNQ,Canadian Securities Exchange,Canada,BC,Surrey,V3S 1L3,http://ajnresources.com,Nano Cap,CA00149L1058,00149L105,BBG00L4J9KS3,BBG00L4J9KL0,BBG00L4J9LL8,True
ALI.CN,Ameriwest Lithium Inc.,Ameriwest Lithium Inc. is a resource exploration company focused on identifying and developing lithium resources. The company is based in Canada.,CAD,Materials,Materials,,CNQ,XCNQ,Canadian Securities Exchange,Philippines,,,,,Nano Cap,,020398103,,,,False
AMMP.CN,AmmPower Corp.,"Soldera Mining Corp. engages in the exploration of mineral properties in Canada. The company holds an option agreement to acquire 100% interest in the Titan Gold property that consists of 34 mining claims covering an area of approximately 2,312.25 hectares located in Northwestern Ontario. Soldera Mining Corp. was incorporated in 2019 and is headquartered in Vancouver, Canada.",CAD,Materials,Materials,Metals & Mining,CNQ,XCNQ,Canadian Securities Exchange,Canada,BC,Vancouver,V6C 1T2,http://solderamining.com,Nano Cap,,,BBG00XRJJJH6,BBG00XRJJJ95,BBG00XRJJKB9,False
AMPD.CN,AMPD Ventures Inc.,"AMPD Ventures Inc., a technology company, provides cloud and computing solutions to games and digital media companies in Canada and the United States. It offers solutions for video games and eSports, digital media production, big data analysis, collection, and visualization applications. The company also provides AMPD Metal, a bare metal server product; AMPD Gallium, a private cloud product; AMPD Cloud Plus; AMPD Storage solutions; AMPD Virtual Workstation; AMPD Multi-CDN; AMPD Virtual Studio, a suite of solutions and products designed to create the infrastructure-less studio; AMPD Game Hosting; AMPD Studio; and AMPD Remote Render products and solutions. AMPD Ventures Inc. is headquartered in Vancouver, Canada.",CAD,Communication Services,Media & Entertainment,Interactive Media & Services,CNQ,XCNQ,Canadian Securities Exchange,Canada,BC,Vancouver,V5T 1E1,http://www.ampd.tech,Nano Cap,CA00175D1006,00175D100,BBG00QNKRXR1,BBG00QNKRXK8,BBG00QNKRYL5,False
AOC.CN,Advantagewon Oil Corporation,"Advantagewon Oil Corporation engages in the acquisition, exploration, development, and production of oil and gas reserves in North America. It holds a 100% interest in various properties in the La Vernia area of Texas. The company acquires an additional oil well located in the province of Alberta. The company was founded in 2013 and is based in Toronto, Canada.",CAD,Energy,Energy,"Oil, Gas & Consumable Fuels",CNQ,XCNQ,Canadian Securities Exchange,Canada,ON,Toronto,M5E 1P8,http://www.aoc-oil.com,Nano Cap,,,,,,False
API.CN,Appia Energy Corp.,"Appia Energy Corp. acquires, explores for, develops, and evaluates mineral properties in Canada. It primarily explores uranium and rare earth deposits. The company owns 100% interests in the Elliot Lake property comprising 61 mining claims covering an area of approximately 12,545 hectares located in northern Ontario; the Alces Lake property covering an area of 17,577 hectares; the Eastside property that covers an area of 4,933 hectares; the Loranger property comprises 26,409 hectares; and the North Wollaston property covering an area of 16,682 hectares located in Saskatchewan. The company was incorporated in 2007 and is based in Toronto, Canada.",CAD,Materials,Materials,Metals & Mining,CNQ,XCNQ,Canadian Securities Exchange,Canada,ON,Toronto,M5C 2B6,http://www.appiaenergy.ca,Micro Cap,,,,,,False
APP.CN,Global Cannabis Applications Corp.,"Global Cannabis Applications Corp. designs, develops, markets, and acquires data technologies and applications for the medical cannabis industry. The company offers Citizen Green platform, a medical cannabis data solution. It uses various technologies, such as mobile applications, artificial intelligence, regulatory, smart databases, blockchain, and digital reward tokens to qualify candidates for clinical studies. The company was formerly known as Fundamental Applications Corp. Global Cannabis Applications Corp. was founded in 2014 and is headquartered in Vancouver, Canada.",CAD,Health Care,Health Care Equipment & Services,Health Care Providers & Services,CNQ,XCNQ,Canadian Securities Exchange,Canada,BC,Vancouver,V6E 4A6,http://cannappscorp.com,Nano Cap,,37960T106,BBG0074JCDC3,BBG0074JCD51,BBG0074JCD42,False
AREV.CN,AREV NanoTec Brands Inc.,"AREV NanoTec Brands Inc., an integrated cannabis company, produces and delivers functional compounds and ingredients in Canada. The company's ingredients and formulations are used in products that are targeted for sale in the natural health, medical, functional food, nutraceutical, sports nutrition, and bioceutical markets. Its products addresses the areas of health, which include anxiety, pain management, insomnia, central nervous system, and disorders and libido. The company was formerly known as AREV Brands International Ltd. and changed its name to AREV NanoTec Brands Inc. in March 2020. AREV NanoTec Brands Inc. was incorporated in 2005 and is based in Coquitlam, Canada.",CAD,Health Care,"Pharmaceuticals, Biotechnology & Life Sciences",Pharmaceuticals,CNQ,XCNQ,Canadian Securities Exchange,Canada,BC,Coquitlam,V3K 6R2,http://www.arevbrands.com,Nano Cap,,,,,,False
ARGO.CN,Argo Living Soils,,,,,,CNQ,XCNQ,,Canada,BC,,,,,,,,,,False
ARM.CN,Armada Mercantile Ltd.,"Armada Mercantile Ltd., a financial services company, provides merchant banking services worldwide. The company provides specialized merchant banking, broker-dealer, venture lending, and corporate finance services, as well as advises clients on corporate structure, strategy, mergers and acquisitions, and raising capital. It also offers various services for public and private equity, factoring, equipment leasing, private placements, corporate debt securities, corporate finance, mezzanine financing, direct public offerings, and mergers and acquisitions; and commercial finance services, including account receivables factoring, supply chain, merchant cash advance, purchase order, and other types of specialized finance, as well as assists investors and corporations in planning investment strategies and raising capital in the public and private equity markets. The company serves investors, entrepreneurs, and businesses. Armada Mercantile Ltd. was founded in 1987 and is based in Roseville, California.",CAD,Financials,Diversified Financials,Capital Markets,CNQ,XCNQ,Canadian Securities Exchange,United States,CA,Roseville,95747,http://www.armadamercantile.com,Nano Cap,,,BBG000L2CKQ5,BBG000L2BBV0,BBG001S6TJ73,False
ARQ.CN,Argo Gold Inc.,"Argo Gold Inc., a development stage company, focuses on the exploration and development of mineral properties in northwestern Ontario. The company explores for gold, silver, cobalt, and zinc deposits. Its flagship project is the Uchi Gold project covering 22 square kilometers of mineralization and various mineralized trends located to the west of Uchi Lake, Ontario. The company was formerly known as Arbitrage Exploration Inc. and changed its name to Argo Gold Inc. in September 2016. Argo Gold Inc. was incorporated in 1995 and is based in Toronto, Canada.",CAD,Materials,Materials,Metals & Mining,CNQ,XCNQ,Canadian Securities Exchange,Canada,ON,Toronto,M5H 2S6,http://www.argogold.ca,Nano Cap,,,BBG000MBB3M7,BBG000MB9ZY6,BBG001SFRPF2,False
ASE.CN,Asante Gold Corporation,"Asante Gold Corporation, a mineral exploration company, engages in the acquisition and development of gold properties in the Republic of Ghana. Its principal property is the Kubi Mining Lease located in south west Ghana. The company was incorporated in 2011 and is headquartered in Vancouver, Canada.",CAD,Materials,Materials,Metals & Mining,CNQ,XCNQ,Canadian Securities Exchange,Canada,BC,Vancouver,V6C 2T5,http://www.asantegold.com,Nano Cap,,,,,,False
ASIA.CN,Asia Green Biotechnology Corp.,"Asia Green Biotechnology Corp., an early stage international agri-technology company, focuses on the development, evaluation, testing, application, and supply of products derived from proprietary organic hybridization technology in Asia. It focuses on planting, growing, and harvesting new and valuable strains of hemp and related crops. Asia Green Biotechnology Corp. has an agreement with Pathway Rx Inc. and PNW Biosciences Inc. for the clinical development and commercialization of the cannabis sativa varieties for prevention and treatment of COVID-19 and other infectious diseases. The company was formerly known as Asia Cannabis Corp. and changed its name to Asia Green Biotechnology Corp. in April 2020. The company was incorporated in 2017 and is based in Calgary, Canada.",CAD,Health Care,"Pharmaceuticals, Biotechnology & Life Sciences",Pharmaceuticals,CNQ,XCNQ,Canadian Securities Exchange,Canada,AB,Calgary,T2N 3E5,http://www.asiagreenbiotechnology.com,Nano Cap,,,,,,False
ASTI.CN,Aquarius Surgical Technologies Inc.,"Aquarius Surgical Technologies Inc., through its subsidiary, Surgical Lasers Inc., manufactures, distributes, services, supports, and trains laser systems and consumables in various medical disciplines in Canada and the United States. Its products include Pathfinder laser for the treatment of benign prostate hyperplasia; HYPHO laser to treat urinary stone; Versafine FRx laser to address vaginal health related conditions associated with menopause; and ASTI's surgical lasers for supporting wavelengths and medical procedures. The company also offers clinical education, service, support, and maintenance services. The company was formerly known as Aquarius Coatings Inc. Aquarius Surgical Technologies Inc. was incorporated in 1986 and is based in Toronto, Canada.",CAD,Health Care,Health Care Equipment & Services,Health Care Technology,CNQ,XCNQ,Canadian Securities Exchange,Canada,ON,Toronto,M5R 1G4,http://aquariussurgical.com,Nano Cap,,,BBG000CWY3Y4,BBG000CWY043,BBG001S746X7,False
ATHR.CN,"Aether Catalyst Solutions, Inc.","Aether Catalyst Solutions, Inc. engages in commercializing patent pending catalyst technology for use in automotive emissions abatement. The company was formerly known as Catcon Technologies Ltd. and changed its name to Aether Catalyst Solutions, Inc. in June 2017. Aether Catalyst Solutions, Inc. was founded in 2011 and is headquartered in Burnaby, Canada.",CAD,Consumer Discretionary,Automobiles & Components,Auto Components,CNQ,XCNQ,Canadian Securities Exchange,Canada,BC,Burnaby,V5A 4W2,http://www.aethercatalyst.com,Nano Cap,,,,,,False
AUAG.CN,Auxico Resources Canada Inc.,"Auxico Resources Canada Inc., together with its subsidiaries, engages in the acquisition, exploration, and development of silver-gold properties in Canada, Mexico, Columbia, Brazil, and the Democratic Republic of the Congo. The company holds a 100% interest in the Zamora silver-gold property in Mexico. Auxico Resources Canada Inc. was founded in 2014 and is headquartered in Montreal, Canada.",CAD,Materials,Materials,Metals & Mining,CNQ,XCNQ,Canadian Securities Exchange,Canada,QC,Montreal,H2Y 1T4,http://www.auxicoresources.com,Nano Cap,,,BBG00HZHH695,BBG00CX8J730,BBG00CX8J749,True
AUCU.CN,Inflection Resources Ltd.,"Inflection Resources Ltd., a junior resource company, engages in the exploration and evaluation of mineral properties in New South Wales and Queensland, Australia. It primarily explores for gold and copper deposits. The company holds a portfolio of exploration licenses and applications totaling 500,000 hectares. Its principal property is the Northern New South Wales project consisting of eighteen non-contiguous exploration licenses (EL); and two EL applications located in the Lachlan Fold Belt region of New South Wales, Australia. The company was founded in 2017 and is headquartered in Vancouver, Canada.",CAD,Materials,Materials,Metals & Mining,CNQ,XCNQ,Canadian Securities Exchange,Canada,BC,Vancouver,V6C 2T5,http://www.inflectionresources.com,Nano Cap,,,BBG00TJJ1XV6,BBG00TJJ1XN5,BBG00TJJ1YP1,False
AUGF.CN,Australian Goldfields Limited,"Australian Goldfields Limited engages in the acquisition and exploration of mineral properties in Canada. The company was formerly known as Graphite Energy Corp. and changed its name to Australian Goldfields Limited in March 2021. Australian Goldfields Limited was incorporated in 2016 and is headquartered in Vancouver, Canada.",CAD,Materials,Materials,Metals & Mining,CNQ,XCNQ,Canadian Securities Exchange,Canada,BC,Vancouver,V6C 2T7,http://www.australiangoldfields.com,Nano Cap,,,,,,False
AUSA.CN,Australis Capital Inc.,"Australis Capital Inc. is a venture capital specializing in early-stage but not limited to equity positions and/or debt in both public and private companies, financings in exchange for royalties or other distribution streams, and control share acquisitions and buyouts. It seeks to identify and invest in United States and abroad in cannabis and real estate assets. Australis Capital Inc. is based in Las Vegas, Nevada and additional offices in Vancouver, Canada.",CAD,Health Care,"Pharmaceuticals, Biotechnology & Life Sciences",Pharmaceuticals,CNQ,XCNQ,Canadian Securities Exchange,United States,NV,Las Vegas,89119,http://www.ausa-corp.com/,Nano Cap,,,,,,False
AVM-X.CN,Avarone Metals Inc.,"Avarone Metals Inc., an exploration stage company, focuses on the acquisition, exploration, and development of resource properties in Canada. The company was formerly known as Remstar Resources Ltd. and changed its name to Avarone Metals Inc. in January 2014. Avarone Metals Inc. was incorporated in 1993 and is headquartered in Vancouver, Canada.",CAD,,,,CNQ,XCNQ,Canadian Securities Exchange,Canada,,,,,,,,,,,False
AWLI.CN,Ameriwest Lithium Inc.,"Ameriwest Lithium Inc. engages in the acquisition, exploration, and development of mineral properties in Canada. The company holds interest in the Koster Dam project comprising 10 mineral claims located in the Clinton Mining Division of British Columbia. It also holds interests in the Thunderbird property, Kilometer 26 project, and the Quet and Fire property, as well as holds an option to purchase a 100% interest in the ESN project. The company was formerly known as Oakley Ventures Inc. and changed its name to Ameriwest Lithium Inc. in April 2021. Ameriwest Lithium Inc. was incorporated in 2017 and is headquartered in Vancouver, Canada.",CAD,Materials,Materials,Metals & Mining,CNQ,XCNQ,Canadian Securities Exchange,Canada,BC,Vancouver,V6B 2S2,http://www.oakleyventures.com,Nano Cap,,03078N100,BBG00R73CH23,BBG00R73CGT6,BBG00R73CGV3,False
AWR.CN,Aurwest Resources Corporation,"Aurwest Resources Corporation engages in the acquisition, exploration, and evaluation of mineral properties in North America. The company explores for gold, silver, copper, and other precious and base metals. It holds 100% interests in the Stellar project, which include 4 mineral claims covering an area of 3,174 hectares located in north central British Columbia; and the Buckley project that consists of 24 mineral claims covering an area of 15,317 hectares located to the southwest of Houston, British Columbia. The company was formerly known as Shamrock Enterprises Inc. and changed its name to Aurwest Resources Corporation in January 2020. Aurwest Resources Corporation was incorporated in 2008 and is headquartered in Calgary, Canada.",CAD,Materials,Materials,Metals & Mining,CNQ,XCNQ,Canadian Securities Exchange,Canada,AB,Calgary,T2R 1S4,http://www.aurwestresources.com,Nano Cap,,029899101,BBG0014TXB80,BBG0014TX9Y6,BBG001TBBY22,False
