symbol,name,summary,currency,sector,industry_group,industry,exchange,mic,market,country,state,city,zipcode,website,market_cap,isin,cusip,figi,composite_figi,shareclass_figi,delisted
SAND.CN,Silver Sands Resources Corp.,"Silver Sands Resources Corp. engages in the acquisition and exploration of mineral resource properties in Canada. It holds an option to acquire 100% interest in the Coastal Copper Claim located near Maple Bay area, Stewart district, British Columbia; and 100% interest in the Virginia silver project located in Santa Cruz Province of Argentina. The company was formerly known as Golden Opportunity Resources Corp. and changed its name to Silver Sands Resources Corp. in June 2020. Silver Sands Resources Corp. was incorporated in 2018 and is based in Vancouver, Canada.",CAD,Materials,Materials,Metals & Mining,CNQ,XCNQ,Canadian Securities Exchange,Canada,BC,Vancouver,V6E 4A6,http://www.silversandscorp.com,Nano Cap,,,BBG00QYWJYV5,BBG00PDQMXK3,BBG00PDQMYM9,False
SASY.CN,Sassy Resources Corporation,"Sassy Resources Corporation, an exploration stage company, engages in the identification, acquisition, and exploration of precious metal and base metal resources in Canada. It explores for gold, silver, nickel, cobalt, platinum, and palladium deposits. The company's flagship property is the Foremore property that consists of 35 mineral claims covering an area of 14,585 hectares located in the Eskay Creek District of British Columbia. The company was incorporated in 2019 and is based in Vancouver, Canada.",CAD,Materials,Materials,Metals & Mining,CNQ,XCNQ,Canadian Securities Exchange,Canada,BC,Vancouver,V6C 2T7,http://sassyresources.ca,Nano Cap,,,,,,False
SBD.CN,SBD Capital Corp.,"SBD Capital Corp., through its subsidiary, Secret Barrel Distillery Corporation, produces and sells alcohol and liquor products in Canada. It offers rum with aromas of citrus, cocoa, and caramel under the Secret Barrel Rum and XM Rum names. The company was formerly known as White Pine Resources Inc. and changed its name to SBD Capital Corp. in September 2017. SBD Capital Corp. was incorporated in 1979 and is headquartered in Toronto, Canada.",CAD,Consumer Staples,"Food, Beverage & Tobacco",Beverages,CNQ,XCNQ,Canadian Securities Exchange,Canada,ON,Toronto,M5G 1E6,http://www.sbdcapitalcorp.com,Nano Cap,,,,,,False
SCRN.CN,ScreenPro Security Inc.,"ScreenPro Security Ltd. provides Covid-19 testing solutions to governments and corporations. The company was incorporated in 2020 and is headquartered in British Columbia, Canada.",CAD,Health Care,"Pharmaceuticals, Biotechnology & Life Sciences",Biotechnology,CNQ,XCNQ,Canadian Securities Exchange,Canada,BC,Vancouver,V6C 2T6,,,,,,,,False
SCV.CN,Scotch Creek Ventures Inc.,"Scotch Creek Ventures Inc. engages in the acquisition, exploration, and development of mineral properties in North America. The company holds a 100% interest in the Cupz property comprising 39 unpatented lode mining claims covering an area of approximately 806 acres located in Esmeralda County, Nevada. It holds an option agreement to acquire interest in the Highlands West project consists of 333 20-acre placer claims located on the west side of southern Clayton Valley, Nevada; and The Macallan East project consists of 122 20-acre claims located on the southeast side of southern Clayton Valley, Nevada. Scotch Creek Ventures Inc. was incorporated in 2017 and is based in Vancouver, Canada.",CAD,Materials,Materials,Metals & Mining,CNQ,XCNQ,Canadian Securities Exchange,Canada,BC,Vancouver,V6C 2T6,http://www.scotch-creek.com,Nano Cap,CA8091851011,809185101,BBG00LTS0CN8,BBG00LTS0CG6,BBG00LTS0DG4,False
SE.CN,Sweet Earth Holdings Corporation,"Sweet Earth Holdings Corporation cultivates, processes, and sells hemp Cannabidiol (CBD) products. The company offers cosmetics products, including hemp hydrating oat and honey facial cleanser, balancing jasmine body oil, hydration cream, salve, lip balm, hydrating cleanser, hand sanitizer, balancing body oil, organic body scrub, rejuvenating salt soak, and muscle recovery rub. It also provides CBD dog treats comprising beef and cheddar potato; turkey and sweet potato; peanut butter crunch; sweet potato cranberry; pumpkin flax; apple carrot oat; and antioxidant blueberry fax. The company is based in Vancouver, Canada.",CAD,Health Care,"Pharmaceuticals, Biotechnology & Life Sciences",Pharmaceuticals,CNQ,XCNQ,Canadian Securities Exchange,Canada,BC,Vancouver,V6E 2Y3,http://www.sweetearthcbd.com,Nano Cap,,87039X208,BBG000L1V1S6,BBG000L1SY08,BBG001SPXTJ1,False
SENS.CN,Sensor Technologies Corp.,"Sensor Technologies Corp. is involved in the oil and gas exploration activities. Sensor Technologies Corp. is headquartered in Mississauga, Canada.",CAD,Information Technology,Software & Services,IT Services,CNQ,XCNQ,Canadian Securities Exchange,Canada,ON,Mississauga,L5A 3P1,http://www.sensetekinc.com,Nano Cap,,,,,,False
SG.CN,Stevens Gold Nevada Inc.,"Stevens Gold Nevada Inc. engages in the acquisition, development, and exploration of mineral properties. It holds interests in Black Point Property located in Eureka County, Nevada, USA. The company was incorporated in 2018 and is headquartered in Vancouver, Canada.",CAD,Materials,Materials,Metals & Mining,CNQ,XCNQ,Canadian Securities Exchange,Canada,BC,Vancouver,V6J 1H4,http://www.stevensgold.com,Nano Cap,,,,,,False
SGD.CN,Snowline Gold Corp.,"Snowline Gold Corp. engages in the exploration of gold properties in Canada. Its flagship project is the Einarson property that consists of two main claim blocks and various outlying claims covering an area of approximately 61,690 hectares in the Selwyn Basin; and interest in the Rogue property that comprises 105 mineral claims covering an area of 2,439 hectares in the Selwyn Basin, Canada. The company was formerly known as Skyledger Tech Corp. and changed its name to Snowline Gold Corp. in February 2021. Snowline Gold Corp. is based in Vancouver, Canada.",CAD,Materials,Materials,Metals & Mining,CNQ,XCNQ,Canadian Securities Exchange,Canada,BC,Vancouver,V6G 3H1,http://www.snowlinegold.com,Nano Cap,,,,,,True
SGRO.CN,Sierra Growth Corp.,"Sierra Growth Corp., a junior natural resource company, engages in the acquisition, exploration, and development of mineral properties. The company holds 100% interests in the Espanola property, which consists of 17 claims located in the San Mateo Mining District in the province of Canete, Peru. It also holds an agreement to earn a 100% interest in 3 epithermal gold-silver projects. The company was formerly known as Grenville Gold Corp. and changed its name to Sierra Growth Corp. in March 2019. Sierra Growth Corp. was incorporated in 1994 and is headquartered in Delta, Canada.",CAD,Materials,Materials,Metals & Mining,CNQ,XCNQ,Canadian Securities Exchange,Canada,BC,Delta,V4K 3N3,http://www.sierragrowth.com,Nano Cap,,,,,,False
SHP.CN,Shoal Point Energy Ltd.,"Shoal Point Energy Ltd., a petroleum exploration and development company, engages in the acquisition, exploration, and development of oil and natural gas properties in Canada. It holds interest in the Humber Arm shale play covering an area of approximately 220,000 acres located in the west coast of Newfoundland. It also holds interest in the Mount Evans project. The company was incorporated in 2006 and is headquartered in Vancouver, Canada.",CAD,Energy,Energy,"Oil, Gas & Consumable Fuels",CNQ,XCNQ,Canadian Securities Exchange,Canada,BC,Vancouver,V6C 1G8,http://www.shoalpointenergy.com,Nano Cap,,,,,,False
SHRC.CN,Sharc International Systems Inc.,"Sharc International Systems Inc. provides wastewater heat exchange products and services for commercial, industrial, public utilities, and residential development projects in Canada, the United Kingdom, and internationally. It offers PIRANHA and SHARC systems that provide energy savings and reduce carbon emissions from multi-unit and district heating and cooling network. The company was formerly known as International Wastewater Systems Inc. and changed its name to Sharc International Systems Inc. in September 2017. Sharc International Systems Inc. is based in Port Coquitlam, Canada.",CAD,Industrials,Capital Goods,Construction & Engineering,CNQ,XCNQ,Canadian Securities Exchange,Canada,BC,Port Coquitlam,V3C 6L4,http://www.sharcenergy.com,Nano Cap,CA81948A1021,81948A102,BBG002G931G5,BBG002G93184,BBG002G931W7,False
SHRM.CN,Champignon Brands Inc.,"AltMed Capital Corp. operates as an alternative medicine business incubator, IP aggregator, and solutions provider. The company was founded in 2019 and is based in Vancouver, Canada.",CAD,Consumer Staples,Food & Staples Retailing,Food & Staples Retailing,CNQ,XCNQ,Canadian Securities Exchange,Canada,BC,Vancouver,V6C2T5,http://www.altmed.capital,Micro Cap,,,,,,False
SHV.CN,Seahawk Gold Corp.,"Seahawk Gold Corp. engages in the acquisition and exploration of mineral resource properties in Canada. The company focuses on gold deposits. It holds 100% interests in the Mystery, Touchdown, Xtra Point, and Blitz properties located in the Urban-Barry Greenstone Belt region within the Abitibi sub-province, Quebec, Canada. The company was formerly known as Seahawk Ventures Inc. and changed its name to Seahawk Gold Corp. in September 2020. Seahawk Gold Corp. was incorporated in 2007 and is headquartered in Coquitlam, Canada.",CAD,Materials,Materials,Metals & Mining,CNQ,XCNQ,Canadian Securities Exchange,Canada,BC,Coquitlam,V3J 7W3,http://www.seahawkgoldcorp.com,Nano Cap,,,,,,False
SIG.CN,Sitka Gold Corp.,"Sitka Gold Corp. engages in the exploration of mineral resource properties in Canada and the United States. The company explores for gold, silver, zinc, lead, and copper deposits. It owns 100% interests in the Coppermine River project covering an area of approximately 50,000 hectares located in Nunavut; the Alpha Gold property consisting of 93 claims that covers an area of approximately 1860 acres situated in Elko, Nevada; and the OGI property consisting of 99 quartz mining claims located in Dawson City, Yukon. The company also holds an option to acquire 100% interest in the RC Gold property comprising 1,891 claims covering approximately 37,600 hectares located in Yukon; the Burro Creek Gold property that covers an area of approximately 287 hectares situated in the Greenwood Mining District, Arizona; and Barney Ridge gold property located to the east of Dawson City, Yukon. In addition, it has an option agreement to acquire 100% interest in the Mahtin Gold property located in Yukon territory; and the Clear Creek Gold property situated east of Dawson City, Yukon. Sitka Gold Corp. was incorporated in 2015 and is based in Vancouver, Canada.",CAD,Materials,Materials,Metals & Mining,CNQ,XCNQ,Canadian Securities Exchange,Canada,BC,Vancouver,V6C 1T2,http://www.sitkagoldcorp.com,Nano Cap,,,,,,False
SILO.CN,Silo Wellness Inc.,"FlyOverture Equity Inc. doing business as Silo Wellness, engages in producing plant and fungal-based compounds for natural wellness. It offers psilocybin nasal spray made from cannabis. FlyOverture Equity Inc. was formerly known as Eighteen Fifty Equity, Inc. The company was founded in 2018 and is headquartered in Springfield, Oregon.",CAD,Health Care,"Pharmaceuticals, Biotechnology & Life Sciences",Pharmaceuticals,CNQ,XCNQ,Canadian Securities Exchange,United States,OR,Springfield,97478,http://www.silowellness.com,,CA8271242072,827124207,BBG00NR9BJD2,BBG00NR9BJ60,BBG00NR9BK76,False
SIRE.CN,PlantFuel Life Inc.,"Sire Bioscience Inc., together with its subsidiaries, invests in, cultivates, produces, and sells various hemp and cannabis products in Canada. It offers cannabidiol (CBD) based wellness products, oils, and edibles, as well as animal and pet related CBD products under the yumz, MEDIflower, BIONIC,FUSIONS, PURPLEK, INFUSIONS, Voila, Karma, CANNA BANANA, cancan, FUR BABY, CBDTECH, and LEAFBELIEF. The company is headquartered in Mississauga, Canada.",CAD,Health Care,"Pharmaceuticals, Biotechnology & Life Sciences",Pharmaceuticals,CNQ,XCNQ,Canadian Securities Exchange,Canada,ON,Mississauga,L5N 6C4,http://www.sirebioscience.com,Nano Cap,,,,,,False
SIX.CN,Sixty Six Capital Inc.,"Sixty Six Capital Inc. provides co-location and cloud computing services. The company engages in the high-performance computing, storage, and information processing activities. It also invests in various technology sectors, such as crypto tokens and crypto finance. The company was formerly known as Hydro66 Holdings Corp. and changed its name to Sixty Six Capital Inc. in April 2021. Sixty Six Capital Inc. is headquartered in London, the United Kingdom.",CAD,Financials,Diversified Financials,Capital Markets,CNQ,XCNQ,Canadian Securities Exchange,United Kingdom,,London,W1T 1DS,http://www.sixtysixcapital.com,Nano Cap,,,BBG00L4PYGB8,BBG00L4PYG46,BBG00L4PYH44,False
SIXW.CN,Sixth Wave Innovations Inc.,"Sixth Wave Innovations Inc., a development stage nanotechnology company, focuses on the extraction and detection of target substances at the molecular level using specialized molecularly imprinted polymers. It is in the process of commercializing its Affinity cannabinoid purification system; and IXOS, a line of extraction polymers for the gold mining industry. The company was formerly known as Atom Energy Inc. and changed its name to Sixth Wave Innovations Inc. in August 2019. Sixth Wave Innovations Inc. was incorporated in 2007 and is headquartered in Salt Lake City, Utah.",CAD,Materials,Materials,Chemicals,CNQ,XCNQ,Canadian Securities Exchange,United States,UT,Salt Lake City,84108,http://sixthwave.com,Nano Cap,,,BBG00RPNB8X6,BBG00RPNB8Q4,BBG001SDQRX4,False
SIZE.CN,Major Precious Metals Corp.,"Major Precious Metals Corp., a junior exploration company, focuses on the acquisition, exploration, and development of resource properties. The company explores for gold, palladium, platinum, titanium, vanadium, and copper. It holds a 100% interest in the Skaergaard project consists of two exploration licenses located on the east coast of Greenland. The company was formerly known as Eastern Zinc Corp. and changed its name to Major Precious Metals Corp. in June 2020. Major Precious Metals Corp. was incorporated in 2006 and is based in Vancouver, Canada.",CAD,Materials,Materials,Metals & Mining,CNQ,XCNQ,Canadian Securities Exchange,Canada,BC,Vancouver,V6C 1H2,http://majorprecious.com,Micro Cap,CA5608291038,560829103,,BBG00NJ3TH49,BBG001T2DB57,False
SLNG.CN,SLANG Worldwide Inc.,"SLANG Worldwide Inc. operates as a cannabis consumer packaged goods company worldwide. It owns, licenses, and/or markets 11 brands which serve flower, inhalable concentrates, and ingestibles, including edibles and pressed pills. The company was formerly known as Fire Cannabis Inc. and changed its name to SLANG Worldwide Inc. in November 2018. SLANG Worldwide Inc. was incorporated in 2017 and is headquartered in Toronto, Canada.",CAD,Health Care,"Pharmaceuticals, Biotechnology & Life Sciences",Pharmaceuticals,CNQ,XCNQ,Canadian Securities Exchange,Canada,ON,Toronto,M4M 3G3,http://www.slangww.com,Micro Cap,CA8310063091,831006309,BBG00N5QF0S9,BBG00N5QF0L6,BBG00N5QF1M3,False
SLV.CN,Silver Dollar Resources Inc.,"Silver Dollar Resources Inc., an exploration stage company, engages in the acquisition and exploration of mineral properties in Canada. The company has an option to acquire 100% interest in the La Joya silver-copper-gold property consisting of 15 mineral concessions totaling 4,646 hectares located in the State of Durango, Mexico. It also holds an option to acquire a 100% interest in the Longlegged Lake Property with 8 multi-cell mining claims covering an area of approximately 2,597 hectares, as well as Pakwash Lake Property with 18 mining claims covering an area of approximately 4,252 hectares situated in the Red Lake Mining Division in northwestern Ontario. The company was incorporated in 2018 and is based in Victoria, Canada.",CAD,Materials,Materials,Metals & Mining,CNQ,XCNQ,Canadian Securities Exchange,Canada,BC,Victoria,V9B 6J9,http://silverdollarresources.com,Nano Cap,,,BBG00RMKTB41,BBG00RMKT9Y3,BBG00RMKTC03,False
SLZ.CN,SLAVE LAKE ZINC CORP,"Slave Lake Zinc Corp. acquires, explores for, and develops mineral properties in Canada. The company primarily explores for zinc, lead, copper, and silver deposits. It holds a 100% interest in the O'Connor Lake property located in the South Slave region of the Northwest Territories. The company was incorporated in 2016 and is headquartered in North Vancouver, Canada.",CAD,Materials,Materials,Metals & Mining,CNQ,XCNQ,Canadian Securities Exchange,Canada,BC,North Vancouver,V7L 3N3,http://www.zinccorp.ca,Nano Cap,,,BBG00MH6HB88,BBG00H9V7K66,BBG00H9V7K75,False
SNL.CN,Sentinel Resources Corp.,"Sentinel Resources Corp. engages in the acquisition, evaluation, and exploration of mineral properties in Canada. The company explores for gold, silver, and copper deposits. Its property portfolio includes the Waterloo, Pass, and Little Bear projects in British Columbia, Canada; and the Salama gold project located in Peru. The company also owns silver-focused exploration concessions totaling approximately 38,600 hectares located in New South Wales, Australia. Sentinel Resources Corp. was incorporated in 2018 and is headquartered in Vancouver, Canada.",CAD,Materials,Materials,Metals & Mining,CNQ,XCNQ,Canadian Securities Exchange,Canada,BC,Vancouver,V7Y 1G5,http://sentinelexp.com,Nano Cap,,,,,,False
SNOW.CN,Snowy Owl Gold Corp.,"Snowy Owl Gold Corp. a mineral exploration company, focuses on acquiring, exploring, and developing gold projects in Canada. It has a 100% interest in the Golden Eagle property, which consists of 161 map designated claims covering a total of 8,887.65 hectares within the Abitibi region located in Quebec, Canada. The company was formerly known as 56 Acquisitions Inc. and changed its name to Snowy Owl Gold Corp. in May 2020. Snowy Owl Gold Corp. was incorporated in 2018 and is headquartered in Vancouver, Canada.",CAD,Materials,Materials,Metals & Mining,CNQ,XCNQ,Canadian Securities Exchange,Canada,BC,Vancouver,V6E 3V6,http://www.snowyowlgold.com,,,81762P102,,,,False
SNR.CN,79 Resources Ltd.,"79 Resources Ltd. engages in the acquisition and exploration of mineral properties in Canada. It holds an option to acquire 75% interest in the Louise Lake Property that consists of eight mineral claims covering an area of 1,862.36 hectares located in the Omineca Mining Division, British Columbia; and an option to earn a 100% interest in the Lac Saint Simon lithium property that consists of nine mineral claims covering an area of 480 hectares located in the James Bay/Eeyou Istchee region of Quebec. The company was incorporated in 2019 and is based in Vancouver, Canada.",CAD,Materials,Materials,Metals & Mining,CNQ,XCNQ,Canadian Securities Exchange,Canada,BC,Vancouver,V6E 4H1,http://www.79resources.com,Nano Cap,,,,,,False
SOL.CN,SOL Global Investments Corp.,"SOL Global Investments Corp. is a principal investment firm with a focus on the biopharmaceutical and cannabis industry in the United States. The company was formerly known as Scythian Biosciences Corp. and changed its name to SOL Global Investments Corp. in October 2018. SOL Global Investments Corp. is based in Toronto, Canada.",CAD,Health Care,"Pharmaceuticals, Biotechnology & Life Sciences",Pharmaceuticals,CNQ,XCNQ,Canadian Securities Exchange,Canada,ON,Toronto,M5X 1C9,http://solglobal.com,Micro Cap,,,BBG003640052,BBG00363ZZZ6,BBG0036400M3,False
SOLD.CN,AmmPower Corp.,"Soldera Mining Corp. engages in the exploration of mineral properties in Canada. The company holds an option agreement to acquire 100% interest in the Titan Gold property that consists of 34 mining claims covering an area of approximately 2,312.25 hectares located in Northwestern Ontario. Soldera Mining Corp. was incorporated in 2019 and is headquartered in Vancouver, Canada.",CAD,Materials,Materials,Metals & Mining,CNQ,XCNQ,Canadian Securities Exchange,Canada,BC,Vancouver,V6C 1T2,http://solderamining.com,Nano Cap,,,,,,False
SOLV.CN,Solvbl Solutions Inc.,"Agile Blockchain Corporation develops block chain based supply chain management software. The company was founded in 2018 and is based in Toronto, Canada.",CAD,Information Technology,Software & Services,Software,CNQ,XCNQ,Canadian Securities Exchange,Canada,ON,Toronto,M5C 2E3,http://www.agileblockchain.ca,,,,,,,False
SONA.CN,Sona Nanotech Inc.,"Sona Nanotech Inc., nanotechnology life sciences company, manufactures gold nanorod products for diagnostic tests. Its products portfolio comprises Gemini 650NM, Gemini 700NM, Gemini 725NM, Gemini 750NM, Gemini 800NM, Gemini 850NM, Gemini 900NM, Gemini 950NM, and Gemini 1050NM. The company also provides Sona Nanotech COVID-19 Lateral Flow Assay, an immunochromatographic assay for the detection of the spike protein antigen from SARS-CoV-2 in nasopharyngeal swab specimens from individuals, who are suspected of COVID-19. In addition, it offers Gemini and Omni gold nanorods for in-vitro and in-vivo applications, such as lateral flow diagnostics and cell imaging. The company has collaboration agreements with Soma Bioscience Ltd. to produce diagnostic tests using lateral flow assay technology; and Expedeon Ltd to develop multiplex point-of-care and lateral flow assay diagnostic tests. Sona Nanotech Inc. is based in Halifax, Canada.",CAD,Health Care,Health Care Equipment & Services,Health Care Equipment & Supplies,CNQ,XCNQ,Canadian Securities Exchange,Canada,NS,Halifax,B3J 3R7,http://www.sonanano.com,Micro Cap,,,BBG000MF0VT1,BBG000MF0QM9,BBG001SQB9W2,False
SP.CN,Silver Phoenix Resources Inc.,"Silver Phoenix Resources Inc., an exploration stage company, engages in acquiring, exploring, and developing mineral properties primarily in British Columbia. It holds interest in Big Showing property with a total area of 1,000 hectares located in British Columbia. The company was incorporated in 2003 and is based in Vancouver, Canada.",CAD,Materials,Materials,Metals & Mining,CNQ,XCNQ,Canadian Securities Exchange,Canada,BC,Vancouver,V7Y 1C3,http://www.silverphoenixresources.ca,Nano Cap,,,,,,False
SPAI.CN,Sparc AI,,,,,,CNQ,XCNQ,,Australia,VIC,,,,,,,BBG00YFGQ6D7,BBG00YFGQ665,BBG00YFGQ781,False
SPEY.CN,SPEY RESOURCES CORP,"Spey Resources Corp. engages in the acquisition, exploration, and development of mineral properties in Canada. It holds an option to acquire a 100% undivided interest in the Silver Basin project located in the Revelstoke Mining Division of British Columbia; and the Kaslo Silver property situated in southern British Columbia. The company was incorporated in 2017 and is headquartered in North Vancouver, Canada.",CAD,Materials,Materials,Metals & Mining,CNQ,XCNQ,Canadian Securities Exchange,Canada,BC,North Vancouver,V7L 3T5,http://www.speyresources.ca,Nano Cap,CA84840P1027,84840P102,BBG00KHT3ST7,BBG00KHT3SM4,BBG00KHT3TM2,True
SPFY.CN,Spacefy Inc.,"Spacefy Inc. operates an online marketplace that connects individuals and businesses in the creative industry to space owners who provide locations to their project needs in the United States and Canada. The company operates through two segments, Spaces and Creatives. Its platform connects individuals or businesses with venue owners to find and book short-term locations, such as houses and condos, restaurants and bars, professional photography and music studios, vacant retail shops, event venues, or farms. Spacefy Inc. was incorporated in 2014 and is headquartered in Toronto, Canada.",CAD,Communication Services,Telecommunication Services,Diversified Telecommunication Services,CNQ,XCNQ,Canadian Securities Exchange,Canada,ON,Toronto,M5J 2P1,http://www.spacefy.com,Nano Cap,CA84624Q1028,84624Q102,BBG00LLCGLT8,BBG00LLCGLM5,BBG00LLCGMP0,False
SPMT.CN,Spearmint Resources Inc.,"Spearmint Resources Inc., an exploration stage company, acquires, explores, and evaluates mineral properties in Canada and the United States. The company explores for gold, platinum, palladium, copper, nickel, vanadium, and cesium. Its flagship property is the Clayton Valley Lithium Clay project comprising 2 claim blocks totaling 1,160 acres in Nevada. The company was formerly known as Indefinitely Capital Corp. and changed its name to Spearmint Resources Inc. in February 2012. Spearmint Resources Inc. was incorporated in 2009 and is headquartered in Vancouver, Canada.",CAD,Materials,Materials,Metals & Mining,CNQ,XCNQ,Canadian Securities Exchange,Canada,BC,Vancouver,V7Y 1K8,http://www.spearmintresources.ca,Nano Cap,CA8473811005,847381100,BBG000Q5S7T2,BBG000Q5S534,BBG001T6LB04,False
SPO.CN,SponsorsOne Brands Inc.,,CAD,,,,CNQ,XCNQ,Canadian Securities Exchange,United States,,,,,,,,BBG005QRV158,BBG002VKNCS4,BBG002VKNCT3,False
SPOR.CN,New Wave Holdings Corp.,"New Wave Holdings Corp. operates as an investment issuer that focuses on the psychedelic and esports sectors. New Wave Holdings Corp. has partnership with the University of West Indies for medicinal drug discovery. The company was formerly known as New Wave Esports Corp. and changed its name to New Wave Holdings Corp. in May 2020. New Wave Holdings Corp. was founded in 2018 and is headquartered in Toronto, Canada.",CAD,Communication Services,Media & Entertainment,Entertainment,CNQ,XCNQ,Canadian Securities Exchange,Canada,ON,Toronto,M5V 0R2,http://www.newwavecorp.com,Nano Cap,CA64913V4001,64913V400,BBG000QMK0X3,BBG000QMJYM3,BBG001SSCT17,False
SPR.CN,Sproutly Canada Inc.,"Sproutly Canada Inc. produces and supplies water-soluble cannabis solutions and bio-natural oils to beverage and consumable markets in Canada. It offers its products under the Caliber brand name. The company is based in Vancouver, Canada.",CAD,Health Care,"Pharmaceuticals, Biotechnology & Life Sciences",Pharmaceuticals,CNQ,XCNQ,Canadian Securities Exchange,Canada,BC,Vancouver,V6B 2T5,http://www.sproutly.ca,Nano Cap,CA85209J1084,85209J108,BBG009S509R9,BBG009S509J8,BBG009S509K6,False
