symbol,name,summary,currency,sector,industry_group,industry,exchange,mic,market,country,state,city,zipcode,website,market_cap,isin,cusip,figi,composite_figi,shareclass_figi,delisted
ABQK.QA,Ahli Bank Q.P.S.C.,"Ahli Bank Q.P.S.C., together with its subsidiaries, provides corporate and retail banking services in Qatar. The company operates through two segments, Retail and Private Banking and Wealth Management; and Corporate Banking Treasury, Investments and Brokerage Subsidiary. It also provides brokerage services. The company offers account products, such as savings, current, and call accounts; loan products that include salary advance, overdrafts, auto loans, personal loans, and mortgage loans; term deposits; and card products, such as credit, debit, cash back, contactless, and payroll cards. It also provides insurance services and various savings and investment products and services. In addition, the company offers financing solutions that include medium and long term loans, syndicated loans, contractor, working capital, equipment and fleet, real estate and project, and structured finances; wage protection systems; and corporate solutions, such as hedging solutions, forwards, swaps, options, interest rate hedging's, interest rate swaps, interest caps and floors, ISDA agreements, investment solutions, fixed income products, and structured deposits and notes. Further, it provides import services that include documentary credits and collections, and shipping guarantees; export services, such as LC advising and confirmation, and documentary collections; and guarantee services that include big bonds, performance bonds, advance payment and payment guarantees, counter guarantees for other banks, and avalisation of promissory notes/checks. Additionally, the company offers financing products, such as pre and post shipment finance, open account finance, and invoice discounting. It serves customers through 14 branches and ATMs comprising 20 in branches and 55 off-site ATMs, as well as contact centers, mobile and online banking. The company was founded in 1983 and is based in Doha, Qatar.",QAR,Financials,Banks,Banks,DOH,DSMD,Qatar Exchange,Qatar,,Doha,,http://www.ahlibank.com.qa,,,,,,,False
AHCS.QA,Aamal Company Q.P.S.C.,"Aamal Company Q.P.S.C., together with its subsidiaries, engages in the property, trading and distribution, industrial manufacturing, and managed services businesses in Qatar and internationally. The company's Property segment is involved in leasing the facilities of retail outlet complex, real estate investments, and property rental businesses. Its Trading and Distribution segment engages in wholesale and/or retail distribution of pharmaceutical and consumable items, automotive goods, home appliances, medical equipment, tires, lubricants, batteries, car spare parts, and office supplies products. This segment also provides industrial printing and laminating solutions; supplies, installs, commissions, and maintains air conditioning and refrigeration equipment; offers hospital information systems; and operates a chain of pharmacies, as well as sells footwear and general commercial trading products, and engages in clinical activities. The company's Industrial Manufacturing segment is involved in the manufacture, wholesale, and/or retail distribution of electric cables and tools, aggregates, ready-mix concrete, cement blocks and bricks, interlocking slabs, curb stone, and concrete pipes; provision of services in relation to industrial investment, repair, and construction of power plants; purchasing and leasing of ships; trading electromechanical equipment and cables; and management of industrial enterprises. Its Managed Services segment offers housekeeping and cleaning, facilities and support, energy, and entertainment and amusement services; and IT support, business process outsourcing, travel agency, and call center services. The company also trades in light emitting diode lamps and other lighting products; and provides facilities management, energy, and building maintenance and cleaning services. Aamal Company Q.P.S.C. was founded in 2001 and is headquartered in Doha, Qatar. Aamal Company Q.P.S.C. is a subsidiary of Al Faisal Holding Company W.L.L.",QAR,Industrials,Capital Goods,Industrial Conglomerates,DOH,DSMD,Qatar Exchange,Qatar,,Doha,,http://www.aamal.com.qa,,,,BBG000TJLFC6,BBG000TJLDX8,BBG001T07SG9,False
AHCS@S.QA,Aamal QPSC,"Aamal Company Q.P.S.C. is a diversified conglomerate operating in Qatar, with interests in various sectors including industrial manufacturing, trading and distribution, property, managed services, and healthcare. The company's business model focuses on investing in and developing businesses that contribute to Qatar's economic diversification. It is headquartered in Doha, Qatar.",QAR,Industrials,Capital Goods,,DOH,DSMD,Qatar Exchange,,,,,,,,,,,,False
AKHI.QA,Al Khaleej Takaful Insurance Company Q.P.S.C.,"Al Khaleej Takaful Insurance Company Q.P.S.C. engages in the insurance, reinsurance, and takaful insurance businesses in Qatar. The company offers comprehensive and third party motor insurance products; and property insurance products, such as fire and special perils, property all risks, business interruption, terrorism, and jewelers block insurance. It also provides engineering insurance products, including contractor's all risk, erection all risk, equipment, machinery breakdown, deterioration of stock in cold storage, and electronic equipment insurance; and workmen's compensation, personal accident, fidelity guarantee, and money insurance. In addition, the company offers public liability/third party liability, product liability, event liability, directors and officers liability and company reimbursement, professional indemnity, medical malpractice, bankers blanket bond, and cyber liability insurance products. Further, it provides freight forwarders liability, marine hull, and aviation insurance; and medical, group life, and travel insurance products. Additionally, it is involved in real estate and investments activities. Al Khaleej Takaful Insurance Company Q.P.S.C. was incorporated in 1978 and is based in Doha, Qatar.",QAR,Financials,Insurance,Insurance,DOH,DSMD,Qatar Exchange,Qatar,,Doha,4555.0,http://www.alkhaleejtakaful.com,,,,BBG000PS8868,BBG000PS87Z8,BBG001SLQJV6,False
BLDN.QA,Baladna Q.P.S.C.,"Baladna Q.P.S.C. produces and sells dairy products in the State of Qatar. The company operates through Dairy, Farm, and Other Activities segments. The Dairy segment offers fresh milk, yoghurt, cheese, labneh, cream, dessert, ghee, long life milk, and other dairy products, as well as Laban and Ayran milk drinks. The Farm segment is involved in slaughtering cows and selling beef meat. The Other Activities segment produces and sells sweet and frozen products, as well as sells livestock feed and medicines. It also offers fruit juices and related products; fertilizer compost; and plastic packaging materials to external parties. In addition, the company engages in the trade of food materials; retail of dairy products, eggs, olives, and pickles in specialized stores; and wholesale of soft drinks, juices, and mineral water. It serves retail outlet, as well as hotel, restaurant, and catering customers. The company was incorporated in 2014 and is headquartered in Al Khor, Qatar.",QAR,Consumer Staples,Food & Staples Retailing,Food & Staples Retailing,DOH,DSMD,Qatar Exchange,Qatar,,Al Khor,,http://baladna.com,,,,BBG00QN0CV59,BBG00QN0CV40,BBG00QN0CV68,False
BLDN@S.QA,Baladna QPSC,"Baladna QPSC is a Qatari dairy and beverage company. It produces and sells a wide range of dairy products, including milk, yogurt, cheese, and juices. The company is headquartered in Qatar.",QAR,Consumer Staples,"Food, Beverage & Tobacco",,DOH,DSMD,Qatar Exchange,,,,,,,,,,,,False
BRES.QA,Barwa Real Estate Company Q.P.S.C.,"Barwa Real Estate Company is a real estate investment firm specializing in real estate projects which include residential facilities, a motor city, warehouses, and complementary commercial and retail spaces. The firm engages in investment, development, and management of properties with a focus on Qatar and Saudi Arabia. It also invests in stocks of real estate firms. The firm invests in the real estate markets across the globe. Its portfolio includes residential and commercial property and hotels. Barwa Real Estate Company was founded on January 19, 2006 and is based in Doha, Qatar.",QAR,Real Estate,Real Estate,Real Estate Management & Development,DOH,DSMD,Qatar Exchange,Qatar,,Doha,,http://www.barwa.com.qa,,,,BBG000KVFK25,BBG000KVFJ73,BBG001SPW354,False
BRES@S.QA,Barwa Real Estate QPSC,"Barwa Real Estate QPSC is a Qatari real estate development company. They are involved in the development of residential, commercial, and mixed-use properties. The company's projects contribute to the growth of the real estate sector in Qatar.",QAR,Real Estate,Real Estate,,DOH,DSMD,Qatar Exchange,,,,,,,,,,,,False
CBQK.QA,The Commercial Bank (P.S.Q.C.),"The Commercial Bank (P.S.Q.C.), together with its subsidiaries, engages in the conventional banking, brokerage services, and credit card businesses. The company operates through four segments Wholesale Banking, Retail Banking, Others, and International. The Wholesale Banking segment provides various conventional funded and non-funded credit facilities; demand and time deposit services; currency exchange facilities; interest rate swaps and other derivative trading services; loan syndication and structured financing services; corporate lending; trade finance; other deposits; and letters of credit and guarantees, as well as manages money market funds and proprietary investment portfolio. This segment serves corporate, commercial, and multinational customers, as well as large, medium, and small enterprises. The Retail Banking segment offers personal current, savings, time, and investment account services; credit and debit card services; consumer, vehicle, and personal loans, and residential mortgage services; and custodial and wealth management services to retail and individual customers. The Other segment provides brokerage services; and issues debts for banks.The International segment provides banking services through a network of 44 branches in Turkey. The company also provides insurance products. It operates in Qatar, other GCC countries, rest of the Middle East, Europe, North America, and internationally. The company operates a network of 28 full-service branches and 172 ATMs. The Commercial Bank (P.S.Q.C.) was incorporated in 1974 and is based in Doha, Qatar.",QAR,Financials,Banks,Banks,DOH,DSMD,Qatar Exchange,Qatar,,Doha,,http://www.cbq.qa,,,,,,,False
CBQK@S.QA,The Commercial Bank PSQC,"The Commercial Bank PSQC is a Qatari bank offering a range of financial services, including retail banking, corporate banking, and investment services. The bank is headquartered in Doha, Qatar, and operates primarily within the Qatari financial market. It aims to provide comprehensive financial solutions to individuals and businesses.",QAR,Financials,Banks,,DOH,DSMD,Qatar Exchange,,,,,,,,,,,,False
DBIS.QA,Dlala Brokerage and Investment Holding Company Q.P.S.C.,"Dlala Brokerage and Investment Holding Company Q.P.S.C., together with its subsidiaries, engages in the brokerage activities at the Qatar Exchange. It operates through Stock Broking, Real Estate, and Information Technology segments. The company offers property management, marketing, and sales services for real estate clients; and information technology management and consultation services. It also engages in developing and programming of programs; and investment activities. Dlala Brokerage and Investment Holding Company Q.P.S.C. was incorporated in 2005 and is based in Doha, Qatar.",QAR,Financials,Diversified Financials,Capital Markets,DOH,DSMD,Qatar Exchange,Qatar,,Doha,,http://www.dlalaholding.com,,,,BBG000GRHZK4,BBG000GRHZ33,BBG001SP0L31,False
DHBK.QA,Doha Bank Q.P.S.C.,"Doha Bank Q.P.S.C. provides various banking products and services to individual, commercial, corporate, and institutional clients. The company operates in two segments, Conventional Banking and Insurance Activities. The Conventional Banking segment offers a range of products and services to business and corporate customers, including funded and non-funded credit facilitates deposits to corporate customers. It also undertakes funding and centralized risk management activities through borrowings; issues debt securities; uses derivatives for risk management purposes; and invests in liquid assets, such as short-term placements, and corporate and government debt securities. In addition, this segment provides loans, credit cards, deposits, and other transactions to individuals. The Insurance Activities segment offers contracts of insurance, arranges deals in investments, and advises on investments. The company operates 23 branches in Qatar; and six overseas branches in the United Arab Emirates, State of Kuwait, and India, as well as representative offices in the United Kingdom, Singapore, Turkey, China, Japan, South Korea, Germany, Australia, Hong Kong, Canada, Bangladesh, South Africa, Sri Lanka, and Nepal. Doha Bank Q.P.S.C. was incorporated in 1979 and is headquartered in Doha, Qatar.",QAR,Financials,Banks,Banks,DOH,DSMD,Qatar Exchange,Qatar,,Doha,,http://qa.dohabank.com,,,,,,,False
DHBK@S.QA,,,,,,,DOH,DSMD,Qatar Exchange,,,,,,,,,,,,False
DOHI.QA,Doha Insurance Group Q.P.S.C.,"Doha Insurance Group Q.P.S.C., together with its subsidiaries, engages in insurance and reinsurance businesses. It operates through three segments: Marine and Aviation, Motor, and Fire and General Accidents. The company's personal insurance products include car, travel, and yacht insurance products; and corporate insurance products comprise motor fleet, aviation, engineering, fire, health, and marine insurance products. It provides insurance and reinsurance services according to Islamic Sharia principles under the Doha Takaful name. In addition, the company engages in the insurance intermediation and management; information technology solutions; real estate and investment; and real estate holding and leasing operations. It operates in the state of Qatar, the United Arab Emirates, Lebanon, Germany, and Jordan. The company was formerly known as Doha Insurance Company Q.S.C. and changed its name to Doha Insurance Group Q.P.S.C. in March 2017. Doha Insurance Group Q.P.S.C. was incorporated in 1999 and is headquartered in Doha, Qatar.",QAR,Financials,Insurance,Insurance,DOH,DSMD,Qatar Exchange,Qatar,,Doha,,http://www.dig.qa,,,,BBG000PS87D2,BBG000PS8733,BBG001SLQJS0,False
ERES.QA,Ezdan Holding Group Q.P.S.C.,"Ezdan Holding Group Q.P.S.C., together with its subsidiaries, manages and rents real estate properties in Qatar. It operates through four segments: Residential and Commercial Properties, Investments, Hotel and Suites, and Malls. The Residential and Commercial Properties segment develops, owns, and rents real estate properties. The Investments segment invests in shares and sukuk investments. The Hotel and Suites segment manages hotels, suites, and restaurants. The Mall segment manages shopping malls. The company was formerly known as Ezdan Real Estate Company Q.S.C. and changed its name to Ezdan Holding Group Q.P.S.C. Ezdan Holding Group Q.P.S.C. was founded in 1960 and is based in Doha, Qatar.",QAR,Real Estate,Real Estate,Real Estate Management & Development,DOH,DSMD,Qatar Exchange,Qatar,,Doha,,http://www.ezdanholding.qa,,,,BBG000TH43C6,BBG000TH42V7,BBG001T05JB6,False
ERES@S.QA,Ezdan Holding Group QPSC,"Ezdan Holding Group QPSC is a Qatari real estate company involved in the development, management, and leasing of residential and commercial properties. The company's portfolio includes hotels, shopping malls, and residential compounds. Ezdan Holding Group is headquartered in Doha, Qatar.",QAR,Real Estate,Real Estate,,DOH,DSMD,Qatar Exchange,,,,,,,,,,,,False
FALH.QA,Al Faleh Educational Holding,"Al Faleh Educational Holding operates educational institutions. It operates schools for kids from age 3 to 18, a college, and training center. The company is headquartered in Doha, Qatar.",QAR,Consumer Staples,Household & Personal Products,Household Products,DOH,DSMD,Qatar Exchange,Qatar,,Doha,,http://www.alfaleh.edu.qa,,,,BBG00ZXWR1H5,BBG00ZXWR1G6,BBG00ZXWR1J3,False
GISS.QA,Gulf International Services Q.P.S.C.,"Gulf International Services Q.P.S.C., through its subsidiaries, provides insurance and reinsurance, drilling, helicopter transportation, and catering services in Qatar and internationally. It operates through Drilling, Insurance, Aviation, and Catering segments. The company owns 8 offshore and onshore drilling rigs that are used for drilling wells for oil and natural gas extraction; 1 jack-up accommodation barge; and 2 lift boats. It also offers helicopter transportation services, including offshore/ onshore transporting, long and short-line load lifting, seismic support, VIP executive transport, ad-hoc shortterm contracts, simulator training, and component maintenance services. In addition, the company also provides a range of insurance and reinsurance services in the field of construction, operations, marine, and medical; and catering, cleaning, pest control, manpower supply, facilities management, camp management, janitorial and laundry, and corporate hospitality and VIP dining services. Gulf International Services Q.P.S.C. was founded in 2008 and is based in Doha, Qatar.",QAR,Energy,Energy,"Oil, Gas & Consumable Fuels",DOH,DSMD,Qatar Exchange,Qatar,,Doha,,http://www.gis.com.qa,,,,BBG000VD9MM4,BBG000VD9MD4,BBG001T255J4,False
GWCS.QA,Gulf Warehousing Company Q.P.S.C.,"Gulf Warehousing Company Q.P.S.C., together with its subsidiaries, provides logistics and freight forwarding services in Qatar and internationally. The company operates through four segments: Logistics Operation, Freight Forwarding, Rentals, and Others. It offers handling, packaging and repackaging, inventory management, international moving and relocation, express courier, retail distribution, and consulting services, as well as inland transportation of goods for storage; and freight forwarding services through land, sea or air. The company also provides transportation and information technology services; and records management services, including digitization of documents, storage of physical and digital documents, time-bound document retrieval, indexing and cataloging accessed by document management systems, and secure destruction of physical and digital documents, as well as develops, operates, and manages warehouses. In addition, it is involved in chemical, food, and other consumables trading businesses; and the provision of marine services, such as yard operations, liner representation, port agency services, cruise ship hosting, and husbandry service. It serves aviation, telecommunication, manufacturing, government, banking and financial, oil and gas, sports and event management, fine arts, records management, healthcare, and small and medium enterprises. Gulf Warehousing Company Q.P.S.C. was founded in 2003 and is headquartered in Doha, Qatar.",QAR,Industrials,Transportation,Air Freight & Logistics,DOH,DSMD,Qatar Exchange,Qatar,,Doha,9763.0,http://www.gwclogistics.com,,,,BBG000C0PQR1,BBG000C0PQK8,BBG001SDD520,False
IGRD.QA,Investment Holding Group - Q.P.S.C.,"Investment Holding Group - Q.P.S.C., together with its subsidiaries, engages in various trading and investment activities in Qatar. It operates through four segments: Contracting, Specialized Contracting, Trading, and Water Treatment & Related Maintenance. The company undertakes projects related to hotels, airports, conference centers, and educational facilities, as well as offers civil contracting services. It also engages in the trading of fire alarms, security systems, and related contracting activities; contracting for wellness and pools, water features, water treatments, and after sale maintenance and services; and installation and maintenance of electro mechanical works. In addition, the company is involved in the trading of electrical equipment, switch gears, light and instrument electrical tools, and electrical and construction materials; and wood, steel, food, chemical, and building materials, as well as engages in electromechanical equipment installation and maintenance works. Further, it offers mechanical, electrical, and plumbing contracting services. The company was founded in 1975 and is based in Doha, Qatar.",QAR,Industrials,Capital Goods,Construction & Engineering,DOH,DSMD,Qatar Exchange,Qatar,,Doha,,http://www.ihgqatar.com,,,,,,,False
IHGS.QA,Islamic Holding Group (Q.P.S.C),"Islamic Holding Group (Q.P.S.C) invests in shares and bonds in Qatar. It operates through Brokerage and Real Estate segments. The company provides financial brokerage services. It provides property management, marketing, and sales services for real estate. The company was formerly known as Islamic Financial Securities Company (Q.S.C) and changed its name to Islamic Holding Group (Q.P.S.C) in July 2010. Islamic Holding Group (Q.P.S.C) was founded in 2003 and is based in Doha, Qatar.",QAR,Financials,Diversified Financials,Capital Markets,DOH,DSMD,Qatar Exchange,Qatar,,Doha,,http://www.islamicholding.com.qa,,,,,,,False
IQCD.QA,Industries Qatar Q.P.S.C.,"Industries Qatar Q.P.S.C., through its subsidiaries, engages in the petrochemical, fertilizer, and steel businesses primarily in Qatar. Its Petrochemicals segment produces and sells ethylene, polyethylene, methyl-tertiary-butyl-ether, methanol, caustic soda, ethylene dichloride, vinyl chloride monomer, Sulphur, pyrolysis gasoline, mixed LPG, and other petrochemical products. The company's Fertilizers segment produces and sells urea, ammonia, melamine, and urea formaldehyde condensate. Its Steel segment produces and sells direct reduced and hot briquetted iron; and steel coils, bars, billets, and other products. The company also exports its products. The company was founded in 1969 and is headquartered in Doha, Qatar. Industries Qatar Q.P.S.C. is a subsidiary of Qatar Petroleum.",QAR,Materials,Materials,Chemicals,DOH,DSMD,Qatar Exchange,Qatar,,Doha,,http://www.iq.com.qa,,,,BBG000C0QFF7,BBG000C0QF67,BBG001SDD8C3,False
IQCD@S.QA,Industries Qatar QPSC,"Industries Qatar QPSC is a Qatar-based company engaged in the production and sale of petrochemicals, fertilizers, and steel products. The company operates through its subsidiaries to manufacture and market a variety of industrial products, contributing to Qatar's industrial sector. Industries Qatar is headquartered in Doha, Qatar.",QAR,Materials,Materials,,DOH,DSMD,Qatar Exchange,,,,,,,,,,,,False
KCBK.QA,Al Khalij Commercial Bank (al khaliji) P.Q.S.C.,"Al Khalij Commercial Bank (al khaliji) P.Q.S.C., together with its subsidiaries, provides commercial banking products and services in Qatar, the United Arab Emirates, and France. It operates through Wholesale Banking and Personal Banking segments. The company offers personal banking products, such as current, savings, and fusion accounts; fixed deposit accounts; personal, mortgage, and auto loans; ATMs; credit life insurance; credit cards; and cross mortgage services. It also provides corporate banking products and services, such as corporate lending products comprising working capital finance, overdrafts, short term loans, and medium and long term loans; club and syndicated loans; structured finance products that include project finance and contract financing; and trade finance products, such as documentary credit, documentary collections, and guarantees. The company's corporate banking products and services also include cash management; and advisory services in the areas of risk management, liquidity management, and treasury and debt capital markets. In addition, the company offers treasury services, such as funding and liquidity, and treasury sales; and premium and private banking, and debt issuance services, as well as Internet, phone, and SMS banking services. It operates 40 ATMs and 9 branches. The company serves premium, business, corporate, and international customers. Al Khalij Commercial Bank (al khaliji) P.Q.S.C. was founded in 2007 and is headquartered in Lusail, Qatar.",QAR,Financials,Banks,Banks,DOH,DSMD,Qatar Exchange,Qatar,,Lusail,,http://www.alkhaliji.com,,,,,,,False
