symbol,name,summary,currency,sector,industry_group,industry,exchange,mic,market,country,state,city,zipcode,website,market_cap,isin,cusip,figi,composite_figi,shareclass_figi,delisted
MARK.QA,Masraf Al Rayan (Q.P.S.C.),"Masraf Al Rayan (Q.P.S.C.) engages in the Islamic banking, financing, investing, and brokerage activities in Qatar and internationally. It operates through four segments: Corporate Banking, Retail Banking, Asset Management, and International Operations segments. The company's corporate banking products and services include corporate finance and advisory services, such as capital restructuring, capital raising, corporate valuation, transformation of business products, mergers and acquisitions, specialized investment, structured finance, project finance, and IPO; financing products comprising Murabaha, Ijarah, Ijarah Muntahia Bittamleek, Istisna'a, and Mudaraba; cash management services; treasury services; profit rate swaps, financing syndication, and other services; and trade finance products, such as letters of credit and guarantee, syndicated financing, import financing, inventory financing, and transaction banking products, as well as deposit services, currency exchange, and other services. Its retail banking products and services comprise current, savings, investment, term and time deposit, and kids accounts, as well as other investment products; personal, car, home, and goods finance products; and credit cards and prepaid cards, as well as call center and ATM services. The company also provides private banking products and services, such as investment planning and asset management, wealth protection, credit planning and management, cash management, and business planning. In addition, it offers investment banking, financial brokerage, investment underwriting, institutional sales, and real estate consulting services. The company serves retail and individual customers, as well as corporate, commercial, and multinational customers. It operates through 17 branches in Qatar. Masraf Al Rayan (Q.P.S.C.) was incorporated in 2006 and is based in Doha, Qatar.",QAR,Financials,Banks,Banks,DOH,DSMD,Qatar Exchange,Qatar,,Doha,,http://www.alrayan.com,,,,,,,False
MARK@S.QA,Masraf Al Rayan QPSC,"Masraf Al Rayan QPSC is a Qatari Islamic bank that provides a range of banking products and services to individuals, businesses, and institutions. These services include retail banking, corporate banking, investment banking, and treasury services, all in accordance with Islamic Sharia principles. The bank is headquartered in Doha, Qatar.",QAR,Financials,Banks,,DOH,DSMD,Qatar Exchange,,,,,,,,,,,,False
MCCS.QA,Mannai Corporation Q.P.S.C.,"Mannai Corporation Q.P.S.C., together with its subsidiaries, operates as a conglomerate worldwide. The company operates through Information Technology, Auto Group, Energy and Industrial Markets, Geotechnical Services, Logistics, Travel, Engineering, Jewellery Trading, Telecom Retail, and Others segments. It offers a range of IT services, including application implementation, bespoke application development, systems integration, mobility, master data management, enterprise content management, data warehousing, enterprise resource planning, and customer relationship management; outsourcing and consulting services; hardware, software, security, networking, compute, and print solutions; digital business and technology services; office equipment solutions; distribution, technology, payment, and other solutions; and healthcare, research, and scientific technology solutions and services. The company also sells small compacts, passenger cars, commercial vehicles, and used cars; sells and markets heavy equipment and construction machinery to the construction and industrial sectors; and car rental, lease hire, chauffeur, and shuttle services. In addition, it supplies equipment and services to the oil and gas, construction, infrastructure, and utilities sector. Further, the company provides geotechnical, geological, and material testing services to civil engineering, water resource, and development projects; engineering services; travel agency services; and air, sea, and road freight transportation, as well as warehousing and customs clearance services. Additionally, it supplies home, white goods, and small kitchen appliances, electronics, video and audio systems; retails and wholesales jewelry and watch products through its 251 stores; and provides facilities maintenance and management services. The company was founded in 1951 and is based in Doha, Qatar. Mannai Corporation Q.P.S.C. operates as a subsidiary of Qatar Investment & Projects Development Holding Co., W.L.L.",QAR,Information Technology,Software & Services,IT Services,DOH,DSMD,Qatar Exchange,Qatar,,Doha,,http://www.mannai.com,,,,,,,False
MCGS.QA,Medicare Group Q.P.S.C.,"Medicare Group Q.P.S.C. provides g healthcare and treatment services in Qatar. The company operates hospitals, medical clinic centers, and outpatient clinics. It also provides home nursing, physical therapy, and nutrition services. The company was formerly known as Al Ahli Specialised Hospital Company Q.P.S.C. Medicare Group Q.P.S.C. was incorporated in 1996 and is based in Doha, Qatar.",QAR,Health Care,Health Care Equipment & Services,Health Care Equipment & Supplies,DOH,DSMD,Qatar Exchange,Qatar,,Doha,,http://www.medicare.com.qa,,,,BBG000PSBNG0,BBG000PSBN25,BBG001SLQPX0,False
MERS.QA,Al Meera Consumer Goods Company Q.P.S.C.,"Al Meera Consumer Goods Company Q.P.S.C., together with its subsidiaries, engages in the wholesale and retail trade of various types of consumer goods commodities in Qatar and the Sultanate of Oman. It operates through three segments: Retail, Investment, and Leasing. The company sells foodstuff, household items and garments, stationery, computer accessories, books, and toys; owns and manages consumer outlets; holds equity and funds in the form of financial assets; and rents shops in various malls. It also establishes and operates shopping centers, supermarkets, and hypermarkets; and offers warehousing and delivery truck services. As of March 28, 2021, the company operated 58 stores. Al Meera Consumer Goods Company Q.P.S.C. was incorporated in 2005 and is based in Doha, Qatar.",QAR,Consumer Discretionary,Consumer Durables & Apparel,Household Durables,DOH,DSMD,Qatar Exchange,Qatar,,Doha,,http://www.almeera.com.qa,,,,BBG000PQH6S2,BBG000PQH6N7,BBG001T5W0V4,False
MPHC.QA,Mesaieed Petrochemical Holding Company Q.P.S.C.,"Mesaieed Petrochemical Holding Company Q.P.S.C., through its subsidiaries, manufactures and sells petrochemical products in Qatar, the Middle East, Asia, Africa, Indian sub-continent, and Europe. The company operates through two segments, Petrochemicals and Chlor-Alkali. It is involved in the production and sale of ethylene, polyolefins, 1-hexene, C4+, polyethylene, normal alpha olefins, pyrolysis gasoline, C3 and C4, caustic soda, ethylene dichloride, vinyl chloride monomer, and hydrochloric acid. The company was founded in 2013 and is headquarterd in Doha, Qatar. Mesaieed Petrochemical Holding Company Q.P.S.C. is a subsidiary of Qatar Petroleum.",QAR,Materials,Materials,Chemicals,DOH,DSMD,Qatar Exchange,Qatar,,Doha,,http://www.mphc.com.qa,,,,,,,False
MPHC@S.QA,Mesaieed Petrochemical Holding ,"Mesaieed Petrochemical Holding Company is a Qatari company engaged in the production and sale of petrochemical products. The company's products include ethylene, polyethylene, and other petrochemicals. It is based in Mesaieed Industrial City, Qatar.",QAR,Materials,Materials,,DOH,DSMD,Qatar Exchange,,,,,,,,,,,,False
MRDS.QA,Mazaya Real Estate Development Q.P.S.C.,"Mazaya Real Estate Development Q.P.S.C. engages in the real estate investment and development businesses. It develops real estate properties, such as master developments to individual projects in the residential, commercial, and industrial sectors. The company also provides project management and consultancy, property valuation, strategic partnership, real estate brokerage, master developments, assets and facility management division, marketing management and consultancy, real estate portfolio and fund management, and real estate market research services, as well as real estate management and maintenance services. In addition, it trades in mechanical electrical and construction equipment. The company was founded in 2008 and is based in Doha, Qatar.",QAR,Real Estate,Real Estate,Real Estate Management & Development,DOH,DSMD,Qatar Exchange,Qatar,,Doha,,http://www.mazayaqatar.com,,,,BBG000Q3SZP9,BBG000Q3SZ15,BBG001T6DV63,False
MRDS@S.QA,Mazaya Real Estate Development ,Mazaya Real Estate Development is a real estate development company based in Qatar. They focus on developing residential and commercial properties. The company aims to contribute to Qatar's real estate sector.,QAR,Real Estate,Real Estate,,DOH,DSMD,Qatar Exchange,,,,,,,,,,,,False
NLCS.QA,Alijarah Holding (Q.P.S.C.),"Alijarah Holding (Q.P.S.C.), together with its subsidiaries, engages in financial leasing, real estate, property development, transportation, taxi service, and driving school businesses in Qatar. The company supplies equipment; and provides taxi and limousine services with a fleet of 520 Airport Taxi and approximately 100 limousine vehicles for transportation needs of individuals, corporate houses, and governments, as well as offers driving school services. It also offers Islamic leasing and infrastructure development services; and leases and manages properties. The company was incorporated in 2003 and is based in Doha, Qatar.",QAR,Real Estate,Real Estate,Real Estate Management & Development,DOH,DSMD,Qatar Exchange,Qatar,,Doha,,http://www.alijarah.com,,,,,,,False
ORDS.QA,Ooredoo Q.P.S.C.,"Ooredoo Q.P.S.C., together with its subsidiaries, provides telecommunications services and related products to small companies, start-ups, and enterprises. The company operates through six segments: Ooredoo Qatar, Asiacell, Indosat Ooredoo, Ooredoo Oman, Ooredoo Algeria, and Ooredoo Myanmar. It offers cellular, wireless, mobile and fixed telecommunication, multimedia, data communication, broadband, internet leased lines, intra city and inter city leased lines, MPLS IPVPN, and internet services. The company also provides machine to machine, cloud, and mobile applications.  It offers its services primarily in Qatar, Iraq, Kuwait, Indonesia, Oman, and other parts of the Middle East, and North African region. Ooredoo Q.P.S.C. was formerly known as Qatar Telecom (Qtel) Q.S.C. and changed its name to Ooredoo Q.P.S.C. in June 2013. The company was founded in 1987 and is headquartered in Doha, Qatar. Ooredoo Q.P.S.C. is a subsidiary of Qatar Holding L.L.C.",QAR,Communication Services,Telecommunication Services,Diversified Telecommunication Services,DOH,DSMD,Qatar Exchange,Qatar,,Doha,,http://www.ooredoo.com,,,,,,,False
ORDS@S.QA,Ooredoo QPSC,"Ooredoo QPSC is a telecommunications company based in Qatar, providing a range of services, including mobile, fixed-line, broadband, and digital services. The company operates in the Middle East, North Africa, and Southeast Asia, serving both consumers and businesses. Ooredoo QPSC is headquartered in Doha, Qatar.",QAR,Communication Services,Telecommunication Services,,DOH,DSMD,Qatar Exchange,,,,,,,,,,,,False
QAMC.QA,Qatar Aluminium Manufacturing Company Q.P.S.C.,"Qatar Aluminium Manufacturing Company Q.P.S.C. produces and sells aluminum products in Asia, Europe, and the United States. It offers extrusion ingots and foundry alloys for the use in automotive, construction, and engineering industries, as well as in the manufacturing of consumer goods. The company was founded in 2018 and is headquartered in Doha, Qatar. Qatar Aluminium Manufacturing Company Q.P.S.C. is a subsidiary of Qatar Petroleum.",QAR,Materials,Materials,Metals & Mining,DOH,DSMD,Qatar Exchange,Qatar,,Doha,,http://www.qamco.com.qa,,,,,,,False
QAMC@S.QA,Qatar Aluminium Manufacturing Q,"Qatar Aluminium Manufacturing Company (QAMCO) manufactures and sells aluminium products. The company offers primary aluminium products, including standard ingots, T-ingots, sow, and billets. The company is headquartered in Doha, Qatar.",QAR,Materials,Materials,,DOH,DSMD,Qatar Exchange,,,,,,,,,,,,False
QATI.QA,Qatar Insurance Company Q.S.P.C.,"Qatar Insurance Company Q.S.P.C., together with its subsidiaries, provides insurance, reinsurance, real estate, and financial advisory services. It operates through six segments: Marine & Aviation Insurance, Property & Casualty Insurance, Health & Life Insurance, Real Estate, Advisory, and Investments. The company offers personal insurance products, including car, home, travel, boat, motorcycle, and life and medical; and business insurance products, such as energy, marine and aviation, property and commercial, and motor fleet. It is also involved in the investment activities; management of property; and provision of IT and related services. The company operates in the State of Qatar, the United Arab Emirates, the Sultanate of Oman, the State of Kuwait, the United Kingdom, Switzerland, Bermuda, Singapore, Cayman Islands, Gibraltar, Italy, Jersey, and Malta. Qatar Insurance Company Q.S.P.C. was founded in 1964 and is headquartered in Doha, Qatar.",QAR,Financials,Insurance,Insurance,DOH,DSMD,Qatar Exchange,Qatar,,Doha,,http://www.qatarinsurance.com/corporate,,,,BBG000BMHKJ5,BBG000BMHK50,BBG001SBKP68,False
QATI@S.QA,Qatar Insurance QSPC,"Qatar Insurance Company (QIC) is an insurance company that offers a range of insurance products and services, including personal, commercial, and international insurance. Its services include property, casualty, marine, aviation, motor, medical, and life insurance, as well as risk management and investment services. The company is headquartered in Doha, Qatar.",QAR,Financials,Insurance,,DOH,DSMD,Qatar Exchange,,,,,,,,,,,,False
QCFS.QA,Qatar Cinema and Film Distribution Company - Q.S.C,"Qatar Cinema and Film Distribution Company - Q.S.C engages in the distribution of cinema films and videos in Qatar. It also trades in television films and programs, and tools for the operation of cinema and projectors. In addition, the company offers commercial advertisement services; and operates movie theater and cafeteria for cinema. Further, it invests in shares, bonds, and funds, real estate. Qatar Cinema and Film Distribution Company - Q.S.C was incorporated in 1970 and is based in Doha, Qatar.",QAR,Communication Services,Media & Entertainment,Entertainment,DOH,DSMD,Qatar Exchange,Qatar,,Doha,,http://www.qatarcinemas.com,,,,,,,False
QEWS.QA,Qatar Electricity & Water Company Q.P.S.C.,"Qatar Electricity and Water Company Q.P.S.C., together with its subsidiaries, develops, owns, and operates plants for the production of electricity and desalinated water in Qatar. The company also invests in electricity and desalinated water projects; identifies, evaluates, and develops solar power projects; and operates and maintains plants. It has an electricity generation capacity of 10,590 megawatts and a water production capacity of 481.5 million gallons of water per day. The company was founded in 1990 and is based in Doha, Qatar.",QAR,Utilities,Utilities,Multi-Utilities,DOH,DSMD,Qatar Exchange,Qatar,,Doha,,http://www.qewc.com,,,,,,,False
QEWS@S.QA,Qatar Electricity and Water QPS,"Qatar Electricity and Water Company QPSC (QEWC) is a utility company engaged in the production and distribution of electricity and water in Qatar. The company owns and operates power and desalination plants. QEWC is based in Doha, Qatar.",QAR,Utilities,Utilities,,DOH,DSMD,Qatar Exchange,,,,,,,,,,,,False
QFBQ.QA,First Bank,"First Bank provides various banking products and services to individuals, businesses, and governmental entities. The company accepts various deposits, including non-interest bearing demand deposits, interest bearing demand accounts, money market accounts, savings accounts, and certificates of deposit, as well as commercial checking accounts. Its loan products include commercial and industrial loans; commercial real estate loans, such as owner-occupied, investor, construction and development, and multi-family loans; residential real estate loans comprising residential mortgages, first and second lien home equity loans, and revolving lines of credit; and consumer and other loans that include auto, personal, and traditional installment loans. The company also provides electronic banking services, including Internet and mobile banking, electronic bill payment, and banking by phone, as well as ATM and debit cards, and wire and ACH transfer services; remote deposit capture; and cash management services. As of January 27, 2021, it operated 18 full-service branches in Cinnaminson, Cranbury, Delanco, Denville, Ewing, Flemington, Hamilton, Hamilton Square, Lawrence, Mercerville, Pennington, Randolph, Somerset, and Williamstown counties in New Jersey, as well as Doylestown, Trevose, Warminster, and West Chester counties in Pennsylvania. First Bank was incorporated in 2007 and is headquartered in Hamilton, New Jersey.",QAR,Financials,Banks,Banks,DOH,DSMD,Qatar Exchange,United States,NJ,Hamilton,8690.0,http://www.firstbanknj.com,Micro Cap,,,,,,False
QFBQ@S.QA,First Bank,"First Bank provides various banking products and services to individuals, businesses, and governmental entities. The company accepts various deposits, including non-interest bearing demand deposits, interest bearing demand accounts, money market accounts, savings accounts, and certificates of deposit, as well as commercial checking accounts. Its loan products include commercial and industrial loans; commercial real estate loans, such as owner-occupied, investor, construction and development, and multi-family loans; residential real estate loans comprising residential mortgages, first and second lien home equity loans, and revolving lines of credit; and consumer and other loans that include auto, personal, and traditional installment loans. The company also provides electronic banking services, including Internet and mobile banking, electronic bill payment, and banking by phone, as well as ATM and debit cards, and wire and ACH transfer services; remote deposit capture; and cash management services. As of January 27, 2021, it operated 18 full-service branches in Cinnaminson, Cranbury, Delanco, Denville, Ewing, Flemington, Hamilton, Hamilton Square, Lawrence, Mercerville, Pennington, Randolph, Somerset, and Williamstown counties in New Jersey, as well as Doylestown, Trevose, Warminster, and West Chester counties in Pennsylvania. First Bank was incorporated in 2007 and is headquartered in Hamilton, New Jersey.",QAR,Financials,Banks,Banks,DOH,DSMD,Qatar Exchange,United States,NJ,Hamilton,8690.0,http://www.firstbanknj.com,Micro Cap,,,,,,False
QFLS.QA,Qatar Fuel Company Q.P.S.C.(WOQOD),"Qatar Fuel Company Q.P.S.C.(ÂWOQOD'), together with its subsidiaries, sells, markets, and distributes oil, gas, and refined petroleum products in Qatar. It distributes gasoline and aviation fuels; operates 105 fuel stations, as well as convenience store under the SIDRA name; supplies bulk fuels; and offers ship -to- ship fuels bunkering services. The company also provides auto care services, such as oil change, brakes and mechanical works, tire rotation and wheel alignment, car accessories and spare parts, batteries and electrical works, manual wash, auto car wash, minor repairs, etc. In addition, it offers commercial LPG to restaurants, bakeries, catering businesses, and hotel owners; compressed natural gas; and industrial LPG. Further, the company produces bituminous products, including polymer modified bitumen, cutbacks, and emulsions. Additionally, it offers vehicle inspection, marine bunkering, oil and gas transportation, and real estate services. The company was founded in 2002 and is headquartered in Doha, Qatar.",QAR,Energy,Energy,"Oil, Gas & Consumable Fuels",DOH,DSMD,Qatar Exchange,Qatar,,Doha,,http://www.woqod.com,,,,,,,False
QFLS@S.QA,Qatar Fuel QPSC,"Qatar Fuel QPSC (WOQOD) is a petroleum company engaged in the distribution and sale of fuel products in Qatar. The company operates a network of petrol stations and supplies fuel to various sectors. WOQOD is based in Doha, Qatar.",QAR,Energy,Energy,,DOH,DSMD,Qatar Exchange,,,,,,,,,,,,False
QGMD.QA,Qatari German Company for Medical Devices (Q.P.S.C.),"Qatari German Company for Medical Devices (Q.P.S.C.) manufactures and sells single use disposable syringes in the Middle East. The company offers Q JectUltra, an insulin syringe serving as a tool in diabetic care; Q Flow for infusion therapy; Q Need, a single use hypodermic needle; Q Ject, a single use syringe for the curative medications; and Q Safe, a re-use prevention syringe. It also trades in medical consumables, medical equipment, medical furniture, tools, and supplies. The company was incorporated in 2000 and is headquartered in Doha, Qatar.",QAR,Health Care,Health Care Equipment & Services,Health Care Equipment & Supplies,DOH,DSMD,Qatar Exchange,Qatar,,Doha,,http://www.qgmd.com,,,,BBG000PS8573,BBG000PS84W8,BBG001SLQJN5,False
QGRI.QA,Qatar General Insurance & Reinsurance Company Q.P.S.C.,"Qatar General Insurance & Reinsurance Company QPSC, together with its subsidiaries, provides general insurance and reinsurance products for individuals, families, and businesses. The company offers personal insurance products, such as motor, villa/home owner, accident, medical, jewelry, and travel insurance products. It also provides corporate insurance products comprising energy, motor, engineering, casualty, property, medical and life, and marine; and specialized insurance products for restaurants, education institutes, supermarkets, pharmacies, beauty salons, and car show rooms, as well as office, jewelry, and Islamic Takaful insurance products. In addition, the company is involved in the investment, development, and management of real estate properties; repair of automobiles; water bottling and beverage trading; hospitality, exhibition, and events management; and contracting and construction activities, as well as manufacture of rebars and insulation materials. Qatar General Insurance & Reinsurance Company QPSC was founded in 1979 and is headquartered in Doha, Qatar.",QAR,Financials,Insurance,Insurance,DOH,DSMD,Qatar Exchange,Qatar,,Doha,,http://www.qgirco.com,,,,BBG000FG9123,BBG000FG9070,BBG001SLQJQ2,False
QGTS.QA,Qatar Gas Transport Company Limited (Nakilat) (QPSC),"Qatar Gas Transport Company Limited (Nakilat) (QPSC), together with its subsidiaries, operates as a shipping and maritime company in Qatar. The company is involved in the chartering of vessels; ship repair and offshore construction activities; fabrication, construction, and assembly of offshore and onshore structures; and provision of pipe fabrication and solutions, module fabrication and assembly, and onshore field and modular construction services. It also offers towage services through owned and operated tug boats, pilot boats, line boats, crew boats, and other harbor crafts, as well as towing, escorting, berthing, pilot support, afloat and ashore line handling services, emergency response, and marine maintenance support. In addition, the company provides agency and logistic support services, custom formalities, husbandry services, bunker coordination services, crew change and administration services, spare and supply services, and drydocking support services; and various support services to vessels, such as chandlery services, storage facilities, and logistics and related services. Its fleet consists of 29 wholly-owned and 40 jointly-owned vessels; 4 LPG carriers; 1 floating storage regasification unit vessel; and 25 tugs and marine support vessels. The company was founded in 2004 and is headquartered in Doha, Qatar.",QAR,Industrials,Transportation,Marine,DOH,DSMD,Qatar Exchange,Qatar,,Doha,,http://nakilat.com,,,,BBG000G9QXS1,BBG000G9QWZ5,BBG001SNW9R2,False
QGTS@S.QA,Qatar Gas Transport Ltd QPSC,"Qatar Gas Transport Company Ltd QPSC (Nakilat) is a shipping and maritime company primarily involved in the transportation of liquefied natural gas (LNG). They own and operate a large fleet of LNG carriers. Nakilat is based in Doha, Qatar.",QAR,Industrials,Transportation,,DOH,DSMD,Qatar Exchange,,,,,,,,,,,,False
