symbol,name,summary,currency,sector,industry_group,industry,exchange,mic,market,country,state,city,zipcode,website,market_cap,isin,cusip,figi,composite_figi,shareclass_figi,delisted
1771.F,"Nippon Kanryu Industry Co., Ltd.","Nippon Kanryu Industry Co., Ltd. engages in the construction business. The company is involved in the traffic safety facilities, landscape, and other construction works, as well as civil engineering, law related disaster prevention, and river and sabo related works. It also sells materials related to various construction works; disaster prevention goods; and industrial safety and health supplies, as well as provides structure repair related services. In addition, the company produces chemicals, such as insoluble sulfur, as well as manufactures natural soil herbs. Nippon Kanryu Industry Co., Ltd. was founded in 1939 and is headquartered in Fukuoka, Japan.",JPY,Industrials,Capital Goods,Construction & Engineering,FKA,XFKA,Fukuoka Stock Exchange,Japan,,Fukuoka,812-0054,http://www.kanryu.co.jp,Nano Cap,,,BBG000GJ40N0,BBG000GJ3XK2,BBG001S8W0K1,False
1802.F,Obayashi Corp.,"Obayashi Corporation engages in the construction business in Japan, North America, Asia, the Middle East, Europe, and Oceania. The company constructs buildings, including offices, condominiums, commercial facilities, factories, hospitals, and schools; and civil engineering projects, such as tunnels, bridges, dams, riverbanks, railroads, and expressways. It is also involved in the development and leasing of real estate properties in various locations, primarily in metropolitan areas, as well as property management activities; solar, biomass, hydropower, geothermal, and wind power generation business; and PPP and agriculture business. In addition, the company sells materials and equipment for construction; develops and sells computer software; sells and leases electronic equipment; offers finance-related services; and operates golf clubs. Further, it engages in the provision of urban development, contracted engineering, management, consultancy services, etc.; and is involved in the M&E design and construction activities. The company was founded in 1892 and is headquartered in Tokyo, Japan.",JPY,Industrials,Capital Goods,Construction & Engineering,FKA,XFKA,Fukuoka Stock Exchange,Japan,,Tokyo,108-8502,http://www.obayashi.co.jp,Mid Cap,JP3190000004,,BBG000BFRGV4,BBG000BFRCY0,BBG001S6B3Q6,False
1999.F,Saita Corporation,"Saita Corporation engages in the construction and crushed stone businesses in Japan. It undertakes various civil work projects, such as roads, rivers, land construction, water and sewerage, agricultural civil engineering, and disaster restoration. The company also produces and sells liquors, sake, and shochu; and sells imported goods and HFC products. In addition, it engages in water treatment, security, and cargo transportation businesses. Saita Corporation was founded in 1923 and is based in Asakura, Japan.",JPY,Industrials,Capital Goods,Construction & Engineering,FKA,XFKA,Fukuoka Stock Exchange,Japan,,Asakura,838-0016,http://www.saita-hd.co.jp,Nano Cap,,,BBG000D9H2N7,BBG000D9DW91,BBG001S86FC6,False
2058.F,"Higashimaru Co.,Ltd.","Higashimaru Co.,Ltd. produces and sells marine and food products in Japan. It offers yellowtail and mixed feeds for various fish farms; and dried and instant noodles, dish udon, noodle soups, snacks, etc. The company also exports its products to 19 countries. Higashimaru Co., Ltd. was founded in 1947 and is headquartered in Kagoshima, Japan.",JPY,Consumer Staples,Household & Personal Products,Household Products,FKA,XFKA,Fukuoka Stock Exchange,Japan,,Kagoshima,899-2594,http://www.k-higashimaru.co.jp,Nano Cap,,,BBG000C1HH43,BBG000C1HDH8,BBG001SBR6D5,False
2919.F,"Marutai Co.,Ltd.","Marutai Co.,Ltd. produces and sells noodles, seasonings, and confectionery products in Japan. It offers instant, stick-like, cup, and fried noodles; and cupcakes, tildes, assortments, and other products. The company was formerly known as Marutai Taimeido Co., Ltd. and changed its name to Marutai Co.,Ltd. in 1990. Marutai Co.,Ltd. was founded in 1947 and is headquartered in Fukuoka, Japan.",JPY,Consumer Staples,Food & Staples Retailing,Food & Staples Retailing,FKA,XFKA,Fukuoka Stock Exchange,Japan,,Fukuoka,,http://www.marutai.co.jp,Micro Cap,,,BBG000FGGVS1,BBG000FGFQF7,BBG001S8KHB7,False
2974.F,"DAIEISANGYO Co.,Ltd.","DAIEISANGYO Co.,Ltd. engages in the condominium and housing business in Japan. The company primarily sells newly built condominiums and single-family homes. It is also involved in the development and sale of residential land; housing construction contract; and planning and sale of used homes, as well as planning, design, construction of housing renovation projects. DAIEISANGYO Co.,Ltd. was founded in 1968 and is headquartered in Kitakyushu, Japan.",JPY,Real Estate,Real Estate,Real Estate Management & Development,FKA,XFKA,Fukuoka Stock Exchange,Japan,,Kitakyushu,807-0075,http://www.daieisangyo.co.jp,Nano Cap,,,BBG00NZYQHS0,BBG00NZYPR09,BBG00NZYPR18,False
3099.F,Isetan Mitsukoshi Holdings Ltd.,"Isetan Mitsukoshi Holdings Ltd., together with its subsidiaries, engages in the department store business in Japan and internationally. The company operates through four segments: Department Store Business, Credit & Finance/Customer Organization Management Business, Real Estate Business, and Other Business. It is involved in the credit card, insurance, and other businesses; constructs and manages underground garages, public underground passages, and underground shopping malls; leases shops; operates restaurants; operates shares and business management, and online mall and others; commercial and corporate management consulting; and designs, constructs, operates, and leases real estate properties, as well as offers tenant leasing and building maintenance and environment production services. The company also offers employment agency, recruitment office, personnel, education and training, and labor and welfare services, as well as information systems solutions. In addition, it engages in the supermarket, retail, and specialty shops; food production; and wholesaling business, as well as operates airport style duty free shops. Further, the company plans, develops, imports, and sells gifts, novelty, and lifestyle goods; imports and wholesales western wine and spirits, foods, and miscellaneous products; and sells foodstuffs, clothing, and other daily goods. Additionally, it plans, produces, promotes, and sells commercials, video signs, TV programs, movies, plays, entertainment and fashion shows, parties, etc.; engages in advertising agency business; plans and sells travel products and conducts tours; owns and operates river cruise ships; and operates beauty and hair salons and sports clubs, and sells cosmetics. The company was incorporated in 2008 and is headquartered in Tokyo, Japan.",JPY,Consumer Discretionary,Consumer Durables & Apparel,Household Durables,FKA,XFKA,Fukuoka Stock Exchange,Japan,,Tokyo,160-0022,http://www.imhds.co.jp,Mid Cap,JP3894900004,,BBG000MF3X69,BBG000MF3SX0,BBG001SQBBX6,False
3943.F,"Ohishi Sangyo Co., Ltd.","Ohishi Sangyo Co., Ltd. manufactures and sells industrial packaging materials in Japan. It offers pulp moulds that are used in livestock, agricultural, and industrial applications; and thermoplastic films, such as polystyrene and T-die embossed films, and polyethylene bags, as well as film coatings. The company also provides heavy duty bags, including multi-walled sack kraft bags, which are used for chemicals, plastics, flours, foods, animal feeds, and fertilizers, as well as form fill seals for use in plastics, such as poly-olefins; and corrugated boards that are used for industrial and agricultural applications. In addition, it offers cradle, a container for packing strawberries. The company was founded in 1947 and is based in Kitakyushu, Japan.",JPY,Consumer Discretionary,Retailing,Distributors,FKA,XFKA,Fukuoka Stock Exchange,Japan,,Kitakyushu,805-0068,http://www.osk.co.jp,Micro Cap,,,BBG000BHY1D5,BBG000BHXZ69,BBG001S6CHP5,False
4447.F,"PBsystems,Inc.","PBsystems,Inc. engages in the construction of private cloud systems in Japan. The company offers a virtual system from business system to space. It also manufactures and sells 4D King, a shared 3D VR theater. PBsystems,Inc. was founded in 1997 and is based in Fukuoka, Japan.",JPY,Information Technology,Software & Services,Software,FKA,XFKA,Fukuoka Stock Exchange,Japan,,Fukuoka,812-0007,http://www.pbsystems.co.jp,Nano Cap,,,BBG00PXRP0C7,BBG0032RS466,BBG0032RS475,False
4502.F,Takeda Pharmaceutical Co. Ltd.,"Takeda Pharmaceutical Company Limited engages in the research, development, manufacturing, and marketing of pharmaceutical products, over-the-counter medicines and quasi-drug consumer products, and other healthcare products. It offers pharmaceutical products in the areas of gastroenterology; oncology; neuroscience; and rare diseases, such as rare metabolic and hematology, and heredity angioedema, as well as plasma-derived therapies and vaccines. The company provides its products under the ENTYVIO, GATTEX/REVESTIVE, ALOFISEL, NATPARA, ADYNOVATE/ADYNOVI, TAKHZYRO, ELAPRASE, VPRIV, GAMMAGARD LIQUID/KIOVIG, HYQVIA, CUVITRU, ALBUMIN/FLEXBUMIN, NINLARO, and ALUNBRIG brands. It operates in Japan, the United States, Europe and Canada, Russia/CIS, Latin America, rest of Asia, the Middle East, Oceania, and Africa. The company has licensing agreements with TESARO, Inc., Denali Therapeutics, and Wave Life Sciences Ltd; collaboration agreements with Rani Therapeutics LLC, Novimmune S.A., AB Biosciences Inc., Sosei Group Corporation, and LogicBio Therapeutics, Inc.; strategic collaboration with Prometheus Biosciences, Inc; a license and research agreement with The University of Texas MD Anderson Cancer Center; a research collaboration agreements with Enzyre BV and Cerevance; a collaboration agreement with Artisan Bio, Inc.; and a multi-target rare disease collaboration with Evox Therapeutics Ltd., as well as licensing agreement with ProThera Biologics Inc. It also has a strategic alliance with Egle Therapeutics SAS and Evotec SE; a strategic partnership with Neurocrine Biosciences, Inc.; Carmine Therapeutics and HemoShear Therapeutics, LLC; strategic collaboration with KSQ Therapeutics to research, develop, and commercialize immune-based therapies for cancer; and strategic collaboration with Anima Biotech. Takeda Pharmaceutical Company Limited was founded in 1781 and is headquartered in Tokyo, Japan.",JPY,Health Care,"Pharmaceuticals, Biotechnology & Life Sciences",Pharmaceuticals,FKA,XFKA,Fukuoka Stock Exchange,Japan,,Tokyo,103-8668,http://www.takeda.com,Large Cap,JP3463000004,,BBG000BJPSL3,BBG000BJPPH4,BBG001S62G78,False
4995.F,"Sankei Chemical Co., Ltd.","Sankei Chemical Co., Ltd. manufactures and sells plant protection materials for agricultural products in Japan. It offers insecticides, fungicides, pheromone agents, herbicides, spreading agents, soil fumigants, agricultural materials, pest control agents, and others. The company was formerly known as Kagoshima Kagaku Kogyo Co., Ltd. and changed its name to Sankei Chemical Co., Ltd. in January 1962. Sankei Chemical Co., Ltd. was founded in 1918 and is headquartered in Kagoshima, Japan.",JPY,Materials,Materials,Construction Materials,FKA,XFKA,Fukuoka Stock Exchange,Japan,,Kagoshima,891-0122,http://www.sankei-chem.com,Nano Cap,,,BBG000BK2GL1,BBG000BK2DG4,BBG001S6J0B0,False
5108.F,BRIDGESTONE CORPORATION,,JPY,,,,FKA,XFKA,Fukuoka Stock Exchange,United States,,,,,,,,BBG000BG8B35,BBG000BG87J7,BBG001S6BBP9,False
5233.F,Taiheiyo Cement Corporation,"Taiheiyo Cement Corporation engages in cement, mineral resources, environmental, and construction materials businesses in Japan and internationally. The company's Cement segment offers ordinary Portland cement, specialty cement, soil stabilizers, and ready-mixed concrete. Its Mineral Resources segment sells limestone aggregate products comprising course and fine aggregate used in ready-mixed concrete, and aggregate used in concrete products and civil engineering; sandstone and andesite as aggregate materials; quicklime, slaked lime, filler, silica, and silica powder; and hollow ceramics, sepiolite, wollastonite, and kaolin, as well as recycles surplus construction soil. The company's Environmental segment recycles used tires, waste plastics, paper sludge, waste casting sand, other industrial waste, surplus soil from water purification, sewage sludge, dredging sludge, and other wastes discarded from municipalities, as well as engages in the CFC treatment and building waste treatment plants; develops and commercializes environmental recycling technologies, including ash washing system and applied kiln system; supplies flue gas desulfurization materials, such as calcium carbonate to coal-fired power plants; and sells slag powder and other inorganic materials, coal, heavy oil, and other fuels, as well as chemicals and gypsum. Its Construction Materials segment produces precast concrete products; promenades, interlocking blocks, and concrete housing products; acoustic panels used to reduce construction noise; and fireproof covering materials used in tunnels. The company's Other Businesses segment leases land for office buildings, commercial stores, leisure facilities, distribution warehouses, and other structures, as well as develops land for residential housing; and engages in data processing, transportation and warehouse, engineering, chemical products, and sports businesses. Taiheiyo Cement Corporation was founded in 1881 and is headquartered in Tokyo, Japan.",JPY,Materials,Materials,Construction Materials,FKA,XFKA,Fukuoka Stock Exchange,Japan,,Tokyo,112-8503,http://www.taiheiyo-cement.co.jp,Mid Cap,,,BBG000BG9KV3,BBG000BG9GS6,BBG001S6BC68,False
5953.F,"Showa Manufacturing Co.,Ltd.","Showa Manufacturing Co.,Ltd. manufactures and sells heat source and hot water supply products in Japan. It also offers air conditioning, environmental, cityscape, casting, and special heat source products. The company was founded in 1883 and is headquartered in Fukuoka City, Japan.",JPY,Information Technology,Technology Hardware & Equipment,"Electronic Equipment, Instruments & Components",FKA,XFKA,Fukuoka Stock Exchange,Japan,,Fukuoka City,811-2101,http://www.showa.co.jp,Nano Cap,,,BBG000BMT0G9,BBG000BMSXH7,BBG001S6P7P3,False
6076.F,"Amaze Co., Ltd.","Amaze Co., Ltd. engages in the hotel and restaurant businesses in Japan. It operates a chain of hotels under the HOTEL AZ name. The company was founded in 1911 and is headquartered in Oita, Japan.",JPY,Consumer Discretionary,Consumer Services,"Hotels, Restaurants & Leisure",FKA,XFKA,Fukuoka Stock Exchange,Japan,,Oita,870-0105,http://www.az-hotels.co.jp,Micro Cap,,,BBG004T860J5,BBG004T860C2,BBG004T860B3,False
6506.F,YASKAWA Electric Corporation,"YASKAWA Electric Corporation engages in motion control, robotics, system engineering, and other businesses worldwide. It manufactures and sells various AC drives, including general purpose AC drives, medium-voltage AC drives, system-use AC drives, and power regenerative units for use in cranes, fans, pumps, machine tools, conveyors, automated warehouses, and metal working machinery; and rotary servo motors, direct drive servo motors, linear servo motors, machine controllers, and machine vision systems that are used in chip mounters, robots, and metal working machinery. The company also offers arc and spot welding, handling/assembling, collaborative, biomedical, palletizing, press handling, sealing/cutting/laser machining, deburring, painting, glass substrates transfer, and semiconductor wafer transfer robots for use in semiconductor/liquid crystal manufacturing, arc welding, spot welding, palletizing, painting, and handling and assembly applications. In addition, it provides industrial system electrical products, such as medium-voltage AC drives, system use AC drives, and system controllers for use in iron and steel systems, water and wastewater treatment, and paper-making/film/port cargo handling/fiber/printing applications. Further, the company offers equipment for energy saving and creation comprising PV inverters, systems for large wind turbines, control equipment for small-scale power generation, and motor drive systems for use in photovoltaic power generation and electric vehicles. YASKAWA Electric Corporation was founded in 1915 and is headquartered in Kitakyushu, Japan.",JPY,Industrials,Capital Goods,Electrical Equipment,FKA,XFKA,Fukuoka Stock Exchange,Japan,,Kitakyushu,806-0004,http://www.yaskawa.co.jp,Large Cap,,,BBG000BDCHS7,BBG000BDCF47,BBG001S6FMP1,False
7189.F,Nishi-Nippon Financial HoldingsInc.,"Nishi-Nippon Financial HoldingsInc. is a financial services group in Japan. The company provides banking, leasing, and other financial services to individuals and businesses. Nishi-Nippon Financial Holdings is headquartered in Fukuoka, Japan.",JPY,Financials,Banks,,FKA,XFKA,Fukuoka Stock Exchange,Japan,,,,,,,,BBG00DQLMP33,BBG00DQLMKP0,BBG00DQLMKR8,False
7441.F,"Misumi Co., Ltd.","Misumi Co., Ltd. provides energy, lifestyle, and food and beverages related products and services in Japan. The company's Energy segment is involved in the wholesale and retail of gasoline, light oil, crude petroleum, lubricants, and other oil related products and LPGs; and provision of delivery services for LPG, as well as construction and inspection services for pressure gas facilities. Its Lifestyle segment engages in the sale of books, CDs, TV games, PCs, and cellular phones; provision of DVD and CD rental services; sale of houses; sale, maintenance, and inspection of cars; and management of commercial complexes, as well as sale of tires. The company's Food & Beverage segment is involved in the management of food chain business; and production and sale of mineral water. The company also manages golf courses; and offers public relations agency services. Misumi Co., Ltd. sells its products through gas stations, service stations, auto gas service stations, store fronts, and outlets. The company was formerly known as Misumi Petroleum Gas Co., Ltd. and changed its name to Misumi Co., Ltd. in April 1989. Misumi Co., Ltd. was founded in 1959 and is headquartered in Kagoshima, Japan.",JPY,Industrials,Capital Goods,Machinery,FKA,XFKA,Fukuoka Stock Exchange,Japan,,Kagoshima,,http://kk-misumi.jp,Micro Cap,,,BBG000F2F7B4,BBG000F2F4D9,BBG001S8GCM1,False
7894.F,"Maruto Sangyo Co., Ltd.","Maruto Sangyo Co., Ltd. manufactures and sells laminated films in Japan. The company engages in photogravure printing and bag making; photogravure cylinder making; and sale of paper packaging, packing paper, label stickers, plastic molding products and packing materials, packaging and industrial machinery, agricultural related materials, and horticultural equipment. It also imports and exports packaging materials; designs, constructs, and sells synthetic resin floor materials; installs machinery and appliances; plans, produces, and sells advertising; and provides package design and advertising agency services. Maruto Sangyo Co., Ltd. was founded in 1939 and is headquartered in Fukuoka, Japan.",JPY,Consumer Discretionary,Retailing,Distributors,FKA,XFKA,Fukuoka Stock Exchange,Japan,,Fukuoka City,838-0112,http://www.marutosangyo.co.jp,Nano Cap,,,BBG000C3MDH8,BBG000C3MB64,BBG001S7WD16,False
8398.F,"The Chikuho Bank, Ltd.","The Chikuho Bank, Ltd. provides various banking products and services to individual and corporate customers in Japan. The company offers deposits, certificates of deposits, loans, financing, fund management, and management support services. As of September 30, 2020, it operated 44 branches. The company was founded in 1952 and is headquartered in Kurume, Japan.",JPY,Financials,Banks,Banks,FKA,XFKA,Fukuoka Stock Exchange,Japan,,Kurume,830-0037,http://www.chikugin.co.jp,Micro Cap,,,BBG000BHZGH7,BBG000BHZCR5,BBG001S6CL67,False
8399.F,Bank of The Ryukyus Limited,,JPY,,,,FKA,XFKA,Fukuoka Stock Exchange,Japan,,,,,,,,BBG000BJ4Y06,BBG000BJ4TZ9,BBG001S6C7C1,False
8540.F,"The Fukuoka Chuo Bank, Ltd.","The Fukuoka Chuo Bank, Ltd. provides financial services in Japan. The company's deposit products include time deposits and foreign currency deposits; and loan products comprise education, renovation, housing, auto, and apartment loans, as well as real estate secured loans. It also provides mortgage consultation; financing and management consultation; life insurance and non-life insurance; asset management consultation; loan and business consultation; and foreign exchange services. In addition, the company offers debit cards, IC cash cards, and Internet and mobile banking services. It operates through 41 branches. The company was founded in 1951 and is headquartered in Fukuoka, Japan.",JPY,Financials,Banks,Banks,FKA,XFKA,Fukuoka Stock Exchange,Japan,,Fukuoka,,http://www.fukuokachuo-bank.co.jp,Micro Cap,,,,,,False
8554.F,"The Minami-Nippon Bank,Ltd.","The Minami-Nippon Bank,Ltd. provides various banking products and services to individual and corporate customers in Japan. The company accepts savings, ordinary, time, and reserve time, periodic, and foreign currency deposits; and certificates of deposit. Its loan products include card, free, car, education, and business loans. The company also offers investment trusts and government bonds; life and non-life insurance, and pension products; cash and debit cards; payroll transfer/automatic pension receipt; online fund transfer; and other services, as well as rating agency, fund management, security, and internet and mobile banking services. In addition, it provides leasing; and transport and security services. The company operates 64 branches. The Minami-Nippon Bank,Ltd. was founded in 1913 and is headquartered in Kagoshima, Japan.",JPY,Financials,Banks,Banks,FKA,XFKA,Fukuoka Stock Exchange,Japan,,Kagoshima,,http://nangin.jp,Nano Cap,,,BBG000BJ0CN3,BBG000BJ08Y0,BBG001S6CLR4,False
8559.F,"The Howa Bank, Ltd.","The Howa Bank,Ltd. provides various banking products and services to individuals and businesses in Japan. It offers time deposits, mutual funds, and government bonds; housing, reform, card, education, and auto loans; and personal pension, one-time lifetime, life, medical, and fire insurance products. The Howa Bank,Ltd. was founded in 1948 and is based in Oita, Japan.",JPY,Financials,Banks,Banks,FKA,XFKA,Fukuoka Stock Exchange,Japan,,Oita,,http://www.howabank.co.jp,Nano Cap,,,BBG000BMTNP9,BBG000BMTM62,BBG001S6P835,False
8560.F,"The Miyazaki Taiyo Bank, Ltd.","The Miyazaki Taiyo Bank, Ltd. provides various banking products and services for individual and corporate customers primarily in Japan. The company operates through Banking, and Lease and Guarantee Business segments. It offers deposit, lending, domestic exchange, foreign exchange, and other incidental business services. The company also provides comprehensive leasing and guarantee services, such as personal loans, as well as engages in the venture capital business. It operates through 52 branches. The company was formerly known as K.K. Miyazaki Sogo Ginko and changed its name to The Miyazaki Taiyo Bank, Ltd. in February 1989. The Miyazaki Taiyo Bank, Ltd. was founded in 1941 and is headquartered in Miyazaki, Japan.",JPY,Financials,Banks,Banks,FKA,XFKA,Fukuoka Stock Exchange,Japan,,Miyazaki,,http://www.taiyobank.co.jp,Nano Cap,,,BBG000BMVP53,BBG000BMVL43,BBG001S6PCH1,False
8968.F,Fukuoka REIT Corporation,"Fukuoka REIT Corporation is a Japanese real estate investment trust (REIT) focused on investing in properties located in the Fukuoka region of Japan. They aim to provide stable income and long-term growth to their investors through a diversified portfolio of real estate assets. The REIT is managed by a separate asset management company and is based in Fukuoka, Japan.",JPY,Real Estate,Real Estate,,FKA,XFKA,Fukuoka Stock Exchange,Japan,,,,,,,,BBG000BYLGW8,BBG000BYLCT1,BBG001SJS3M4,False
8996.F,"HouseFreedom Co.,Ltd.","HouseFreedom Co.,Ltd. engages in the construction of newly detached homes in Japan. The company also leases real estate properties, as well as provides real estate brokerage services. In addition, it offers non-life insurance agency services, such as fire and earthquake insurance; and engages in the nursing care and construction contract businesses. The company was founded in 1995 and is headquartered in Matsubara, Japan.",JPY,Real Estate,Real Estate,Real Estate Management & Development,FKA,XFKA,Fukuoka Stock Exchange,Japan,,Matsubara,580-0043,http://www.housefreedom.co.jp,Nano Cap,,,BBG000LSSRP7,BBG000LSSP53,BBG001SQ4MT5,False
9035.F,"Daiichi Koutsu Sangyo Co.,Ltd.","Daiichi Koutsu Sangyo Co.,Ltd. provides passenger transportation services through taxi and bus in Japan. It also engages in the sale and lease of real estate properties, including condominiums, houses, stores, and offices; revitalization of real estate properties; management of condominiums and apartments; operation of auto gas station and hotels; sale of LPG; and provision of car maintenance, visit and home care, nursing care, and elderly housing services. In addition, the company offers real estate backed loans; and radiation shielding products and paints. Further, it is involved in the real estate agency and brokerage, non-life insurance agency, coin parking, golf driving range, mail order, and ship businesses, as well as system and software development, and information communication businesses. Daiichi Koutsu Sangyo Co.,Ltd. was founded in 1960 and is headquartered in Kitakyushu, Japan.",JPY,Industrials,Transportation,Road & Rail,FKA,XFKA,Fukuoka Stock Exchange,Japan,,Kitakyushu,802-8515,http://www.daiichi-koutsu.co.jp,Micro Cap,,,BBG000BKJB61,BBG000BKJ7H8,BBG001SCQ7R7,False
9142.F,Kyushu Railway Company,,JPY,,,,FKA,XFKA,Fukuoka Stock Exchange,Japan,,,,,,JP3247010006,,BBG00DSWBZ91,BBG000CMHF23,BBG001SF85Y6,False
