symbol,name,summary,currency,sector,industry_group,industry,exchange,mic,market,country,state,city,zipcode,website,market_cap,isin,cusip,figi,composite_figi,shareclass_figi,delisted
AALLON.HE,Aallon Group Oyj,"Aallon Group Oyj provides accounting services to companies operating in Finland. It offers day-to-day financial management services from accounting to payroll, in digital and monthly invoicing services; tax advice, legal, employment counseling, and business advisory services; financial management services; and specialized industry solutions to the IT industry, venture capital companies, foundations, construction, and real estate companies. Aallon Group Oyj is based in Helsinki, Finland.",EUR,Industrials,Commercial & Professional Services,Professional Services,HEL,XHEL,NASDAQ OMX Helsinki,Finland,,Helsinki,240,http://aallongroup.fi,Nano Cap,,,,,,False
ACG1V.HE,Aspocomp Group Oyj,"Aspocomp Group Oyj manufactures and sells printed circuit boards (PCBs) in Finland, Europe, and internationally. It offers high density interconnection, multilayer, high speed digital, advanced high density interconnection, and high frequency PCBs, as well as PCBs with component cooling. The company's PCB's are used in various applications in automotive electronics, semiconductor industry, telecommunication infrastructure, and industrial electronics as well as security, and defense and aerospace sectors. It also provides design support, logistics, volume supply, and PCB trading services. Aspocomp Group Oyj was founded in 1999 and is headquartered in Espoo, Finland.",EUR,Information Technology,Technology Hardware & Equipment,"Electronic Equipment, Instruments & Components",HEL,XHEL,NASDAQ OMX Helsinki,Finland,,Espoo,2150,http://aspocomp.com,Nano Cap,,,BBG000C2G147,BBG000C2G0Y6,BBG001SD9FB3,False
ADMCM.HE,Admicom Oyj,"Admicom Oyj engages in the ERP management system development business in Finland. The company offers cloud based business management system solutions; accounting, payroll, and controller services; and training, and customer support services. It serves building engineers, and construction and industrial professionals. The company was founded in 2004 and is based in Jyv√É¬§skyl√É¬§, Finland.",EUR,Information Technology,Software & Services,Software,HEL,XHEL,NASDAQ OMX Helsinki,Finland,,Jyvaskyla,40100,http://www.admicom.fi,Small Cap,,,,,,False
AFAGR.HE,Afarak Group Oyj,"Afarak Group Oyj engages in the production and supply of chrome products worldwide. It operates through two segments, FerroAlloys and Speciality Alloys. The Ferro Alloys segment produces chrome ore, charge chrome, medium carbon ferrochrome, and silicomanganese. The Specialty Alloys segment offers specialized low carbon and ultra low carbon ferrochrome. The company also exports chrome ore. It sells its products in the United States, China, Africa, Finland, and Other European Union countries. The company was formerly known as Ruukki Group Plc and changed its name to Afarak Group Plc in July 2013. Afarak Group Oyj is based in Helsinki, Finland.",EUR,Materials,Materials,Metals & Mining,HEL,XHEL,NASDAQ OMX Helsinki,Finland,,Helsinki,100,http://www.afarak.com,Micro Cap,,,BBG000FZV3X8,BBG000FZV3G7,BBG001S8PLB3,False
AHOLA.HE,Oyj Ahola Transport Abp,"Oyj Ahola Transport Abp provides transport services in the Nordic and Baltic countries, Poland, the Czech Republic, and Slovakia. The company offers road transport, special transport, vehicle transport, and IT and logistics services, as well as other services, such as warehousing and customs. Oyj Ahola Transport Abp was founded in 1955 and is headquartered in Kokkola, Finland.",EUR,Industrials,Transportation,Transportation Infrastructure,HEL,XHEL,NASDAQ OMX Helsinki,Finland,,Kokkola,67701,http://www.aholatransport.com,Nano Cap,,,,,,False
AKTIA.HE,Aktia Pankki Oyj,"Aktia Pankki Oyj provides banking and financing solutions to individuals, corporates, and institutions in Finland. It operates through three segments: Banking Business, Asset Management, and Group Functions. The company offers banking, savings, financing, financial advisory, and investment advice services. It also provides life insurance, disability, and severe illness insurance products, as well as asset management services. The company serves its customers through 14 branch offices, as well as through Internet and telephone services. The company was founded in 1825 and is headquartered in Helsinki, Finland.",EUR,Financials,Banks,Banks,HEL,XHEL,NASDAQ OMX Helsinki,Finland,,Helsinki,100,http://www.aktia.fi,Small Cap,,,,,,False
ALBAV.HE,Alandsbanken Abp,"√É¬Ölandsbanken Abp operates as a commercial bank in Finland and Sweden. Its deposit products include savings accounts, time deposits, cash accounts connected to securities accounts, certificates of deposit, index bonds, and debentures issued to the public. The company provides home mortgage loans, securities account loans, loans for business operations, and loans for other household purposes to private individuals; loans to companies, public sector entities, and household interest organizations; and credit and debit cards, as well as lending and guarantee commissions. It also offers investment services, such as discretionary and advisory asset management, fund management, and securities brokerage products and services, as well as cashier and payment intermediate services, bank safety deposit boxes, etc. In addition, it supplies banking computer systems for small and medium-sized banks. The company operates through 10 offices. √É¬Ölandsbanken Abp was founded in 1919 and is headquartered in Mariehamn, Finland.",EUR,Financials,Banks,Banks,HEL,XHEL,NASDAQ OMX Helsinki,Finland,,Mariehamn,22100,http://www.alandsbanken.fi,Small Cap,,,BBG000BR6NM6,BBG000BR6N64,BBG001SBV2R4,False
ALBBV.HE,Alandsbanken Abp,"√É¬Ölandsbanken Abp operates as a commercial bank in Finland and Sweden. Its deposit products include savings accounts, time deposits, cash accounts connected to securities accounts, certificates of deposit, index bonds, and debentures issued to the public. The company provides home mortgage loans, securities account loans, loans for business operations, and loans for other household purposes to private individuals; loans to companies, public sector entities, and household interest organizations; and credit and debit cards, as well as lending and guarantee commissions. It also offers investment services, such as discretionary and advisory asset management, fund management, and securities brokerage products and services, as well as cashier and payment intermediate services, bank safety deposit boxes, etc. In addition, it supplies banking computer systems for small and medium-sized banks. The company operates through 10 offices. √É¬Ölandsbanken Abp was founded in 1919 and is headquartered in Mariehamn, Finland.",EUR,Financials,Banks,Banks,HEL,XHEL,NASDAQ OMX Helsinki,Finland,,Mariehamn,22100,http://www.alandsbanken.fi,Small Cap,,,BBG000BR6Q58,BBG000BR6PL2,BBG001SBV2S3,False
ALMA.HE,Alma Media Oyj,"Alma Media Oyj, a media company, provides digital and publishing services in Finland and internationally. It operates through four reporting segments: Alma Markets, Alma Talent, Alma News & Life, and Alma Regions. The Alma Markets segment offers recruitment services through the Monster.fi, Jobs.cz, Prace.cz, CV Online, Profesia.sk, MojPosao.net, Monster.hu, Monsterpolska.pl, Monster.cz, and Jobote.com sites; housing-related services through the Etuovi.com, Vuokraovi.com, and Urakkamaailma.fi sites; and automotive services through the Autotalli.com, Autosofta, and Alkali sites. This segment operates Gofinland.fi, a travel portal; Nettikoti, which specializes in software for ERP systems in construction and renovation; and Kivi, a real estate agency system. The Alma Talent segment publishes trade and financial media, and books; provides skills development and growth services to professionals and businesses in various fields, such as event and training, and information services. The Alma News & Life segment offers digital and print news, and lifestyle contents. The Alma Regions segment is involved in the print and online publishing of Aamulehti, Satakunnan Kansa, Lapin Kansa/Pohjolan Sanomat, and various local and town papers, as well as printing and distribution activities. The company was founded in 2005 and is headquartered in Helsinki, Finland.",EUR,Communication Services,Telecommunication Services,Diversified Telecommunication Services,HEL,XHEL,NASDAQ OMX Helsinki,Finland,,Helsinki,100,http://www.almamedia.fi,Small Cap,FI0009013114,,BBG000BRPNR0,BBG000BRPMD7,BBG001SBRL97,False
ALTIA.HE,Altia Oyj,"Altia Oyj produces, imports, markets, distributes, and sells alcoholic beverages in the Nordic and Baltic countries. It offers wines, spirits, and other beverages; and barley starch, grain sprits, technical ethanol, and feed components, as well as provides contract manufacturing services. The company is also involved in sourcing, logistics and warehousing, and bottling and packaging, as well as distilling, maturation, and blending activities. Its customers include alcohol retail monopolies, alcoholic beverage wholesale outlets, restaurants, and grocery stores, as well as travel trade, importers in the export markets, and industrial customers. The company offers its products under the Leijona, Jaloviina, Blossa, Renault, Saaremaa, O.P. Anderson, Explorer, Gr√É¬∂nstedts, Koskenkorva, Chill Out, Larsen, and Xant√É¬© brands, as well as under the partner brands. It exports its products to approximately 30 countries in Europe, Asia, and North America. Altia Oyj was founded in 1888 and is headquartered in Helsinki, Finland.",EUR,Consumer Staples,"Food, Beverage & Tobacco",Beverages,HEL,XHEL,NASDAQ OMX Helsinki,Finland,,Helsinki,180,http://www.altiagroup.com,Small Cap,,,,,,False
AM1.HE,Ahlstrom-Munksjo Oyj,"Ahlstrom-Munksj√É¬∂ Oyj manufactures and sells fiber-based materials, and supplies sustainable solutions worldwide. It operates through five segments: Decor, Filtration and Performance, Industrial Solutions, North America Specialty Solutions, and Specialties. The Decor segment develops and produces paper-based surfacing for wood-based materials, such as laminate flooring, furniture, and interiors. The Filtration and Performance segment develops and produces filtration materials for engine oils, fuels, and air, as well as industrial filtration products. This segment also provides glass fiber for flooring products and wind turbine blades, as well as nonwoven materials for automotive, construction, textile and hygiene, and wall cover material applications. The Industrial Solutions segment offers abrasive backings, electro-technical insulation papers, release liners, and coated specialty papers. This segment also supplies fine art and printing papers, as well as thin papers, specialty pulp, and balancing foil paper. The North America Specialty Solutions segment provides a range of specialized materials that protect and enhance the performance of industrial and consumer applications, such as release liners, tapes, interleaving papers, and specialty paper. The Specialties segment provides materials for food and beverage processing, laboratory filters and life science diagnostics, water filtration, tape products, and medical fabrics. This segment also supplies hot cooking oil and milk filtration materials, and graphics paper for sticky notes and envelopes, as well as metallized labels and flexible packaging papers. It primarily serves food and beverage processing and packaging, transportation, homebuilding, furniture, and health care and life science industries. The company was formerly known as Munksj√É¬∂ Oyj and changed its name to Ahlstrom-Munksj√É¬∂ Oyj in March 2017. Ahlstrom-Munksj√É¬∂ Oyj was founded in 1862 and is headquartered in Helsinki, Finland.",EUR,Materials,Materials,Paper & Forest Products,HEL,XHEL,NASDAQ OMX Helsinki,Finland,,Helsinki,101,http://www.ahlstrom-munksjo.com,Mid Cap,,031162100,,,,False
APETIT.HE,Apetit Oyj,"Apetit Oyj operates as a food company primarily in Finland, Norway, Germany, Sweden, and internationally. It operates through Food Solutions, Oilseed Products, and Grain Trade segments. The company develops, produces, markets, and sells frozen vegetables, foods, and pizzas under the Apetit brand name; vegetable and rapeseed oils, and other oilseed products; and grains, oilseeds, and raw materials for feeds. It also offers burgers and nuggets, frozen pizzas, granites, and arctic peas, as well as fish based ready food products; and manufactures various products for private labels. The company also exports its products. It serves retailers, food service sector, and food and animal feed industries, as well as. the hotel, restaurant, and catering sector. The company was founded in 1930 and is headquartered in Helsinki, Finland.",EUR,Consumer Staples,Food & Staples Retailing,Food & Staples Retailing,HEL,XHEL,NASDAQ OMX Helsinki,Finland,,Helsinki,580,http://apetit.fi,Micro Cap,,,BBG000BTHVC3,BBG000BTHTW6,BBG001SF78X2,False
ASPO.HE,Aspo Oyj,"Aspo Oyj owns and develops corporate brands in Finland, Scandinavia, the Baltic countries, Russia, Ukraine, other CIS countries, and internationally. The company operates through ESL Shipping, Leipurin, Telko, and Kauko segments. The company's ESL Shipping segment handles marine raw material transport and related services for the energy and heavy industries. Its Leipurin segment supplies bakery production lines, baking units, and other machinery and equipment for baking and other food industries. The company's Telko segment supplies plastic raw materials and industrial chemicals the Baltic Sea region. This segment also provides technical support services; and engages in the development of production processes. Its Kauko segment offers customized hardware and software solutions for healthcare, logistics, industry, and authorities. Aspo Oyj was founded in 1929 and is based in Helsinki, Finland.",EUR,Industrials,Capital Goods,Industrial Conglomerates,HEL,XHEL,NASDAQ OMX Helsinki,Finland,,Helsinki,101,http://www.aspo.com,Small Cap,,,BBG000C2LXW0,BBG000C2LX78,BBG001SDB675,False
ATRAV.HE,Atria Oyj,"Atria Oyj, together with its subsidiaries, produces and markets meat and food products in Finland, Sweden, Denmark, Estonia, Russia, and internationally. The company provides fresh and consumer packed meat; poultry products; cooking products, such as sausages; cold cuts and spreads; convenience food, including pizza; animal feed; pet food; and vegetable and delicatessen products. It offers its products under the Atria, Sibylla, 3-Stjernet, L√É¬∂nneberga, Aalbaek, Maks & Moorits, VK, W√É¬µro, Pit-Product, CampoMos, and Casademont brand names. The company also exports its products, including beef, pork, chicken, and turkey products. It markets its products to the grocery trade, food service, and concept customers, as well as the food industry. Atria Oyj was founded in 1903 and is headquartered in Sein√É¬§joki, Finland.",EUR,Consumer Staples,Food & Staples Retailing,Food & Staples Retailing,HEL,XHEL,NASDAQ OMX Helsinki,Finland,,Seinajoki,60060,http://www.atria.fi,Small Cap,,,BBG000BHLW05,BBG000BHLVR8,BBG001S75693,False
AVIDLY.HE,Avidly Oyj,"Avidly Oyj operates as a digital sales and marketing agency in Finland, Germany, Denmark, Norway, Sweden, and internationally. It operates in two segments, Marketing Services and Inbound Marketing. The company operates a HubSpot marketing platform. It also provides inbound strategy and roadmap, Web designing and development, sales enablement, inbound and content marketing, video and conversational marketing, integration, brand creation, communication, marketing automation, and online and social media marketing services. The company was formerly known as Zeeland Family Oyj and changed its name to Avidly Oyj in September 2018. Avidly Oyj is based in Helsinki, Finland.",EUR,Communication Services,Telecommunication Services,Diversified Telecommunication Services,HEL,XHEL,NASDAQ OMX Helsinki,Finland,,Helsinki,510,http://www.avidlyagency.com,Nano Cap,,,,,,False
BAS1V.HE,Basware Oyj,"Basware Oyj provides networked purchase-to-pay solutions, and e-invoicing and financing services in Finland and internationally. It offers analytics, travel and expense management, sourcing, and e-procurement solutions; and solutions for accounts receivable and payable. The company also provides financing services solutions, including Basware Discount, a solution that offers discount for early payment; and Basware Pay, a payment solution. It serves customers in healthcare, energy and utilities, public sector and non-profit, manufacturing, retail and leisure, construction, transport and logistics, finance and insurance, software and telecoms. The company was founded in 1985 and is headquartered in Espoo, Finland.",EUR,Information Technology,Software & Services,Software,HEL,XHEL,NASDAQ OMX Helsinki,Finland,,Espoo,2601,http://www.basware.com,Small Cap,,,,,,False
BEAR-SSABX3-H.HE,BEAR SSABX3 H,,EUR,,,,HEL,XHEL,NASDAQ OMX Helsinki,,,,,,,,,,,,False
BILOT.HE,Bilot Oyj,"Bilot Oyj, a software and IT service company, provides digital services and solutions in Finland. It offers solutions in the areas of customer experience marketing, sales, commerce, and service; and data strategy and governance, data management, business intelligence and advanced analytics, artificial intelligence, and machine learning. The company also provides service design and user experience, business process, integration, and custom solutions. It serves companies in process, manufacturing, wholesale, retail, services, consumer products, and food industries. The company was incorporated in 2005 and is headquartered in Helsinki, Finland.",EUR,Information Technology,Software & Services,Software,HEL,XHEL,NASDAQ OMX Helsinki,Finland,,Helsinki,180,http://bilot.group,Nano Cap,,,,,,False
BIOBV.HE,Biohit Oyj,"Biohit Oyj, a biotechnology company, produces diagnostic tests and analysis systems for use in research institutions and healthcare industries worldwide. The company's diagnostic tests product range includes the GastroPanel test for diagnosing diseases of the stomach and associated risks; Biohit Active B12, a test for measuring the levels of active vitamin B12; Biohit Total, an indicator of vitamin D status; Biohit Calprotectin, a test for measuring human calprotectin; Helicobacter Pylori Quick Test and Helicobacter Pylori UFT300 Quick Test, a test methods to detect H. pylori infection from a biopsy sample during gastroscopy; ColonView Quick Test, a test for detection of fecal occult blood; Lactose Intolerance Quick Test; Celiac Disease Quick Test; and The GA-map Dysbiosis test, a gut microbiota DNA analysis tool. It also provides monoclonal antibodies for use in cellular pathology, neurobiology, oncology, and human gastric biomarkers research. In addition, the company offers acetaldehyde binding products, such as Acetium capsules that are intended for persons with a low-acid or anacidic stomach; and Acetium lozenges, which removes acetaldehyde in smoker's saliva. Further, it provides microplate readers and strip washers, quick test readers, and ThunderBolt, an automated immunoassay analyzer; and products that bind carcinogenic acetaldehyde into harmless compounds, monoclonal antibodies, and service laboratory services. The company was founded in 1988 and is headquartered in Helsinki, Finland.",EUR,Health Care,"Pharmaceuticals, Biotechnology & Life Sciences",Biotechnology,HEL,XHEL,NASDAQ OMX Helsinki,Finland,,Helsinki,880,http://www.biohithealthcare.com,Nano Cap,,,BBG000BXNJ89,BBG000BXNH74,BBG001SCWWV0,False
BITTI.HE,Bittium Oyj,"Bittium Oyj provides solutions for connectivity, tactical communications, and biosignal measuring and monitoring. It offers tactical communications solutions that cover IP networks, radio links, mobile ad-hoc networks, software defined radio based products and systems, waveforms, LTE solutions, and IP-based communication products; and secure communications and connectivity solutions comprising secure smartphones for professionals, certified secure mobile communications, LTE and dual-mode critical communications, customizable mobile platforms for enterprises, secure remote access for care workers, and always-on connectivity for field workers. The company also provides information security solutions for mobile devices and portable computers; and healthcare technology products and services for biosignal measuring in the areas of cardiology, neurology, rehabilitation, occupational health, and sports medicine. In addition, it offers research and development services in the areas of system and architecture, electronics, mechanics, wireless, and software design, as well as testing and verification, digitalization, and certified systems for the automotive, healthcare and medical, IoT, mobile devices, mobile satellite communications, semiconductors, and telecom markets. It operates in Finland, Germany, the United States, Mexico, and Singapore. The company was formerly known as Elektrobit Oyj and changed its name to Bittium Oyj in July 2015. Bittium Oyj was founded in 1985 and is headquartered in Oulu, Finland.",EUR,Information Technology,Technology Hardware & Equipment,Communications Equipment,HEL,XHEL,NASDAQ OMX Helsinki,Finland,,Oulu,90590,http://www.bittium.com,Micro Cap,,,BBG000BSTFH2,BBG000BSTF00,BBG001SB5104,False
BONEH.HE,BBS-Bioactive Bone Substitutes,,EUR,,,,HEL,XHEL,NASDAQ OMX Helsinki,United States,,,,,,,,,,,False
BOREO.HE,Boreo Oyj,"Boreo Oyj imports and sells electronic components and tools to Finland, Russia, and the Baltics. The company offers 3D printing products, antennas and accessories, audio/video products, cables and accessories, converters, KVMs, networking products, PC and car accessories, telecommunication and power products, wall outlets, and AVs. It also provides batteries, chemicals, connectors, cooling products and fans, development kits, electric accessories, LED components, lighting and RF products, mechanical components, passives, relays, semiconductors, sounders, switches, tapes, and literature products. In addition, the company offers baking ovens, cable cutting and strip tools, cleaning and dry storage products, clothing and personal protection products, component counter and lead handling products, crimping dies and machines, dispensers, fume extractors, labels, lamps, microscopes, mounting accessories, PCBs and accessories, packing products, safety and soldering products, ultrasonic cleaners, and weighting products, as well as ESD and protection products. Further, it provides air quality/flow meters, bags and carrying cases, battery testers, cable locators and testers, calipers, clamp and distance meters, component and earth ground testers, electrical and FO testers, endoscopes, frequency counters, function generators, installation and insulation testers, IR windows, lasers, LAN and machine testers, light intensity meters, loggers, multimeters and its related software, oscilloscopes, phase rotation indicators, power quality meters, process calibrators and precision pressure gauges, radiation meters, solar power and sound level meters, power analyzers, surface testers, tachometers, temperature/humidity meters, test leads and probes, thermal cameras and accessories, vibration testers, and visual inspection and other tools. It sells products through stores and catalogues. The company was formerly known as Yleiselektroniikka Oyj. Boreo Oyj was founded in 1969 and is based in Espoo, Finland.",EUR,Industrials,Capital Goods,Electrical Equipment,HEL,XHEL,NASDAQ OMX Helsinki,Finland,,Espoo,2201,http://www.boreo.com,Micro Cap,,,BBG000LXG7P3,BBG000LXG6P5,BBG001SD2247,False
