symbol,name,summary,currency,sector,industry_group,industry,exchange,mic,market,country,state,city,zipcode,website,market_cap,isin,cusip,figi,composite_figi,shareclass_figi,delisted
PON1V.HE,Ponsse Oyj,"Ponsse Oyj, together with its subsidiaries, develops, manufactures, and sells cut-to-length forest machines Northern Europe, Central and Southern Europe, Russia and Asia, and North and South America. Its products include harvesters, forwarders, harvester heads, and dual machines. The company also offers information system products, such as forest machine and wood procurement systems; and simulators. In addition, it provides spare parts; and used machines. Ponsse Oyj was founded in 1970 and is headquartered in Vierem√É¬§, Finland.",EUR,Industrials,Capital Goods,Machinery,HEL,XHEL,NASDAQ OMX Helsinki,Finland,,Vierema,74200,http://www.ponsse.com,Small Cap,FI0009005078,,BBG000HZ94H7,BBG000HZ9450,BBG001S815R7,False
PRIVA.HE,Privanet Group Oyj,"Privanet Group Oyj, an investment services company, specializing in the brokerage of unlisted corporate securities in Finland. The company offers a service to trade in over-the-counter securities; and company reports on its portfolio companies, and news feeds from portfolio companies on its website. Privanet Group Oyj was founded in 2000 and is based in Helsinki, Finland.",EUR,Financials,Diversified Financials,Capital Markets,HEL,XHEL,NASDAQ OMX Helsinki,Finland,,Helsinki,130,http://privanet.fi,Nano Cap,,,,,,False
PUMU.HE,PunaMusta Media Oyj,"PunaMusta Media Oyj publishes newspapers and magazines in Finland. It also offers digital marketing portals, digital display solutions, and advertising and digital printing services; and operates radio stations. In addition, the company engages in securities trading, and real estate rental activities. The company was formerly known as Pohjois-Karjalan Kirjapaino Oyj and changed its name to PunaMusta Media Oyj in April 2019. PunaMusta Media Oyj was founded in 1874 and is based in Joensuu, Finland.",EUR,Communication Services,Telecommunication Services,Diversified Telecommunication Services,HEL,XHEL,NASDAQ OMX Helsinki,Finland,,Joensuu,80140,http://www.punamustamedia.fi,Micro Cap,,,,,,True
QPR1V.HE,QPR Software Oyj,"QPR Software Oyj provides services and software tools for developing business processes and enterprise architecture in Finland, rest of Europe, Russia, Turkey, and internationally. It offers QPR ProcessAnalyzer, a process mining software; QPR EnterpriseArchitect, an enterprise architecture modeling software; and QPR Metrics, a performance management software product that automates strategy execution, operational performance management, people performance management, risk management, and project portfolio management. The company also provides QPR ProcessDesigner, a business process modeling tool to describe, analyze, communicate, and enhance processes; QPR Connectors that connects to various data sources and integrate data; and QPR Cloud, which offers solutions as a service for process mining, enterprise architecture, business process management, performance management, and quality management. In addition, it offers software maintenance and consulting services. The company sells its products through direct sales force, as well as through a network of resellers. QPR Software Oyj was founded in 1991 and is headquartered in Helsinki, Finland.",EUR,Information Technology,Software & Services,Software,HEL,XHEL,NASDAQ OMX Helsinki,Finland,,Helsinki,350,http://www.qpr.com,Nano Cap,,,BBG000CL4C08,BBG000CL4B82,BBG001SG8YY1,False
QTCOM.HE,Qt Group Oyj,"Qt Group Oyj develops, productizes, and licenses software development tools under commercial and open source licenses Finland, Norway, Germany, the United States, Japan, China, South Korea, France, the United Kingdom, and India. It offers Qt Design Studio, a user interface design tool for applications; Qt Creator, a cross-platform integrated development environment for application development; and Qt Framework that contains C++ library classes and APIs to simplify application development. The company also provides professional, consulting, and training services. It offers its services to automotive, industrial automation, consumer electronics, and medical industries. The company is headquartered in Espoo, Finland.",EUR,Information Technology,Software & Services,Software,HEL,XHEL,NASDAQ OMX Helsinki,Finland,,Espoo,2600,http://www.qt.io,Mid Cap,,,BBG00BP1ZKG5,BBG00BP1ZKF6,BBG00BP1ZKD8,False
RAIKV.HE,Raisio plc,"Raisio plc, together with its subsidiaries, produces and sells food and fish feeds primarily in Finland, the United Kingdom, Poland, Ireland, and Belgium. The company operates through three segments: Healthy Food, Healthy Ingredients, and Other Operations. The company engages in the production, procurement, and supply of grain-based foods and their ingredients for industrial and catering companies, as well as fish feed under the Benecol, Elovena, Sunnuntai, Nalle, Torino, Provena, Nordic, Benella, Hercules, Baltic Blend, and Raisio Oats brands. It is also involved in the rental and royalty activities. The company was formerly known as Raisio Group plc and changed its name to Raisio plc in 2005. Raisio plc was founded in 1939 and is headquartered in Raisio, Finland.",EUR,Consumer Staples,Food & Staples Retailing,Food & Staples Retailing,HEL,XHEL,NASDAQ OMX Helsinki,Finland,,Raisio,21201,http://www.raisio.com,Small Cap,,,,,,False
RAIVV.HE,Raisio plc,"Raisio plc, together with its subsidiaries, produces and sells food and fish feeds primarily in Finland, the United Kingdom, Poland, Ireland, and Belgium. The company operates through three segments: Healthy Food, Healthy Ingredients, and Other Operations. The company engages in the production, procurement, and supply of grain-based foods and their ingredients for industrial and catering companies, as well as fish feed under the Benecol, Elovena, Sunnuntai, Nalle, Torino, Provena, Nordic, Benella, Hercules, Baltic Blend, and Raisio Oats brands. It is also involved in the rental and royalty activities. The company was formerly known as Raisio Group plc and changed its name to Raisio plc in 2005. Raisio plc was founded in 1939 and is headquartered in Raisio, Finland.",EUR,Consumer Staples,Food & Staples Retailing,Food & Staples Retailing,HEL,XHEL,NASDAQ OMX Helsinki,Finland,,Raisio,21201,http://www.raisio.com,Small Cap,,,,,,False
RAP1V.HE,Rapala VMC Corporation,"Rapala VMC Corporation, together with its subsidiaries, engages in manufacturing, sourcing, and distributing fishing tackle products in North America, Nordic countries, rest of Europe, and internationally. It operates through two segments, Group Products and Third Party Products. The company offers products used in lures for hard baits, and also for fishing accessories, clothing, luggage, and eyewear; metal lures specifically designed for salmon and trout fishing, and trolling in fresh and salt water; braided and monofilament lines, and specialized leader lines; hooks used for sport fishing and commercial hooks, and terminal tackles; hard baits, hybrids and rigged, and unrigged soft baits; specialized trolling lures and metal jigs for saltwater big game fishing; baits for carp, match, and coarse fishing; and knives for filleting, outdoor, hunting, and kitchen use, as well as ice augers and auger blades, and cross country skis. Its brand portfolio includes Rapala and other international brands, such as Luhr-Jensen, VMC, Sufix, Storm, Blue Fox, Luhr Jensen, Williamson, Dynamite Baits, Mora Ice, StrikeMaster, Carp Spirit, Marttiini, and Peltonen. Rapala VMC Corporation was founded in 1936 and is based in Helsinki, Finland.",EUR,Industrials,Capital Goods,Building Products,HEL,XHEL,NASDAQ OMX Helsinki,Finland,,Helsinki,610,http://www.rapalavmc.com,Small Cap,,,BBG000CJS9B2,BBG000CJS8Z8,BBG001SC75L8,False
RAUTE.HE,Raute Oyj,"Raute Oyj, a technology and service company, provides machinery and equipment for production process in the wood products industry in Europe, Russia, North America, and Chile. The company supplies a range of machinery, systems, and technology for the production of plywood and veneer, such as log handling, peeling, drying, veneer handling, plywood layup and pressing, panel handling, and automation and control; and visual, moisture, and density analyzers. It also offers project deliveries, including complete production plants, production lines, and individual machines and equipment, as well as automation, machine vision applications, and measuring technology; and technology services comprising maintenance and spare part, modernization, and consulting and business development services. The company was founded in 1908 and is headquartered in Nastola, Finland.",EUR,Industrials,Capital Goods,Machinery,HEL,XHEL,NASDAQ OMX Helsinki,Finland,,Nastola,15551,http://www.raute.com,Micro Cap,,,,,,False
REG1V.HE,Revenio Group Oyj,"Revenio Group Oyj, a health technology company, designs, manufactures, and sells medical instruments for the early detection of glaucoma, diabetic retinopathy, and macular degeneration in Finland, Italy, rest of Europe, the United States, and internationally. The company offers ic100 and ic200 tonometers; Icare HOME, a device for self-measurement of eye pressure; Icare TONOVET Plus tonometers for animals; fundus imaging devices comprising EIDON, DRS, and DRSplus; MAIA, a microperimeter to measure the effectiveness of drugs for retinal disease treatment; COMPASS, which provides fundus perimetry with true-color confocal retinal images; and Ventica, to examine the variability in tidal breathing in children. It is also developing Cutica, a hyperspectral camera for dermatologists to detect skin cancers. Revenio Group Oyj is based in Vantaa, Finland.",EUR,Health Care,Health Care Equipment & Services,Health Care Technology,HEL,XHEL,NASDAQ OMX Helsinki,Finland,,Vantaa,1510,http://www.reveniogroup.fi,Small Cap,FI0009010912,,BBG000CLNN58,BBG000CLNMS5,BBG001SG9G79,False
REKA.HE,Reka Industrial Oyj,"Reka Industrial Oyj manufactures and sells cables in Finland, Sweden, Denmark, Norway, the Baltic countries, and Russia. It offers instrumentation cables, fire-resistant cables, medium and high voltage cables, halogen-free cables, network power cables, and standard cables under the FlameRex, DryRex, LiteRex, PoweRex, and Reka brands. The company serves construction, power distribution, and equipment manufacturers. The company was formerly known as Neo Industrial Plc and changed its name to Reka Industrial Oyj in December 2020. Reka Industrial Oyj is based in Hyvink√É¬§√É¬§, Finland. Reka Industrial Oyj is a subsidiary of Reka Ltd.",EUR,Industrials,Capital Goods,Electrical Equipment,HEL,XHEL,NASDAQ OMX Helsinki,Finland,,Hyvinkaa,5800,http://www.rekaindustrial.fi,Nano Cap,,,BBG000K1JD32,BBG000K1JBZ1,BBG001SC6BK7,False
RELAIS.HE,Relais Group Oyj,"Relais Group Oyj imports and wholesales vehicle electrical equipment and spare parts in the Nordic and Baltic countries. The company offers electrical equipment and spare parts for cars and commercial vehicles under the Startax brand name; batteries, warning lights, and lighting and camera systems for vehicles, boats, and industrial applications under the Awimex brand name; spare parts for passenger cars and light commercial vehicles under the ABR brand name; and spare parts, components, and accessories for busses, trucks, trailers, and construction machinery under the Huzells brand name. It also provides auxiliary and working lights, power management systems, and automotive camera systems for light commercial vehicles under the SEC name; and spare parts and equipment for heavy duty vehicles under the TD Tunga Delar name. The company was founded in 1996 and is based in Vantaa, Finland.",EUR,Consumer Discretionary,Automobiles & Components,Auto Components,HEL,XHEL,NASDAQ OMX Helsinki,Finland,,Vantaa,1530,http://www.relais.fi,Small Cap,,,,,,False
REMEDY.HE,Remedy Entertainment Oyj,"Remedy Entertainment Oyj develops and sells console and computer games in Finland and internationally. It primarily creates cinematic action games. The company was incorporated in 1995 and is based in Espoo, Finland.",EUR,Communication Services,Media & Entertainment,Interactive Media & Services,HEL,XHEL,NASDAQ OMX Helsinki,Finland,,Espoo,2200,http://www.remedygames.com,Small Cap,FI4000251897,,BBG00GPW2ZW1,BBG005J6BZ31,BBG005J6BZ40,False
ROBIT.HE,Robit Oyj,"Robit Oyj manufactures and sells drilling consumables for applications in mining, quarrying, construction, and well drilling industries. The company offers top hammer drill strings for underground drifting, bolting, and long hole drilling; DTH hammers, bits, tubes, and rotary heads for surface mining; DTH hammers and bits, and locked casing systems for tough ground conditions; top hammer bench and underground drilling tools; and top hammer drill strings for face drilling and forepoling, as well as for bolting and roof support. It also provides reverse circulation products; and digital technologies comprising the unique drill hole measurement technology under the Robit Sense Systems brand. The company operates in Europe, the Middle East, Africa, Americas, Asia, Australasia, and internationally. Robit Oyj was founded in 1985 and is headquartered in Lemp√É¬§√É¬§l√É¬§, Finland.",EUR,Energy,Energy,Energy Equipment & Services,HEL,XHEL,NASDAQ OMX Helsinki,Finland,,Lempaala,33880,http://www.robitgroup.com,Micro Cap,,,BBG008MWW9B0,BBG001BC4GW3,BBG001TKWJW9,False
ROVIO.HE,Rovio Entertainment Oyj,"Rovio Entertainment Oyj, a games-first entertainment company, creates, develops, and publishes mobile games in North America, Latin America, Europe, the Middle East, Africa, and the Asia Pacific. It operates through Games, Brand Licensing, and Other segments. The company offers various mobile games through mobile application stores; produces movies; and licenses the Angry Birds brand to consumer and entertainment products, as well as develops a cloud-based game service. It also provides physical merchandise, including toys and apparel, as well as location-based entertainment, such as activity parks; and books and comics, animated series, and digital products. Rovio Entertainment Oyj was founded in 2003 and is headquartered in Espoo, Finland.",EUR,Communication Services,Media & Entertainment,Interactive Media & Services,HEL,XHEL,NASDAQ OMX Helsinki,Finland,,Espoo,2150,http://www.rovio.com,Small Cap,,,BBG00HMNRNB5,BBG001KNLKL3,BBG001V0QKZ1,False
RUSH.HE,Rush Factory Oyj,"Rush Factory Oyj develops and conducts consumer-oriented sports and adventure events in Europe. The company is based in Rauma, Finland.",EUR,Industrials,Commercial & Professional Services,Professional Services,HEL,XHEL,NASDAQ OMX Helsinki,Finland,,Rauma,26100,http://rushfactory.fi,Nano Cap,,,,,,True
SAA1V.HE,Sanoma Oyj,"Sanoma Oyj operates as a media and learning company in Finland, the Netherlands, other European countries, and internationally. It operates in two segments, Sanoma Learning and Sanoma Media Finland. The Sanoma Learning segment offers printed and digital learning materials, as well as digital learning and teaching platforms for primary, secondary, and vocational education. This segment serves approximately 20 million students in 11 countries. The Sanoma Media Finland segment provides information, experiences, inspiration, and entertainment services through various media platforms, such as newspapers, TV, radio, events, magazines, and online and mobile channels. This segment offers its products under the Helsingin Sanomat, Ilta-Sanomat, Aamulehti, Me Naiset, Aku Ankka, Nelonen, Ruutu, Supla, and Radio Suomipop brand names. It offers festivals and events, marketing, event marketing, custom publishing, books, and printing services. The company was founded in 1889 and is based in Helsinki, Finland.",EUR,Communication Services,Telecommunication Services,Diversified Telecommunication Services,HEL,XHEL,NASDAQ OMX Helsinki,Finland,,Helsinki,100,http://www.sanoma.com,Mid Cap,FI0009007694,,BBG000BVB4G0,BBG000BVB443,BBG001SCQHN9,False
SAGCV.HE,Saga Furs Oyj,"Saga Furs Oyj operates as a full service auction house in the fur and fashion industries in Finland. The company offers mink, fox, finnraccoon, karakul, and other furs under the Saga Furs brand name. It serves fur breeders and suppliers, clothing manufacturers, and fashion houses. The company was formerly known as Turkistuottajat Oyj and changed its name to Saga Furs Oyj in October 2011. Saga Furs Oyj was founded in 1938 and is based in Vantaa, Finland.",EUR,Consumer Discretionary,Consumer Durables & Apparel,"Textiles, Apparel & Luxury Goods",HEL,XHEL,NASDAQ OMX Helsinki,Finland,,Vantaa,,http://www.sagafurs.com,Micro Cap,,,BBG000LXH9Z7,BBG000LXG880,BBG001SF7915,False
SAMPO.HE,Sampo Oyj,"Sampo Oyj, through its subsidiaries, provides life and non-life insurance products and services in Finland, Sweden, Norway, Denmark, and the Baltic countries. It operates through If, Topdanmark, Mandatum, and Holding segments. The company offers household, homeowner, motor, accident, travel, boat, forest, livestock, property, casualty, liability, casualty, and cargo insurance. It also provides life, individual and group pension, home and content, illness, animal, electronics, change of ownership, workers' compensation, marine, aviation, and transport insurance, as well as wealth management services. Sampo Oyj was founded in 1909 and is based in Helsinki, Finland.",EUR,Financials,Insurance,Insurance,HEL,XHEL,NASDAQ OMX Helsinki,Finland,,Helsinki,100,http://www.sampo.com,Large Cap,,,BBG000BRP3P6,BBG000BRP3G6,BBG001S7XYB8,False
SAVOH.HE,Savosolar Oyj,"Savosolar Oyj, together with its subsidiaries, designs and supplies solar thermal systems primarily in Europe. The company produces flat plate collectors, collector fields, and turnkey solar thermal systems. Its products are used in district heating, industrial process heating, and hot water and space heating applications. The company was founded in 2009 and is based in Mikkeli, Finland.",EUR,Information Technology,Technology Hardware & Equipment,"Technology Hardware, Storage & Peripherals",HEL,XHEL,NASDAQ OMX Helsinki,Finland,,Mikkeli,50150,http://savosolar.com/fi,Nano Cap,FI4000425848,,,,,False
SCANFL.HE,Scanfil Oyj,"Scanfil Oyj operates as a contract manufacturer and system supplier for the electronics industry worldwide. The company provides product design, product manufacturing, material procurement and logistics solutions, as well as after-sales services, such as maintenance and spare parts services. It also offers video surveillance systems and equipment, communications network devices, audio communications products, health technology devices and systems, electricity and automation system modules, renewable energy production converters and inverters, frequency converters, elevator and forklift control systems, analyzers, lift control systems, analyzers, various slot and vending machines, defense industry devices, and meteorological instruments. The company serves customers in communication, consumer applications, energy and automation, industrial, and medtech and life science, as well as companies operating in fields related to urbanization. The company was founded in 1976 and is headquartered in Sievi, Finland.",EUR,Information Technology,Technology Hardware & Equipment,"Electronic Equipment, Instruments & Components",HEL,XHEL,NASDAQ OMX Helsinki,Finland,,Sievi,85410,http://www.scanfil.com,Small Cap,FI4000029905,,BBG001ZQNBV7,BBG001ZQNBT0,BBG001ZQNBX5,False
SIEVI.HE,Sievi Capital Plc,"Sievi Capital Plc is a principal investment firm specializing in capital investments in small and medium-sized enterprises, in turnover and net result in the medium term and long term. The firm focuses on industrial companies, either listed or unlisted. It primarily invests in investments in Denmark, Finland, Iceland, Norway, and Sweden. It seeks to acquire a significant holding and seeks a board seat on its investee companies. The firm also makes financial investments in shares, ETF instruments, structured products, corporate bonds, and other fixed-income investments. It seeks to have majority stakes. For financial investments, it holds its investments for less than three years. It seeks to make balance sheet investments. The firm was formerly known as Scanfil plc and changed its name to Sievi Capital Oyj in 2011. Sievi Capital Plc is based in Helsinki, Finland.",EUR,Financials,Diversified Financials,Capital Markets,HEL,XHEL,NASDAQ OMX Helsinki,Finland,,Helsinki,100,http://www.sievicapital.fi/en/,Micro Cap,,,,,,True
SIILI.HE,Siili Solutions Oyj,"Siili Solutions Oyj engages in the software integration and digital service businesses in Finland and internationally. The company offers strategy and consulting, experience design, engineering, data and intelligence, automation, and managed services. It also provides customized design and development services for the full lifecycle of digital services. The company was founded in 2005 and is based in Helsinki, Finland.",EUR,Information Technology,Software & Services,IT Services,HEL,XHEL,NASDAQ OMX Helsinki,Finland,,Helsinki,180,http://www.siili.com,Micro Cap,,,BBG003H0BKC4,BBG003G2LJ97,BBG003G2LJB4,False
SITOWS.HE,Sitowise Group Oyj,"Sitowise Group Oyj offers design, engineering, and project management services to the construction and renovation projects primarily in Finland and Sweden. The company provides also provides planning, design, and engineering services to the infrastructure projects, as well as services related to digital solutions to built environment. It serves private and public sectors. The company was incorporated in 2016 and is based in Espoo, Finland.",EUR,Industrials,Capital Goods,Construction & Engineering,HEL,XHEL,NASDAQ OMX Helsinki,Finland,,Espoo,2600,http://www.sitowise.com,Small Cap,,,BBG00ZN60JS1,BBG00ZMDSRS9,BBG00ZMDSRT8,False
SOLTEQ.HE,Solteq Oyj,"Solteq Oyj, an IT service and software company, provides digital business solutions and industry-specific software in Finland, Sweden, Norway, Denmark, Poland, and the United Kingdom. The company offers Solteq Cloud POS, a point-of sale (POS) solution for cafeteria, lunch restaurants, events, and self-service needs; Solteq Tekso, a cash register system for fashion and hardware shops, other specialty shops, and grocery retail; and Solteq Order Engine that is tailored to individual customer needs. It also provides Solteq Robotics for customized packages and continuous service; and Solteq Retail Robot, which moves inside a store to recognize products, empty or hole shelves, and incorrect price tags, as well as builds 3D maps of stores with product locations and integrates to the POS, PIM, planogram, and ERP systems. In addition, the company offers inPulse4Utilities that provides tools for digital customer engagement for district heating, water supply, and energy companies; inWorks, which offers browser-based customer data management and invoicing systems; and Solteq Smart Dealer, which offers automotive and aftermarket products. Further, it provides Solteq WebService, a cloud-based ERP system for vehicle maintenance and after-sales services; Trafi √Ç¬ñquery, a search portal for accessing up-to-date vehicle and customer information from the Trafi ATJ database; Customer Data Refreshment, which offers up to date customer data; Solteq Care, an electronic journal system, for municipality health care; and Solteq Tooth, a dental system for handling records and patient-oriented administrative tasks. The company was formerly known as Tampereen Tiedonhallinta. Solteq Oyj was founded in 1982 and is headquartered in Vantaa, Finland.",EUR,Information Technology,Software & Services,Software,HEL,XHEL,NASDAQ OMX Helsinki,Finland,,Vantaa,1530,http://www.solteq.com,Micro Cap,,,BBG000D80VY1,BBG000D80VB6,BBG001SDWXT9,False
SOPRA.HE,Soprano Oyj,"Soprano Oyj, together with its subsidiaries, operates as a service business development company in the Nordic region. It offers management, communication, and ICT training services. The company is headquartered in Helsinki, Finland.",EUR,Information Technology,Software & Services,Software,HEL,XHEL,NASDAQ OMX Helsinki,Finland,,Helsinki,130,http://www.soprano.fi,Nano Cap,,,,,,False
SOSI1.HE,Sotkamo Silver AB,"Sotkamo Silver AB, together with its subsidiaries, explores for and develops mineral deposits in the Nordic region. The company primarily explores for silver, gold, lead, and zinc deposits. Its primary project is the Silver Mine project located in the municipality of Sotkamo in Finland. The company is based in Stockholm, Sweden.",EUR,Materials,Materials,Metals & Mining,HEL,XHEL,NASDAQ OMX Helsinki,Sweden,,Stockholm,102 45,http://www.silver.fi,Micro Cap,,,BBG003569DH8,BBG003569DG9,BBG001SK7QF1,False
