symbol,name,summary,currency,sector,industry_group,industry,exchange,mic,market,country,state,city,zipcode,website,market_cap,isin,cusip,figi,composite_figi,shareclass_figi,delisted
ABETNC.JO,FNB ETN on ACTIVIC NOV25,,ZAC,Financials,Diversified Financials,,JNB,XJSE,Johannesburg Stock Exchange,,,,,,,,,,,,False
ABETNQ.JO,FNB ETN on ACTIVIQ NOV25,,ZAC,Financials,Diversified Financials,,JNB,XJSE,Johannesburg Stock Exchange,,,,,,,,,BBG00YCJHDW8,BBG00YCJHDV9,BBG00YCJHDY6,False
ABG.JO,Absa Group Limited,"Absa Group Limited, together with its subsidiaries, provides various financial products and services in South Africa and internationally. It offers personal and business banking, corporate and investment banking, wealth and investment management, and insurance services. The company offers retail and business banking products and services to individual, enterprise, and commercial customers, including residential property-related finance solutions; vehicle and asset finance products and services; credit cards; personal loans; short-term insurance products; and transactional banking, savings, and investment products and services. It also provides commercial property finance, term loans, and overdraft services; notice, fixed, cheque account, savings and transmission, foreign currency, and call deposits; and electronic banking services. In addition, the company offers investment banking services; private equity and infrastructure investments; corporate banking products and services; and wealth management services. Further, it provides life insurance products covering death, disability and retrenchment, funeral, and life investment products; investments, such as asset management, multi-management, unit trusts, and linked investment products; treasury services; and fiduciary and financial advisory services. Additionally, the company offers market services; trade and working capital solutions; and cash management, payment, and liquidity products and solutions. The company was formerly known as Barclays Africa Group Limited and changed its name to Absa Group Limited in May 2018. Absa Group Limited was incorporated in 1986 and is based in Johannesburg, South Africa.",ZAC,Financials,Banks,Banks,JNB,XJSE,Johannesburg Stock Exchange,South Africa,,Johannesburg,2001,http://www.absa.africa,Mid Cap,,,BBG000BF9DG8,BBG000BF9C25,BBG001S7JF34,False
ABSGEA.JO,Absa Global Equity Multi-Factor Risk-Controlled (13%) ETN,Absa Global Equity Multi-Factor Risk-Controlled (13%) ETN is an Exchange Traded Note. It provides exposure to global equities while employing a multi-factor risk-controlled strategy. The ETN is listed on the Johannesburg Stock Exchange (JSE).,ZAC,Financials,Diversified Financials,,JNB,XJSE,Johannesburg Stock Exchange,,,,,,,,,,,,False
ABSP.JO,Absa Bank Limited,"Absa Bank Limited, together with its subsidiaries, provides various banking products and services in South Africa, Nigeria, and Namibia. The company accepts cheque, youth, transactional, and business accounts. Its loan products include personal, home, car, study, structured, short, and medium term, and trade and working capital finance; vehicle and asset, property, and debt finance; and overdraft and revolving products. The company also offers credit and debit cards; savings and investment products; business insurance products; and youth and student, Islamic and international banking, investment management, retirement planning, trust and will, and foreign exchange services. In addition, it provides corporate banking solutions; exchange traded products; market services; trade and working capital solutions; and cash management, payment, and liquidity products and solutions. The company was founded in 1991 and is headquartered in Johannesburg, South Africa. Absa Bank Limited is a subsidiary of Absa Group Limited.",ZAC,Financials,Banks,Banks,JNB,XJSE,Johannesburg Stock Exchange,South Africa,,Johannesburg,2001,http://www.absa.co.za,,,,,,,False
ACL.JO,ArcelorMittal,"ArcelorMittal, together with its subsidiaries, owns and operates steel manufacturing and mining facilities in Europe, North and South America, Asia, and Africa. The company's principal steel products include semi-finished flat products, such as slabs; finished flat products comprising plates, hot- and cold-rolled coils and sheets, hot-dipped and electro-galvanized coils and sheets, tinplate, and color coated coils and sheets; semi-finished long products, such as blooms and billets; finished long products, including bars, wire-rods, structural sections, rails, sheet piles, and wire-products; and seamless and welded pipes and tubes. Its principal mining products comprise iron ore lumps, fines, concentrates, pellets, and sinter feeds; and coking and thermal coal, and pulverized coal injections. The company sells its products to various customers in the automotive, appliance, engineering, construction, energy, and machinery industries through a centralized marketing organization, as well as distributors. It has iron ore mining activities in Brazil, Bosnia, Canada, Kazakhstan, Liberia, Mexico, and Ukraine; and coal mining activities in Kazakhstan. The company was founded in 1976 and is headquartered in Luxembourg City, Luxembourg.",ZAC,Materials,Materials,Metals & Mining,JNB,XJSE,Johannesburg Stock Exchange,Luxembourg,,Luxembourg City,1160,http://corporate.arcelormittal.com,Large Cap,,,BBG000BFHG27,BBG000BFHF10,BBG001S6KB97,False
ACS.JO,Acsion Limited,"Acsion Limited engages in property holding and development activities in South Africa. Its investment portfolio includes nine retail properties, including two regional shopping centers. The company develops regional shopping centers, community centers, convenience centers, neighborhood centers, and residential development projects, as well as industrial/commercial properties. Acsion Limited was incorporated in 2014 and is based in Centurion, South Africa.",ZAC,Real Estate,Real Estate,Real Estate Management & Development,JNB,XJSE,Johannesburg Stock Exchange,South Africa,,Centurion,157,http://www.acsionsa.co.za,,,,BBG007LW6JM8,BBG007LW6JK0,BBG007LW6JL9,False
ACT.JO,AfroCentric Investment Corporation Limited,"AfroCentric Investment Corporation Limited, an investment holding company, provides health administration and health risk management solutions to the healthcare sector. The company operates through Healthcare SA, Healthcare Retail, Healthcare Africa, and Information Technology segments. It offers documentation based care equipment and administration services to 12 musculoskeletal treatment centers; and engages in the retail and wholesale of pharmaceutical products under the Pharmacy Direct, MMed, Scriptpharm Risk Management, Curasana Wholesaler, and Activo Health names. The company also provides a platform that allows integration between healthcare stakeholders, such as medical aids, insurance companies, and healthcare providers. It operates in South Africa, Botswana, Mauritius, Namibia, Eswatini, and Zimbabwe. AfroCentric Investment Corporation Limited was founded in 2008 and is based in Roodepoort, South Africa.",ZAC,Health Care,Health Care Equipment & Services,Health Care Equipment & Supplies,JNB,XJSE,Johannesburg Stock Exchange,South Africa,,Roodepoort,1709,http://www.afrocentric.za.com,,,,,,,False
ADETNC.JO,FNB ETN on ADOBEC NOV25,,ZAC,,,,JNB,XJSE,Johannesburg Stock Exchange,,,,,,,,,BBG00YCJFY72,BBG00YCJFY63,BBG00YCJFYB7,False
ADETNQ.JO,FNB ETN on ADOBEQ NOV25,,ZAC,,,,JNB,XJSE,Johannesburg Stock Exchange,,,,,,,,,BBG00YCJHLN0,BBG00YCJHLM1,BBG00YCJHLQ7,False
ADH.JO,ADvTECH Limited,"ADvTECH Limited provides education, training, and staff placement services in South Africa and other African countries. It operates through three divisions: Schools, Tertiary, and Resourcing. The Schools division provides pre-primary, primary, and secondary education services. The Tertiary division offers education in diploma, degree, and postgraduate levels through face-to-face, online, and distance learning. The Resourcing division provides placement solutions in the areas of IT, finance, and engineering. The company was founded in 1978 and is based in Sandton, South Africa.",ZAC,Consumer Staples,Household & Personal Products,Household Products,JNB,XJSE,Johannesburg Stock Exchange,South Africa,,Sandton,2196,http://www.advtech.co.za,,,,BBG000C9N518,BBG000C9N4T1,BBG001SF8B82,False
ADI.JO,Adapt IT Holdings Limited,"Adapt IT Holdings Limited provides information and communications technology services in South Africa and internationally. Its Education segment provides enterprise resource planning solutions for use in educational institutions; and ITS integrator support, automated exam and class timetabling, training and consulting, and learning relationship management system services, as well as implementation, customization, development, and integration services. The company's Manufacturing segment offers integrated workforce management system solutions for the manufacturing, agri-processing, security resource, and utilities sectors; and business advisory, software development, implementation, systems integration, sustainability reporting, and ERP support services. Its Financial Services segment provides software solutions that automate financial statement and assurance engagements, streamline tax management processes, and enable simplified time and billing management; and software implementation services. The company's Energy segment designs, implements, and supports SAP and supply chain solutions within the oil and gas sector. Its Communications segment offers telecommunications solutions; and services, such as software as a service, APN-as-a-service, analytics-as-a-service, telecommunication and technology expense management, customer experience and self-service advisory, enterprise data services and connectivity, and enterprise performance management. The company's Hospitality segment provides integrated software and hardware solutions to the hospitality industries; and consulting, project management, implementation, hosting and database, application, and support services. The company is headquartered in Johannesburg, South Africa.",ZAC,Industrials,Capital Goods,Industrial Conglomerates,JNB,XJSE,Johannesburg Stock Exchange,South Africa,,Johannesburg,1687,http://www.adaptit.com,,,032654105,,,,False
ADR.JO,Adcorp Holdings Limited,"Adcorp Holdings Limited provides workplace solutions in South Africa and Australia. It operates through Industrial Services, Support Services, Professional Services, Financial Services, and Training Services segments. The company offers permanent recruitment and flexible staffing, professional IT, business process outsourcing, training, and financial services; and agency agreement, shared, managed, emergent business, payroll card, and project management products and services. Adcorp Holdings Limited was founded in 1968 and is headquartered in Johannesburg, South Africa.",ZAC,Industrials,Commercial & Professional Services,Professional Services,JNB,XJSE,Johannesburg Stock Exchange,South Africa,,Johannesburg,2191,http://www.adcorpgroup.com,,,,BBG000BF8X66,BBG000BF8WZ6,BBG001S7JDH4,False
ADW.JO,African Dawn Capital Limited,"African Dawn Capital Limited, a micro finance company, provides various financial products in South Africa. It operates through Investment Advisory and Investment Management, and Micro Finance segments. The company offers micro finance, debtor discounting, and structured property finance services. It also provides investment advisory and management, and online consulting services to entrepreneurial and other companies through its YueDiligence online platform. African Dawn Capital Limited was founded in 1998 and is headquartered in Johannesburg, South Africa.",ZAC,Financials,Diversified Financials,Consumer Finance,JNB,XJSE,Johannesburg Stock Exchange,South Africa,,Johannesburg,1724,http://www.afdawn.co.za,,,,BBG000BJ0WN9,BBG000BJ0W22,BBG001S7SZN8,False
AEE.JO,African Equity Empowerment Investments Limited,"African Equity Empowerment Investments Limited formerly known as Sekunjalo Investments Limited is a private equity firm specializing in acquisitions, PIPEs, and buyouts. It seeks to invest in companies operating in the food, fishing & brands, marine, biotherapeutics , healthcare & beauty, pharmaceuticals, information technology, telecommunication, Mobile solutions, solar energy, financial services, aquaculture, biotechnology, enterprise development, tourism, events management including entertainment, and travel sectors. The firm prefers to invest companies based in South Africa and outside South Africa in Asia, Dubai, Saudi Arabia, Spain, the UK, the USA, Ghana, Uganda, Zambia, Cameroon, Tanzania, Nigeria, Namibia, Kenya, Zimbabwe, Botswana, Ethiopia, Lesotho, Eswatini (previously Swaziland), Malawi, Mauritius, CÃ´te d'Ivoire, France, Belgium, and Canada. It is open to acquiring non-controlling and majority stakes. The firm invests using its balance sheet and personal capital. African Equity Empowerment Investments Limited was founded in May 1996 and is based in Cape Town, South Africa.",ZAC,Information Technology,Software & Services,IT Services,JNB,XJSE,Johannesburg Stock Exchange,South Africa,,Cape Town,8001,http://aeei.co.za,,,,,,,False
AEG.JO,Aveng Limited,"Aveng Limited, together with its subsidiaries, engages in the construction and engineering, and mining businesses worldwide. The company operates as an engineering, construction, building, and maintenance contractor for the building, infrastructure, and resource markets focusing on tunnel and pipeline, railway infrastructure, marine and mechanical, industrial building, oil and gas, and mining and mineral projects. It also provides open cut and underground mining services. Aveng Limited is based in Johannesburg, South Africa.",ZAC,Industrials,Capital Goods,Construction & Engineering,JNB,XJSE,Johannesburg Stock Exchange,South Africa,,Johannesburg,2076,http://aveng.co.za,Micro Cap,,,BBG000BVS3X5,BBG000BVS3L8,BBG001SCF2L6,False
AEGN.JO,Aveng Group Limited NPL,"Aveng Group Limited NPL is a South African-based infrastructure and construction group. The company operates in various sectors, including infrastructure, mining, and manufacturing. It is currently under business rescue proceedings.",ZAC,Industrials,Capital Goods,,JNB,XJSE,Johannesburg Stock Exchange,Netherlands,,,,,,,,,,,False
AEL.JO,Allied Electronics Corporation Limited,"Allied Electronics Corporation Limited, through its subsidiaries, provides ICT solutions in South Africa and internationally. It operates through Managed Services, Digital Transformation, Smart IoT, Healthech/Fintech, and Others segments. The Managed Services segment offers hardware and consumables to manage outsource print services, such as installation and training; supplies paper and toner; maintains and services equipment and service contracts; supports and maintains enterprise-wide information products and services; talent management services; and outsourcing services for contact centers and extended capabilities. The Digital Transformation segment provides turnkey solutions for communications and information needs; networking, hardware, software, storage, software integration, SAP and management consulting, Microsoft certified solution, data warehousing, CRM, and support services; information security and risk management, and IT infrastructure solutions; systems integration; and designs, develops, and implements specialised solutions. The Smart IoT segment offers vehicle tracking and recovery systems, fleet management services, and usage-based telematics. The Healthech/Fintech segment provides managed electronic payment solutions, including mobile or online platforms, e-wallet, and medical transaction switching. The Others segment distributes industrial electronic components, such as batteries and solar products; lighting and optics; software and compilers; and semiconductor and aerospace products. Allied Electronics Corporation Limited was founded in 1965 and is headquartered in Parktown, South Africa.",ZAC,Information Technology,Software & Services,IT Services,JNB,XJSE,Johannesburg Stock Exchange,South Africa,,Parktown,2193,http://www.altron.com,,,,,,,False
AFE.JO,AECI Ltd,"AECI Ltd, together with its subsidiaries, operates in the mining, water treatment, plant and animal health, food and beverage, infrastructure, and general industrial sectors in Africa, Europe, South East Asia, North America, South America, and Australia. The company operates through five segments: AECI Mining, AECI Water, AECI Agri Health, AECI Chemicals, and AECI Property Services & Corporate. The AECI Mining segment provides mine-to-mineral solution for the mining sector. This segment offers commercial explosives, initiating systems, and blasting services, as well as surfactants for explosives manufacture. The AECI Water segment provides integrated water treatment and process chemicals, and equipment solutions for various applications comprising public and industrial water, desalination, and utilities. The AECI Agri Health segment manufactures and distributes crop protection products, plant nutrients, animal premixes, specialty animal health products, and fine chemicals. The AECI Chemicals segment supplies raw materials and related services to customers in the food and beverage, manufacturing, infrastructure, and general industrial sectors. The AECI Property Services & Corporate segment offers property leasing and management services in the office, industrial, and retail sectors. AECI Ltd was founded in 1894 and is based in Sandton, South Africa.",ZAC,Materials,Materials,Chemicals,JNB,XJSE,Johannesburg Stock Exchange,South Africa,,Sandton,2191,http://www.aeciworld.com,,,00830W105,BBG000BF9085,BBG000BF8ZN2,BBG001S7JDP5,False
AFEP.JO,AECI Ltd,"AECI Ltd, together with its subsidiaries, operates in the mining, water treatment, plant and animal health, food and beverage, infrastructure, and general industrial sectors in Africa, Europe, South East Asia, North America, South America, and Australia. The company operates through five segments: AECI Mining, AECI Water, AECI Agri Health, AECI Chemicals, and AECI Property Services & Corporate. The AECI Mining segment provides mine-to-mineral solution for the mining sector. This segment offers commercial explosives, initiating systems, and blasting services, as well as surfactants for explosives manufacture. The AECI Water segment provides integrated water treatment and process chemicals, and equipment solutions for various applications comprising public and industrial water, desalination, and utilities. The AECI Agri Health segment manufactures and distributes crop protection products, plant nutrients, animal premixes, specialty animal health products, and fine chemicals. The AECI Chemicals segment supplies raw materials and related services to customers in the food and beverage, manufacturing, infrastructure, and general industrial sectors. The AECI Property Services & Corporate segment offers property leasing and management services in the office, industrial, and retail sectors. AECI Ltd was founded in 1894 and is based in Sandton, South Africa.",ZAC,Materials,Materials,Chemicals,JNB,XJSE,Johannesburg Stock Exchange,South Africa,,Sandton,2191,http://www.aeciworld.com,,,,,,,False
AFH.JO,Alexander Forbes Group Holdings Limited,"Alexander Forbes Group Holdings Limited provides integrated retirement and investment solutions for individuals and businesses in South Africa and internationally. The company's solutions for individuals cover money management, budgeting, and savings services; goal based, unit trusts, endowments, and offshore investment; retirement pension or provident, and annuity funds; healthcare solutions and support, and consulting services; life and risk cover; and wills and estate planning services, as well as private wealth management services. Its solutions for businesses cover consulting and actuarial services; retirement fund services; healthcare consulting, health management solutions, and technical advisory services; group and business insurance services that cover assets, earnings, and the legal liabilities of business against loss or damage; services that cover emerging markets in Arica; and trust and beneficiary services that cover the management of death benefits for beneficiaries of deceased retirement fund members and employees. The company was formerly known as Alexander Forbes Equity Holdings Proprietary Limited and changed its name to Alexander Forbes Group Holdings Limited in June 2014. Alexander Forbes Group Holdings Limited was founded in 1935 and is headquartered in Sandton, South Africa.",ZAC,Financials,Diversified Financials,Capital Markets,JNB,XJSE,Johannesburg Stock Exchange,South Africa,,Sandton,2196,http://www.alexanderforbes.co.za,,,,,,,False
AFT.JO,Afrimat Limited,"Afrimat Limited, an open pit mining company, provides industrial minerals and construction materials in South Africa. It operates through three segments: Construction Materials, Industrial Minerals, and Bulk Commodities. The Construction Materials segment offers aggregates, readymix concrete, building lime, bricks and blocks, roadlime, and silica products, as well as clinker supplies. The Industrial Minerals segment offers agriculture and animal hygiene lime, dolomite, and metallurgical calcite and dolomite products, as well as limestone. The Bulk Commodities segment mines for iron ores. It also offers drilling and blasting, mobile crushing, screening, and bid preparation and contractual services. Afrimat Limited was founded in 1963 and is headquartered in Bellville, South Africa.",ZAC,Materials,Materials,Construction Materials,JNB,XJSE,Johannesburg Stock Exchange,South Africa,,Bellville,7530,http://www.afrimat.co.za,,,002896207,BBG000PMNQL7,BBG000PMNQ55,BBG001SR5C50,False
AGL.JO,Anglo American plc,"Anglo American plc operates as a mining company worldwide. The company explores for rough and polished diamonds, copper, platinum group metals, metallurgical and thermal coal, and iron; and nickel, polyhalite, and manganese ores, as well as alloys. Anglo American plc was founded in 1917 and is headquartered in London, the United Kingdom.",ZAC,Materials,Materials,Metals & Mining,JNB,XJSE,Johannesburg Stock Exchange,United Kingdom,,London,EC1N 6RA,http://www.angloamerican.com,Large Cap,,,BBG000BV7Q30,BBG000BV7PM1,BBG001S5Z1X8,False
AHA.JO,Arrowhead Properties Limited,"Arrowhead is a diversified South African Real Estate Investment Trust (ÂREITÂ) focused on creating long-term shareholder value. Arrowhead holds a diverse portfolio of retail, office and industrial properties valued at R9.7 billion. As at 30 September 2020, Arrowhead also held a 60.0% interest (2019: 59.6 %) in its subsidiary, Indluplace Properties Limited (ÂIndluplaceÂ), which owns a portfolio of residential properties. The average value per direct property held as at 30 September 2020 was R68.0 million (R57.2 million as at 30 September 2019). Arrowhead has a 15.0% (2019: 17.9%) interest in Rebosis Property Fund Limited (ÂRebosisÂ) and an 8.6% (2019: 8.6%) interest in Dipula Income Fund Limited (ÂDipulaÂ) at 30 September 2020.",ZAC,Real Estate,Real Estate,Equity Real Estate Investment Trusts (REITs),JNB,XJSE,Johannesburg Stock Exchange,South Africa,,Johannesburg,2196,http://www.arrowheadproperties.co.za,,,,,,,False
AHB.JO,Arrowhead Properties Limited,"Arrowhead is a diversified South African Real Estate Investment Trust (ÂREITÂ) focused on creating long-term shareholder value. Arrowhead holds a diverse portfolio of retail, office and industrial properties valued at R9.7 billion. As at 30 September 2020, Arrowhead also held a 60.0% interest (2019: 59.6 %) in its subsidiary, Indluplace Properties Limited (ÂIndluplaceÂ), which owns a portfolio of residential properties. The average value per direct property held as at 30 September 2020 was R68.0 million (R57.2 million as at 30 September 2019). Arrowhead has a 15.0% (2019: 17.9%) interest in Rebosis Property Fund Limited (ÂRebosisÂ) and an 8.6% (2019: 8.6%) interest in Dipula Income Fund Limited (ÂDipulaÂ) at 30 September 2020.",ZAC,Real Estate,Real Estate,Equity Real Estate Investment Trusts (REITs),JNB,XJSE,Johannesburg Stock Exchange,South Africa,,Johannesburg,2196,http://www.arrowheadproperties.co.za,,,,,,,False
AHL.JO,AH-Vest Limited,"AH-Vest Limited manufactures and sells food products primarily in South Africa. The company offers tomato sauces and other value added products. It offers products under All Joy brand. The company was founded in 1988 and is based in Johannesburg, South Africa. AH-Vest Limited operates as a subsidiary of Eastern Trading Co (Pty) Ltd.",ZAC,Consumer Staples,Food & Staples Retailing,Food & Staples Retailing,JNB,XJSE,Johannesburg Stock Exchange,South Africa,,Johannesburg,1872,http://www.alljoy.co.za,,,,BBG000CKXBL7,BBG000CKX9W0,BBG001SC7VB2,False
AIL.JO,African Rainbow Capital Investments Limited,"African Rainbow Capital Investments Limited, an investment holding company, invests in a portfolio of listed and unlisted investments. The company was founded in 2015 and is based in EbÃ¨ne, Mauritius.",ZAC,Financials,Diversified Financials,Capital Markets,JNB,XJSE,Johannesburg Stock Exchange,Mauritius,,Ebene,72201,http://arci.mu,,,,,,,False
