symbol,name,summary,currency,sector,industry_group,industry,exchange,mic,market,country,state,city,zipcode,website,market_cap,isin,cusip,figi,composite_figi,shareclass_figi,delisted
KCCGLD.JO,Krugerrand Custodial Certificates ETF,"Krugerrand Custodial Certificates ETF is an exchange traded fund launched and managed by Rand Merchant Bank. It invests in the commodity markets. The fund invests in the gold coin custodial certificates. Krugerrand Custodial Certificates ETF was formed on October 21, 2014 and is domiciled in South Africa.",ZAC,Financials,Diversified Financials,,JNB,XJSE,Johannesburg Stock Exchange,South Africa,,Sandton,2146,http://www.rmb.co.za/page/krugerrand-custodial-certificate,,,,BBG007HRFF15,BBG007HRFDZ3,BBG007HRFF06,False
KIO.JO,Kumba Iron Ore Limited,"Kumba Iron Ore Limited, together with its subsidiaries, engages in the exploration, extraction, beneficiation, marketing, sale, and shipping of iron ore primarily in South Africa. The company produces iron ore at Sishen and Kolomela mines in the Northern Cape Province. It also operates a port in Saldanha Bay. The company supplies its iron ore to the steel industry; and exports to China, rest of Asia, Europe, the Middle East, North Africa, and the Americas. The company was incorporated in 2005 and is based in Centurion, South Africa. Kumba Iron Ore Limited is a subsidiary of Anglo South Africa Proprietary Limited.",ZAC,Materials,Materials,Metals & Mining,JNB,XJSE,Johannesburg Stock Exchange,South Africa,,Centurion,157,http://www.angloamericankumba.com,Large Cap,,,BBG000PPVK43,BBG000PPVJJ0,BBG001SKC4G3,False
KP2.JO,Kore Potash plc,"Kore Potash plc, together with its subsidiaries, engages in the exploration and development of potash minerals in the Republic of Congo. Its flagship property is the 97%-owned Sintoukola potash project that comprises the Kola sylvinite and carnallite deposits located to the north of the city of Pointe Noire. The company was incorporated in 2017 and is headquartered in London, the United Kingdom.",ZAC,Materials,Materials,Metals & Mining,JNB,XJSE,Johannesburg Stock Exchange,United Kingdom,,London,EC2R 6AY,http://korepotash.com,,,,BBG00KFWQK32,BBG00KFWQK23,BBG00J5BF902,False
KRO.JO,Karooooo Ltd.,Karooooo Ltd. develops a vehicle fleet management software solution. The company was incorporated in 2018 and is based in Singapore.,ZAC,Information Technology,Software & Services,Software,JNB,XJSE,Johannesburg Stock Exchange,Singapore,,Singapore,79903,,Small Cap,,,BBG0101632Q7,BBG0101632P8,BBG00PQMJSX9,False
KST.JO,PSG Konsult Limited,"PSG Konsult Limited, through its subsidiaries, provides various financial services and products in South Africa, Namibia, and Botswana. It operates through three segments: PSG Wealth, PSG Asset Management, and PSG Insure. The PSG Wealth segment offers portfolio management, stockbroking, local and offshore investments, estate planning, financial planning, local and offshore fiduciary, multi-managed investment solutions, and retirement products to individuals, families, and businesses. The PSG Asset Management segment provides various investment products, including local and international unit trust funds; and investment management services to long-term retail and institutional investors. The PSG Insure segment offers personal short-term insurance products, including home, car, and household insurance; and commercial short-term insurance products, such as business and agri-insurance. The company was incorporated in 1993 and is headquartered in Bellville, South Africa. PSG Konsult Limited is a subsidiary of PSG Financial Services Limited.",ZAC,Financials,Diversified Financials,Capital Markets,JNB,XJSE,Johannesburg Stock Exchange,South Africa,,Bellville,7530,http://www.psg.co.za,,,,,,,False
L2D.JO,two,"two is a blank check company. The company was incorporated in 2021 and is based in San Francisco, California.",ZAC,Financials,Diversified Financials,Diversified Financial Services,JNB,XJSE,Johannesburg Stock Exchange,United States,CA,San Francisco,94129,http://www.sz000004.cn,Micro Cap,,,,,,True
L4L.JO,Long4life Limited,"Long4life Limited is a venture capital firm focuses on businesses with proven track record, having strong cash flow & attractive growth capital prospects led by strong, management teams. The firm prefers to invest in retail, wholesale, manufacturing, service, merchandising, distribution, e-commerce, Sports & Recreation, personal care, Beverages & Wellness sectors. Long4life Limited is based in Johannesburg, South Africa.",ZAC,Consumer Discretionary,Retailing,Specialty Retail,JNB,XJSE,Johannesburg Stock Exchange,South Africa,,Johannesburg,2196,http://www.long4life.co.za,,,,,,,False
LAB.JO,Labat Africa Limited,"Labat Africa Limited, an investment holding company, designs and markets integrated circuits South Africa. The company operates through Technology, Bulk Logistics, and Healthcare segments. It engages in the transportation of coals and minerals for mines in South Africa; and healthcare business. Labat Africa Limited was founded in 1995 and is based in Roodepoort, South Africa.",ZAC,Information Technology,Semiconductors & Semiconductor Equipment,Semiconductors & Semiconductor Equipment,JNB,XJSE,Johannesburg Stock Exchange,South Africa,,Roodepoort,1709,http://labat.co.za,,,50543R109,BBG000BQ05B5,BBG000BQ04D6,BBG001SCWC17,False
LBH.JO,Liberty Holdings Limited,"Liberty Holdings Limited, a financial services company, engages in the insurance business in South Africa. The company offers critical illness, disability, income and life protection, car, home, personal liability, medical, and salary protection insurance products, as well as funeral cover; and annuities, group risk, umbrella fund solutions, investment products, asset management, and consulting and actuarial services. It serves individuals, corporates, and retirement funds. The company was founded in 1957 and is headquartered in Johannesburg, South Africa. Liberty Holdings Limited is a subsidiary of Standard Bank Group Limited.",ZAC,Financials,Insurance,Insurance,JNB,XJSE,Johannesburg Stock Exchange,South Africa,,Johannesburg,2001,http://www.libertyholdings.co.za,,,,,,,False
LBR.JO,Libstar Holdings Limited,"Libstar Holdings Limited manufactures, imports, exports, and supplies various food and beverage, household, and personal care products in South Africa and internationally. It offers dairy products, such as cheeses, yoghurts, milk, butters, dips, spreads, and creams and sauces; meat and chicken products; mushrooms; prepared meals; natural and flavored waters, carbonated soft drinks, and bar mixes; disposable paper cups; paper and plastic containers and polystyrene trays; and cutlery and accessories. The company also provides chutneys, table sauces, vinegars, tomato pastes, salad dressings, and mayonnaise and marinades; salt, pepper, herbs and spices, and curry powders and seasoning mixes; pastas and noodles; pasta sauces and cook-in-sauces; soups, canned fruit, vegetables, legumes, and antipasti; honey, jams, and peanut and nut butters; and teas. In addition, it offers cereals, nuts, snack bars, and confectionery products; baking products and aids; cotton wool and cotton buds, cosmetic facial pads, beauty soaps, and bath additions; and laundry detergents, fabric softeners, and related products. The company sells consumer packaged goods to customers in the retail, food service, industrial, and export channels. Libstar Holdings Limited was founded in 2005 and is based in Johannesburg, South Africa.",ZAC,Consumer Staples,Food & Staples Retailing,Food & Staples Retailing,JNB,XJSE,Johannesburg Stock Exchange,South Africa,,Johannesburg,2196,http://www.libstar.co.za,,,,BBG00KK20WL4,BBG00B5YNSV4,BBG00B5YNSW3,False
LEW.JO,Lewis Group Limited,"Lewis Group Limited, a credit retailer, sells household furniture and electrical appliances in South Africa, Botswana, Lesotho, Eswatini, and Namibia. The company's stores offer home electronics; sound and vision equipment; and lounge, bedroom, and dining room furniture products under the Lewis, Best Home and Electric, United Furniture Outlets, and Beares brands. In addition, it provides short-term insurance to customers purchasing merchandise on credit. As of November 25, 2020, the company operated approximately 805 stores. Lewis Group Limited was founded in 1934 and is based in Cape Town, South Africa.",ZAC,Consumer Discretionary,Retailing,Specialty Retail,JNB,XJSE,Johannesburg Stock Exchange,South Africa,,Cape Town,7925,http://www.lewisgroup.co.za,,,,BBG000NSQKY2,BBG000NSQKJ9,BBG001SKX899,False
LHC.JO,Life Healthcare Group Holdings Limited,"Life Healthcare Group Holdings Limited, together with its subsidiaries, operates private hospitals in South Africa, Poland, the United Kingdom, rest of Europe, and Internationally. It operates through two segments, Hospitals and Complementary Services; and Healthcare Services. The company provides range of acute hospitals and complementary services; Life Esidimeni services, such as chronic mental healthcare, frail care rehabilitation, step-down care, correctional services, primary healthcare and substance abuse recovery programs; and life employee health solutions, including on-site occupational and primary healthcare services and employee wellness programs. It also offers services in the areas of diagnostics, mental health, acute rehabilitation, renal dialysis, oncology, cardiology, neurology, orthopedic, pediatric, dermatology, ophthalmology, gynecology, and obstetric. In addition, the company provides diagnostic imaging services; magnetic resonance imaging and computerized tomography scanners; develops, manufactures, and distributes radiopharmaceuticals for use in positron emission tomography-computerized tomography (PET-CT) diagnostics. The company was formerly known as Afrox Healthcare Limited and changed its name to Life Healthcare Group Holdings Limited in January 2005. Life Healthcare Group Holdings Limited was founded in 1983 and is headquartered in Johannesburg, South Africa.",ZAC,Health Care,Health Care Equipment & Services,Health Care Equipment & Supplies,JNB,XJSE,Johannesburg Stock Exchange,South Africa,,Johannesburg,2196,http://www.lifehealthcare.co.za,Small Cap,,,,,,False
LNF.JO,London Finance & Investment Group P.L.C.,"London Finance & Investment Group P.L.C., together with its subsidiaries, operates as an investment finance and management company. It primarily invests in smaller U.K. quoted companies, which are balanced by a general portfolio that consists of investments in U.S., U.K. and European equities. The general portfolio includes interest in food and beverage, oil, natural resources, chemicals, and tobacco sectors. The firm is based in London, the United Kingdom.",ZAC,Financials,Diversified Financials,Capital Markets,JNB,XJSE,Johannesburg Stock Exchange,United Kingdom,,London,EC1N 6RY,http://www.city-group.com/london-finance-investment-group-plc,,,,,,,False
LTE.JO,Lighthouse Capital Limited,"Lighthouse Capital Limited invests in direct property, and listed real estate and infrastructure securities. Its property portfolio includes retail, logistics, industrial, warehousing, and office properties in Australia, Canada, Hong Kong, Singapore, the United Kingdom, Europe, and the United States. The company was formerly known as Greenbay Properties Ltd. and changed its name to Lighthouse Capital Limited in December 2018. Lighthouse Capital Limited was incorporated in 2014 and is based in Grand Baie, Mauritius.",ZAC,Real Estate,Real Estate,Real Estate Management & Development,JNB,XJSE,Johannesburg Stock Exchange,Mauritius,,Grand Baie,,http://www.lighthousecapital.mu,,,,,,,False
LUX.JO,Luxe Holdings Limited,"Luxe Holdings Limited owns and licenses a portfolio of corporate owned and franchised luxury retail brands in South Africa. It manufactures and supplies gold and silver jewelry; and retails luxury watches. The company operates outlets under the Natal Wholesale Jewellers, Arthur Kaplan, and World's Finest Watches brand names. The company was formerly known as Taste Holdings Limited and changed its name to Luxe Holdings Limited in July 2020. Luxe Holdings Limited was incorporated in 2000 and is based in Sandton, South Africa.",ZAC,Consumer Discretionary,Consumer Durables & Apparel,"Textiles, Apparel & Luxury Goods",JNB,XJSE,Johannesburg Stock Exchange,South Africa,,Sandton,2196,http://www.luxeholdings.co.za,,,,,,,False
MCETNC.JO,FNB ETN on MCDOC SEP25,,ZAC,Financials,,,JNB,XJSE,Johannesburg Stock Exchange,,,,,,,,,,,,False
MCETNQ.JO,FNB ETN on MCDOQ SEP25,,ZAC,Financials,,,JNB,XJSE,Johannesburg Stock Exchange,,,,,,,,,,,,False
MCG.JO,MultiChoice Group Limited,"MultiChoice Group Limited, through its subsidiaries, operates video-entertainment subscriber platforms in Africa, Europe, and internationally. It operates through South Africa, Rest of Africa, and Technology segments. The company offers digital satellite television, digital terrestrial television, over-the-top, and related video-entertainment services. Its video-entertainment is a commercial service that provides packages of video and audio programming to consumers. The company also provides digital content management and protection systems to protect, manage, and monetize digital media on various platforms. In addition, it broadcasts advertisements on its video entertainment platforms and shows online on its Websites; and sells set-top boxes. The company offers its services under the SuperSport, DStv, GOtv, M-Net, Showmax, and Irdeto names. It serves approximately 14 million people in 50 countries across various platforms. The company was founded in 1995 and is based in Randburg, South Africa.",ZAC,Communication Services,Media & Entertainment,Entertainment,JNB,XJSE,Johannesburg Stock Exchange,South Africa,,Randburg,2194,http://www.multichoice.com,Mid Cap,ZAE000265971,,BBG00N2W9Y48,BBG00N2W9W60,BBG00N2W9W79,False
MCZ.JO,MC Mining Ltd,"MC Mining Limited, together with its subsidiaries, acquires, explores, develops, and operates metallurgical and thermal coal projects in South Africa. The company's principal projects include the Uitkomst Colliery, a metallurgical and thermal coal project located in the KwaZulu Natal province; the Makhado hard coking and thermal coal project situated in the Soutpansberg coalfield in the Limpopo province; and the Vele Colliery, a semi-soft coking and thermal coal mine located to the west of Musina in the Limpopo province. Its principal projects also comprise three coking and thermal coal projects, including Chapudi, Generaal, and Mopane located in Limpopo province. The company was formerly known as Coal of Africa Limited and changed its name to MC Mining Limited in November 2017. MC Mining Limited is based in Mount Pleasant, Australia.",ZAC,Materials,Materials,Metals & Mining,JNB,XJSE,Johannesburg Stock Exchange,Australia,WA,Mount Pleasant,6153,http://www.mcmining.co.za,,AU000000MCM9,,BBG000Q2N714,BBG000Q2N643,BBG001S6M5H9,False
MDI.JO,Master Drilling Group Limited,"Master Drilling Group Limited, an investment holding company, provides specialized drilling services to blue chip major and mid-tier companies in the mining, civil engineering, construction, and hydro-electric power sectors. The company offers rock boring services, including raise, horizontal raise, slot, tunnel, blind hole, and reef boring; slim drilling services, such as blast hole, de-watering, core, percussion, reverse circulation, and mud and air rotary drilling; and support services, which include directional drilling, stage and remote-operated shaft support, piling, scan mobile, analyzing ore, and core yard management. It operates in Africa, Central and North America, South America, and internationally. Master Drilling Group Limited was founded in 1986 and is based in Fochville, South Africa.",ZAC,Industrials,Capital Goods,Construction & Engineering,JNB,XJSE,Johannesburg Stock Exchange,South Africa,,Fochville,2515,http://www.masterdrilling.com,,,,BBG003PRXWQ1,BBG003PRXWP2,BBG003PRXWR0,False
MEI.JO,Mediclinic International plc,"Mediclinic International plc, together with its subsidiaries, operates private hospitals. The company offers acute care, specialist-orientated, and multidisciplinary healthcare services under the Mediclinic and Hirslanden brand names. It operates 17 hospitals, 2 day case clinics, 3 outpatient clinics, and 110 theatres with approximately 1,893 inpatient beds in Switzerland; 52 hospitals, 10 day case clinics, 8 sub-acute hospitals, and 305 theatres in South Africa and Namibia with approximately 8,792 inpatient beds; and 7 hospitals, 2 day case clinics, 18 outpatient clinics, and 38 theatres with approximately 927 inpatient beds in the United Arab Emirates. The company also provides treasury, hospital equipment and procurement, emergency medical, management, food and catering, healthcare management, and debt collection and related services; manages healthcare staff; and owns and manages properties. In addition, it engages in intellectual property holding and medical store/procurement businesses. The company was founded in 1983 and is based in Stellenbosch, South Africa.",ZAC,Health Care,Health Care Equipment & Services,Health Care Equipment & Supplies,JNB,XJSE,Johannesburg Stock Exchange,South Africa,,Stellenbosch,7600,http://www.mediclinic.com,,GB00B8HX8Z88,,BBG00C5BPWF9,BBG00C5BPWD1,BBG004MGY0Z5,True
MFL.JO,Metrofile Holdings Limited,"Metrofile Holdings Limited, an investment holding company, provides records and information management services in South Africa, Botswana, Kenya, Mozambique, and the Middle East. The company provides records storage and management services, including archive, active, hosting, and stationery services; backup storage services comprising vault and managed services; records management consultancy and software integration; document shredding; and image processing services, such as digital and analogue services. It also offers business process outsourcing services, which includes proof of delivery solutions, track and trace management, sensitive information protection, procurement tracking solutions, claims processing, human resource services, electronic exam marking system, and business continuity and work area recovery service. In addition, the company provides filing solutions, including office filing stationery, archive filing boxes, bulk filing solutions, filing cabinets, shelving and steel products, and scanners, as well as software solutions; and ScreenWell, a digital solution to capture, track, and manage daily temperature screening, health questionnaires, and workplace policy compliance for returning staff and visitors. It serves clients in financial services, healthcare, mining, public, and retail sectors. The company was formerly known as MGX Holdings Limited and changed its name to Metrofile Holdings Limited in February 2005. Metrofile Holdings Limited was founded in 1983 and is based in Illovo, South Africa.",ZAC,Industrials,Commercial & Professional Services,Professional Services,JNB,XJSE,Johannesburg Stock Exchange,South Africa,,Illovo,2196,http://www.metrofilegroup.com,,,,BBG000BQ32K9,BBG000BQ3292,BBG001S6WNS7,False
MHB.JO,Mahube Infrastructure Limited,GAIA Infrastructure Capital Limited is a blank check company. The company was formerly known as Gaia Capital Proprietary Limited. The company was incorporated in 2015 and is based in South Africa.,ZAC,Financials,Diversified Financials,Capital Markets,JNB,XJSE,Johannesburg Stock Exchange,South Africa,,Johannesburg,2196,http://www.gaia-ic.com,,,,BBG00B8N1YJ0,BBG00B8N1YG3,BBG00B8N1YH2,False
MIX.JO,MiX Telematics Limited,"MiX Telematics Limited provides fleet and mobile asset management solutions through software-as-a-service (Saas) delivery model. The company offers fleet solutions, including MiX Fleet Manager Premium that provides access to secure information about drivers and vehicles; MiX Fleet Manager Essential for monitoring drivers and vehicles; and MiX Asset Manager used to track hardware products and other assets. It also provides consumer solutions, including Matrix that provides vehicle tracking, telematics, and personal safety services; and Beame, a wireless device, which offers vehicle recovery services. In addition, the company provides value added services comprising driver communication, collision prevention and reduction, satellite communication, track and react bureau, driver performance management, driving monitoring, field services management, driver engagement, fuel management and security solutions, and driver identification solutions, as well as voice kits and keypads, and in-vehicle cameras. It delivers fleet and mobile asset management solutions as SaaS to 818,487 subscribers in South Africa, the Americas, the Middle East, Australia, Europe, and Brazil. The company was founded in 1996 and is based in Boca Raton, Florida.",ZAC,Information Technology,Software & Services,Software,JNB,XJSE,Johannesburg Stock Exchange,United States,FL,Boca Raton,33487,http://www.mixtelematics.co.za,Small Cap,,,,,,False
MKR.JO,"Montauk Renewables, Inc.","Montauk Renewables, Inc., a renewable energy company, engages in recovery and processing of biogas from landfills and other non-fossil fuel sources. The company develops, owns, and operates renewable natural gas (RNG) projects that capture methane and prevents it from being released into the atmosphere by converting it into either RNG or electrical power for the electrical grid. Its customers for RNG and renewable identification numbers include long-term owner-operators of landfills and livestock farms, investor-owned and municipal electricity utilities, and refiners in the natural gas and refining sectors. Montauk Renewables, Inc. was incorporated in 2020 and is headquartered in Pittsburgh, Pennsylvania.",ZAC,Utilities,Utilities,Multi-Utilities,JNB,XJSE,Johannesburg Stock Exchange,United States,PA,Pittsburgh,15220,http://www.montaukrenewables.com,Small Cap,,,BBG00YVSVT29,BBG00YVSVT10,BBG00YHYK376,False
MMP.JO,Marshall Monteagle PLC,"Marshall Monteagle PLC, an investment holding company, engages in the import and distribution, and property holding businesses in South Africa, Europe, the United States, and the Middle East. The company owns and manages commercial property, and multi-tenanted rent properties; and imports, exports, distributes, and trades in hand tools, machinery, non-perishable food, coffee roasting, and other household consumer products, and metals and minerals. It also engages in the warehousing and logistics business; and provides trade finance solutions to a range of producers, traders, and end-users. Marshall Monteagle PLC is based in Saint Helier, the United Kingdom.",ZAC,Industrials,Capital Goods,Trading Companies & Distributors,JNB,XJSE,Johannesburg Stock Exchange,Jersey,,Saint Helier,JE1 1GH,http://www.monteaglegroup.com,,,,BBG001FBGBC1,BBG001FBGBB2,BBG001V09011,False
MNP.JO,Mondi plc,"Mondi plc engages in the manufacture and sale of packaging and paper products in Africa, Western Europe, Emerging Europe, Russia, North America, South America, Asia, and Australia. It operates in Corrugated Packaging, Flexible Packaging, Engineered Materials, and Uncoated Fine Paper segments. The company offers flexible packaging, bags, and pouches; personal care components; release liners; technical films; corrugated packaging solutions; industrial bags; barrier coatings; specialty Kraft and sack Kraft papers; containerboards; and office and professional printing papers. It serves customers in the agriculture, automotive, building and construction, chemicals and dangerous goods, food and beverages, graphic and photographic, home and personal care, medical and pharmaceutical, office and professional printing, paper and packaging converting, pet care, retail and e-commerce, and shipping and transport industries. The company was founded in 1967 and is based in Addlestone, the United Kingdom.",ZAC,Materials,Materials,Paper & Forest Products,JNB,XJSE,Johannesburg Stock Exchange,United Kingdom,,Addlestone,KT15 2PG,http://www.mondigroup.com,Large Cap,,,BBG000FYRDB8,BBG000FYRCR3,BBG001SKX3C6,False
MPT.JO,Mpact Limited,"Mpact Limited engages in the paper and plastic packaging and recycling business in South Africa. It operates through Paper and Plastics segments. The company manufactures recycled-based packaging and industrial paper grades, such as containerboards and carton boards; and a range of printed and unprinted converted corrugated products, including boards for use in the manufacture of corrugated packaging, corrugated boxes, die-cut cases, folded glued cases, trays, and point-of-sale displays, cups, lids, and bags. It also sells Mondi ProVantage Baywhite, a white top Kraftliner and Mondi ProVantage BayKraf, a Kraftliner; and recycles paper through various recovered paper sources comprising pre- and post-consumer materials. In addition, the company manufactures various plastic packaging products, such as polyethylene-terephthalate (PET) preforms, bottles, and jars; closures for food and beverage, household, and chemical markets; plastic jumbo bins, wheelie bins, and pallets and crates; FMCG rigid plastic packaging products; polystyrene and PET trays; vinyl films. It offers packaging and industrial paper products to corrugated board and box producers, and other containerboard converters; carton boards to folding carton and other producers of industrial products, as well as users of cards and book covers; corrugated products to producers of agricultural, fast moving consumer goods (FMCG), and other durable and non-durable goods; and plastic packaging products to food, beverage, personal care, home care, pharmaceutical, agricultural, and retail markets. The company is headquartered in Johannesburg, South Africa.",ZAC,Consumer Discretionary,Retailing,Distributors,JNB,XJSE,Johannesburg Stock Exchange,South Africa,,Johannesburg,2196,http://www.mpact.co.za,,,,BBG001QKKYQ9,BBG000QQ6TQ5,BBG001SNF189,False
