symbol,name,summary,currency,sector,industry_group,industry,exchange,mic,market,country,state,city,zipcode,website,market_cap,isin,cusip,figi,composite_figi,shareclass_figi,delisted
DSY.JO,Discovery Limited,"Discovery Limited provides various insurance products and services primarily in South Africa, the United Kingdom, and the United States. It operates through Health South Africa, Life South Africa, Invest South Africa, Vitality South Africa, Insure South Africa, Bank South Africa, Health United Kingdom, Life United Kingdom, and All Other segments. The company offers health, life, car, and home insurance products; motor, building, household content, and portable procession insurance products; and commercial short-term risk insurance products. It also provides investment products and credit cards; retail banking solutions; and Vitality, which offers health and lifestyle benefits, such as rewards for living healthier, driving well, and banking well. The company was formerly known as Discovery Holdings Limited and changed its name to Discovery Limited in December 2012. Discovery Limited was founded in 1992 and is based in Sandton, South Africa.",ZAC,Financials,Insurance,Insurance,JNB,XJSE,Johannesburg Stock Exchange,South Africa,WA,Sandton,2146,http://www.discovery.co.za,Large Cap,,,BBG000DD6054,BBG000DD5ZG6,BBG001SD9C75,False
DTC.JO,Datatec Limited,"Datatec Limited, together with its subsidiaries, provides information and communication technology (ICT) solutions and services worldwide. The company operates in three segments: Westcon International; Logicalis; and Corporate, Management Consulting and Financial Services. The Westcon International segment distributes security, networking, collaboration, networking and data centre, and cloud products, as well as global deployment and services. It offers solutions through a network of service providers, systems integrators, and specialty resellers under the Westcon and Comstor brands. The Logicalis segment provides ICT infrastructure solutions and services with a focus on data center and cloud services, security and network infrastructure, workspace communications and collaboration, data and information strategies, and IT operation modernization. The Corporate, Management Consulting and Financial Services segment provides strategic, trusted advisory, modeling, and market intelligence services to the telecoms, media, and technology industries, as well as capital/leasing services. Datatec Limited was founded in 1986 and is headquartered in Sandown, South Africa.",ZAC,Information Technology,Software & Services,IT Services,JNB,XJSE,Johannesburg Stock Exchange,South Africa,,Sandown,2031,http://www.datatec.com,,,24463V101,BBG000G40FG2,BBG000G40F09,BBG001S8QR56,False
ELI.JO,Ellies Holdings Limited,"Ellies Holdings Limited, an investment holding company, engages in the manufacture, import, wholesale, and distribution of LED lighting, electrical, and electronic products and solutions to the residential and commercial sectors in South Africa, Botswana, Namibia, and Swaziland. It operates in two segments, Trading and Distribution and Manufacturing. The company provides aerial and satellite television equipment, accessories and hardware, photovoltaic solar panels, and cable and fiber distribution networks, as well as signal, sound, and audio-visual solutions in the business sector. It also develops, manufactures, and sells terrestrial antennae; and light metal products, such as wall brackets, shelving, satellite and terrestrial mounting brackets, and satellite dishes, as well as LED and plasma TV mounts. In addition, the company offers wizard remote blaster and video senders; and vacuum and plastic blister packaging products. Ellies Holdings Limited was founded in 1979 and is based in Sandton, South Africa.",ZAC,Information Technology,Technology Hardware & Equipment,Communications Equipment,JNB,XJSE,Johannesburg Stock Exchange,South Africa,,Sandton,2090,http://elliesholdings.com,,,,,,,False
EMH.JO,eMedia Holdings Limited,"eMedia Holdings Limited, an investment holding company, operates in media sector in South Africa. The company operates e.tv, a free-to-air television channel; eNCA, a 24-hour news channel; OpenView HD, a DTH satellite television platform; Open News, a news channel; and YFM, a radio station that targets the youth audience. It also provides property and facilities services, including television and film studios, live broadcast and post-production facilities, and production office rental services, as well as produces and acquires content to license and sell to third parties. The company was formerly known as Seardel Investment Corporation Limited and changed its name to eMedia Holdings Limited in November 2015. eMedia Holdings Limited was founded in 1957 and is based in Johannesburg, South Africa. eMedia Holdings Limited is a subsidiary of Fulela Trade and Invest 81 Proprietary Limited.",ZAC,Communication Services,Media & Entertainment,Entertainment,JNB,XJSE,Johannesburg Stock Exchange,South Africa,,Johannesburg,2196,http://www.emediaholdings.co.za,,,,,,,False
EMI.JO,Emira Property Fund Limited,"Emira is a diversified real estate investment trust (ÂREITÂ) company, with a property portfolio of predominantly South African assets, and a growing component of offshore assets. The Company listed on the JSE in November 2003, in the real estate investment trusts sector. In line with its strategic objectives, Emira's property portfolio spans multiple sectors, namely office, retail and industrial, with a new element of residential. The Company is focused on growing the quality and value of its property portfolio, in order to sustain and enhance its distribution growth to shareholders. This is achieved via selective acquisitions and disposals, as well as refurbishments, upgrades and the redevelopment of specific properties. To this end, all investment decisions are reinforced by Emira's stringent investment criteria to enhance yields and improve the performance of the portfolio.",ZAC,Real Estate,Real Estate,Equity Real Estate Investment Trusts (REITs),JNB,XJSE,Johannesburg Stock Exchange,South Africa,,Bryanston,2191,http://www.emira.co.za,,LU1650491282,,,BBG000D2T0Q0,,False
EMN.JO,eMedia Holdings Limited,"eMedia Holdings Limited, an investment holding company, operates in media sector in South Africa. The company operates e.tv, a free-to-air television channel; eNCA, a 24-hour news channel; OpenView HD, a DTH satellite television platform; Open News, a news channel; and YFM, a radio station that targets the youth audience. It also provides property and facilities services, including television and film studios, live broadcast and post-production facilities, and production office rental services, as well as produces and acquires content to license and sell to third parties. The company was formerly known as Seardel Investment Corporation Limited and changed its name to eMedia Holdings Limited in November 2015. eMedia Holdings Limited was founded in 1957 and is based in Johannesburg, South Africa. eMedia Holdings Limited is a subsidiary of Fulela Trade and Invest 81 Proprietary Limited.",ZAC,Communication Services,Media & Entertainment,Entertainment,JNB,XJSE,Johannesburg Stock Exchange,South Africa,,Johannesburg,2196,http://www.emediaholdings.co.za,,,277432100,,,,False
ENX.JO,enX Group Limited,"enX Group Limited, together with its subsidiaries, provides industrial, petrochemical, and fleet management and logistics products and related services primarily to industrial and commercial sectors. The company operates through enX Equipment, enX Fleet, and enX Petrochemicals segments. The enX Equipment segment provides distribution, rental, and value added services for industrial and materials handling equipment; manufactures, installs, and maintains diesel generators, and distributes various industrial and marine engines, as well as provides temporary power; and distributes professional woodworking equipment, and tooling and edging products, as well as provides associated services, such as blade sharpening and equipment maintenance services. This segment also distributes forklifts, BT warehousing equipment, konecranes heavy duty forklifts, container handling equipment, terminal tractors, batteries and chargers, industrial cleaning equipment, and truck mounted cranes. The enX Petrochemicals segment produces and markets oil lubricants and greases; and distributes plastics, polymers, rubber, and specialty chemicals. The enX Fleet segment provides leasing, fleet management, outsourcing solutions, maintenance, warranty management and vehicle tracking solutions. This segment also offers fleet management solutions for commercial vehicle fleet owners and logistics solutions. It has operations in South Africa, sub-Saharan Africa, the United Kingdom, and Ireland. The company was formerly known as Austro Group Limited and changed its name to enX Group Limited in January 2015. enX Group Limited was founded in 2007 and is based in Johannesburg, South Africa.",ZAC,Industrials,Capital Goods,Machinery,JNB,XJSE,Johannesburg Stock Exchange,South Africa,,Johannesburg,1600,http://www.enxgroup.co.za,,,,BBG000C138F6,BBG000C137V0,BBG001SKLNB6,False
EOH.JO,EOH Holdings Limited,"EOH Holdings Limited provides information and communications technology (ICT) services in South Africa, rest of Africa, Europe, and the Middle East. The company offers industry consulting, IT services, systems integration, software, industrial technologies, and business process outsourcing services. Its services include go-to-market solutions, network solutions, manage and operate digital industries, knowledge process outsourcing, computer software and hardware reselling, enterprise applications, application development, data analysis, cloud and security, and automation solutions. The company also offers infrastructure solutions; information services; rapid application development platform that allows the agile enterprise to build, model, and deploy multi-experience apps; and systems and services for the administration of cities. EOH Holdings Limited was incorporated in 1998 and is based in Bedfordview, South Africa.",ZAC,Information Technology,Software & Services,IT Services,JNB,XJSE,Johannesburg Stock Exchange,South Africa,,Bedfordview,2007,http://www.eoh.co.za,,,,,,,True
EPE.JO,EPE Capital Partners Ltd,"EPE Capital Partners Ltd, an investment holding company, invests in a portfolio of unlisted private equity-type investments. The company was incorporated in 2016 and is based in Ebene, Mauritius.",ZAC,Financials,Diversified Financials,Capital Markets,JNB,XJSE,Johannesburg Stock Exchange,Mauritius,,Ebene,,http://www.ethoscapital.mu,,,,BBG00DDK95B9,BBG00DDK9583,BBG00DDK9592,False
EPP.JO,EPP N.V.,"EPP N.V. operates as a real estate investment company in Poland. It operates through two segments, Retail and Office. The company acquires, develops, and leases shopping malls and offices. It operates a portfolio of 25 retail and 6 office properties, as well as 1 mixed-use development project with a total leasable area of approximately 1,000,000 square meters in Warsaw. The company was formerly known as Echo Polska Properties N.V. and changed its name to EPP N.V. in May 2018. EPP N.V. was incorporated in 2016 and is based in Amsterdam, the Netherlands.",ZAC,Real Estate,Real Estate,Real Estate Management & Development,JNB,XJSE,Johannesburg Stock Exchange,Netherlands,,Amsterdam,1082 MA,http://www.epp-poland.com,,,,,,,False
EPS.JO,Eastern Platinum Limited,"Eastern Platinum Limited, together with its subsidiaries, engages in the mining, exploration, and development of platinum group metal (PGM) and chrome properties in South Africa. Its PGM deposits include platinum, palladium, rhodium, osmium, iridium, and ruthenium. The company principally holds interests in the Crocodile River Mine located on the western limb and the Kennedy's Vale project on the eastern limb of Bushveld Complex (BCX); a 87% interest in the Mareesburg project situated on the eastern limb of the BCX; and a 93.4% interest in the Spitzkop project located on the eastern limb of the BCX. Eastern Platinum Limited was founded in 1989 and is headquartered in Vancouver, Canada.",ZAC,Materials,Materials,Metals & Mining,JNB,XJSE,Johannesburg Stock Exchange,Canada,BC,Vancouver,V6E 4A2,http://eastplats.com,Nano Cap,,,BBG000Q8K0H2,BBG000Q8JZ32,BBG001SFXK75,False
EQU.JO,Equites Property Fund Limited,"Equites is a listed Real Estate Investment Trust (ÂREITÂ) with a focus on owning and developing modern, well-located logistics properties let to A-grade tenants on long-dated leases. Equites has established itself as a leading owner and developer of high-quality logistics assets in SA and the UK and is the only specialist logistics REIT listed on the JSE. This gives shareholders pure exposure to an asset class that is expected to outperform over time.",ZAC,Real Estate,Real Estate,Equity Real Estate Investment Trusts (REITs),JNB,XJSE,Johannesburg Stock Exchange,South Africa,,Cape Town,8001,http://www.equites.co.za,,,,BBG006MC2360,BBG006MC2342,BBG006MC2351,False
ETFRHO.JO,RH,"RH, together with its subsidiaries, operates as a retailer in the home furnishings. It offers products in various categories, including furniture, lighting, textiles, bathware, dÃ©cor, outdoor and garden, and child and teen furnishings. The company provides its products through its retail galleries; and Source Books, a series of catalogs, as well as online through rh.com, rhbabyandchild.com, rhteen.com, and rhmodern.com, as well as waterworks.com. As of January 30, 2021, it operated a total of 68 RH Galleries and 38 RH outlet stores in 31 states in the District of Columbia and Canada, as well as 14 Waterworks showrooms throughout the United States and the United Kingdom. The company was formerly known as Restoration Hardware Holdings, Inc. and changed its name to RH in January 2017. RH was incorporated in 2011 and is headquartered in Corte Madera, California.",ZAC,Consumer Discretionary,Retailing,Specialty Retail,JNB,XJSE,Johannesburg Stock Exchange,United States,CA,Corte Madera,94925,http://www.rh.com,Large Cap,,962166104,,,,False
ETO.JO,Etion Limited,"Etion Limited provides original design manufacturing, safety and productivity, digital network, and cyber security solutions in South Africa, Australia, the rest of Africa, and the Middle East. The company designs, develops, and manufactures various electronic and digital technologies for external customers; and develops customized and generic electronic subsystems, as well as products for clients in the aerospace and defense, cyber security, mining, industrial, and transportation sectors. It also provides digital safety and environment management systems that include IoT devices and custom software for transport and logistics, mining, and energy sectors; and offers asset management and maintenance services. In addition, the company offers connectivity and communications products and solutions for fiber and wireless deployment, data and digital radio communications networks, network monitoring, and power-related infrastructure, as well as services for data center environments; and cybersecurity solutions and services, such as SSL certificates and certificate management systems, FIDO certified strong authentication, digital signature and approval solutions, managed public key infrastructure, biometric enrolment and matching systems, and insider threat prevention solutions. The company was formerly known as Ansys Limited. Etion Limited was founded in 1987 and is headquartered in Centurion, South Africa.",ZAC,Information Technology,Technology Hardware & Equipment,"Electronic Equipment, Instruments & Components",JNB,XJSE,Johannesburg Stock Exchange,South Africa,,Centurion,157,http://www.etion.co.za,,,,,,,False
EUZ.JO,Europa Metals Limited,"Europa Metals Limited engages in the exploration for mineral properties. Its flagship project is the Toral lead, zinc, silver project located in the province of Castilla y LeÃ³n, north west Spain. The company was formerly known as Ferrum Crescent Limited and changed its name to Europa Metals Limited in June 2018. Europa Metals Limited is based in Perth, Australia.",ZAC,Materials,Materials,Metals & Mining,JNB,XJSE,Johannesburg Stock Exchange,Australia,WA,Perth,6000,http://www.europametals.com,,,,BBG0027R38P0,BBG0027R38N2,BBG001SMQJ35,False
EXX.JO,Exxaro Resources Ltd.,"Exxaro Resources Limited engages in coal, iron ore investment, pigment manufacturing, and renewable energy businesses in South Africa, Europe, the United States, and Asia. The company produces thermal coal, metallurgical coal, and semi-soft coking coal products primarily in the Waterberg and Mpumalanga regions; offers gas-atomised ferrosilicon for use in separation plants, as well as iron ore; and operates two wind farms. It also owns 26% interest in the Black Mountain zinc project located in the Northern Cape. The company was formerly known as Kumba Iron Ore Limited and changed its name to Exxaro Resources Limited in November 2006. The company is headquartered in Centurion, South Africa.",ZAC,Materials,Materials,Metals & Mining,JNB,XJSE,Johannesburg Stock Exchange,South Africa,,Centurion,157,http://www.exxaro.com,,ZAE000084992,,BBG000CF7Z98,BBG000CF7XY5,BBG001SB79Z7,False
FAETNC.JO,FNB ETN on FACEBC SEP25,,ZAC,,,,JNB,XJSE,Johannesburg Stock Exchange,,,,,,,,,,,,False
FAETNQ.JO,FNB ETN on FACEBQ SEP25,,ZAC,,,,JNB,XJSE,Johannesburg Stock Exchange,,,,,,,,,,,,False
FBR.JO,Famous Brands Limited,"Famous Brands Limited, through its subsidiaries, operates as a branded quick service, fast casual, and casual dining restaurant franchisor. The company operates franchised, master license, and company-owned restaurants. It operates a portfolio of 24 brands represented through a franchise network of 2,898 restaurants in South Africa, the rest of Africa, the Middle East, and the United Kingdom. It also manufactures and supplies food or other products to franchisees or customers; and provides logistics services. The company was formerly known as Steers Holdings Limited and changed its name to Famous Brands Limited in 2004. Famous Brands Limited was incorporated in 1969 and is headquartered in Midrand, South Africa.",ZAC,Consumer Discretionary,Consumer Services,"Hotels, Restaurants & Leisure",JNB,XJSE,Johannesburg Stock Exchange,South Africa,,Midrand,,http://www.famousbrands.co.za,,,,BBG000F2M147,BBG000F2M0C0,BBG001S8GG79,False
FDETNC.JO,FNB ETN on FORDC NOV25,,ZAC,,,,JNB,XJSE,Johannesburg Stock Exchange,,,,,,,,,BBG00YCJG2J8,BBG00YCJG2H0,BBG00YCJG2L5,False
FDETNQ.JO,FNB ETN on FORDQ NOV25,,ZAC,,,,JNB,XJSE,Johannesburg Stock Exchange,,,,,,,,,BBG00YCJHYP0,BBG00YCJHYN2,BBG00YCJHYR8,False
FFA.JO,Fortress REIT Limited,"Fortress was listed on 22 October 2009 on the main board of the Johannesburg Stock Exchange Limited as a property loan stock company. It listed with an initial market capitalisation of R1.8 billion, making it the largest initial listing in the listed property sector. Fortress converted to a Real Estate Investment Trust REIT on 1 July 2013. Fortress is a hybrid fund, investing in both direct property as well as other listed property stocks and REITs. It focusses on the development of prime real estate logistics assets as well as investments into its retail portfolio. Currently Fortress portfolio includes industrial, logistics, office, retail and other properties.",ZAC,Real Estate,Real Estate,Equity Real Estate Investment Trusts (REITs),JNB,XJSE,Johannesburg Stock Exchange,South Africa,,Morningside,2196,http://www.fortressfund.co.za,,,,,,,False
FFB.JO,Fortress REIT Limited,"Fortress REIT Limited is a South African real estate investment trust (REIT) that invests in a diversified portfolio of logistics and industrial properties in South Africa and Central and Eastern Europe. The company's portfolio includes logistics facilities, warehouses, and retail properties. The company is headquartered in Johannesburg, South Africa.",ZAC,Real Estate,Real Estate,,JNB,XJSE,Johannesburg Stock Exchange,Malaysia,,,,,,,,,,,False
FGL.JO,Finbond Group Limited,"Finbond Group Limited operates as a financial services institution in South Africa and North America. It operates through Investment Products, Lending, Property Investment, and Transactional Banking segments. The company offers short-term unsecured and secured lending services, as well as insurance, credit, and savings and investment products. It also provides Internet banking services. Finbond Group Limited was incorporated in 2001 and is based in Pretoria, the Republic of South Africa.",ZAC,Financials,Banks,Thrifts & Mortgage Finance,JNB,XJSE,Johannesburg Stock Exchange,South Africa,,Pretoria,181,http://www.finbondlimited.co.za,,,,BBG000QPKYF2,BBG000QPKXW5,BBG001SSFR54,False
FNBGSA.JO,UBS FNBGSA 18Mar25,,ZAC,,,,JNB,XJSE,Johannesburg Stock Exchange,,,,,,,,,,,,False
FNBGSE.JO,UBS FNBGSE 18Mar25,,ZAC,,,,JNB,XJSE,Johannesburg Stock Exchange,,,,,,,,,,,,False
FRK02.JO,FRK BOND GOLD 12AUG2024,,ZAC,,,,JNB,XJSE,Johannesburg Stock Exchange,,,,,,,,,,,,False
FSR.JO,FirstRand Limited,"FirstRand Limited, together with its subsidiaries, provides banking, transactional, lending, insurance, and investment products and services to retail, commercial, corporate, and public sector customers primarily in South Africa, rest of Africa, and the United Kingdom. The company offers personal loans and short-term insurance; asset and invoice finance, as well as SME commercial, residential, and buy-to-let mortgages; and vehicle finance, installment credit and fleet management, and corporate and investment banking services. It also provides asset management, as well as vehicle-related insurance services. FirstRand Limited was founded in 1998 and is based in Sandton, South Africa.",ZAC,Financials,Banks,Banks,JNB,XJSE,Johannesburg Stock Exchange,South Africa,,Sandton,2196,http://www.firstrand.co.za,Large Cap,,,BBG000BNTS67,BBG000BNTRR6,BBG001S8F0C9,False
FSRP.JO,FirstRand Limited,"FirstRand Limited, together with its subsidiaries, provides banking, transactional, lending, insurance, and investment products and services to retail, commercial, corporate, and public sector customers primarily in South Africa, rest of Africa, and the United Kingdom. The company offers personal loans and short-term insurance; asset and invoice finance, as well as SME commercial, residential, and buy-to-let mortgages; and vehicle finance, installment credit and fleet management, and corporate and investment banking services. It also provides asset management, as well as vehicle-related insurance services. FirstRand Limited was founded in 1998 and is based in Sandton, South Africa.",ZAC,Financials,Banks,Banks,JNB,XJSE,Johannesburg Stock Exchange,South Africa,,Sandton,2196,http://www.firstrand.co.za,Large Cap,,,,,,False
FVT.JO,Fairvest Property Holdings Limited,"Fairvest Property Holdings Limited is a property investment holding company and Real Estate Investment Trust (""REIT""), with a unique focus on retail assets weighted toward non-metropolitan and rural shopping centres, as well as convenience and community shopping centres servicing the lower-LSM market, in high-growth nodes close to commuter networks.",ZAC,Real Estate,Real Estate,Equity Real Estate Investment Trusts (REITs),JNB,XJSE,Johannesburg Stock Exchange,South Africa,,Cape Town,8001,http://fairvest.co.za,,,,,,,False
GFI.JO,Gold Fields Limited,"Gold Fields Limited operates as a gold producer with reserves and resources in Chile, South Africa, Ghana, Australia, and Peru. The company also explores for copper deposits. It holds interests in 9 operating mines with an annual gold-equivalent production of approximately 2.24 million ounces, as well as gold mineral reserves of approximately 52.1 million ounces and mineral resources of approximately 116.0 million ounces. Gold Fields Limited was founded in 1887 and is based in Sandton, South Africa.",ZAC,Materials,Materials,Metals & Mining,JNB,XJSE,Johannesburg Stock Exchange,South Africa,,Sandton,2196,http://www.goldfields.com,Mid Cap,,,BBG000G5S250,BBG000G5S1N2,BBG001S61SX4,False
GIVISA.JO,NewFunds S&amp;P GIVI SA Top 50 Exchange Traded Fund,,ZAC,Financials,Diversified Financials,,JNB,XJSE,Johannesburg Stock Exchange,,,,,,,,,,,,False
GLD.JO,NewGold Debentures,NewGold Debentures is a debt instrument listed on the Johannesburg Stock Exchange. These debentures are backed by physical gold holdings. They provide investors with exposure to gold price movements without directly owning physical gold.,ZAC,Financials,Diversified Financials,,JNB,XJSE,Johannesburg Stock Exchange,Canada,,,,,,,,,,,False
GLI.JO,Go Life International Limited,"Go Life International Limited, a healthcare company, distributes health products focusing on the nutraceuticals and cosmeceuticals markets in South Africa and internationally. It also offers pharmaceutical and generic products, medical consumables, and hospital equipment. In addition, the company operates four frail care centers in the Western Cape. Further, it is involved in the investment and holding activities. The company sells its products through stockists and an online shop. The company was formerly known as Go Life International PCC and changed its name to Go Life International Ltd in March 2015. Go Life International Ltd was founded in 2005 and is headquartered in Knysna, South Africa.",ZAC,Health Care,"Pharmaceuticals, Biotechnology & Life Sciences",Pharmaceuticals,JNB,XJSE,Johannesburg Stock Exchange,South Africa,,Knysna,6571,http://golife.co.za,,,,,,,True
