symbol,name,summary,currency,sector,industry_group,industry,exchange,mic,market,country,state,city,zipcode,website,market_cap,isin,cusip,figi,composite_figi,shareclass_figi,delisted
PPH.JO,Pepkor Holdings Ltd.,"Pepkor Holdings Limited, together with its subsidiaries, operates as a retailer focusing on discount, value, and specialized goods in Angola, Botswana, eSwatini, Lesotho, Mozambique, Malawi, Namibia, Nigeria, South Africa, and Zambia. The company offers clothing products, general merchandise, household goods, furniture, appliances, consumer electronics, cellular products and services, financial, and fintech services. As of September 30, 2020, it operated approximately 5,254 stores. The company was formerly known as Steinhoff Africa Retail Limited and changed its name to Pepkor Holdings Limited in August 2018. Pepkor Holdings Limited was founded in 2017 and is based in Cape Town, South Africa. Pepkor Holdings Limited is a subsidiary of Steinhoff International Holdings N.V.",ZAC,Consumer Discretionary,Consumer Durables & Apparel,Household Durables,JNB,XJSE,Johannesburg Stock Exchange,South Africa,,Cape Town,7493,http://www.pepkor.co.za,,ZAE000259479,,BBG00HDGJ2C4,BBG00HDGJ2B5,BBG00HDGJ2D3,False
PPR.JO,Putprop Limited,"Putprop Limited operates as a property investment company in South Africa. The company operates through Industrial, Retail, and Commercial segments. It invests in industrial, commercial, and retail properties. As of June 30, 2020, the company had a portfolio of 14 properties with a gross lettable area of 68,553 square meters located primarily in the Johannesburg and Pretoria metropolitan areas of Gauteng. The company was formerly known as Putco Properties Limited and changed its name to Putprop Limited in 2006. Putprop Limited is based in Johannesburg, South Africa. Putprop Limited is a subsidiary of Carleo Enterprises Proprietary Limited.",ZAC,Real Estate,Real Estate,Real Estate Management & Development,JNB,XJSE,Johannesburg Stock Exchange,South Africa,,Johannesburg,2196,http://www.putprop.co.za,,,,BBG000BFLPC1,BBG000BFLP22,BBG001S7KK95,True
PRX.JO,Prosus N.V.,"Prosus N.V. engages in the e-commerce and internet businesses. It operates internet platforms, such as classifieds, payments and fintech, food delivery, travel, education, etail, health, social, and other internet platforms. It has operations in the Americas, Africa, Central and Eastern Europe, and Asia. The company was formerly known as Myriad International Holdings N.V. and changed its name to Prosus N.V. in August 2019. Prosus N.V. is headquartered in Amsterdam, the Netherlands. Prosus N.V. is a subsidiary of Naspers Limited.",ZAC,Communication Services,Telecommunication Services,Diversified Telecommunication Services,JNB,XJSE,Johannesburg Stock Exchange,Netherlands,,Amsterdam,1082 MS,http://www.prosus.com,Large Cap,US74365P1084,74365P108,BBG00PBGC2T7,BBG00PBGC2S8,BBG00NQKSQ35,False
QFH.JO,Quantum Foods Holdings Ltd,"Quantum Foods Holdings Ltd engages in the feed and poultry business in South African and rest of African markets. The company operates through Eggs, Farming, and Animal Feeds segments. It produces and distributes eggs; and sells layer parent stock, hatching eggs, day-old pullets, and point-of-lay hens under the Bergvlei Chicks brand. The company also supplies livestock to abattoirs; produces day-old commercial broiler chicks from hatcheries; and produces and sells various feeds, including broiler, layer, dairy, sheep, cattle, ostrich, and pig feeds under the Nova Feeds brand. In addition, it sells its products under the Bellevue Chicks, Safe Eggs, Nulaid, Quantum, Mega Eggs, and Galovos brand names. The company was incorporated in 2013 and is headquartered in Wellington, South Africa.",ZAC,Consumer Staples,Household & Personal Products,Household Products,JNB,XJSE,Johannesburg Stock Exchange,South Africa,,Wellington,7655,http://quantumfoods.co.za,,,,BBG007374V48,BBG007374V20,BBG007374V39,False
QLT.JO,Quilter plc,"Quilter plc provides advice-led investment solutions and investment platforms in the United Kingdom and internationally. The company operates in two segments, Advice and Wealth Management, and Wealth Platforms. The Advice and Wealth Management segment develops and manages various investment solutions in the form of funds. It also offers discretionary investment management services to affluent and high-net worth customers, charities, companies, and institutions; and mortgage and financial planning advice, and financial solutions for individuals and businesses. The Wealth Platforms segment engages in the provision of investment platform for advice-based wealth management products and services; and cross-border business, focusing on high net worth and affluent local customers and expatriates. Quilter plc was incorporated in 2007 and is based in London, the United Kingdom.",ZAC,Financials,Diversified Financials,Capital Markets,JNB,XJSE,Johannesburg Stock Exchange,United Kingdom,,London,EC4V 4AB,http://www.quilter.com,,GB00BNHSJN34,,BBG00KWX30Y6,BBG00KWX30X7,BBG007NFYZ19,False
RACP.JO,RECM and Calibre Limited,"RECM and Calibre Limited is a principal investment firm specializing in investments in publicly-listed or unlisted companies. The firm seeks to invest in any geography (onshore or offshore) and prefer investing in operating business entities, rather than structures or assets. It typically acquires minority stakes in the firm. RECM and Calibre Limited was founded in 2009 and is based in Claremont, South Africa.",ZAC,Financials,Diversified Financials,Capital Markets,JNB,XJSE,Johannesburg Stock Exchange,South Africa,,Cape Town,7700,http://www.racltd.co.za,,,,,,,False
RBP.JO,Royal Bafokeng Platinum Limited,"Royal Bafokeng Platinum Limited, together with its subsidiaries, engages in mining and producing platinum group metals in South Africa. The company explores for platinum, palladium, rhodium, iridium, osmium, ruthenium, gold, nickel, copper, and cobalt. Its operations include the Bafokeng Rasimone Platinum mine (BRPM), which consists of a North and South shaft; Styldrift; the BRPM Concentrator complex; and the Maseve concentrator plant. The company also completed a pre-feasibility study on its Styldrift II exploration project to the east of Styldrift. Royal Bafokeng Platinum Limited was incorporated in 2008 and is based in Johannesburg, the South Africa.",ZAC,Materials,Materials,Metals & Mining,JNB,XJSE,Johannesburg Stock Exchange,South Africa,,Johannesburg,2021,http://www.bafokengplatinum.co.za,,ZAE000149936,,BBG0017SV8F0,BBG0017SV8D2,BBG001TCS5L4,False
RBX.JO,Raubex Group Limited,"Raubex Group Limited operates in the construction industry in South Africa and internationally. The company operates in three segments: Materials, Roads and Earthworks, and Infrastructure. The Materials segment operates commercial quarry, which supplies aggregates; contract crushing; and materials handling and processing services for the mining industry. The Roads and Earthworks segment is involved in the road construction and earthworks, and surfacing and rehabilitation activities, including the manufacturing and laying of asphalt, chip and spray, surface dressing, enrichments, and slurry seals, as well as the manufacture and distribution of value added bituminous products. The Infrastructure segment undertakes infrastructure projects, such as renewable energy, rail, telecommunications, pipeline construction, housing infrastructure, and commercial building refurbishment and construction projects. Raubex Group Limited was founded in 1974 and is headquartered in Bloemfontein, South Africa.",ZAC,Industrials,Capital Goods,Construction & Engineering,JNB,XJSE,Johannesburg Stock Exchange,South Africa,,Bloemfontein,9300,http://www.raubex.com,,,,BBG000HTXQZ5,BBG000HTXPZ7,BBG001SP9DF7,False
RCL.JO,RCL Foods Limited,"RCL Foods Limited, through its subsidiaries, engages in the food business in South Africa and other African countries. The company operates through Food and Logistics divisions. It provides grocery products, pies, beverages, flour, mill bake products and specialty baking products, chicken products, sugar, and animal feed products. The company sells its products primarily under the Nola, Number 1, Selati, Bobtail, Catmor, Ouma, Rainbow Simply Chicken, Monati, Canine Cuisine, and EPOL brand names. RCL Foods Limited also provides sales, supply chain intelligence, warehousing, distribution, import/export, and credit management solutions. The company was formerly known as Rainbow Chicken Limited and changed its name to RCL Foods Limited in August 2013. The company was founded in 1960 and is headquartered in Durban, South Africa. RCL Foods Limited is a subsidiary of Remgro Limited.",ZAC,Consumer Staples,Food & Staples Retailing,Food & Staples Retailing,JNB,XJSE,Johannesburg Stock Exchange,South Africa,,Durban,3629,http://www.rclfoods.com,,,,,,,False
RDF.JO,Redefine Properties Limited,"Redefine is a leading South African-based, internally managed Real Estate Investment Trust (REIT), with the primary goal of growing and improving cash flow to deliver quality earnings that will underpin growth in distributions and sustained value creation for all stakeholders. We are listed on the Johannesburg Stock Exchange (JSE). We actively manage a diversified property asset platform with a value of R81.0 billion, comprising local and international property assets. Our shares are among the most actively traded on the JSE, making them a highly liquid, single-entry point for gaining the exposure to quality domestic properties, and a spread of international commercial real estate markets. We differentiate ourselves by placing people at the heart of what we do.",ZAC,Real Estate,Real Estate,Equity Real Estate Investment Trusts (REITs),JNB,XJSE,Johannesburg Stock Exchange,South Africa,,Johannesburg,2196,http://www.redefine.co.za,,ZAE000190252,,BBG000CC6G34,BBG000CC6FR0,BBG001SDXQD0,False
REA.JO,Rebosis Property Fund Limited,Rebosis is a JSE listed real estate investment trust (REIT) with a high quality diversified portfolio across commercial and retail assets. The majority of the commercial income enjoys a sovereign underpin from leases to national government departments across 36 buildings. Its retail portfolio has a mix of shopping centres including Port Elizabeth (Baywest Mall) and Centurion (Forest Hill City).,ZAC,Real Estate,Real Estate,Equity Real Estate Investment Trusts (REITs),JNB,XJSE,Johannesburg Stock Exchange,South Africa,,Bryanston,2191,http://www.rebosis.co.za,,,,BBG00GFMNX29,BBG00GFMNX10,BBG00GFMNX38,False
REB.JO,Rebosis Property Fund Limited,Rebosis is a JSE listed real estate investment trust (REIT) with a high quality diversified portfolio across commercial and retail assets. The majority of the commercial income enjoys a sovereign underpin from leases to national government departments across 36 buildings. Its retail portfolio has a mix of shopping centres including Port Elizabeth (Baywest Mall) and Centurion (Forest Hill City).,ZAC,Real Estate,Real Estate,Equity Real Estate Investment Trusts (REITs),JNB,XJSE,Johannesburg Stock Exchange,South Africa,,Bryanston,2191,http://www.rebosis.co.za,,,,BBG001P1VGQ9,BBG001P1VGP0,BBG001V183F9,False
REM.JO,Remgro Limited,"Remgro Limited is a principal investment firm. The firm prefers to invest in financial services, food, liquor and home care, banking, insurance, industrial, healthcare, infrastructure, information technology infrastructure services, media, and sport. It considers investments in Africa, UAE, UK, Switzerland and other international countries though investee companies. The firm typically invests in companies with significant influence and board representation. It mainly focuses on the provision of support rather than on being involved in the day-to-day management of business units of investees. Remgro Limited was founded in 1948 and is based in Stellenbosch, South Africa.",ZAC,Financials,Diversified Financials,Capital Markets,JNB,XJSE,Johannesburg Stock Exchange,South Africa,,Stellenbosch,7600,http://www.remgro.com,Mid Cap,,,BBG000C55RJ9,BBG000C55QN6,BBG001SG1K14,False
REN.JO,Renergen Limited,"Renergen Limited, an investment holding company, engages in the alternative and renewable energy businesses in South Africa and sub-Saharan Africa. The company explores for, develops, and sells compressed natural gas, as well as liquefied helium and natural gas. Renergen Limited was founded in 2014 and is based in Johannesburg, South Africa.",ZAC,Financials,Diversified Financials,Capital Markets,JNB,XJSE,Johannesburg Stock Exchange,South Africa,,Johannesburg,2196,http://www.renergen.co.za,,,,BBG009BQBW16,BBG009BQBW07,BBG009BQBVZ1,True
RES.JO,Resilient REIT Limited,"Resilient is a Real Estate Investment Trust (REIT) which has been listed on the Johannesburg stock exchange since December 2002. It owns a portfolio of dominant regional malls and shopping centres tenanted predominantly by national retailers. Resilient continues to develop retail centres which are both quality and yield enhancing. Strict criteria are applied in evaluating target investments including the presence of at least three national anchor tenants and major national retail groups occupying in excess of 70% of the lettable area. In addition, Resilient owns a portfolio of listed and offshore property-related assets. Resilient is internally asset managed with property management being outsourced to independent property management companies.",ZAC,Real Estate,Real Estate,Equity Real Estate Investment Trusts (REITs),JNB,XJSE,Johannesburg Stock Exchange,South Africa,,Rivonia,2191,http://www.resilient.co.za,,,,BBG000CL4BK8,BBG000CL49R6,BBG001SFJMM0,False
RFG.JO,RFG Holdings Limited,"RFG Holdings Limited manufactures and markets convenience meal solutions in South Africa and the Kingdom of Eswatini. The company operates through Regional and International segments. It offers canned fruits, jams, vegetables, meat products, fruit juices, fruit purees and concentrates, dry packed foods, fresh and frozen ready meals, pies, pastries, bakery, salads, canned pineapple, tomato paste, canned tomatoes, vegetable puree, citrus fruit products, custards, spices, and gravy and cook-in sauces. In addition, the company provides jelly, crispy coatings, vegetable protein, curries, breyanis, soya, infant meals, and dairy products, as well as a range of food/household ingredients. It provides its products under the Rhodes, Bull Brand, Bisto, Hinds, Pakco, Hazeldene, Woza Woza, Buffalo, Magpie, Gold Dish, Wilde, Zing, Trout Hall, Trotters, Southern Coating, Wild Fruit Juice, and Rhodes Squish brands. The company was formerly known as Rhodes Food Group Holdings Limited and changed its name to RFG Holdings Limited in April 2020. RFG Holdings Limited was founded in 1897 and is headquartered in Cape Town, South Africa.",ZAC,Consumer Staples,Food & Staples Retailing,Food & Staples Retailing,JNB,XJSE,Johannesburg Stock Exchange,South Africa,,Cape Town,7680,http://www.rfg.com,,IT0005466963,,,BBG013966039,,False
RHB.JO,RH,"RH, together with its subsidiaries, operates as a retailer in the home furnishings. It offers products in various categories, including furniture, lighting, textiles, bathware, dÃ©cor, outdoor and garden, and child and teen furnishings. The company provides its products through its retail galleries; and Source Books, a series of catalogs, as well as online through rh.com, rhbabyandchild.com, rhteen.com, and rhmodern.com, as well as waterworks.com. As of January 30, 2021, it operated a total of 68 RH Galleries and 38 RH outlet stores in 31 states in the District of Columbia and Canada, as well as 14 Waterworks showrooms throughout the United States and the United Kingdom. The company was formerly known as Restoration Hardware Holdings, Inc. and changed its name to RH in January 2017. RH was incorporated in 2011 and is headquartered in Corte Madera, California.",ZAC,Consumer Discretionary,Retailing,Specialty Retail,JNB,XJSE,Johannesburg Stock Exchange,United States,CA,Corte Madera,94925,http://www.rh.com,Large Cap,,962166104,,,,False
RLO.JO,Reunert Limited,"Reunert Limited operates in the fields of electrical engineering, information communication technologies (ICT), and applied electronics in South Africa, Australia, Lesotho, South Asia, the United States, and Zambia. The company's Electrical Engineering segment designs, manufactures, installs, and maintains power cables; copper and optical fiber telecommunications cables and cable ducts; low-voltage electrical distribution, protection, and control equipment; copper casted rods; and overhead aluminum conductors. It serves mining, utilities, municipalities, government and state-owned entities (SOEs), and building industries. Its ICT segment provides multi-functional printer devices, managed print software and solutions, production printing devices, document management solutions, smart solutions, surveillance and access controls, and telephony and connectivity solutions; and asset-backed financial solutions. This segment also provides voice, data, and hosted services through fixed-line and wireless access circuits; cloud-based virtual private branch exchange services; network telecommunications services; converged enterprise network and communications solutions; and hosted call recording, geographic number portability, and business Internet access products. It serves corporate and retail customers, small and medium-sized enterprises, and government and SOEs. The company's Applied Electronics segment offers search and tracking radar systems and subsystems; secure communication systems; secure network-centric solutions; cryptographic products and solutions; electronic components; remote controlled stabilized weapons platforms; energy engineering and storage solutions; and robotics systems. It serves corporates, municipalities, governments, SOEs, local and international defense forces, and mining houses. The company was founded in 1888 and is headquartered in Johannesburg, South Africa.",ZAC,Industrials,Capital Goods,Electrical Equipment,JNB,XJSE,Johannesburg Stock Exchange,South Africa,,Johannesburg,2191,http://www.reunert.com,Small Cap,,,BBG000BFN0P0,BBG000BFN0B5,BBG001S7KRQ1,False
RMH.JO,RMB Holdings Limited,"RMB Holdings Limited, an investment holding company, invests in financial services businesses primarily in South Africa. The company was founded in 1987 and is headquartered in Sandton, South Africa.",ZAC,Financials,Banks,Banks,JNB,XJSE,Johannesburg Stock Exchange,South Africa,,Sandton,2196,http://www.rmh-online.co.za,,,,BBG000BFGXJ3,BBG000BFGX85,BBG001S7K990,False
RMI.JO,Rand Merchant Investment Holdings Limited,"Rand Merchant Investment Holdings Limited, an investment holding company, provides a range of financial products and services in South Africa, Australia, New Zealand, and the United Kingdom. It offers financial services to the healthcare, life insurance, short-term insurance, savings and investment, wellness, and banking markets primarily under the Discovery Health, Discovery Life, Discovery Invest, Discovery Insure, Discovery Card, Discovery Vitality, Discovery Bank, VitalityHealth, VitalityLife, Vitality Invest, and Ping An Health, as well as Hastings, OUTsurance, Momentum, and Metropolitan brand names. The company provides long- and short-term insurance, asset management, savings, investment, healthcare administration, and employee benefits services to corporate and individual clients, as well as small and medium enterprises. In addition, it offers personal lines and business, life and funeral, and commercial line, as well as death, disability, and critical illness insurance. The company was formerly known as Rand Merchant Insurance Holdings Limited and changed its name to Rand Merchant Investment Holdings Limited in January 2016. Rand Merchant Investment Holdings Limited was founded in 1977 and is headquartered in Sandton, South Africa.",ZAC,Financials,Insurance,Insurance,JNB,XJSE,Johannesburg Stock Exchange,South Africa,,Sandton,2196,http://www.rmih.co.za,,,,,,,False
RNG.JO,Randgold & Exploration Company Limited,"Randgold & Exploration Company Limited operates as an investment and exploration company in the gold mining sector in South Africa. The company was incorporated in 1992 and is based in Sandton, South Africa.",ZAC,Materials,Materials,Metals & Mining,JNB,XJSE,Johannesburg Stock Exchange,South Africa,,Sandton,2196,http://www.randgoldexp.co.za,Nano Cap,,,BBG000BFMXT5,BBG000BFMXH8,BBG001S7KR81,False
RNI.JO,Reinet Investments S.C.A.,"Reinet Investments S.C.A. operates as a securitization vehicle in Luxembourg. The company, through its subsidiary, Reinet Fund S.C.A., F.I.S., invests in assets. Reinet Investments Manager S.A. serves as the general partner of Reinet Investments S.C.A. The company was formerly known as Richemont S.A. and changed its name to Reinet Investments S.C.A. in October 2008. Reinet Investments S.C.A. was incorporated in 1979 and is based in Luxembourg City, Luxembourg.",ZAC,Financials,Diversified Financials,Capital Markets,JNB,XJSE,Johannesburg Stock Exchange,Luxembourg,,Luxembourg City,1724,http://www.reinet.com,,,,,,,False
RPL.JO,RDI REIT P.L.C.,"RDI REIT P.L.C. was incorporated in the Isle of Man on 28 June 2004 (Registered Number: 111198C) and was re-registered under the Isle of Man Companies Act 2006 on 3 December 2013 (Registered Number: 010534V).On 4 December 2013, the Company converted to a UK-REIT and transferred its tax residence from the Isle of Man to the United Kingdom (""UK"").The Company holds a primary listing on the Main Market of the London Stock Exchange (""LSE"") and a secondary listing on the Main Board of the Johannesburg Stock Exchange (""JSE"").",ZAC,Real Estate,Real Estate,Equity Real Estate Investment Trusts (REITs),JNB,XJSE,Johannesburg Stock Exchange,United Kingdom,,London,SW1Y 4NB,http://www.rdireit.com,,,,,,,False
RTN.JO,Rex Trueform Group Limited,"Rex Trueform Group Limited, through its subsidiaries, engages in the retail of clothing and accessories in South Africa. It operates through Retail, Property, and Water Infrastructure segments. The company offers ladies' and men's clothing, shoes, costume jewelry, related fashion accessories, and cosmetics through branded Queenspark outlets located in South Africa and Namibia, as well as through a Queenspark branded franchised outlet in Kenya. It also invests in properties; and has investments in a private water and wastewater utility group that operates in South Africa. The company was formerly known as Rex Trueform Clothing Company Limited and changed its name to Rex Trueform Group Limited in January 2018. The company was founded in 1937 and is based in Cape Town, South Africa. Rex Trueform Group Limited is a subsidiary of African and Overseas Enterprises Limited.",ZAC,Consumer Discretionary,Consumer Durables & Apparel,"Textiles, Apparel & Luxury Goods",JNB,XJSE,Johannesburg Stock Exchange,South Africa,,Cape Town,7925,http://www.rextrueform.com,,GB00B0YG1K06,,,,,False
RTO.JO,Rex Trueform Group Limited,"Rex Trueform Group Limited, through its subsidiaries, engages in the retail of clothing and accessories in South Africa. It operates through Retail, Property, and Water Infrastructure segments. The company offers ladies' and men's clothing, shoes, costume jewelry, related fashion accessories, and cosmetics through branded Queenspark outlets located in South Africa and Namibia, as well as through a Queenspark branded franchised outlet in Kenya. It also invests in properties; and has investments in a private water and wastewater utility group that operates in South Africa. The company was formerly known as Rex Trueform Clothing Company Limited and changed its name to Rex Trueform Group Limited in January 2018. The company was founded in 1937 and is based in Cape Town, South Africa. Rex Trueform Group Limited is a subsidiary of African and Overseas Enterprises Limited.",ZAC,Consumer Discretionary,Consumer Durables & Apparel,"Textiles, Apparel & Luxury Goods",JNB,XJSE,Johannesburg Stock Exchange,South Africa,,Cape Town,7925,http://www.rextrueform.com,,,,BBG000BFN3F5,BBG000BFN301,BBG001S7KRW4,False
S32.JO,South32 Limited,"South32 Limited operates as a diversified metals and mining company primarily in Australia, Southern Africa, North America, and South America. The company has a portfolio of assets producing alumina, aluminum, bauxite, energy and metallurgical coal, manganese ore and alloy, ferronickel, silver, lead, and zinc. It also exports its products. South32 Limited has a strategic alliance agreement with AusQuest Limited for exploration opportunity under at its Morrisey nickel-copper project. The company was formerly known as BHP Coal Holdings Pty Limited and changed its name to South32 Limited in March 2015. South32 Limited was incorporated in 2000 and is headquartered in Perth, Australia.",ZAC,Materials,Materials,Metals & Mining,JNB,XJSE,Johannesburg Stock Exchange,Australia,WA,Perth,6000,http://www.south32.net,Large Cap,,,BBG008D1YTY7,BBG008D1YTX8,BBG0070L8ZV7,False
SAC.JO,SA Corporate Real Estate Limited,"SA Corporate Real Estate Limited is a JSE-listed Real Estate Investment Trust (ÂREITÂ) which owns a diversified portfolio of quality industrial, retail, commercial and residential buildings located primarily in the major metropolitan areas of South Africa with a secondary node in Zambia. The property, excluding investment in listed shares and loans advanced, consists of 192 properties, with 1 629 105 m2 of lettable area, valued at R16.6 billion, and a 50% joint venture in three Zambian properties valued at R1.1 billion.",ZAC,Real Estate,Real Estate,Equity Real Estate Investment Trusts (REITs),JNB,XJSE,Johannesburg Stock Exchange,South Africa,,Century City,7441,http://www.sacorporatefund.co.za,,,,BBG000JJFZQ5,BBG000JJFZB1,BBG001SB6WB3,False
