symbol,name,summary,currency,sector,industry_group,industry,exchange,mic,market,country,state,city,zipcode,website,market_cap,isin,cusip,figi,composite_figi,shareclass_figi,delisted
7103.KL,Spritzer Bhd.,"Spritzer Bhd. is a Malaysia-based company engaged in the manufacturing and distribution of bottled water, sparkling water, and functional drinks. They are known for their Spritzer brand of natural mineral water. The company is headquartered in Taiping, Perak, Malaysia.",MYR,Consumer Staples,"Food, Beverage & Tobacco",,KLS,XKLS,Bursa Malaysia,,,,,,Micro Cap,,,,,,False
7105.KL,RH,"RH, together with its subsidiaries, operates as a retailer in the home furnishings. It offers products in various categories, including furniture, lighting, textiles, bathware, d√É¬©cor, outdoor and garden, and child and teen furnishings. The company provides its products through its retail galleries; and Source Books, a series of catalogs, as well as online through rh.com, rhbabyandchild.com, rhteen.com, and rhmodern.com, as well as waterworks.com. As of January 30, 2021, it operated a total of 68 RH Galleries and 38 RH outlet stores in 31 states in the District of Columbia and Canada, as well as 14 Waterworks showrooms throughout the United States and the United Kingdom. The company was formerly known as Restoration Hardware Holdings, Inc. and changed its name to RH in January 2017. RH was incorporated in 2011 and is headquartered in Corte Madera, California.",MYR,Consumer Discretionary,Retailing,Specialty Retail,KLS,XKLS,Bursa Malaysia,United States,CA,Corte Madera,94925,http://www.rh.com,Large Cap,,962166104.0,,,,False
7106.KL,RH,"RH, together with its subsidiaries, operates as a retailer in the home furnishings. It offers products in various categories, including furniture, lighting, textiles, bathware, d√É¬©cor, outdoor and garden, and child and teen furnishings. The company provides its products through its retail galleries; and Source Books, a series of catalogs, as well as online through rh.com, rhbabyandchild.com, rhteen.com, and rhmodern.com, as well as waterworks.com. As of January 30, 2021, it operated a total of 68 RH Galleries and 38 RH outlet stores in 31 states in the District of Columbia and Canada, as well as 14 Waterworks showrooms throughout the United States and the United Kingdom. The company was formerly known as Restoration Hardware Holdings, Inc. and changed its name to RH in January 2017. RH was incorporated in 2011 and is headquartered in Corte Madera, California.",MYR,Consumer Discretionary,Retailing,Specialty Retail,KLS,XKLS,Bursa Malaysia,United States,CA,Corte Madera,94925,http://www.rh.com,Large Cap,,962166104.0,,,,False
7108.KL,PERDANA,"Perdana Petroleum Berhad is a Malaysia-based company providing offshore marine support services to the oil and gas industry. Their services include vessel chartering, transportation, and accommodation for offshore personnel. The company is headquartered in Kuala Lumpur, Malaysia.",MYR,Energy,Energy,,KLS,XKLS,Bursa Malaysia,,,,,,,,,,,,False
7108PA.KL,PERDANA-PA,,MYR,,,,KLS,XKLS,Bursa Malaysia,,,,,,,,,,,,False
7113.KL,RH,"RH, together with its subsidiaries, operates as a retailer in the home furnishings. It offers products in various categories, including furniture, lighting, textiles, bathware, d√É¬©cor, outdoor and garden, and child and teen furnishings. The company provides its products through its retail galleries; and Source Books, a series of catalogs, as well as online through rh.com, rhbabyandchild.com, rhteen.com, and rhmodern.com, as well as waterworks.com. As of January 30, 2021, it operated a total of 68 RH Galleries and 38 RH outlet stores in 31 states in the District of Columbia and Canada, as well as 14 Waterworks showrooms throughout the United States and the United Kingdom. The company was formerly known as Restoration Hardware Holdings, Inc. and changed its name to RH in January 2017. RH was incorporated in 2011 and is headquartered in Corte Madera, California.",MYR,Consumer Discretionary,Retailing,Specialty Retail,KLS,XKLS,Bursa Malaysia,United States,CA,Corte Madera,94925,http://www.rh.com,Large Cap,,962166104.0,,,,False
7114.KL,D Nonce Technology Bhd,"D Nonce Technology Bhd is a Malaysia-based company involved in the manufacturing of precision plastic components and tooling. They serve various industries, including the electronics, automotive, and medical sectors. The company is headquartered in Melaka, Malaysia.",MYR,Industrials,Capital Goods,,KLS,XKLS,Bursa Malaysia,Japan,,,,,Nano Cap,,,,,,False
7115.KL,SKB Shutters Corp. Bhd,"SKB Shutters Corp. Bhd is a Malaysia-based company involved in the manufacturing and distribution of roller shutters, steel doors, and related products. They cater to residential, commercial, and industrial applications. The company is headquartered in Rawang, Selangor, Malaysia.",MYR,Industrials,Capital Goods,,KLS,XKLS,Bursa Malaysia,Japan,,,,,Nano Cap,,,,,,False
7120.KL,RH,"RH, together with its subsidiaries, operates as a retailer in the home furnishings. It offers products in various categories, including furniture, lighting, textiles, bathware, d√É¬©cor, outdoor and garden, and child and teen furnishings. The company provides its products through its retail galleries; and Source Books, a series of catalogs, as well as online through rh.com, rhbabyandchild.com, rhteen.com, and rhmodern.com, as well as waterworks.com. As of January 30, 2021, it operated a total of 68 RH Galleries and 38 RH outlet stores in 31 states in the District of Columbia and Canada, as well as 14 Waterworks showrooms throughout the United States and the United Kingdom. The company was formerly known as Restoration Hardware Holdings, Inc. and changed its name to RH in January 2017. RH was incorporated in 2011 and is headquartered in Corte Madera, California.",MYR,Consumer Discretionary,Retailing,Specialty Retail,KLS,XKLS,Bursa Malaysia,United States,CA,Corte Madera,94925,http://www.rh.com,Large Cap,,962166104.0,,,,False
7121.KL,Xian Leng Holdings Bhd,"Xian Leng Holdings Bhd is a Malaysia-based company engaged in the aquaculture and ornamental fish breeding industry. They breed, rear, and trade various types of ornamental fish for export and local markets. The company is headquartered in Tangkak, Johor, Malaysia.",MYR,Consumer Staples,"Food, Beverage & Tobacco",,KLS,XKLS,Bursa Malaysia,,,,,,Nano Cap,,,,,,False
7123.KL,RH,"RH, together with its subsidiaries, operates as a retailer in the home furnishings. It offers products in various categories, including furniture, lighting, textiles, bathware, d√É¬©cor, outdoor and garden, and child and teen furnishings. The company provides its products through its retail galleries; and Source Books, a series of catalogs, as well as online through rh.com, rhbabyandchild.com, rhteen.com, and rhmodern.com, as well as waterworks.com. As of January 30, 2021, it operated a total of 68 RH Galleries and 38 RH outlet stores in 31 states in the District of Columbia and Canada, as well as 14 Waterworks showrooms throughout the United States and the United Kingdom. The company was formerly known as Restoration Hardware Holdings, Inc. and changed its name to RH in January 2017. RH was incorporated in 2011 and is headquartered in Corte Madera, California.",MYR,Consumer Discretionary,Retailing,Specialty Retail,KLS,XKLS,Bursa Malaysia,United States,CA,Corte Madera,94925,http://www.rh.com,Large Cap,,962166104.0,,,,False
7129.KL,Asia File Corporation Bhd.,"Asia File Corporation Bhd. is a Malaysia-based company involved in the manufacturing and distribution of paper-based filing products and stationery. They produce lever arch files, box files, ring binders, and other office supplies. The company is headquartered in Johor Bahru, Johor, Malaysia.",MYR,Consumer Staples,"Food, Beverage & Tobacco",,KLS,XKLS,Bursa Malaysia,Japan,,,,,Micro Cap,,,,,,False
7130.KL,Kumpulan Powernet Bhd,"Kumpulan Powernet Bhd is involved in construction, focusing on power transmission infrastructure projects and other related engineering works, primarily in Malaysia. The company undertakes engineering, procurement, and construction (EPC) contracts. Kumpulan Powernet is headquartered in Malaysia.",MYR,Industrials,Capital Goods,,KLS,XKLS,Bursa Malaysia,Japan,,,,,Nano Cap,,,,,,False
7131.KL,ACME,"ACME Holdings Berhad, formerly known as Rohas Tecnic Berhad, is a Malaysia-based engineering and construction company. The company undertakes projects related to water infrastructure, power transmission, and telecommunications. Its headquarter is located in Kuala Lumpur, Malaysia.",MYR,Industrials,Capital Goods,,KLS,XKLS,Bursa Malaysia,Japan,,,,,,,,,,,False
7132.KL,SMIS Corp. Bhd,"SMIS Corp. Bhd is a Malaysia-based company involved in the design, manufacturing, and marketing of smart card readers, terminals, and related solutions. They cater to various sectors, including banking, transportation, and government. The company is headquartered in Kuala Lumpur, Malaysia.",MYR,Information Technology,Technology Hardware & Equipment,,KLS,XKLS,Bursa Malaysia,,,,,,Nano Cap,,,,,,False
7137.KL,RH,"RH, together with its subsidiaries, operates as a retailer in the home furnishings. It offers products in various categories, including furniture, lighting, textiles, bathware, d√É¬©cor, outdoor and garden, and child and teen furnishings. The company provides its products through its retail galleries; and Source Books, a series of catalogs, as well as online through rh.com, rhbabyandchild.com, rhteen.com, and rhmodern.com, as well as waterworks.com. As of January 30, 2021, it operated a total of 68 RH Galleries and 38 RH outlet stores in 31 states in the District of Columbia and Canada, as well as 14 Waterworks showrooms throughout the United States and the United Kingdom. The company was formerly known as Restoration Hardware Holdings, Inc. and changed its name to RH in January 2017. RH was incorporated in 2011 and is headquartered in Corte Madera, California.",MYR,Consumer Discretionary,Retailing,Specialty Retail,KLS,XKLS,Bursa Malaysia,United States,CA,Corte Madera,94925,http://www.rh.com,Large Cap,,962166104.0,,,,False
7139.KL,RH,"RH, together with its subsidiaries, operates as a retailer in the home furnishings. It offers products in various categories, including furniture, lighting, textiles, bathware, d√É¬©cor, outdoor and garden, and child and teen furnishings. The company provides its products through its retail galleries; and Source Books, a series of catalogs, as well as online through rh.com, rhbabyandchild.com, rhteen.com, and rhmodern.com, as well as waterworks.com. As of January 30, 2021, it operated a total of 68 RH Galleries and 38 RH outlet stores in 31 states in the District of Columbia and Canada, as well as 14 Waterworks showrooms throughout the United States and the United Kingdom. The company was formerly known as Restoration Hardware Holdings, Inc. and changed its name to RH in January 2017. RH was incorporated in 2011 and is headquartered in Corte Madera, California.",MYR,Consumer Discretionary,Retailing,Specialty Retail,KLS,XKLS,Bursa Malaysia,United States,CA,Corte Madera,94925,http://www.rh.com,Large Cap,,962166104.0,,,,False
7140.KL,Oka Corp. Bhd,"Oka Corp. Bhd is a Malaysia-based company that manufactures and sells precast concrete products, mainly focusing on sewerage and drainage systems. They offer a range of products like reinforced concrete pipes, box culverts, and related components used in infrastructure projects. The company is headquartered in Malaysia.",MYR,Materials,Materials,,KLS,XKLS,Bursa Malaysia,Japan,,,,,Nano Cap,,,,,,False
7145.KL,Prinsiptek Corp. Bhd,"Prinsiptek Corp. Bhd is an investment holding company with subsidiaries involved in construction, property development, and manufacturing of pre-cast concrete products. Their construction segment focuses on residential and commercial buildings, while the property development arm develops residential properties. The company is based in Malaysia.",MYR,Industrials,Capital Goods,,KLS,XKLS,Bursa Malaysia,,,,,,Nano Cap,,,,,,False
7148.KL,RH,"RH, together with its subsidiaries, operates as a retailer in the home furnishings. It offers products in various categories, including furniture, lighting, textiles, bathware, d√É¬©cor, outdoor and garden, and child and teen furnishings. The company provides its products through its retail galleries; and Source Books, a series of catalogs, as well as online through rh.com, rhbabyandchild.com, rhteen.com, and rhmodern.com, as well as waterworks.com. As of January 30, 2021, it operated a total of 68 RH Galleries and 38 RH outlet stores in 31 states in the District of Columbia and Canada, as well as 14 Waterworks showrooms throughout the United States and the United Kingdom. The company was formerly known as Restoration Hardware Holdings, Inc. and changed its name to RH in January 2017. RH was incorporated in 2011 and is headquartered in Corte Madera, California.",MYR,Consumer Discretionary,Retailing,Specialty Retail,KLS,XKLS,Bursa Malaysia,United States,CA,Corte Madera,94925,http://www.rh.com,Large Cap,,962166104.0,,,,False
7149.KL,RH,"RH, together with its subsidiaries, operates as a retailer in the home furnishings. It offers products in various categories, including furniture, lighting, textiles, bathware, d√É¬©cor, outdoor and garden, and child and teen furnishings. The company provides its products through its retail galleries; and Source Books, a series of catalogs, as well as online through rh.com, rhbabyandchild.com, rhteen.com, and rhmodern.com, as well as waterworks.com. As of January 30, 2021, it operated a total of 68 RH Galleries and 38 RH outlet stores in 31 states in the District of Columbia and Canada, as well as 14 Waterworks showrooms throughout the United States and the United Kingdom. The company was formerly known as Restoration Hardware Holdings, Inc. and changed its name to RH in January 2017. RH was incorporated in 2011 and is headquartered in Corte Madera, California.",MYR,Consumer Discretionary,Retailing,Specialty Retail,KLS,XKLS,Bursa Malaysia,United States,CA,Corte Madera,94925,http://www.rh.com,Large Cap,,962166104.0,,,,False
7152.KL,RH,"RH, together with its subsidiaries, operates as a retailer in the home furnishings. It offers products in various categories, including furniture, lighting, textiles, bathware, d√É¬©cor, outdoor and garden, and child and teen furnishings. The company provides its products through its retail galleries; and Source Books, a series of catalogs, as well as online through rh.com, rhbabyandchild.com, rhteen.com, and rhmodern.com, as well as waterworks.com. As of January 30, 2021, it operated a total of 68 RH Galleries and 38 RH outlet stores in 31 states in the District of Columbia and Canada, as well as 14 Waterworks showrooms throughout the United States and the United Kingdom. The company was formerly known as Restoration Hardware Holdings, Inc. and changed its name to RH in January 2017. RH was incorporated in 2011 and is headquartered in Corte Madera, California.",MYR,Consumer Discretionary,Retailing,Specialty Retail,KLS,XKLS,Bursa Malaysia,United States,CA,Corte Madera,94925,http://www.rh.com,Large Cap,,962166104.0,,,,False
7153.KL,Kossan Rubber Industries Bhd,"Kossan Rubber Industries Bhd is a Malaysia-based company engaged in the manufacturing and sale of rubber gloves, cleanroom products, and technical rubber products. Their gloves are used in various industries, including healthcare, while cleanroom products cater to the electronics and pharmaceutical sectors. The company is headquartered in Malaysia.",MYR,Health Care,Health Care Equipment & Services,,KLS,XKLS,Bursa Malaysia,,,,,,Small Cap,,,,,,False
7154.KL,Caely Holdings Bhd,"Caely Holdings Bhd is a Malaysia-based company primarily involved in the manufacturing, sale, and marketing of lingerie, undergarments, and apparel. They also engage in direct selling activities and operate retail outlets. The company is headquartered in Malaysia.",MYR,Consumer Discretionary,Consumer Durables & Apparel,,KLS,XKLS,Bursa Malaysia,,,,,,Nano Cap,,,,,,False
7155.KL,SKP Resources Bhd,"SKP Resources Bhd is a Malaysia-based company engaged in the manufacturing of plastic parts and components, as well as providing electronics manufacturing services (EMS). They serve various industries, including electronics, automotive, and consumer products. The company is headquartered in Malaysia.",MYR,Industrials,Capital Goods,,KLS,XKLS,Bursa Malaysia,,,,,,Small Cap,,,,,,False
7157.KL,CYL,,MYR,,,,KLS,XKLS,Bursa Malaysia,Japan,,,,,,,,,,,False
7158.KL,Scomi Group Bhd,"Scomi Group Bhd is a Malaysia-based global service provider involved in oilfield services, transport solutions, and marine services. Their oilfield services include drilling fluids and waste management, while their transport solutions involve monorail systems and rail maintenance. The company is headquartered in Malaysia.",MYR,Industrials,Capital Goods,,KLS,XKLS,Bursa Malaysia,,,,,,Nano Cap,,,,,,False
7160.KL,Pentamaster Corp. Bhd,"Pentamaster Corp. Bhd is a Malaysia-based company that designs, manufactures, and installs automated equipment and solutions for various industries, including semiconductor, automotive, and medical devices. They provide customized solutions for testing, inspection, and assembly processes. The company is headquartered in Malaysia.",MYR,Industrials,Capital Goods,,KLS,XKLS,Bursa Malaysia,,,,,,Micro Cap,,,,,,False
7161.KL,RH,"RH, together with its subsidiaries, operates as a retailer in the home furnishings. It offers products in various categories, including furniture, lighting, textiles, bathware, d√É¬©cor, outdoor and garden, and child and teen furnishings. The company provides its products through its retail galleries; and Source Books, a series of catalogs, as well as online through rh.com, rhbabyandchild.com, rhteen.com, and rhmodern.com, as well as waterworks.com. As of January 30, 2021, it operated a total of 68 RH Galleries and 38 RH outlet stores in 31 states in the District of Columbia and Canada, as well as 14 Waterworks showrooms throughout the United States and the United Kingdom. The company was formerly known as Restoration Hardware Holdings, Inc. and changed its name to RH in January 2017. RH was incorporated in 2011 and is headquartered in Corte Madera, California.",MYR,Consumer Discretionary,Retailing,Specialty Retail,KLS,XKLS,Bursa Malaysia,United States,CA,Corte Madera,94925,http://www.rh.com,Large Cap,,962166104.0,,,,False
7162.KL,RH,"RH, together with its subsidiaries, operates as a retailer in the home furnishings. It offers products in various categories, including furniture, lighting, textiles, bathware, d√É¬©cor, outdoor and garden, and child and teen furnishings. The company provides its products through its retail galleries; and Source Books, a series of catalogs, as well as online through rh.com, rhbabyandchild.com, rhteen.com, and rhmodern.com, as well as waterworks.com. As of January 30, 2021, it operated a total of 68 RH Galleries and 38 RH outlet stores in 31 states in the District of Columbia and Canada, as well as 14 Waterworks showrooms throughout the United States and the United Kingdom. The company was formerly known as Restoration Hardware Holdings, Inc. and changed its name to RH in January 2017. RH was incorporated in 2011 and is headquartered in Corte Madera, California.",MYR,Consumer Discretionary,Retailing,Specialty Retail,KLS,XKLS,Bursa Malaysia,United States,CA,Corte Madera,94925,http://www.rh.com,Large Cap,,962166104.0,,,,False
7163.KL,PJBUMI,"PJBUMI Berhad, formerly known as Pan Malaysia Holdings Berhad, is an investment holding company with interests in financial services, property development, and other businesses. The company operates through its subsidiaries and associated companies. The company is headquartered in Kuala Lumpur, Malaysia.",MYR,Financials,Diversified Financials,,KLS,XKLS,Bursa Malaysia,,,,,,,,,,,,False
7164.KL,KNM Group Bhd,"KNM Group Bhd is a Malaysia-based company engaged in engineering, procurement, construction, and commissioning (EPCC) services for the oil, gas, petrochemical, and energy industries. They manufacture process equipment and provide related services globally. The company is headquartered in Malaysia.",MYR,Energy,Energy,,KLS,XKLS,Bursa Malaysia,Japan,,,,,Micro Cap,,,,,,False
7165.KL,RH,"RH, together with its subsidiaries, operates as a retailer in the home furnishings. It offers products in various categories, including furniture, lighting, textiles, bathware, d√É¬©cor, outdoor and garden, and child and teen furnishings. The company provides its products through its retail galleries; and Source Books, a series of catalogs, as well as online through rh.com, rhbabyandchild.com, rhteen.com, and rhmodern.com, as well as waterworks.com. As of January 30, 2021, it operated a total of 68 RH Galleries and 38 RH outlet stores in 31 states in the District of Columbia and Canada, as well as 14 Waterworks showrooms throughout the United States and the United Kingdom. The company was formerly known as Restoration Hardware Holdings, Inc. and changed its name to RH in January 2017. RH was incorporated in 2011 and is headquartered in Corte Madera, California.",MYR,Consumer Discretionary,Retailing,Specialty Retail,KLS,XKLS,Bursa Malaysia,United States,CA,Corte Madera,94925,http://www.rh.com,Large Cap,,962166104.0,,,,False
7165PA.KL,,,,,,,KLS,XKLS,Bursa Malaysia,,,,,,,,,,,,False
7167.KL,Johore Tin Bhd,"Johore Tin Bhd is a Malaysia-based company primarily involved in the manufacturing of tin cans, printing of metal sheets, and the processing and sale of milk powder and related dairy products. They cater to various industries, including food and beverage. The company is headquartered in Malaysia.",MYR,Consumer Staples,"Food, Beverage & Tobacco",,KLS,XKLS,Bursa Malaysia,Japan,,,,,Nano Cap,,,,,,False
7169.KL,DOMINAN,"DOMINAN Technologies Berhad, formerly known as United U-Li Corporation Berhad, is a Malaysia-based company involved in manufacturing and distribution of cable support systems, lighting trunking, and related products. Their products are used in commercial, industrial, and infrastructure projects. The company is headquartered in Rawang, Selangor, Malaysia.",MYR,Industrials,Capital Goods,,KLS,XKLS,Bursa Malaysia,,,,,,,,,,,,False
7170.KL,LFECORP,"LFECORP Bhd, formerly known as Leader Furniture Industries Bhd, is a Malaysia-based company involved in the design, manufacturing, and marketing of furniture. The company offers a range of furniture products, including office furniture, home furniture and related furniture products. The company is headquartered in Muar, Johor, Malaysia.",MYR,Consumer Discretionary,Consumer Durables & Apparel,,KLS,XKLS,Bursa Malaysia,Japan,,,,,,,,,,,False
7170OR.KL,,,,,,,KLS,XKLS,Bursa Malaysia,,,,,,,,,,,,False
7174.KL,CAB Cakaran Corp. Bhd,"CAB Cakaran Corp. Bhd is a Malaysia-based integrated poultry farming business involved in breeder farming, broiler farming, processing and sale of chicken, and production of animal feed. The company also has interests in fast-food restaurants and other food-related businesses. It is headquartered in Malaysia.",MYR,Consumer Staples,"Food, Beverage & Tobacco",,KLS,XKLS,Bursa Malaysia,,,,,,Nano Cap,,,,,,False
7178.KL,RH,"RH, together with its subsidiaries, operates as a retailer in the home furnishings. It offers products in various categories, including furniture, lighting, textiles, bathware, d√É¬©cor, outdoor and garden, and child and teen furnishings. The company provides its products through its retail galleries; and Source Books, a series of catalogs, as well as online through rh.com, rhbabyandchild.com, rhteen.com, and rhmodern.com, as well as waterworks.com. As of January 30, 2021, it operated a total of 68 RH Galleries and 38 RH outlet stores in 31 states in the District of Columbia and Canada, as well as 14 Waterworks showrooms throughout the United States and the United Kingdom. The company was formerly known as Restoration Hardware Holdings, Inc. and changed its name to RH in January 2017. RH was incorporated in 2011 and is headquartered in Corte Madera, California.",MYR,Consumer Discretionary,Retailing,Specialty Retail,KLS,XKLS,Bursa Malaysia,United States,CA,Corte Madera,94925,http://www.rh.com,Large Cap,,962166104.0,,,,False
7179.KL,DBE Gurney Resources Bhd,"DBE Gurney Resources Bhd is a Malaysia-based investment holding company with subsidiaries involved in the poultry business, focusing on broiler farming, processing, and distribution of chicken products. They also operate a chain of restaurants and cafes. The company is headquartered in Malaysia.",MYR,Consumer Staples,"Food, Beverage & Tobacco",,KLS,XKLS,Bursa Malaysia,,,,,,Micro Cap,,,,,,False
7180.KL,Sern Kou Resources Bhd,"Sern Kou Resources Bhd is a Malaysia-based company involved in the processing and trading of timber products, including sawn timber, plywood, and veneer. They also engage in forest plantation activities and the manufacturing of wooden doors. The company is headquartered in Malaysia.",MYR,Materials,Materials,,KLS,XKLS,Bursa Malaysia,Japan,,,,,Nano Cap,,,,,,False
