symbol,name,summary,currency,sector,industry_group,industry,exchange,mic,market,country,state,city,zipcode,website,market_cap,isin,cusip,figi,composite_figi,shareclass_figi,delisted
PROF-B.ST,ProfilGruppen AB (publ),"ProfilGruppen AB (publ), together with its subsidiaries, designs, develops, manufactures, and markets customized aluminum extrusions and components primarily in Europe. The company serves interior design, construction, electronics, and automotive industries. It also exports its products. ProfilGruppen AB (publ) was founded in 1981 and is headquartered in √É¬Öseda, Sweden.",SEK,Industrials,Capital Goods,Building Products,STO,XSTO,NASDAQ OMX Stockholm,Sweden,,Aseda,364 21,http://www.profilgruppen.se,Micro Cap,,,,,,False
PROGEN-TO-1.ST,Prostatype Genomics AB TO 1,,SEK,,,,STO,XSTO,NASDAQ OMX Stockholm,,,,,,,,,,,,False
PROGEN.ST,Prostatype Genomics AB (publ),"Prostatype Genomics AB manufactures, markets, and sells the prognostic gene tests. It offers Prostatype, a gene test for prostate cancer patients. The company offers Prostatype Test System that combines gene expression information with used clinical parameters, such as PSA, Gleason Score, and Tumor Stage, as well as calculates the P-score. The test is based on database containing prostate cancer patients and provides decision support for patients and doctors when making a treatment decision. The company was founded in 2007 and is based in Solna, Sweden.",SEK,Health Care,"Pharmaceuticals, Biotechnology & Life Sciences",Biotechnology,STO,XSTO,NASDAQ OMX Stockholm,Sweden,,Solna,171 48,http://www.prostatypegenomics.com,Nano Cap,,,,,,False
PROMO.ST,Promore Pharma AB (publ),"Promore Pharma AB (publ), a biopharmaceutical company, develops therapeutic peptides for the bio-active wound care market in Sweden and internationally. Its product candidates include PXL01 that is in Phase IIa study for the prevention of post-surgical adhesions and scars, and for the prevention of dermal scars, as well as for tendon repair surgery in the hand, which is in Phase III trial; and LL-37, which is in Phase IIb clinical studies for treating patients with venous leg ulcers and for the treatment of diabetic foot ulcers. The company was formerly known as Lipopeptide AB and changed its name to Promore Pharma AB (publ) in January 2017. Promore Pharma AB (publ) was founded in 2002 and is based in Solna, Sweden.",SEK,Health Care,"Pharmaceuticals, Biotechnology & Life Sciences",Biotechnology,STO,XSTO,NASDAQ OMX Stockholm,Sweden,,Solna,171 65,http://www.promorepharma.com,Nano Cap,,,,,,False
PYRO A.ST,Pyrosequencing AB,,,,,,STO,XSTO,NASDAQ OMX Stockholm,,,,,,,,,,,,False
QAIR.ST,QleanAir Holding AB (publ),"QleanAir Holding AB (publ) provides air cleaners, cleanrooms, and solutions for protection against passive smoking worldwide. It offers products and solutions for air cleaning, including ceiling mounted and floor standing air filtration systems; smoking cabins; and room solutions, such as adaptable cleanroom solutions, and indoor and outdoor smoking-room solutions. The company was founded in 1988 and is headquartered in Solna, Sweden.",SEK,Industrials,Capital Goods,Construction & Engineering,STO,XSTO,NASDAQ OMX Stockholm,Sweden,,Solna,171 54,http://www.qleanair.com,Micro Cap,,,,,,False
QIIWI.ST,Qiiwi Games AB (publ),"Qiiwi Games AB (publ) develops games for mobile platforms, such as iOS and Android. It has strategic cooperation agreements with All3Media International to develop and publish a word game for the detective drama Midsomer Murders and a match-3 game for the reality television series Kitchen Nightmares. The company was founded in 2012 and is based in Alings√É¬•s, Sweden.",SEK,Communication Services,Media & Entertainment,Interactive Media & Services,STO,XSTO,NASDAQ OMX Stockholm,Sweden,,Alingsas,441 30,http://www.qiiwi.com,Nano Cap,,,,,,False
QLIFE.ST,Qlife Holding AB (publ),"Qlife Holding AB (publ), a high-tech medical device company, manufactures and sells in-vitro diagnostic analyzers and reagents. It offers Egoo Home System, an integrated platform consisting of a small home device and disposable capsules each of that test for a specific biomarker, as well as a digital infrastructure that shares data with patient journal or hospital platform. The company has a research agreement with Nordsj√É¬¶llands Hospital to continue the validation of the Egoo Sars-CoV-2 virus test. The company was founded in 2019 and is based in Helsingborg, Sweden.",SEK,Health Care,Health Care Equipment & Services,Health Care Technology,STO,XSTO,NASDAQ OMX Stockholm,Sweden,,Helsingborg,252 21,http://qlifeholding.com/en,Micro Cap,,,,,,False
QLINEA.ST,Q-linea AB (publ),"Q-linea AB (publ), an innovative infection diagnostics company, researches, develops, manufactures, and sells instruments and consumables for infection diagnostics in Sweden. It offers inventive systems for in vitro diagnostics systems for infectious diseases. The company's lead product candidate is ASTar, an antibiotic susceptibility testing system used for positive blood cultures. It develops and delivers solutions for healthcare providers. Q-linea AB (publ) was founded in 2008 and is headquartered in Uppsala, Sweden.",SEK,Health Care,Health Care Equipment & Services,Health Care Equipment & Supplies,STO,XSTO,NASDAQ OMX Stockholm,Sweden,,Uppsala,752 37,http://www.qlinea.com,Small Cap,SE0011527845,,BBG00MJLWLZ4,BBG00JXRCDW5,BBG00JXRCDX4,False
QLIRO.ST,Qliro AB (publ),"Qliro AB (publ) operates as a fintech company. The company offers online payment solutions to e-retailers and their customers in the Nordic region, as well as digital financial services to consumers in Sweden. It also offers consumer financing, personal loans, and savings accounts. The company was founded in 2014 and is headquartered in Stockholm, Sweden. Qliro AB (publ) operates as a subsidiary of Qliro Group AB (publ).",SEK,Financials,Diversified Financials,Consumer Finance,STO,XSTO,NASDAQ OMX Stockholm,Sweden,,Stockholm,113 46,http://www.qliro.com,Micro Cap,,,BBG00XNP9417,BBG00H9Q3FH0,BBG00H9Q3FJ8,False
QUART-PREF.ST,Quartiers Properties AB (publ),"Quartiers Properties AB (publ) engages in the property development, management, and sales; and hotel management activities in Spain. The company operates Quartiers Apartment Hotel & Resort in Benahav√É¬≠s; Boho Club comprising two restaurants, two pools, and 30 rooms and bungalows in Marbella; develops villas and apartments; and offers concierge and letting services to buyers of apartments in Quartiers Properties project. It also offers property brokerage services. The company's real estate projects are located in the community of Hacienda del Se√É¬±orio de Cifuentes in Benahavis and Marbella, Spain. Quartiers Properties AB (publ) was founded in 2014 and is headquartered in Stockholm, Sweden.",SEK,Real Estate,Real Estate,Real Estate Management & Development,STO,XSTO,NASDAQ OMX Stockholm,Sweden,,Stockholm,114 56,http://www.quartiersproperties.com,Nano Cap,,,,,,True
QUART-TO3.ST,Quartiers Properties AB TO3,,SEK,,,,STO,XSTO,NASDAQ OMX Stockholm,,,,,,,,,,,,False
QUART-TO4.ST,Quartiers Properties AB TO4,,SEK,,,,STO,XSTO,NASDAQ OMX Stockholm,,,,,,,,,,,,False
QUART.ST,Quartiers Properties AB (publ),"Quartiers Properties AB (publ) engages in the property development, management, and sales; and hotel management activities in Spain. The company operates Quartiers Apartment Hotel & Resort in Benahav√É¬≠s; Boho Club comprising two restaurants, two pools, and 30 rooms and bungalows in Marbella; develops villas and apartments; and offers concierge and letting services to buyers of apartments in Quartiers Properties project. It also offers property brokerage services. The company's real estate projects are located in the community of Hacienda del Se√É¬±orio de Cifuentes in Benahavis and Marbella, Spain. Quartiers Properties AB (publ) was founded in 2014 and is headquartered in Stockholm, Sweden.",SEK,Real Estate,Real Estate,Real Estate Management & Development,STO,XSTO,NASDAQ OMX Stockholm,Sweden,,Stockholm,114 56,http://www.quartiersproperties.com,Nano Cap,,,,,,True
QUIA.ST,QuiaPEG Pharmaceuticals Holding AB (publ),"QuiaPEG Pharmaceuticals Holding AB (publ), a biotech company, develops biopharmaceutical products for the treatment of metabolic disorders. It develops biopharmaceuticals based on PEGylation technology platform, which is applicable on proteins, peptides, and small molecules or oligonucleotides. The company has strategic collaboration with Cobra Biologics AB for the refinement of biopharmaceutical products. The company was formerly known as Oligovation AB and changed its name to QuiaPEG Pharmaceuticals Holding AB (publ). QuiaPEG Pharmaceuticals Holding AB (publ) was founded in 2012 and is headquartered in Solna, Sweden.",SEK,Health Care,"Pharmaceuticals, Biotechnology & Life Sciences",Biotechnology,STO,XSTO,NASDAQ OMX Stockholm,Sweden,,Solna,171 65,http://www.quiapeg.com,Nano Cap,,,,,,True
RAIL.ST,Railcare Group AB (publ),"Railcare Group AB (publ) provides railway maintenance services primarily in Scandinavia and the United Kingdom. The company offers maintenance services for railway reballasting beneath tracks and switches; special transport services, including locomotives, wagons, and temporary personnel; and workshop services, such as repairs, upgrades, and regular maintenance. It also conducts construction and project transports, heavy transports, and special transports that require traffic permits; supplies locomotives, wagons, and machines; installs radio control systems and safety systems; and renovates and modifies railway vehicles. In addition, the company produces, markets, and sells engineered machines, including ballast feeder systems and snow clearing machines. Railcare Group AB (publ) was founded in 1992 and is headquartered in Skelleftehamn, Sweden.",SEK,Industrials,Transportation,Road & Rail,STO,XSTO,NASDAQ OMX Stockholm,Sweden,,Skelleftehamn,932 21,http://www.railcare.se,Micro Cap,,,,,,False
RAKE.ST,Raketech Group Holding PLC,"Raketech Group Holding PLC operates as an online affiliate and content marketing company worldwide. The company offers comparison services, online guides, communities, and social media products for the online gaming, online casino, sports betting, TV sports, consumer finance, and cryptocurrency industries. It operates CasinoGuide.se, a casino review Website; BetXpert.com that offers sports betting content, expert betting advice, and live match data from sports; TurtleBet.com that provides casino content, bonus offers, and sports betting news. The company also operates TV sports guide family, which offer real-time listings, live scores, and match information to sports fans; L√É¬•napengar.com, a financial platform; Betting.se, a sports betting Website; and CasinoFeber.se that provides casino-related content, including casino news, reviews and latest promotions. In addition, it operates CasinoBonusar.nu that offers promotions, bonus spin offers, and campaigns; Cryptimi.com, a digital currency and block chain review site; Casinoer.com, an online guide; Urheiluveikkaus.com, a sports betting affiliate product; and Norskkreditt.no, a consumer finance Website. Raketech Group Holding PLC was founded in 2010 and is headquartered in St Julian's, Malta.",SEK,Communication Services,Telecommunication Services,Diversified Telecommunication Services,STO,XSTO,NASDAQ OMX Stockholm,Malta,,St. Julian's,STJ3109,http://www.raketech.com,Micro Cap,,,,,,False
RATO-A.ST,Ratos AB (publ),"Ratos AB (publ) is a private equity firm specializing in buyouts, turnarounds, add on acquisitions, and middle market transactions. The firm does not invest in early stages and in companies that operate in the arms industry, pornography, or are detrimental to the environment. It seeks to invest in unlisted medium sized companies. The firm invests in industry, construction and services, consumer, and technology sectors. The firm typically invests in the Nordic region, with focus on Sweden, Finland, Denmark, and Norway. It seeks to invest in companies with equity investments between SEK250 million ($29.66 million) and SEK5000 million ($762.77 million), sales value between SEK300 million ($45.77 million) and SEK5000 million (762.77 million) and EBITDA greater than SEK50 million ($5.16 million). The firm prefers to be the principal owner with a minimum holding of at least 20 percent and also seeks a board seat. It prefers to hold its investment between five to ten years. It invests through its own balance sheet and bank loans. Ratos AB (publ) was founded in 1934 and is based in Stockholm, Sweden.",SEK,Financials,Diversified Financials,Capital Markets,STO,XSTO,NASDAQ OMX Stockholm,Sweden,,Stockholm,111 96,http://www.ratos.com,Mid Cap,,,,,,False
RATO-B.ST,Ratos AB (publ),"Ratos AB (publ) is a private equity firm specializing in buyouts, turnarounds, add on acquisitions, and middle market transactions. The firm does not invest in early stages and in companies that operate in the arms industry, pornography, or are detrimental to the environment. It seeks to invest in unlisted medium sized companies. The firm invests in industry, construction and services, consumer, and technology sectors. The firm typically invests in the Nordic region, with focus on Sweden, Finland, Denmark, and Norway. It seeks to invest in companies with equity investments between SEK250 million ($29.66 million) and SEK5000 million ($762.77 million), sales value between SEK300 million ($45.77 million) and SEK5000 million (762.77 million) and EBITDA greater than SEK50 million ($5.16 million). The firm prefers to be the principal owner with a minimum holding of at least 20 percent and also seeks a board seat. It prefers to hold its investment between five to ten years. It invests through its own balance sheet and bank loans. Ratos AB (publ) was founded in 1934 and is based in Stockholm, Sweden.",SEK,Financials,Diversified Financials,Capital Markets,STO,XSTO,NASDAQ OMX Stockholm,Sweden,,Stockholm,111 96,http://www.ratos.com,Mid Cap,,,,,,False
RAY-B.ST,RaySearch Laboratories AB Class B,"RaySearch Laboratories AB (publ), a medical technology company, develops software solutions for cancer treatment in Sweden and internationally. It develops and markets RayStation, a treatment planning system for treatment activities, such as automated planning, adaptive therapy, multi-criteria optimization, fast and accurate dose computations, reduce OAR dose, robustness, the physician's toolbox, machine learning, VMAT, IMRT, 3D-CRT, virtual simulation, electron beam therapy, tomo therapy, stereotactic, proton therapy, carbon ion therapy, and boron neutron capture therapy. The company also develops RayPlan, a treatment planning system for supporting a range of treatment planning activities for 3D-CRT, IMRT, VMAT, tomo therapy, and electron beam radiation therapy; and RayCare, an oncology information system for the treatment of cancer comprising oncology treatment activities, including digital oncology workflows, rule-based scheduling, state-of-the-art software platform, enterprise-wide integration, adaptive therapy, RayCare flow, and data handling and machine learning. In addition, it offers RayCommand, a treatment control system that is compatible with multiple hardware models and supports advanced functionalities of treatment machines and software systems; and RayIntelligence, a cloud-based oncology analytics system, which turns patient data into insights. Further, the company provides training courses, as well as customer support services. RaySearch Laboratories AB (publ) was founded in 2000 and is headquartered in Stockholm, Sweden.",SEK,Health Care,Health Care Equipment & Services,Health Care Providers & Services,STO,XSTO,NASDAQ OMX Stockholm,Sweden,,Stockholm,111 34,http://www.raysearchlabs.com,Small Cap,SE0000135485,,BBG000BHGH86,BBG000BHGGG9,BBG001S746B1,False
READ.ST,Readly International AB (publ),"Readly International AB (publ) operates an application that offers digital subscription services for magazines with content from third-party publishers. It offers titles from 900 publishers in 17 languages in 50 countries. The company provides customers have unlimited access to about 5,000 national and international magazines divided into 36 different categories. It distributes approximately 140,000 issues of magazines that have been read 99 million times. It serves subscribers primarily in Austria, Australia, Germany, Ireland, Italy, the Netherlands, New Zealand, Sweden, Switzerland, the United Kingdom, and the United States. The company was incorporated in 2012 and is headquartered in Stockholm, Sweden.",SEK,Communication Services,Telecommunication Services,Diversified Telecommunication Services,STO,XSTO,NASDAQ OMX Stockholm,Sweden,,Stockholm,111 43,http://se.readly.com,Micro Cap,SE0014855292,,BBG00X6ZLFT5,BBG00D78GG21,BBG00D78GG30,False
REALFI-TO1.ST,Realfiction Holding AB TO1,,SEK,,,,STO,XSTO,NASDAQ OMX Stockholm,,,,,,,,,,,,False
REALFI.ST,Realfiction Holding AB (publ),"Realfiction Holding AB (publ) manufactures and sells mixed reality solutions for retail, education, events, and brand activations worldwide. The company offers Dreamoc HD3, a platform for grabbing attention in commercial setting; DeepFrame, a mixed-reality display system; Dreamoc POP3, a display to create attention around a campaign or product launch; Dreamoc XL3; and Dreamoc XL4, a high-quality 3D holographic display that creates an eye-catching visual experience. It also provides Dreamoc XXL3, a mixed reality display and optimal solution for creating experiences in environments, such as malls, museums, and busy trade fairs; and Dreamoc Diamond, a display solutions for events and brand activations in shopping malls, trade fairs, and other traffic locations. The company was founded in 2008 and is based in Copenhagen, Denmark.",SEK,Information Technology,Software & Services,Software,STO,XSTO,NASDAQ OMX Stockholm,Denmark,,Copenhagen,2100,http://www.realfiction.com,Nano Cap,,,,,,False
REDW.ST,Redwood Pharma AB,"Redwood Pharma AB engages in the development of ophthalmic pharmaceutical therapies for unmet market needs. The company's lead development product is RP101, an eye drop that treats severe chronic dry eye disease in post-menopausal women. It uses IntelliGel, a supramolecular smart drug delivery system for development of topical formulation for ophthalmic uses, as well as for administration to the front of the eye. Redwood Pharma AB is based in Stockholm, Sweden.",SEK,Health Care,"Pharmaceuticals, Biotechnology & Life Sciences",Biotechnology,STO,XSTO,NASDAQ OMX Stockholm,Sweden,,Stockholm,118 60,http://www.redwoodpharma.se,Nano Cap,,,,,,False
REJL-B.ST,Rejlers AB (publ),"Rejlers AB (publ) provides technical consultancy services to various customers in the construction and property, energy, industry, infrastructure, and telecom sectors. The company also offers IT services. It operates in Sweden, Finland, and Norway. The company was formerly known as Rejlerkoncernen AB and changed its name to Rejlers AB (publ) in July 2013. Rejlers AB (publ) was founded in 1942 and is headquartered in Stockholm, Sweden.",SEK,Industrials,Commercial & Professional Services,Professional Services,STO,XSTO,NASDAQ OMX Stockholm,Sweden,,Stockholm,104 25,http://www.rejlers.com,Small Cap,,,,,,False
RENEW.ST,Re:NewCell AB (publ),"Re:Newcell AB operates as a textile recycling company in Sweden. It produces and sells dissolving pulp from recycled textiles under the Circulose brand name. The company's Circulose product is used as a raw material to produce regenerated fibers, such as viscose, modal, and lyocell. The company was founded in 2012 and is headquartered in Stockholm, Sweden.",SEK,Consumer Discretionary,Consumer Durables & Apparel,"Textiles, Apparel & Luxury Goods",STO,XSTO,NASDAQ OMX Stockholm,Sweden,,Stockholm,114 36,http://www.renewcell.com,Small Cap,SE0014960431,,,BBG00Y91F9D3,,False
RESURS.ST,Resurs Holding AB (publ),"Resurs Holding AB (publ), through its subsidiaries, provides payment solutions, consumer loans, and insurance products in Sweden, Norway, Finland, and Denmark. The company's payment solutions comprise retail finance, which includes sales-driving finance, and payment and loyalty solutions to chain stores and e-commerce companies; credit cards for retail finance partner; and factoring that focuses on invoice factoring and invoice discounting for small and mid-sized companies increase their liquidity and reduce credit risk. It also offers unsecured loans to consumers; and insurance products, such as product, security, motor, and travel. Resurs Holding AB (publ) was founded in 1977 and is headquartered in Helsingborg, Sweden.",SEK,Financials,Diversified Financials,Consumer Finance,STO,XSTO,NASDAQ OMX Stockholm,Sweden,,Helsingborg,,http://www.resursholding.com/en/,Small Cap,,,,,,False
RISMA.ST,,,,,,,STO,XSTO,NASDAQ OMX Stockholm,Denmark,,,,,,,,,,,False
RIZZO-B.ST,Rizzo Group AB (publ),"Rizzo Group AB (publ) offers travel accessories, bags, and shoes and accessories. As of December 1, 2020, it operated through a network of 101 stores under the Accent, Morris, Rizzo, and NK names in Sweden and Norway. The company was formerly known as Venue Retail Group AB and changed its name to Rizzo Group AB (publ) in December 2020. Rizzo Group AB (publ) is headquartered in Stockholm, Sweden.",SEK,Consumer Discretionary,Consumer Durables & Apparel,"Textiles, Apparel & Luxury Goods",STO,XSTO,NASDAQ OMX Stockholm,Sweden,,Stockholm,104 50,http://www.rizzogroup.se,Nano Cap,,,,,,False
RLS.ST,RLS Global AB (publ),"RLS Global AB (publ), a medical technology company, develops and sells products for the treatment of diseases in wound and dental care in Sweden. Its products include ChloraSolv that is used for the treatment of chronic foot and leg ulcers for diabetic patients; and CariSolv, a gel used for treating caries. The company was founded in 1996 and is based in M√É¬∂lndal, Sweden.",SEK,Health Care,"Pharmaceuticals, Biotechnology & Life Sciences",Pharmaceuticals,STO,XSTO,NASDAQ OMX Stockholm,Sweden,,Molndal,431 53,http://rls.global,Nano Cap,,775711104,,,,False
RNBS.ST,RNB Retail and Brands AB (publ),"RNB Retail and Brands AB (publ) owns, develops, and operates fashion wear, ready-to-wear clothing, accessories, jewelry, and cosmetics stores in Sweden, Norway, Finland, and internationally. It sells its products through Brothers store concept, which offers tailored and casual fashion wear for men; and Polarn O. Pyret store concept that provides clothing for babies and children. The company also sells its products through departments and stores under the NK name in Stockholm and Gothenburg; and Man of a Kind, an e-commerce concept that provides luxury brands with Nordic aesthetics, as well as offers services, such as made-to-measure, style advice, and articles for masculine style and fashion. It operates approximately 190 stores and e-commerce platforms. The company is based in Stockholm, Sweden.",SEK,Consumer Discretionary,Consumer Durables & Apparel,"Textiles, Apparel & Luxury Goods",STO,XSTO,NASDAQ OMX Stockholm,Sweden,,Stockholm,103 23,http://www.rnb.se,Nano Cap,,,,,,False
RO.ST,Rolling Optics Holding AB (publ),"Rolling Optics Holding AB (publ) develops, designs, produces, and sells products in visual authentication based on in-house developed and patented technology in micro-optics. The company was founded in 2005 and is based in Solna, Sweden.",SEK,Information Technology,Technology Hardware & Equipment,"Electronic Equipment, Instruments & Components",STO,XSTO,NASDAQ OMX Stockholm,Sweden,,Solna,171 54,http://www.rollingoptics.com,Micro Cap,CH0012032113,,,BBG000BCLVP1,,False
RPLAN.ST,Ranplan Group AB,"Ranplan Group AB, a software company, develops a suite of software tools for outdoor/indoor wireless network planning, design, and optimization. It offers Ranplan Professional, a platform that allows to plan, design, and optimize 5G in-building and outdoor wireless and Wi-Fi networks in coordination; Ranplan In-Building for planning indoor wireless networks; Ranplan In-Building Lite, which helps in planning indoor public safety wireless networks; and Ranplan Tablet tool that automates site survey and indoor network designs. The company also provides Ranplan Collaboration Hub, a cloud-based project management and workflow tool that allows managers and onsite engineers to manage projects in real-time from inception through to deployment and maintenance. The company's products are used in indoor, outdoor, 5G, large venues, smart cities, tunnels/transportation, public safety, and Internet of Things applications. It primarily serves mobile operators and telecommunication equipment vendors. The company has operations in Asia, North America, Europe, the Middle East, and Africa. Ranplan Group AB was founded in 2012 and is based in Stockholm, Sweden.",SEK,Information Technology,Software & Services,Software,STO,XSTO,NASDAQ OMX Stockholm,Sweden,,Stockholm,114 51,http://www.ranplanwireless.com,Nano Cap,,,,,,False
RROS.ST,Rottneros AB,"Rottneros AB (publ) produces and sells pulp worldwide. It produces chemical pulp for use in electrical applications, filters, paper, and boards; mechanical pulp for use in paper, boards, tissue paper, and filters; and fiber trays for food and technical products. The company was founded in 1916 and is based in Vallvik, Sweden. Rottneros AB (publ) is a subsidiary of Arctic Paper S.A.",SEK,Materials,Materials,Paper & Forest Products,STO,XSTO,NASDAQ OMX Stockholm,Sweden,,Vallvik,826 79,http://www.rottneros.com,Micro Cap,SE0000112252,,BBG000BHFWX6,BBG000BHFWK0,BBG001S74532,False
