symbol,name,summary,currency,sector,industry_group,industry,exchange,mic,market,country,state,city,zipcode,website,market_cap,isin,cusip,figi,composite_figi,shareclass_figi,delisted
KABE-B.ST,KABE Group AB (publ.),"KABE Group AB (publ.) manufactures and sells caravans and mobile homes. The company sells its products through dealers in Europe. The company was formerly known as KABE AB (publ.) and changed its name to KABE Group AB (publ.) in July 2018. KABE Group AB (publ.) is based in Tenhult, Sweden.",SEK,Consumer Discretionary,Consumer Services,"Hotels, Restaurants & Leisure",STO,XSTO,NASDAQ OMX Stockholm,Sweden,,Tenhult,561 06,http://www.kabe.se/se/om-kabe/bolagsinformation,Micro Cap,,,,,,False
KAKEL.ST,Kakel Max AB (publ),"Kakel Max AB (publ) operates in the building ceramic market in Sweden. It offers tiles and other bathroom accessories. The company sells its products through project customers and retailers, as well as through its own network of stores. Kakel Max AB (publ) was founded in 1987 and is based in √É¬ñsterv√É¬•la, Sweden.",SEK,Materials,Materials,Construction Materials,STO,XSTO,NASDAQ OMX Stockholm,Sweden,,Ostervala,740 46,http://www.kakelmax.se,Nano Cap,,,,,,False
KAMBI.ST,Kambi Group plc,"Kambi Group plc operates as a business-to-business supplier of managed sports betting services to business-to-consumer gaming operators in Europe, the Americas, and internationally. It offers services, including compliance, odds-compiling, customer intelligence, and risk management services built on an in-house developed software platform. The company was founded in 2010 and is headquartered in Ta' Xbiex, Malta.",SEK,Consumer Discretionary,Consumer Services,"Hotels, Restaurants & Leisure",STO,XSTO,NASDAQ OMX Stockholm,Malta,,Ta' Xbiex,TBX1120,http://www.kambi.com,Small Cap,,,,,,False
KAN.ST,Kancera AB (publ),"Kancera AB (Publ) develops drugs for inflammatory diseases and cancer in Sweden and internationally. The company is developing small molecule drug candidates KAND567 and KAND145 which block the Fractalkine receptor CX3CR1 and thus specific parts of the immune system for treatment of hyperinflammation HDAC6 for the treatment of nerve inflammation and pain; and ROR inhibitors for the treatment of solid tumors and blood cancers. Kancera AB (Publ) was founded in 2010 and is based in Solna, Sweden.",SEK,Health Care,"Pharmaceuticals, Biotechnology & Life Sciences",Biotechnology,STO,XSTO,NASDAQ OMX Stockholm,Sweden,,Solna,171 65,http://www.kancera.com,Micro Cap,,,,,,True
KAPIAB.ST,Kalleback Property Invest AB (publ),"Kalleb√É¬§ck Property Invest AB (publ) operates as a real estate company. The company owns, manages, and rents Kalleb√É¬§ck 17:2, an office building located in Gothenburg. Kalleb√É¬§ck Property Invest AB (publ) is based in V√É¬§ster√É¬•s, Sweden.",SEK,Real Estate,Real Estate,Real Estate Management & Development,STO,XSTO,NASDAQ OMX Stockholm,Sweden,,Vasteras,721 06,http://www.kallebackpropertyinvest.se,Micro Cap,,,,,,False
KAR.ST,Karnov Group AB (publ),"Karnov Group AB (publ) provides mission critical information in the areas of legal, tax and accounting, environmental, and health and safety in Denmark and Sweden. It offers online and offline professional information products and services. The company principally offers its products in the form of digital, including subscription based online solutions. It also publishes and sells offline books and journals, as well as hosts legal training courses. The company provides its products under the brands of Karnov, Norstedts Juridik, Notisum, Legal Cross Border, Forlaget Andersen, LEXNordics, and DIBkunnskap. It serves law firms, tax and accounting firms, and corporates, as well as the public sector, including courts, libraries, universities, and other public authorities and municipalities. The company was founded in 1867 and is headquartered in Stockholm, Sweden.",SEK,Consumer Discretionary,Consumer Services,"Hotels, Restaurants & Leisure",STO,XSTO,NASDAQ OMX Stockholm,Sweden,,Stockholm,112 51,http://www.karnovgroup.com,Small Cap,,,BBG00NNQ1WQ6,BBG007HWWDT0,BBG007HWWDV7,False
KARO.ST,Karo Pharma AB (publ),"Karo Pharma AB (publ) develops and markets prescription drugs, over-the-counter products, medical devices, and hospital supply products for pharmacies and the health care sectors in Sweden, Norway, Denmark, Finland, France, rest of Europe, the United States, and internationally. It offers dermatology products under the Decubal, Fungobase, indy beauty, Lucobase, Mildison, OLIVA, PoxClin, and PROPYLESS brands; intimate care products under the HemoClin, Multi-Gyn, Multi-Mam, Pevaryl, and Scheriproct brand names; and foot care products under the CCS, Cortimyk, Footner, Nailner, Pevaryl, and wortie brands. The company also provides pain, cough, cold products under the Bronkyl, Dolerin, Ibux, Mollipect, Nazamer, nozoil, Paracet, and Viruseptin brand names; prescription drugs under the Burinex, Centyl, Kaleorid, and Selexid brands; and wellness products under the Flux, All√É¬©vo, Dosett, Dax, antibac, BAMSE, Betavivo, and Lactocare brands. It sells its products to pharmacies and retailers through direct sales organisations and a network of distributors, as well as online. The company was formerly known as Karo Bio AB (publ) and changed its name to Karo Pharma AB (publ) in March 2016. Karo Pharma AB (publ) was incorporated in 1987 and is based in Stockholm, Sweden.",SEK,Health Care,"Pharmaceuticals, Biotechnology & Life Sciences",Pharmaceuticals,STO,XSTO,NASDAQ OMX Stockholm,Sweden,,Stockholm,111 22,http://www.karopharma.com,Small Cap,SE0007464888,,,BBG000M17BK8,,False
KDEV.ST,Karolinska Development AB (publ),"Karolinska Development AB (publ) is a venture capital firm specializing in investments in growth capital, seed stage, and early stage companies. It seeks to invest in pharmaceutical research and development, medical research, healthcare technology, gene research and development, drug delivery technologies, biotechnology, and life science tools and service sectors. The firm seeks to invest in the Nordic region with a focus on Sweden, Iceland, Norway, Finland, and Denmark. It prefers to be a lead investor in its portfolio companies however does consider co-investments also. It seeks to invest in up to five projects annually. Karolinska Development AB (publ) was founded in 2003 and is headquartered in Stockholm, Sweden.",SEK,Health Care,"Pharmaceuticals, Biotechnology & Life Sciences",Biotechnology,STO,XSTO,NASDAQ OMX Stockholm,Sweden,,Solna,17165,http://www.karolinskadevelopment.com,Micro Cap,SE0002190926,,BBG001MKRLW7,BBG0019SJHG1,BBG001TG5DF0,False
KEBNI-B.ST,KebNi AB (publ),"KebNi AB (publ) develops, manufactures, markets, and sells 4-axes stabilizing VSAT antennas for maritime applications under the KebNi Maritime brand. It also provides inertial sensor systems for measuring movements in three dimensions; and communication on the move (COTM) antennas for land and mobile satellite communications systems. The company was formerly known as Advanced Stabilized Technologies Group AB (publ) and changed its name to KebNi AB (publ) in July 2020. KebNi AB (publ) is headquartered in Stockholm, Sweden.",SEK,Information Technology,Technology Hardware & Equipment,Communications Equipment,STO,XSTO,NASDAQ OMX Stockholm,Sweden,,Stockholm,164 40,http://www.kebni.com,Nano Cap,,,,,,False
KENH.ST,Kentima Holding AB (publ),"Kentima Holding AB (publ) develops, manufactures, and sells products for the automation and security sector. It offers WideQuick HMI/SCADA software, which is general system for communication for use in process, food, manufacturing, property automation, machine control, security system, and infrastructure industries; and Ethiris video management software for video surveillance used in transport and infrastructure sectors, shopping centers and shops, public areas, industrial and process plants, arenas and sports installations, hospitals and schools, and alarm centers. The company also provides Ethiris Network Video Recorder and Network Video Client, a video surveillance system; and PSIM software that facilitates integration and communication, as well as presents information in a common user interface. In addition, it offers industrial computers comprising panel PCs and box PCs for various industrial applications; and WideQuick HMI Panels. Further, the company provides various training courses. It sells its products primarily through distributors and resellers. The company is based in Staffanstorp, Sweden.",SEK,Information Technology,Software & Services,Software,STO,XSTO,NASDAQ OMX Stockholm,Sweden,,Staffanstorp,245 44,http://www.kentima.com,Nano Cap,,,,,,False
KFAST-B.ST,K-Fast Holding AB (publ),"K-Fast Holding AB (publ) operates as a project development, construction, and property management company in Sweden. The company focuses primarily on rental housing properties in the √É¬ñresund region. Its property portfolio includes low-rise and lateral low-rise buildings, apartment blocks, and commercial properties. As of December 31, 2020, the company's property and project portfolio comprised of 7,496 apartments. K-Fast Holding AB (publ) was founded in 2010 and headquartered in H√É¬§ssleholm, Sweden.",SEK,Real Estate,Real Estate,Real Estate Management & Development,STO,XSTO,NASDAQ OMX Stockholm,Sweden,,Hassleholm,281 43,http://www.k-fastigheter.se,Micro Cap,,,,,,False
KIN1D-430SHB.ST,,,,,,,STO,XSTO,NASDAQ OMX Stockholm,,,,,,,,,,,,False
KIN1L-475SHB.ST,KIN1L 475SHB,,SEK,,,,STO,XSTO,NASDAQ OMX Stockholm,,,,,,,,,,,,False
KIN1R-375SHB.ST,KIN1R 375SHB,,SEK,,,,STO,XSTO,NASDAQ OMX Stockholm,,,,,,,,,,,,False
KIND-SDB.ST,Kindred Group plc,"Kindred Group plc operates an online gambling business primarily in Europe, Australia, and the United States. The company offers pre-game and live sports betting, including horse racing betting; poker; casino and games; and bingo through various brands, such as the 32 Red, bingo.com, Bohemia Casino, Casinohuone, Pokerhuone, Bingohuone, iGame, Kolikkopelit, Maria Casino, RoxyPalace, Storspelare, Storspiller, Unibet, and Vlad Cazino. As of December 31, 2019, it had approximately 27 million registered customers worldwide. The company was formerly known as Unibet Group plc and changed its name to Kindred Group plc in December 2016. Kindred Group plc was founded in 1997 and is headquartered in Sliema, Malta.",SEK,Consumer Discretionary,Consumer Services,"Hotels, Restaurants & Leisure",STO,XSTO,NASDAQ OMX Stockholm,Malta,,Sliema,TPO 0001,http://www.kindredgroup.com,Mid Cap,SE0007871645,,,,,True
KINV-A.ST,Kinnevik AB,"Kinnevik AB formerly known as Investment AB Kinnevik, is a venture capital firm specializing in investments in growth capital. It prefers to invest in digital consumer business, education, communication, e-commerce and marketplaces, entertainment, healthcare, and financial services but may also invest in other areas. The firm invests worldwide, especially in Europe with a focus on the Nordics, Latin America, Asia, Australia, Africa, and North America. The firm looks for disruptive, technology-enabled and value-added consumer services in developed and emerging markets. It takes an active role on the boards of its subsidiaries and associated companies. It acts as a long-term lead shareholder in large listed entities. Kinnevik AB was founded in 1936 and is based in Stockholm, Sweden.",SEK,Financials,Diversified Financials,Capital Markets,STO,XSTO,NASDAQ OMX Stockholm,Sweden,,Stockholm,103 13,http://www.kinnevik.com,Large Cap,,,,,,False
KINV-B.ST,Kinnevik AB,"Kinnevik AB formerly known as Investment AB Kinnevik, is a venture capital firm specializing in investments in growth capital. It prefers to invest in digital consumer business, education, communication, e-commerce and marketplaces, entertainment, healthcare, and financial services but may also invest in other areas. The firm invests worldwide, especially in Europe with a focus on the Nordics, Latin America, Asia, Australia, Africa, and North America. The firm looks for disruptive, technology-enabled and value-added consumer services in developed and emerging markets. It takes an active role on the boards of its subsidiaries and associated companies. It acts as a long-term lead shareholder in large listed entities. Kinnevik AB was founded in 1936 and is based in Stockholm, Sweden.",SEK,Financials,Diversified Financials,Capital Markets,STO,XSTO,NASDAQ OMX Stockholm,Sweden,,Stockholm,103 13,http://www.kinnevik.com,Large Cap,,,,,,False
KLAR.ST,Klaria Pharma Holding AB (publ.),"Klaria Pharma Holding AB (publ.) operates as a pharmaceutical company in Sweden and internationally. It offers Sumatriptan for the treatment of migraine; and Midazolam for acute epilepsy. The company's clinical phase products include Epinephrine/Adrenaline for the treatment of acute allergic reaction; Naloxone for opioid overdose; and Ketamine for acute pain and depression. It also focuses on the commercialization of cannabis/cannabinoids, including THC and CBD for medical and recreational applications. The company was founded in 2014 and is based in Uppsala, Sweden.",SEK,Health Care,"Pharmaceuticals, Biotechnology & Life Sciences",Pharmaceuticals,STO,XSTO,NASDAQ OMX Stockholm,Sweden,,Uppsala,754 50,http://www.klaria.com,Micro Cap,SE0007280326,,,,,False
KLED.ST,Kungsleden AB (publ),"Kungsleden are people that create places and experiences for people. By developing and managing attractive and sustainable places, we offer people better and more inspiring work experience. We are a long-term property owner focused on commercial properties in Sweden's growth regions. As of 30 September 2020, we owned 211 properties with total value of SEK 39,872 million.",SEK,Real Estate,Real Estate,Real Estate Management & Development,STO,XSTO,NASDAQ OMX Stockholm,Sweden,,Stockholm,107 25,http://www.kungsleden.se,Mid Cap,,,,,,False
KLOV-A.ST,Klovern AB (publ),"Kl√É¬∂vern AB (publ) operates as a real estate company in Sweden. It has approximately 350 properties that have a total lettable area of approximately 2.5 million square meters. The company primarily focuses on renting offices, as well as offer premises for companies and organizations in healthcare, education, and retail; and warehousing and logistics. In addition, it works with projects of a housing development. The company is based in Stockholm, Sweden.",SEK,Real Estate,Real Estate,Real Estate Management & Development,STO,XSTO,NASDAQ OMX Stockholm,Sweden,,Stockholm,111 30,http://www.klovern.se,Small Cap,,,,,,False
KLOV-B.ST,Klovern AB (publ),"Kl√É¬∂vern AB (publ) operates as a real estate company in Sweden. It has approximately 350 properties that have a total lettable area of approximately 2.5 million square meters. The company primarily focuses on renting offices, as well as offer premises for companies and organizations in healthcare, education, and retail; and warehousing and logistics. In addition, it works with projects of a housing development. The company is based in Stockholm, Sweden.",SEK,Real Estate,Real Estate,Real Estate Management & Development,STO,XSTO,NASDAQ OMX Stockholm,Sweden,,Stockholm,111 30,http://www.klovern.se,Small Cap,,,,,,False
KLOV-PREF.ST,Klovern AB (publ),"Kl√É¬∂vern AB (publ) operates as a real estate company in Sweden. It has approximately 350 properties that have a total lettable area of approximately 2.5 million square meters. The company primarily focuses on renting offices, as well as offer premises for companies and organizations in healthcare, education, and retail; and warehousing and logistics. In addition, it works with projects of a housing development. The company is based in Stockholm, Sweden.",SEK,Real Estate,Real Estate,Real Estate Management & Development,STO,XSTO,NASDAQ OMX Stockholm,Sweden,,Stockholm,111 30,http://www.klovern.se,Small Cap,,,,,,False
KNOW.ST,Knowit AB (publ),"Knowit AB (publ), a consultancy company, provides digital and cross-functional solutions in the Nordic region. The company operates in three segments: Experience, Insight, and Solutions. It offers services in the areas of strategy and digitalization, analysis and insight, branding and communication, design and innovation, digital marketing, Web development and platforms, E-commerce and PIM, mobile solutions, architecture, big data, business intelligence, cloud, defense solutions, digital transformation, finance technology, Internet of Things, machine learning and artificial intelligence, mobility, robotics, quality assurance, sourcing management, SysDevops, and technical transformation. The company also provides services in the areas of digital law, energy management, human resource management, IT strategy, organization development, project management, quality management, scaled agile and lean, and security. It serves banking and finance, insurance, energy, manufacturing, life science and medical, media, education, gaming, public, retail, services, and telecom sectors. The company was formerly known as Know IT AB (publ.) and changed its name to Knowit AB (publ) in April 2012. Knowit AB (publ) was founded in 1990 and is headquartered in Stockholm, Sweden.",SEK,Information Technology,Software & Services,IT Services,STO,XSTO,NASDAQ OMX Stockholm,Sweden,,Stockholm,103 68,http://www.knowit.se,Small Cap,,,,,,False
KOLL-TO1.ST,Kollect on Demand Holding AB TO,,SEK,,,,STO,XSTO,NASDAQ OMX Stockholm,,,,,,,,,,,,False
KOLL.ST,Kollect on Demand Holding AB (publ),"Kollect on Demand Holding AB (publ) offers waste disposal services in Ireland and the United Kingdom. The company offers domestic and commercial waste collection services; container hiring services; and junk removal services for items, such as furniture, mattresses, and other large objects. It also operates an online platform for booking waste collection services. In addition, the company provides BIGbin, a compactor bin for the disposal of domestic waste. Kollect on Demand Holding AB (publ) was founded in 2015 and is headquartered in Waterford, Ireland.",SEK,Industrials,Transportation,Transportation Infrastructure,STO,XSTO,NASDAQ OMX Stockholm,Ireland,,Waterford,,http://plc.kollect.ie,Nano Cap,,,,,,True
KONT.ST,Kontigo Care AB (publ),"Kontigo Care AB (publ) provides health care solutions for addiction treatment in Sweden. It offers Previct Alcohol, a digital medical device for the drug rehabilitation; and Previct Gambling, a digital tool for the treatment and prevention of work at the gaming addiction. Kontigo Care AB (publ) was founded in 2013 and is based in Uppsala, Sweden.",SEK,Health Care,Health Care Equipment & Services,Health Care Providers & Services,STO,XSTO,NASDAQ OMX Stockholm,Sweden,,Uppsala,,http://www.kontigocare.com,Nano Cap,,,,,,False
KOPY.ST,Kopy Goldfields AB (publ),"Kopy Goldfields AB (publ) operates as a gold exploration and production company in Russia. The company holds interests in 12 licenses covering an area of approximately 2,156 square kilometers located in the Lena Goldfields of Siberia and in the Amur Region of the Russian Far East. Its flagship project is the Krasny project that consists of three licenses with a total area of 119 square kilometers. The company is headquartered in Stockholm, Sweden.",SEK,Materials,Materials,Metals & Mining,STO,XSTO,NASDAQ OMX Stockholm,Sweden,,Stockholm,114 52,http://www.kopygoldfields.com,Micro Cap,,,,,,False
LAGR-B.ST,Lagercrantz Group AB (publ),"Lagercrantz Group AB (publ) operates as a technology company in Sweden, Denmark, Norway, Finland, the United Kingdom, Germany, Poland, rest of Europe, and internationally. The company operates through four divisions: Electronics, Mechatronics, Communications, and Niche Products. It offers special products in embedded electronics, industrial wireless communication, RFID, and light controls. The company also provides electric connections systems, electric installation materials, electric and electro-mechanical components, and wiring harness, as well as safety switches, cabling, electrical enclosures, and infrastructural products comprising masts and aerial brackets for the manufacturing, power production, electricity distribution, infrastructure, and property sectors. In addition, it offers products, systems, services, and support in the areas of network access, and digital image transmission/technical security, as well as control systems and software. Further, the company produces and sells proprietary technical products and solutions to other companies. Additionally, it provides products used in manufacturing and dispensing foodstuffs; material handling products; furniture and fittings for workplaces, shops, or warehouses; special plastic doors; and galvanized steel wires for roadway, mast, and agriculture applications, as well as provides snow clearance and airport runway cleaning services. Lagercrantz Group AB (publ) was founded in 1906 and is headquartered in Stockholm, Sweden.",SEK,Information Technology,Software & Services,IT Services,STO,XSTO,NASDAQ OMX Stockholm,Sweden,,Stockholm,103 69,http://www.lagercrantz.com,Mid Cap,,,,,,False
LAMM-B.ST,Lammhults Design Group AB (publ),"Lammhults Design Group AB (publ), together with its subsidiaries, develops, manufactures, markets, and sells office and home, and public interiors in Sweden and internationally. It operates through Public Interiors, and Office and Home Interiors segment. The company offers furniture and interiors for public spaces and homes, as well as libraries. It is also involved in the aftermarket sale of furniture and consumables. The company markets and sells its office and home interiors products under the Lammhults, Abstracta, Fora Form, Morgana, Ragnars, Ire, and Voice brands; and public interiors under the BCI and Schulz Speyer, as well as Eurobib Direct brands. It serves government agencies, companies, offices, hotels, and restaurants. The company was formerly known as Expanda AB and changed its name to Lammhults Design Group AB (publ) in June 2008. Lammhults Design Group AB (publ) was founded in 1945 and is based in Lammhult, Sweden.",SEK,Consumer Discretionary,Consumer Durables & Apparel,Household Durables,STO,XSTO,NASDAQ OMX Stockholm,Sweden,,Lammhult,363 03,http://www.lammhultsdesigngroup.com,Nano Cap,,,,,,False
LATO-B.ST,Investment AB Latour (publ),"Investment AB Latour (publ) is an investment firm. The firm prefer to invest in companies for long term with Development, manufacture and marketing of proprietary products under their own brands. It prefer to invest in companies with  10 percent average annual growth over a business cycle, 10 percent operating margin over a business cycle, and 15 - 20 percent return on operating capital over a business cycle. It takes an active role on the board of its investee company. The firm was previously known as AB Hevea. Investment AB Latour (publ) was founded in 1984 and is based in Gothenburg, Sweden with an additional office in Malmo, Sweden and Stockholm, Sweden.",SEK,Financials,Diversified Financials,Capital Markets,STO,XSTO,NASDAQ OMX Stockholm,Sweden,,Gothenburg,401 25,http://www.latour.se/en/,Large Cap,,,,,,False
LAUR.ST,Lauritz.com Group A/S,"Lauritz.com Group A/S provides online auction services. The company offers art, design, antiquities, and home luxury products through its Website. Its product categories also comprise furniture, art works, lighting, silver, ceramics, porcelain, vintage clothing, sculptures, designer electronics, toys, and others. The company serves trendsetters, pensioners, students, and top executives. It has 29 auction houses in 6 countries. The company was founded in 1885 and is based in S√É¬∏borg, Denmark. Lauritz.com Group A/S is a subsidiary of Blixtz Holding A/S.",SEK,Consumer Discretionary,Retailing,Specialty Retail,STO,XSTO,NASDAQ OMX Stockholm,Denmark,,Soborg,2860,http://www.lauritz.com,Nano Cap,,518613203,,,,False
LCLEAN.ST,LifeClean International AB (publ),"Lifeclean International AB researches, produces, markets, and sells disinfection products in Sweden. It has developed a patented spore, fungal, biofilm, bacterial, and virus-killing surface disinfection for equipment and surfaces, such as floors, walls, furniture, and general roof surfaces. The company was founded in 2012 and is based in Uddevalla, Sweden.",SEK,Consumer Staples,Household & Personal Products,Household Products,STO,XSTO,NASDAQ OMX Stockholm,Sweden,,Uddevalla,451 76,http://www.lifeclean.se,Nano Cap,,,,,,False
LEDIBOND-T.ST,,,DKK,,,,STO,XSTO,NASDAQ OMX Stockholm,,,,,,,,,,,,False
LEMSE.ST,Leading Edge Materials Corp.,"Leading Edge Materials Corp. explores for and develops a portfolio of raw material projects in Europe. The company primarily explores for graphite, lithium, nickel, cobalt, and rare earth elements. It holds a 100% interest in the Woxna graphite project that comprises four concessions consisting of Kringelgruven, Mattsmyra, Gropabo, and Mansberg located in Gavleborg County, central Sweden. The company also holds interests in the Norra Karr HREE project located in south-central Sweden; Bergby lithium project, which consists of three exploration permits located in central Sweden; and a 51% interest in the Bihor Sud nickel cobalt exploration alliance located in Romania. The company was formerly known as Flinders Resources Limited and changed its name to Leading Edge Materials Corp. in August 2016. Leading Edge Materials Corp. is headquartered in Vancouver, Canada.",SEK,Materials,Materials,Metals & Mining,STO,XSTO,NASDAQ OMX Stockholm,Canada,BC,Vancouver,V6E 3V7,http://leadingedgematerials.com,Nano Cap,,,,,,False
