symbol,name,summary,currency,sector,industry_group,industry,exchange,mic,market,country,state,city,zipcode,website,market_cap,isin,cusip,figi,composite_figi,shareclass_figi,delisted
DOME.ST,Dome Energy AB (publ),"Dome Energy AB (publ) operates as an independent oil and gas company. It produces oil, gas, and condensate in Arkansas, Indiana, Kentucky, Louisiana, Michigan, Mississippi, Oklahoma, Texas, and Wyoming. The company was formerly known as Commodity Quest AB (publ). Dome Energy AB (publ) was founded in 1996 and is headquartered in Houston, Texas.",SEK,Energy,Energy,"Oil, Gas & Consumable Fuels",STO,XSTO,NASDAQ OMX Stockholm,United States,TX,Houston,77057,http://www.domeenergy.com,Nano Cap,,,,,,False
DORO.ST,Doro AB (publ),"Doro AB (publ), a technology company, develops products and services for seniors. It offers easy-to-use mobile and smart phones, home telephones, and accessories; corded phones and cordless models; stationary and mobile social alarms, digital social alarms, GPS-alarms, and telecare solutions; and products for remote supervision and monitoring. The company also provides end-to-end digital alarm chain services. It sells its products in approximately 28 countries primarily through a network of telecom operators, distributors, specialists, and dealers. The company serves public actors, civil society, and private companies. Doro AB (publ) was founded in 1974 and is headquartered in Malm√É¬∂, Sweden.",SEK,Information Technology,Technology Hardware & Equipment,Communications Equipment,STO,XSTO,NASDAQ OMX Stockholm,Sweden,,Malmo,211 20,http://www.doro.com,Micro Cap,,,,,,True
DOXA.ST,Doxa AB (publ),"Doxa AB (publ), a dental company, develops, manufactures, and commercializes bioceramic dental products under the Ceramir brand worldwide. It offers Crown & Bridge, a dental cement that is used for permanent cementing of crowns and bridges. The company was founded in 1987 and is based in Uppsala, Sweden.",SEK,Health Care,Health Care Equipment & Services,Health Care Equipment & Supplies,STO,XSTO,NASDAQ OMX Stockholm,Sweden,,Uppsala,754 50,http://www.doxa.se,Nano Cap,,,,,,False
DRIL.ST,Drillcon AB (publ),"Drillcon AB (publ), together with its subsidiaries, operates as a diamond core drilling and raise boring contractor in Europe, Latin America, and internationally. It offers various drilling services, such as surface and underground core drilling, and percussion drilling services, as well as technical surveys and services related to drilling. The company also provides raise boring services for ventilation, ore and waste pass, production slot raise, narrow vein mining, shaft sinking, and box hole projects. In addition, it offers geophysical services, including survey planning, field work, data processing, interpretation, map compiling, and reporting; geological services comprising geological and geotechnical core logging and mapping on site, dimension stone and aggregate investigation, and digital recording and processing of geological data; and rock mechanics services consisting of surveying, monitoring, advisory, and technical reporting. The company was founded in 1963 and is headquartered in Nora, Sweden.",SEK,Industrials,Commercial & Professional Services,Professional Services,STO,XSTO,NASDAQ OMX Stockholm,Sweden,,Nora,713 30,http://www.drillcon.se,Micro Cap,,,,,,False
DSNO.ST,Desenio Group AB (publ),"Desenio Group AB (publ), an online-based direct-to-consumer company, provides affordable wall art in Europe. It offers approximately 6,000 designs of posters and prints, as well as wall calendars, frames and accessories, iPhone cases, and tote bags through 20 websites. The company was founded in 2010 and is based in Stockholm, Sweden.",SEK,Consumer Discretionary,Retailing,Internet & Direct Marketing Retail,STO,XSTO,NASDAQ OMX Stockholm,Sweden,,Stockholm,118 63,http://www.deseniogroup.com,Small Cap,,,,,,False
DUG.ST,DUG Foodtech,,,,,,STO,XSTO,,Sweden,,,,,,,,,,,False
DUNI.ST,Duni AB (publ),"Duni AB (publ), together with its subsidiaries, develops, manufactures, and sells concepts and products for the serving and packaging of meals. It operates through Table Top, Meal Service, Consumer, and New Markets segments. The company offers napkins, table covers, candles, meal packaging products, cups and glasses, plates and serving items, cutlery, LED candles, boxes and bowls, table top accessories, Duniform sealing machines and tray materials, Duniform films, ecoecho serving and meal eco-conscious solutions, and fingerfood products, as well as Paper + Design napkins, Duni Amuse-bouche miniature dishes, and Designs for Duni design products. It also provides plastic products; and profile printing, embossing, and tailor-made packaging services. The company offers its products to hotels; restaurants; catering industry; and retail outlets, as well as fast food, caf√É¬©, and take-away outlets. It operates in the Middle East and North Africa; Asia and Oceania; and North, South, and Latin America. The company was founded in 1949 and is headquartered in Malm√É¬∂, Sweden.",SEK,Consumer Staples,Household & Personal Products,Household Products,STO,XSTO,NASDAQ OMX Stockholm,Sweden,,Malmo,201 22,http://www.duni.com,Small Cap,,,BBG000BCGJ47,BBG000BCGHT4,BBG001S63YV1,False
DURC-B.ST,Duroc AB (publ),"Duroc AB (publ), through its subsidiaries, engages in the fiber, industrial trade, and other businesses in Sweden, Europe, and the United States. The company manufactures polypropylene-based fibers and yarns for the automotive, construction, furniture, and filter industries; and textiles for greenhouses. It also distributes diesel engines for industrial and marine uses, as well as provides related spare parts, service, repairs, and others; and trades in machine tools, including automation solutions, tools, service, and support for engineering companies. Further, the company engages in the maintenance of railway wheels for locomotives and railway wagons to rail operators; and renovation and manufacturing of industrial components based on laser surface treatment technology for power, mining, steel, paper/pulp, offshore, aerospace, and engineering industries. Duroc AB (publ) was founded in 1987 and is headquartered in Danderyd, Sweden.",SEK,Industrials,Capital Goods,Machinery,STO,XSTO,NASDAQ OMX Stockholm,Sweden,,Danderyd,182 33,http://www.duroc.com,Micro Cap,,,,,,False
DUST.ST,Dustin Group AB (publ),"Dustin Group AB (publ) offers online IT products and services in the Nordic region and the Netherlands. It operates through three segments: Small and Medium-sized Businesses, Large Corporate and Public Sector, and Business to Consumer. The company sells hardware, software, and related services and solutions. The company act as a strategic IT partner primarily for small and medium-sized, and large-sized businesses, as well as the public sector and consumers. Dustin Group AB (publ) was founded in 1984 and is headquartered in Nacka Strand, Sweden.",SEK,Information Technology,Software & Services,IT Services,STO,XSTO,NASDAQ OMX Stockholm,Sweden,,Nacka,131 27,http://www.dustingroup.com,Small Cap,,,BBG0081S4NS4,BBG001B7BK48,BBG001TJLNV6,False
EAST.ST,Eastnine AB (publ),"Eastnine AB (publ) is a real estate investment firm. The firm seeks to make emerging growth investments. In the beginning of 2017 it shifted its focus from both public and unlisted equity investments to purely real estate, where it makes investments in direct and fund of fund stages.  It may also invest in special situations on a selective basis. The firm invests in real estate sectors only. For real estate sector, it can also invest in land, real property, and other real estate assets. It primarily invests in Eastern Europe, Russia and other CIS countries including Ukraine, Kazakhstan, Belarus, Uzbekistan, Turkmenistan, Azerbaijan, Georgia, Armenia, Kyrgyzstan, Tajikistan, and Moldova; the Balkans; the Baltic States; and Central Europe. The firm can also make investments into future East Capital private equity funds and real estate funds as well as in existing and future East Capital alternative funds. It also has the possibility to make limited investments in East Capital's open-ended daily-traded funds. The firm is a long term active investor. The firm makes balance sheet investments. Eastnine AB (publ), formerly know as East Capital Explorer AB. was founded in November 2007 and is based in Stockholm, Sweden with additional office in Tallinn, Estonia, Vilnius, Lithuania, Riga, Latvia.",SEK,Financials,Diversified Financials,Capital Markets,STO,XSTO,NASDAQ OMX Stockholm,Sweden,,Stockholm,103 88,http://www.eastnine.com/en,Small Cap,LU2090063160,,,BBG00VSGTS75,,False
ECC-B.ST,Ecoclime Group AB (publ),"Ecoclime Group AB (publ) provides real estate technology for recycling, charging, storage, extraction, and distribution of recycled and renewable thermal energy. The company is involved in the design, manufacture, construction, installation, and service of system products in circular energy systems; and sale of renewable recycled energy. It also offers indoor comfort and ventilation systems with control and optimization of temperature comfort and energy efficiency in properties. Ecoclime Group AB (publ) is headquartered in Ume√É¬•, Sweden.",SEK,Industrials,Capital Goods,Building Products,STO,XSTO,NASDAQ OMX Stockholm,Sweden,,Umea,903 26,http://www.ecoclime.se,Micro Cap,,,,,,False
ECOWVE.ST,EWPG Holding AB (publ),"EWPG Holding AB (publ), an onshore wave energy technology company, owns and operates a wave energy array that is connected to the grid in accordance with a Power Purchase Agreement. It develops a technology that turns ocean and sea waves into green electricity. The company has operations in Sweden, Gibraltar, Australia, Mexico, China, and Israel. The company was founded in 2011 and is based in Stockholm, Sweden.",SEK,Utilities,Utilities,Independent Power and Renewable Electricity Producers,STO,XSTO,NASDAQ OMX Stockholm,Sweden,,Stockholm,114 56,http://www.ecowavepower.com,Nano Cap,,,,,,False
EFFP.ST,Effnetplattformen AB (publ),"Effnetplattformen AB (publ), through its subsidiary, Effnet AB, provides header compression products. The company develops and sells the Effnet Header Compression products, which consists of software applications that increase the productivity of Internet Protocol traffic in fixed, mobile, and satellite networks. Its customers include chipset companies, and manufacturers of satellite and telecommunications equipment. The company is based in Lule√É¬•, Sweden.",SEK,Financials,Diversified Financials,Capital Markets,STO,XSTO,NASDAQ OMX Stockholm,Sweden,,Lulea,972 34,http://www.effnetplattformen.se,Nano Cap,,,,,,False
EG7.ST,Enad Global 7 AB,"Enad Global 7 AB (publ) develops, markets, publishes, and distributes PC, console, and mobile games in Europe, North America, and internationally. The company also provides consulting services for development strategies and marketing of games; and operates a marketing agency. In addition, it released approximately 1,500 titles under the Call of Duty, Destiny, Dark Souls, and Rage brands. The company was formerly known as Toadman Interactive AB (publ) and changed its name to Enad Global 7 AB (publ) in March 2020. Enad Global 7 AB (publ) was incorporated in 2013 and is headquartered in Stockholm, Sweden.",SEK,Communication Services,Media & Entertainment,Interactive Media & Services,STO,XSTO,NASDAQ OMX Stockholm,Sweden,,Stockholm,118 60,http://www.enadglobal7.com,Small Cap,SE0010520106,,BBG00J5L6CQ5,BBG00J5L6CP6,BBG00J5L6CV9,False
EGTX.ST,Egetis Therapeutics AB (publ),"Egetis Therapeutics AB (publ), a pharmaceutical drug development company, focuses on projects in late-stage development for the treatment of serious rare/niche diseases with unmet medical needs in the orphan drug segment. Its products pipeline includes Aladote, a drug to reduce the risk of acute liver injury associated with acetaminophen/paracetamol poisoning, which is in phase IIb/III clinical trial; and Emcitate, a drug for the treatment of MCT8 deficiency, a rare inborn error of thyroid hormone signaling that is in phase IIb/III clinical trial. The company was formerly known as PledPharma AB (publ) and changed its name to Egetis Therapeutics AB (publ) in December 2020. Egetis Therapeutics AB (publ) was founded in 2006 and is based in Stockholm, Sweden.",SEK,Health Care,"Pharmaceuticals, Biotechnology & Life Sciences",Biotechnology,STO,XSTO,NASDAQ OMX Stockholm,Sweden,,Stockholm,114 46,http://www.egetis.com,Micro Cap,,,BBG001K77XP2,BBG001K77XN4,BBG001V0L0J8,False
EKOBOT-TO1.ST,Ekobot AB TO1,,SEK,,,,STO,XSTO,NASDAQ OMX Stockholm,,,,,,,,,,,,False
EKOBOT.ST,Ekobot AB (publ),"Ekobot AB (publ) develops, manufactures, and sells autonomous agricultural robots that help farmers and growers in weeding crops. The company was founded in 2017 and is based in √É¬Ñlvsj√É¬∂, Sweden.",SEK,Industrials,Capital Goods,Machinery,STO,XSTO,NASDAQ OMX Stockholm,Sweden,,Alvsjo,12556,http://www.ekobot.se,Nano Cap,,,,,,False
EKT1F-140SWE.ST,,,SEK,,,,STO,XSTO,NASDAQ OMX Stockholm,,,,,,,,,,,,False
EKTA-B.ST,Elekta AB (publ),"Elekta AB (publ), a medical technology company, provides clinical solutions for cancer and brain disorders worldwide. The company offers radiotherapy treatment systems, such as Versa HD, a dose delivery accuracy system; Elekta Infinity, an image-guided radiation therapy (IGRT) system; and Elekta Synergy, a digital accelerator for advanced IGRT. It also provides personalized imaging tools; automation and integration systems; beam shaping solutions; patient positioning and immobilization solutions; and radiotherapy treatment planning systems. In addition, the company offers radiosurgery systems under the Leksell Gamma Knife Icon, Leksell Gamma Knife Perfexion, and Elekta Axesse names; Leksell GammaPlan, a treatment planning software; and Elekta Unity, a magnetic resonance radiation therapy solution. Further, it provides care management software, such as MOSAIQ Radiation Oncology and MOSAIQ Medical Oncology; MOSAIQ IQ Scripts, a workflow automation and customization tool; Patient Engagement, a patient communication tool; MOSAIQ Evaluate, a plan management and dose review solution; MOSAIQ Locate, a stereotactic localization solution; and METRIQ, a cancer registry data management solution. Additionally, the company offers Flexitron, a remote after loading platform; Esteya, an electronic brachytherapy for treating skin cancer; Oncentra Brachy, a treatment planning software; real-time prostate solutions; and gynecological brachytherapy, bronchus and esophagus, breast, prostate, rectum and bladder, and skin applicators, as well as brachytherapy needles and flexible implant tubes. It also provides Leksell Vantage Stereotactic System for neuroimaging and treatment; Leksell Stereotactic System for minimally invasive stereotactic neurosurgery; and proton therapy components. The company was founded in 1972 and is headquartered in Stockholm, Sweden.",SEK,Health Care,Health Care Equipment & Services,Health Care Equipment & Supplies,STO,XSTO,NASDAQ OMX Stockholm,Sweden,,Stockholm,103 93,http://www.elekta.com,Mid Cap,US28617Y1010,28617Y101,,BBG000KK09J2,,False
ELAN-B.ST,Elanders AB (publ),"Elanders AB (publ), a logistics company, provides supply chain management, and print and packaging solutions primarily in Sweden. It offers global order management services; sourcing and procurement services; custom configuration and manufacturing services; warehousing and inventory management; and print and packaging services. The company also provides fulfillment and distribution services; freight services; after sales services, such as warehousing spare parts, accessories, replacement equipment, and consumables, as well as repairs and service; value recovery services; e-commerce services; and photo products. In addition, the company sells its products under the LGI, Mentor Media and ITG, Elanders, d|o|m fotokasten, and myphotobook brands. It serves automotive, electronics, fashion and lifestyle, health care and life science, and industrial sectors in China, the United Kingdom, Singapore, Germany, and the United States. The company was founded in 1908 and is headquartered in M√É¬∂lndal, Sweden. Elanders AB (publ) is a subsidiary of Carl Bennet AB.",SEK,Industrials,Commercial & Professional Services,Professional Services,STO,XSTO,NASDAQ OMX Stockholm,Sweden,,Molndal,431 35,http://www.elanders.com,Small Cap,,,,,,False
ELEC.ST,Electra Gruppen AB (publ),"Electra Gruppen AB (publ), through its subsidiaries, offers home electronics in Sweden. The company operates in Electra Retail and Electra Logistics & IT segments. It also provides commerce, IT, and logistics services. In addition, the company offers supply chain, 3PL, chain concept, installing portal, store computer system, establishment tools, digital signage, and accounting services. The company offers its products through retail chains, e-retailers, and companies in various industries. Electra Gruppen AB (publ) was founded in 1949 and is based in Kalmar, Sweden.",SEK,Consumer Discretionary,Retailing,Specialty Retail,STO,XSTO,NASDAQ OMX Stockholm,Sweden,,Kalmar,392 39,http://www.electra.se,Nano Cap,,,,,,False
ELLWEE-TO1.ST,ELLWEE AB TO1,,SEK,,,,STO,XSTO,NASDAQ OMX Stockholm,,,,,,,,,,,,False
ELLWEE-TO2.ST,ELLWEE AB TO2,,SEK,,,,STO,XSTO,NASDAQ OMX Stockholm,,,,,,,,,,,,False
ELLWEE.ST,Ellwee AB (publ),"Ellwee Ab (Publ) manufactures and sells electric golf vehicles. The company was founded in 2015 and is headquartered in Trollh√É¬§ttan, Sweden.",SEK,Consumer Discretionary,Automobiles & Components,Automobiles,STO,XSTO,NASDAQ OMX Stockholm,Sweden,,Trollhattan,461 38,http://ellwee.com,Nano Cap,,,,,,True
ELN.ST,Ellen AB (publ),"Ellen AB (publ), a biotech company, develops and sells self-care products for women's intimate health. It offers ellen Probiotic Tampon products that supply probiotic lactic acid bacteria to the vagina while simultaneously offering sanitary protection; and ellen Probiotic Intimate Cr√É¬®me, a moisturizing intimate cream that acts as a protective barrier for skin and mucous membranes. The company also provides ellen pH-Control, a medical device, which is used to measure the vaginal pH at home; and ellen Sport Tampong/Aqua Block, which is designed to prevent chlorinated or contaminated water from seeping into the vagina while swimming or in other water activities. In addition, it offers LN Intimate Cleansing Foam to clean intimate areas, as well as used as a shaving cream for intimate grooming; LN Intimate Deo, a softening intimate deodorant formulated with lactic acid to promote a healthy vaginal flora and vaginal pH; and LN After Shave & Wax Gel that soothes the skin after shaving or waxing intimate areas or other parts of body. It operates in France, Belgium, Germany, Switzerland, Austria, Scandinavia, and other countries. The company sells its products through distributors and retailers; and through online in Scandinavia. Ellen AB (publ) was founded in 2000 and is headquartered in Stockholm, Sweden.",SEK,Consumer Staples,Household & Personal Products,Household Products,STO,XSTO,NASDAQ OMX Stockholm,Sweden,,Stockholm,111 23,http://www.ellen.se,Nano Cap,,,,,,True
ELOS-B.ST,Elos Medtech AB (publ),"Elos Medtech AB (publ) develops and manufactures medical devices and components for the medical technology industry. The company operates in three segments: Dental, Orthopedics, and Life Science. Its products include implants, screws, plates, instruments, drills, pins and wires, prosthetics, digital dentistry workflow products, disposable plastics, HPLC fittings, and other medical plastic parts, as well as original equipment manufacturing products. The company also provides design and development, regulatory, prototyping, testing, process validation, and supply and inventory management, as well as design for manufacturing and engineering services. It has operations in Sweden, Denmark, China, and the United States. The company was formerly known as Elos AB (publ) and changed its name to Elos Medtech AB (publ) in April 2015. Elos Medtech AB (publ) was founded in 1923 and is headquartered in Gothenburg, Sweden.",SEK,Health Care,Health Care Equipment & Services,Health Care Equipment & Supplies,STO,XSTO,NASDAQ OMX Stockholm,Sweden,,Gothenburg,411 04,http://www.elosmedtech.com,Micro Cap,,,,,,False
ELTEL.ST,Eltel AB (publ),"Eltel AB (publ) provides technical services for the power and communication infrastructure networks in Sweden, Finland, Norway, Poland, Denmark, Germany, and internationally. The company builds, maintains, and upgrades power transmission systems, as well as supplies power distribution services. It also designs, plans, builds, installs, upgrades, operates, and services mobile and fixed networks. In addition, the company offers maintenance services, which comprise scheduled and corrective care services and connect services; upgrade and conversion services to recover and upgrade the condition or technology of an existing infrastructure network; and project delivery services, which include engineering and delivering customer specific network infrastructure projects. It provides its services to national transmission system operators, power distribution grids, telecom operators, and other communication network owners. The company is headquartered in Bromma, Sweden.",SEK,Industrials,Capital Goods,Construction & Engineering,STO,XSTO,NASDAQ OMX Stockholm,Sweden,,Bromma,112 92,http://www.eltelgroup.com,Small Cap,,,BBG007WL2795,BBG007WL2786,BBG007WL27F8,False
ELU1E-250SHB.ST,ELU1E 250SHB,,SEK,,,,STO,XSTO,NASDAQ OMX Stockholm,,,,,,,,,,,,False
ELUX-A.ST,AB Electrolux (publ),"AB Electrolux (publ), together with its subsidiaries, manufactures and sells household appliances in Europe, North America, Latin America, the Asia/Pacific, the Middle East, and Africa. The company offers various appliances, such as refrigerators, freezers, cookers, dryers, washing machines, dishwashers, room air-conditioners, microwave ovens, floor-care products, vacuum cleaners, water heaters, heat pumps, and other small domestic appliances, as well as consumables and accessories. It also provides hobs, ovens, and hoods; and tumble dryers. The company offers its products under the Electrolux, AEG, and Frigidaire brands through retailers, buying groups, and independent stores. AB Electrolux (publ) was founded in 1901 and is headquartered in Stockholm, Sweden.",SEK,Information Technology,Technology Hardware & Equipment,"Electronic Equipment, Instruments & Components",STO,XSTO,NASDAQ OMX Stockholm,Sweden,,Stockholm,105 45,http://www.electroluxgroup.com,Mid Cap,,,,,,False
ELUX-B.ST,AB Electrolux (publ),"AB Electrolux (publ), together with its subsidiaries, manufactures and sells household appliances in Europe, North America, Latin America, the Asia/Pacific, the Middle East, and Africa. The company offers various appliances, such as refrigerators, freezers, cookers, dryers, washing machines, dishwashers, room air-conditioners, microwave ovens, floor-care products, vacuum cleaners, water heaters, heat pumps, and other small domestic appliances, as well as consumables and accessories. It also provides hobs, ovens, and hoods; and tumble dryers. The company offers its products under the Electrolux, AEG, and Frigidaire brands through retailers, buying groups, and independent stores. AB Electrolux (publ) was founded in 1901 and is headquartered in Stockholm, Sweden.",SEK,Information Technology,Technology Hardware & Equipment,"Electronic Equipment, Instruments & Components",STO,XSTO,NASDAQ OMX Stockholm,Sweden,,Stockholm,105 45,http://www.electroluxgroup.com,Mid Cap,,,,,,False
EMBELL.ST,Embellence Group AB (publ),"Embellence Group AB (publ) acquires, owns, and develops various brands in wallpapers, textiles, rugs, and other interior decoration items. It serves customers in Sweden, Norway, Italy, and the United Kingdom. The company was founded in 1905 and is headquartered in Bor√É¬•s, Sweden.",SEK,Consumer Discretionary,Consumer Durables & Apparel,Household Durables,STO,XSTO,NASDAQ OMX Stockholm,Sweden,,Boras,504 94,http://www.embellencegroup.com,Micro Cap,,,,,,False
EMBRAC-B.ST,Embracer Group AB (publ),"Embracer Group AB (publ), together with its subsidiaries, develops and publishes PC and console games for the gaming market in Europe, the United States, Sweden, and internationally. The company's game catalogue consists of 190 owned franchises, such as Saints Row, Goat Simulator, Dead Island, Darksiders, Metro, MX vs ATV, Kingdoms of Amalur, TimeSplitters, Satisfactory, Wreckfest, Insurgency, World War Z, and others. It also publishes games for various partners. In addition, the company publishes and distributes films. It distributes games through retailers and digital distributors. The company was formerly known as THQ Nordic AB (publ) and changed its name to Embracer Group AB (publ) in October 2019. Embracer Group AB (publ) was incorporated in 1999 and is headquartered in Karlstad, Sweden.",SEK,Communication Services,Media & Entertainment,Interactive Media & Services,STO,XSTO,NASDAQ OMX Stockholm,Sweden,,Karlstad,652 25,http://www.embracer.com,Large Cap,SE0016828511,,,BBG00FFBNH11,,False
