symbol,name,currency,summary,category_group,category,family,exchange,mic
ROLG.AS,Rolinco N.V. EUR G,EUR,"Rolinco N.V. EUR G is a share class of Rolinco N.V., an investment company that focuses on long-term capital growth by investing in global companies involved in technological innovation and their applications. The fund aims to identify and invest in companies that are leaders in their respective fields, across various sectors. Rolinco N.V. is based in the Netherlands and seeks to provide investors with exposure to technological advancements.",Information Technology,Technology,Robeco Institutional Asset Mgmt BV,AMS,XAMS
ROLPR.AS,Rolinco N.V.,EUR,"Rolinco N.V. is an investment company incorporated in the Netherlands. It invests in a globally diversified portfolio of listed equities, primarily focusing on companies with long-term growth potential. The company aims to provide shareholders with capital appreciation over the long term.",Equities,Equities,,AMS,XAMS
ROMF.AS,Robeco QI Global Multi-Factor Equities Fund G &#226;&#130;&#172;,EUR,"The Robeco QI Global Multi-Factor Equities Fund G is an equity fund that invests globally, employing a quantitative investment strategy to select stocks based on multiple factors, such as value, momentum, quality, and low volatility. The fund seeks to achieve long-term capital appreciation by systematically exploiting these factors. The investment process aims to construct a well-diversified portfolio that outperforms the broader market.",Equities,Factors,Robeco Institutional Asset Mgmt BV,AMS,XAMS
ROQI.AS,Robeco QI Global Developed Enhanced Index Equities Fund - EUR G,EUR,"The Robeco QI Global Developed Enhanced Index Equities Fund - EUR G is an equity fund that invests in developed market equities globally, aiming to outperform the MSCI World Index. The fund uses a quantitative investment strategy to enhance returns while maintaining a risk profile similar to the index. The fund seeks to achieve its objective by tilting its portfolio towards stocks with attractive characteristics identified through its quantitative models.",Equities,Equities,Robeco Institutional Asset Mgmt BV,AMS,XAMS
RORA.AS,Robeco Global Total Return Bond Fund,EUR,"Robeco Global Total Return Bond Fund is a fixed income fund that invests in a diversified portfolio of global bonds, aiming to achieve a positive total return. The fund invests in government bonds, corporate bonds, and other fixed income securities from around the world. The fund's investment strategy involves active management of interest rate risk, credit risk, and currency risk to enhance returns.",Fixed Income,Bonds,,AMS,XAMS
SEIF.AS,Sustainable Europe Index Fund,EUR,"Sustainable Europe Index Fund is an exchange-traded fund (ETF) or mutual fund that tracks an index of European companies that meet specific sustainability criteria. It aims to provide investors with exposure to companies demonstrating strong environmental, social, and governance (ESG) practices. The fund's performance will be closely tied to the performance of the underlying sustainability index.",Equities,Developed Markets,InsingerGilissen Asset Management N.V.,AMS,XAMS
SNAIF.AS,Sustainable North America Index Fund,EUR,"The Sustainable North America Index Fund aims to track the performance of an index composed of North American companies that meet specific sustainability criteria. The fund invests in equities of companies within North America while adhering to ESG (environmental, social, and governance) standards. The fund is based in Europe.",Equities,Equities,InsingerGilissen Asset Management N.V.,AMS,XAMS
SWIF.AS,Sustainable World Index Fund,EUR,"Sustainable World Index Fund aims to track the performance of an index composed of companies with high environmental, social, and governance (ESG) ratings. The fund invests in equities of companies worldwide that meet specific sustainability criteria. It is managed by a European asset manager given the "".AS"" extension.",Equities,Equities,InsingerGilissen Asset Management N.V.,AMS,XAMS
TCMAF.AS,TCM Africa High Dividend Equity,EUR,TCM Africa High Dividend Equity is an investment fund focused on African equities with high dividend yields. The fund aims to provide investors with a combination of income and capital appreciation by investing in a diversified portfolio of companies listed on African stock exchanges. The fund is managed by TCM Investment Funds.,Equities,Equities,Trustus Capital Management BV,AMS,XAMS
TCMGF.AS,TCM Global Frontier High Dividend Equity,EUR,TCM Global Frontier High Dividend Equity is an investment fund focused on frontier market equities with high dividend yields. The fund aims to provide investors with a combination of income and capital appreciation by investing in a diversified portfolio of companies listed on frontier market stock exchanges. The fund is managed by TCM Investment Funds.,Equities,Frontier Markets,Trustus Capital Management BV,AMS,XAMS
TCMVN.AS,TCM Vietnam High Dividend Equity,EUR,TCM Vietnam High Dividend Equity is an investment fund focused on Vietnamese equities with high dividend yields. The fund aims to provide investors with a combination of income and capital appreciation by investing in a diversified portfolio of companies listed on the Vietnam stock exchange. The fund is managed by TCM Investment Funds.,Equities,Equities,Trustus Capital Management BV,AMS,XAMS
TETEF.AS,Triodos Impact Strategies II N.V. - Triodos Renewables Europe Fund,EUR,"Triodos Impact Strategies II N.V. - Triodos Renewables Europe Fund focuses on investing in renewable energy projects throughout Europe. The fund, managed by Triodos Investment Management, supports the transition to a sustainable energy system by providing capital to companies and projects involved in renewable energy generation, distribution, and related technologies. Headquartered in the Netherlands, Triodos Investment Management is a global leader in impact investing, dedicated to generating both financial returns and positive social and environmental impact.",Equities,Energy,,AMS,XAMS
TFSF.AS,Triodos Fair Share Fund Inc,EUR,"Triodos Fair Share Fund Inc invests in microfinance institutions and fair trade organizations in developing countries. Managed by Triodos Investment Management, the fund aims to promote financial inclusion and sustainable development by providing capital and support to organizations that serve low-income communities. Headquartered in the Netherlands, Triodos Investment Management is a global leader in impact investing.",Financials,Emerging Markets,Triodos Investment Management B.V.,AMS,XAMS
THXLE.AS,Legends Fund,EUR,,Alternative,Alternative,Theta Capital Management BV,AMS,XAMS
TMIF.AS,Triodos Multi Impact Fund Z Inc,EUR,"The Triodos Multi Impact Fund Z Inc invests in companies and projects that generate positive social and environmental impact alongside financial returns. It is managed by Triodos Investment Management, a firm known for its sustainable and ethical investment approach and is based in the Netherlands. The specific investment criteria and impact themes would be defined in the fund's documentation.",Alternatives,Emerging Markets,Triodos Investment Management B.V.,AMS,XAMS
TRIGF.AS,Triodos Groenfonds NV,EUR,"The Triodos Groenfonds NV is a Dutch green fund that invests in projects and companies that contribute to sustainable development and environmental protection in the Netherlands. It focuses on sectors such as renewable energy, sustainable agriculture, and energy efficiency. Triodos Bank manages the fund, promoting responsible and impact investing.",Financials,Bonds,,AMS,XAMS
WPSEU.AS,W.P. Stewart Holdings Fund Class A EUR Acc,EUR,,Equities,United States,AllianceBernstein,AMS,XAMS
WPSH.AS,W.P. Stewart Holdings,USD,"W.P. Stewart Holdings is a global asset management firm that focuses on managing investments for institutions and high-net-worth individuals. The firm utilizes a growth-oriented investment approach, seeking to identify companies with sustainable competitive advantages and long-term growth potential. W.P. Stewart Holdings is headquartered in New York City.",Financials,United States,AllianceBernstein,AMS,XAMS
