symbol,name,currency,summary,category_group,category,family,exchange,mic,isin
9400.SR,Falcom Saudi Equity ETF,SAR,"The fund aims to provide investors with long term capital appreciation and growth. It passively invests in the listed Saudi equities in order to achieve the results that correspond to the performance of index.
 The fund invests at least 95% of its assets in Equity securities of companies that are Shariah-compliant, listed and traded on Tadawul in the Kingdom of Saudi Arabia.",Financials,Emerging Markets,Falcom Financial Services,SAU,XSAU,
9401.SR,Falcom Petrochemical ETF,SAR,"The investment seeks to replicate, net of expenses, the FALCOM Petrochemical index.
 The fund aims to provide investors with long term capital appreciation and growth. It passively invests in the listed Saudi equities of the Petrochemical sector in order to achieve the results that correspond to the performance of the index.",Materials,Emerging Markets,Falcom Financial Services,SAU,XSAU,
9402.SR,HSBC Amanah Saudi 20 ETF,SAR,,,,HSBC Investment Funds,SAU,XSAU,
9403.SR,Albilad Saudi Sovereign Sukuk Etf,SAR,,,Government Bonds,,SAU,XSAU,
9404.SR,Alinma Saudi Government Sukuk Etf Fund - Short Maturity - Alinma Sukuk Fund,SAR,,,Government Bonds,,SAU,XSAU,
9405.SR,Albilad Gold ETF,SAR,,,,,SAU,XSAU,
